TweetsData/shakira.csv;2017-02-21 02:41;1061;5078;"Están listos para un poco de bachata con @PrinceRoyce ? #Dejavu ya está disponible! Shak pic.twitter.com/WJ91xprrFM"
TweetsData/shakira.csv;2017-02-21 02:40;1312;7932;"Ready for some bachata with @princeroyce ? #Dejavu , out today! Shak pic.twitter.com/5JyQek7IuG"
TweetsData/shakira.csv;2017-02-20 23:15;878;3446;"Ya disponible! Deja Vu, la nueva canción de Shak con @PrinceRoyce ! Escúchenla en @Spotify aquí -> http:// smarturl.it/DejaVuSpotify ShakHQ pic.twitter.com/Kbc4lvBQU5"
TweetsData/shakira.csv;2017-02-20 23:10;1211;5771;"Out today! Deja Vu, Shak’s new track with @PrinceRoyce ! Listen to the song on @Spotify -> http:// smarturl.it/DejaVuSpotify ShakHQ pic.twitter.com/EFnpphkLEZ"
TweetsData/shakira.csv;2017-02-13 05:42;591;3198;"Para celebrar el lanzamiento del perfume #DanceShakira les invitamos a que nos compartieran sus mejores movimientos! Aquí una selección! SHQ pic.twitter.com/JDuLfMpiTI"
TweetsData/shakira.csv;2017-02-13 05:40;546;2528;"To celebrate the launch of Shak's latest fragrance, we asked you to submit your #DanceShakira boomerangs. Here's a video compilation! ShakHQ pic.twitter.com/fwsN0GskRl"
TweetsData/shakira.csv;2017-02-10 22:54;671;2548;"80 years apart, these two refugees have more in common than you’d think. #RefugeesWelcome @UNICEF https:// youtu.be/PTk7a1s8vR8"
TweetsData/shakira.csv;2017-02-10 02:04;1448;5138;"“Shakira: America Must Protect All Our People” @TIME http:// time.com/4665295/shakir a-donald-trump-ban/ … #resist pic.twitter.com/0k9GuEnxH6"
TweetsData/shakira.csv;2017-02-08 22:21;650;3548;"Wow, 9 nominations! Thank you @latinbillboards and congrats to all the other artists nominated! Shak pic.twitter.com/qrivrZzqVy"
TweetsData/shakira.csv;2017-02-08 22:20;1432;10221;"9 nominaciones! Muchas gracias @LatinBillboards y mis felicitaciones a todos los otros artistas nominados! Shak pic.twitter.com/bvyDbe8BXf"
TweetsData/shakira.csv;2017-02-08 02:03;320;1207;"No se olviden de subir sus videos para participar en el #ChantajeChallengeContest y ganar un viaje a BCN! http://www. shakira.com/news/969 ShakHQ"
TweetsData/shakira.csv;2017-02-08 02:01;450;2240;"#ChantajeChallengeContest dance videos by Wed and you could win a trip to Barcelona to meet Shak! http:// shakira.com/news/968 ShakHQ"
TweetsData/shakira.csv;2017-02-05 22:25;518;3199;"Get Shak's new salsa version of Chantaje from @AmazonMusic now! Chantaje versión salsa tamién está en Amazon http:// smarturl.it/ChantajeSam ShakHQ"
TweetsData/shakira.csv;2017-02-04 06:38;614;4107;"Gracias Carlos por llevarnos contigo! Shak https:// twitter.com/carlosvives/st atus/827414096723054592 …"
TweetsData/shakira.csv;2017-02-04 03:36;500;2542;"Check out the new salsa version of Chantaje on @Spotify ! No se pierdan la versión salsa de Chantaje en Spotify! SHQ https:// open.spotify.com/album/1URxRvwX b8QTVJvjLzUMjh?lf=4f382e4256cb8f9f90010cb32f2822eb …"
TweetsData/shakira.csv;2017-02-03 22:18;641;4973;"My super team doing the waka for me and @3gerardpique on our bday!! Shak pic.twitter.com/Zv98tWvR1i"
TweetsData/shakira.csv;2017-02-02 23:00;523;2133;"Hope you guys enjoy Chantaje Salsa with Chelito De Castro on the piano! "Pura salsa brava!" #chantajesalsa Shak https:// youtu.be/tVcE5PFXpbQ"
TweetsData/shakira.csv;2017-02-02 23:00;630;3031;"Espero que disfruten Chantaje Salsa y del piano de @ChelitoDeCastro . Pura salsa brava! #chantajesalsa Shak https:// youtu.be/tVcE5PFXpbQ"
TweetsData/shakira.csv;2017-01-31 00:22;405;2196;"Gracias por los videos del #ChantajeChallengeContest ! Sigan publicando en twitter e insta y podrán conocer a Shak! http://www. shakira.com/news/969 pic.twitter.com/V4vQVQtkmr"
TweetsData/shakira.csv;2017-01-31 00:20;484;2989;"So many great #ChantajeChallengeContest videos already! Post your dance to Twitter/Insta & win a trip to meet Shak http:// shakira.com/news/968 pic.twitter.com/Duq6QFtb2s"
TweetsData/shakira.csv;2017-01-28 05:54;554;3145;"#ChantajeChallengeContest -> http://www. shakira.com/news/968 pic.twitter.com/NYS9Ga86pt"
TweetsData/shakira.csv;2017-01-26 05:35;951;4618;"You guys are really impressing me with your moves to Chantaje! Wonder if you can match mine… Shak pic.twitter.com/SaYgRVBilE"
TweetsData/shakira.csv;2017-01-26 05:32;1245;7408;"Muy impresionada con sus movimientos bailando Chantaje, a ver si pueden hacer los míos!! Shak pic.twitter.com/0ZsfKTYGmC"
TweetsData/shakira.csv;2017-01-26 00:50;408;2117;"Listen to the new @JohnBlake_Music remix of Chantaje on @Spotify / Escuchen el nuevo remix de Chantaje! ShakHQ https:// open.spotify.com/track/23bdFaeP epmoGrsFY4h3S0 …"
TweetsData/shakira.csv;2017-01-24 18:59;904;6584;"#Chantaje https:// youtu.be/6Mgqbai3fKo pic.twitter.com/JBWMD4h2FZ"
TweetsData/shakira.csv;2017-01-23 23:32;411;2013;"Pongan un poco de ritmo a su lunes con el nuevo remix de Chantaje realizado por John-Blake! https:// youtu.be/fruXsHEXKS8 ShakHQ"
TweetsData/shakira.csv;2017-01-23 23:29;420;2650;"Put some pep in your Monday with John-Blake’s pulsing new remix of Chantaje… https:// youtu.be/fruXsHEXKS8 ShakHQ"
TweetsData/shakira.csv;2017-01-22 05:38;1252;6719;"Éste sí que es un lavado de cabeza!! Y él es el mejor del mundo!! / Now this is a proper shampoo--and he's the best in the world! Shak pic.twitter.com/Kz20qyyxXF"
TweetsData/shakira.csv;2017-01-22 03:42;1786;10857;"Beauty salon day! (Part 1) / Día cualquiera en la peluquería (Parte 1) Shak pic.twitter.com/svV1Vt1h2j"
TweetsData/shakira.csv;2017-01-19 18:25;586;3762;"“Today's babies will solve tomorrow's problems” –watch Shak chatting to @Reuters in Davos http://www. reuters.com/video/2017/01/ 17/our-babies-are-our-future-leaders-shakir?videoId=370934393 … ShakHQ #EarlyMomentsMatter"
TweetsData/shakira.csv;2017-01-18 22:20;388;2151;"Aquí les dejamos con un resumen gráfico de la visita de Shak al Foro Económico Mundial de Davos @WEF_ES @UNICEFenEspanol ShakHQ #wef17 pic.twitter.com/cPGqQZ9GaM"
TweetsData/shakira.csv;2017-01-18 22:19;594;3782;"Here are some photo highlights from Shak’s visit to the World Economic Forum in Davos #wef17 @wef @unicef ShakHQ pic.twitter.com/TudaEPowon"
TweetsData/shakira.csv;2017-01-18 19:22;599;3601;"Watch Shak chatting #FacetoFace with @ariannahuff for @CNBC at #wef17 in Davos, at http://www. shakira.com/news/962 ShakHQ pic.twitter.com/ErxPLuJhN1"
TweetsData/shakira.csv;2017-01-18 03:57;1101;4904;"With Gordon Brown discussing the next steps to secure new major financing for Education. Shak #LearningGeneration @educommission pic.twitter.com/Zr4vFJoBCD"
TweetsData/shakira.csv;2017-01-17 22:14;230;1522;"Tienen preguntas para Shak y @ariannahuff ? Pueden mandarlas aquí -> https://www. facebook.com/cnbc/photos/a. 109527614368.115573.97212224368/10155112061449369/?type=3&theater … ShakHQ"
TweetsData/shakira.csv;2017-01-17 05:43;889;5732;"With fellow SDG advocate @ForestWhitaker at the world economic forum ( @wef ) -education for peace! Shak pic.twitter.com/3fiorucE9x"
TweetsData/shakira.csv;2017-01-17 04:50;439;1926;""No podemos hacer una pausa y pedirle a estos niños que nos esperen" Vean/lean el discurso de Shak en #wef17 http://www. shakira.com/news/961 ShakHQ"
TweetsData/shakira.csv;2017-01-17 04:48;527;2622;"“There isn’t a moment to lose.” Watch / read Shak's speech at #wef17 about early childhood development. http://www. shakira.com/news/960 ShakHQ"
TweetsData/shakira.csv;2017-01-17 01:37;271;1397;"Shak se encuentra en el #wef17 donde hablará sobre Desarrollo Infantil Temprano y recibirá el premio Cristal. http:// webcasts.weforum.org/widget/1/davos 2017?id=a0Wb0000006S0PmEAK&p=1&pi=1&hl=spanish&utm_content=buffer7064d&utm_medium=social&utm_source=twitter.com&utm_campaign=buffer … ShakHQ"
TweetsData/shakira.csv;2017-01-17 01:35;389;1981;"Shak's at #wef17 to speak about Early Childhood Development & get the Cristal Award for her work. Watch at https://www. weforum.org/events/world-e conomic-forum-annual-meeting-2017 … ShakHQ"
TweetsData/shakira.csv;2017-01-14 02:10;572;2639;"El video de Chantaje con @maluma es el tercer video en llegar más rápido a las 400 millones de reproducciones! ShakHQ pic.twitter.com/aZuAiPgXUr"
TweetsData/shakira.csv;2017-01-14 02:09;1458;8345;"Chantaje ft @Maluma was the third fastest video to reach 400m views ever! ShakHQ pic.twitter.com/3N6jWQ4mXI"
TweetsData/shakira.csv;2017-01-12 23:50;931;5346;"#Chantaje http://www. billboard.com/articles/colum ns/latin/7654235/shakira-chantaje-ties-hips-dont-lie-second-longest-hot-latin-songs … ShakHQ pic.twitter.com/6Eu1cHxL9K"
TweetsData/shakira.csv;2017-01-12 01:18;1599;12316;"400 million views for my latest Chantaje video! This is my OMG face / 400 millones de reproducciones tiene ya el video de #Chantaje ! Shak pic.twitter.com/H73St7PIjB"
TweetsData/shakira.csv;2017-01-11 03:33;780;4135;"Check out Shak's blog on Early Childhood Development for the upcoming World Economic Forum ( @wef ) ShakHQ https://www. weforum.org/agenda/2017/01 /shakira-mother-child-development-education?utm_content=bufferea860&utm_medium=social&utm_source=twitter.com&utm_campaign=buffer … pic.twitter.com/trl5Q2wxRU"
TweetsData/shakira.csv;2017-01-09 21:47;1210;7252;"Congrats to the @DisneyAnimation and @DisneyZootopia team on a well-deserved win at the Golden Globes! Love u guys! pic.twitter.com/HsjYHWc0my"
TweetsData/shakira.csv;2017-01-09 02:49;500;2582;"100 millones en Spotify -- Ustedes son los MEJORES! Más en 2017. Shak https:// open.spotify.com/track/1WniHvhq 9zTkny0WvGXX8o …"
TweetsData/shakira.csv;2017-01-09 02:48;685;4150;"Wow, 100 million plays for Chantaje on @Spotify --you guys are the BEST! More to come in 2017 Shak https:// open.spotify.com/track/1WniHvhq 9zTkny0WvGXX8o …"
TweetsData/shakira.csv;2017-01-07 00:45;1321;11609;"Adivinen a quien le salió el rey en el roscón? Shak pic.twitter.com/iar3pPtKuK"
TweetsData/shakira.csv;2017-01-06 08:06;528;3020;"Mañana cierran las votaciones para los @premiolonuestro ! Shak está nominada en 3 categorías! Para votar -> http:// smarturl.it/PLNvota2017 ShakHQ pic.twitter.com/Iy0YMhcMtS"
TweetsData/shakira.csv;2017-01-06 01:24;644;3555;"Check out #Chantaje ft @Maluma on @Spotify 's Viva Latino playlist! Chantaje está en la playlist Viva Latino! ShakHQ https:// open.spotify.com/user/spotify_l atino/playlist/1T6MNA5FbPylNjI7c3SryX … pic.twitter.com/wyjIkIs0SN"
TweetsData/shakira.csv;2017-01-05 03:26;470;2220;"Acabamos de conocer que #Chantaje con @maluma tuvo este fin de año 2.45 millones de reproducciones en @Spotify ! SHQ https:// open.spotify.com/track/1WniHvhq 9zTkny0WvGXX8o …"
TweetsData/shakira.csv;2017-01-05 03:24;1008;5713;"We just heard that #Chantaje ft @Maluma had its highest ever daily @Spotify plays on NYE- 2.45m! Thanks guys! ShakHQ https:// open.spotify.com/track/1WniHvhq 9zTkny0WvGXX8o …"
TweetsData/shakira.csv;2017-01-04 23:45;1038;8469;"Linda razón para desconcentrarse jugando al golf con Chantaje! What a good reason to get distracted while playing golf! Shak pic.twitter.com/zJdkiatUJR"
TweetsData/shakira.csv;2017-01-01 06:58;3670;18545;"Feliz 2017 de los Piqué Mebarak! Happy 2017 from the Piqué Mebarak family! pic.twitter.com/XIayfbHnZK"
TweetsData/shakira.csv;2017-01-01 06:26;1608;14826;"Gracias a todos por regalarme un año más disfrutando de hacer música y compartiéndola con ustedes! Mucha paz y alegría para este 2017! pic.twitter.com/KU6Nk3IJLz"
TweetsData/shakira.csv;2017-01-01 06:25;1451;12150;"Thank you all for giving me another year of enjoying music-making and sharing it with all of you! Lots of love, peace and happiness in 2017! pic.twitter.com/pTqWlVVn4x"
TweetsData/shakira.csv;2016-12-31 22:53;365;2097;"Quién ha incluido Chantaje en su playlist de @Spotify de fin de año? Nos indican dónde van a celebrarlo? https:// open.spotify.com/track/1WniHvhq 9zTkny0WvGXX8o … ShakHQ"
TweetsData/shakira.csv;2016-12-31 22:51;554;3443;"Who's got Chantaje on their @Spotify NYE playlist for tonight? Let us know where you’re partying! ShakHQ https:// open.spotify.com/track/1WniHvhq 9zTkny0WvGXX8o …"
TweetsData/shakira.csv;2016-12-25 23:12;888;4798;"Mejor regalo de Navidad, imposible! #Chantaje es #1 en la Lista de @Los40_Spain ! http:// los40.com/los40/2016/12/ 23/del40al1/1482496748_019791.html … ShakHQ pic.twitter.com/koZk2VDSrJ"
TweetsData/shakira.csv;2016-12-25 05:34;2278;13641;"Feliz Navidad! Los quiero! Shak pic.twitter.com/VeI9kXP0YM"
TweetsData/shakira.csv;2016-12-23 00:27;740;3843;"Los jugadores de la @FCBEscola celebrando su participación en el Torneo Las Américas con La Bicicleta! Shak https:// twitter.com/FCBEscola/stat us/811959060874395648 …"
TweetsData/shakira.csv;2016-12-22 04:19;1016;5426;"Happy Holidays! / Feliz Navidad! ShakHQ http:// smarturl.it/ShakiraBeauty pic.twitter.com/usgKgr16vn"
TweetsData/shakira.csv;2016-12-21 06:51;723;4664;"200 millones de visitas para nuestro video Chantaje en un mes, 200 millones de gracias! Shak pic.twitter.com/gwYGo1adam"
TweetsData/shakira.csv;2016-12-21 06:51;1169;10439;"200 million views for Chantaje in one month! Thank you all so, so much! Shak pic.twitter.com/BCgALplmDe"
TweetsData/shakira.csv;2016-12-19 02:31;589;4253;"Con Bea Matallana, en mi camerino, antes de sacar a pasear a Pig Floyd pic.twitter.com/xNnotmcQeF"
TweetsData/shakira.csv;2016-12-19 02:31;1052;11015;"With Bea Matallana in my dressing room, getting ready to take my pig for a walk. pic.twitter.com/asxzrhX56u"
TweetsData/shakira.csv;2016-12-17 01:27;513;2264;"#Chantaje es la primera canción en español en @Spotify (y una de las más reproducidas alrededor del mundo) ShakHQ https:// open.spotify.com/album/3EwBqZP1 5qaDl3B6DuWXZ7 …"
TweetsData/shakira.csv;2016-12-17 01:26;714;3541;"#Chantaje is the #1 Latin song on @Spotify (and among the most-streamed tracks worldwide!) ShakHQ https:// open.spotify.com/album/3EwBqZP1 5qaDl3B6DuWXZ7 …"
TweetsData/shakira.csv;2016-12-16 03:42;356;1772;"A @radiomixfm esteve no lançamento do #Dance da Shak e aproveitou para fazer umas perguntinhas dos fãs para ela. SHQ http://www. mixfm.com.br/novidades/conf ira-o-que-rolou-na-entrevista-exclusiva-com-shakira …"
TweetsData/shakira.csv;2016-12-15 01:09;563;2796;"Raise a glass! The #Chantaje video ft @maluma has reached 150m views! ShakHQ pic.twitter.com/tHUvjmRSql"
TweetsData/shakira.csv;2016-12-15 01:08;1511;9728;"Brindemos por ello! El video de Chantaje con @maluma ya tiene 150 millones de reproducciones! ShakHQ pic.twitter.com/guwH7VHuKl"
TweetsData/shakira.csv;2016-12-14 03:41;536;2160;"#Chantaje ShakHQ https:// twitter.com/RobertMendoza_ /status/808377462354833408 …"
TweetsData/shakira.csv;2016-12-13 23:24;404;1786;"#Chantaje entra en el listado de las mejores canciones de este año de @billboard en la posición #22! ShakHQ http://www. billboard.com/articles/event s/year-in-music-2016/7617635/billboard-top-100-pop-songs-of-2016 …"
TweetsData/shakira.csv;2016-12-13 23:23;430;1765;"#Chantaje has made it to #22 in @Billboard 's 100 Best Pop Songs of 2016! ShakHQ http://www. billboard.com/articles/event s/year-in-music-2016/7617635/billboard-top-100-pop-songs-of-2016 …"
TweetsData/shakira.csv;2016-12-13 11:16;807;3246;"It’s @UNICEF ’s 70th anniversary! What I want #foreverychild is access to a quality education. Shak"
TweetsData/shakira.csv;2016-12-13 08:17;777;3852;"Amazing #Chantaje moves from @Gianluca_Vacchi & Giorgia Gabriele! Un video increíble de @Gianluca_Vacchi y Giorgia bailando Chantaje! ShakHQ pic.twitter.com/4uepnB9QvB"
TweetsData/shakira.csv;2016-12-13 01:59;487;2360;"Check out this amazing collection of @zumba dancers worldwide getting down to Chantaje! ShakHQ pic.twitter.com/SBsmw9wyFy"
TweetsData/shakira.csv;2016-12-13 01:58;885;4800;"VIDEO: Practicando @zumba alrededor del mundo a ritmo de #Chantaje ! ShakHQ pic.twitter.com/u4iDFY81mp"
TweetsData/shakira.csv;2016-12-12 05:43;1342;9711;"No wonder I get burned with curling irons all the time/ Ya sé porque me quemo con las tenacillas todo el tiempo! No me quedo quieta! Shak pic.twitter.com/dEAABwF1vi"
TweetsData/shakira.csv;2016-12-11 05:15;551;3366;"En esta foto cuando estábamos en construcción la playa, con DAYANA la campeona Panamericana @fpiesdescalzos pic.twitter.com/6w2t2OpCbt"
TweetsData/shakira.csv;2016-12-11 03:58;1009;4550;"Qué lindo escucharlos cantar chantaje! Un beso para ti @maluma y todos en Argentina!! Shak pic.twitter.com/abHSucvyWU"
TweetsData/shakira.csv;2016-12-10 02:12;434;2243;"No se pierdan este video de #Chantaje con una coreografía espectacular de @WilldaBeast__ http:// youtu.be/BNFdGfu5uUU ShakHQ"
TweetsData/shakira.csv;2016-12-10 02:11;356;1707;"Check out this amazing #Chantaje dance video, choreographed by @WilldaBeast__ https:// youtu.be/BNFdGfu5uUU ShakHQ"
TweetsData/shakira.csv;2016-12-09 23:56;574;4386;"Felicidades a Dayana del Colegio @fpiesdescalzos por ser campeona panamericana de patinaje - estamos orgullosos de ti! Shak"
TweetsData/shakira.csv;2016-12-09 06:37;588;1982;"#Chantaje es el video en español que más rápido ha alcanzado los 100M de visitas y ser certificado por @vevo https:// youtu.be/6Mgqbai3fKo ShakHQ"
TweetsData/shakira.csv;2016-12-09 06:33;500;1779;"#Chantaje is the fastest ever Spanish video to reach 100m views and become @Vevo Certified! https:// youtu.be/6Mgqbai3fKo ShakHQ"
TweetsData/shakira.csv;2016-12-09 03:46;351;1570;"Overjoyed to hear about the 3 @premiolonuestro nominations coming home from an amazing LatAm trip - feeling so much love, thanks to you all! pic.twitter.com/iQCXlXVPai"
TweetsData/shakira.csv;2016-12-09 03:30;769;4415;"Tres @premiolonuestro nominaciones! Sintiendo mucho el cariño después de este viaje increíble a Latinoamérica. Un beso para todos y gracias! pic.twitter.com/fQ6r4Fe7SD"
TweetsData/shakira.csv;2016-12-08 23:46;1790;10098;"#Chantaje 100 millones de visitas / 100 million views pic.twitter.com/wF6sqzsOXB"
TweetsData/shakira.csv;2016-12-08 07:22;799;4012;"Descubran el nuevo perfil de Shak y su #ChantajeDanceOff ahora mismo en @musicallyapp . Pueden superar la versión de Shak? ShakHQ pic.twitter.com/bTtQG159hs"
TweetsData/shakira.csv;2016-12-08 07:21;1802;11222;"Check out Shak's new account and the #ChantajeDanceOff happening on @musicallyapp right now--can you top Shak's version? ShakHQ pic.twitter.com/1aDkOb49LG"
TweetsData/shakira.csv;2016-12-07 22:29;748;4509;"Shakira ontem com seus fãs, no aeroporto de São Paulo, após o lancamento da sua nova fragrancia, Dance. ShakiraHQ pic.twitter.com/u91Nh8nvn6"
TweetsData/shakira.csv;2016-12-07 10:27;2394;10368;"Thank you Brazil! Love you guys! Shak http:// spoti.fi/2efs0f1 pic.twitter.com/NQNi5iun4E"
TweetsData/shakira.csv;2016-12-07 02:39;688;3083;"Celebrando mi nominación a los #GRAMMYs por Try Everything en São Paulo! Shak @RecordingAcad pic.twitter.com/h5UkAUUxNz"
TweetsData/shakira.csv;2016-12-07 02:37;1534;9303;"Celebrating the @RecordingAcad nomination for Try Everything in São Paulo! Shak #GRAMMYs pic.twitter.com/trYcO5rXDL"
TweetsData/shakira.csv;2016-12-06 23:56;760;2895;"90 million! 90 Millones! #Chantaje https:// youtu.be/6Mgqbai3fKo ShakHQ"
TweetsData/shakira.csv;2016-12-06 00:02;1203;7844;"Presentando mi fragancia "Dance" en Chile / During the launch of my fragrance "Dance" in Chile. Shak pic.twitter.com/RYPTldzUWg"
TweetsData/shakira.csv;2016-12-05 23:34;791;5675;"Hola Chile! Les esperamos a las 6 de la tarde hoy en el Mall Plaza Vespucio de Santiago donde Shaki presentará su fragancia, Dance! ShakHQ pic.twitter.com/vjqNFpaxci"
TweetsData/shakira.csv;2016-12-05 07:02;1270;6932;"Shak gone wild in Santiago, Chile// En una heladería de Santiago, Chile. ShakHQ #dance pic.twitter.com/KQYm5hETCb"
TweetsData/shakira.csv;2016-12-05 03:56;895;6314;"Con mi equipo! / With my team! Shak pic.twitter.com/h6XmkbIchq"
TweetsData/shakira.csv;2016-12-04 23:49;707;4670;"Hola Chile! Shakira presentará mañana en Santiago, su última fragancia #Dance . Todos los detalles aquí -> https:// business.facebook.com/events/2196980 087194624/ … ShakHQ pic.twitter.com/3IY18ON8Id"
TweetsData/shakira.csv;2016-12-04 05:55;1998;12643;"Creo que a Sasha le gusta mi nueva canción! / I think that Sasha likes my new song! Shak pic.twitter.com/QlYW8yKs22"
TweetsData/shakira.csv;2016-12-03 03:09;677;2932;"Así se hizo #Chantaje ! Check out the official behind-the-scenes video from the #Chantaje shoot! https:// youtu.be/yIEfRvBnuR4 ShakHQ"
TweetsData/shakira.csv;2016-12-02 22:34;894;4081;"Más de 750 millones de streams para La Bicicleta y Chantaje en el mundo! Noche increíble, gracias a los fans! Shak pic.twitter.com/udaSTuhPhz"
TweetsData/shakira.csv;2016-12-02 22:33;1487;9927;"Over 750 million streams for la Bicicleta and Chantaje worldwide! Incredible evening! Thank you to my amazing fans! Shak pic.twitter.com/QrHtyxxXgc"
TweetsData/shakira.csv;2016-12-02 07:10;1021;5802;"Gracias a @Los40_Spain por esta noche! A mi equipo y a mi mgmt Jay Brown y Jaime Levine, por estar conmigo hoy y ayudarme tanto siempre!! pic.twitter.com/6J9Lo9jlgt"
TweetsData/shakira.csv;2016-12-02 07:09;1858;14562;"Thanks to @Los40_Spain for tonight! To my team and my management Jay Brown and Jaime Levine, for being with me today & helping me always!! pic.twitter.com/vqEAnz3iaq"
TweetsData/shakira.csv;2016-12-01 04:19;918;4287;"More great #Chantaje news - the new single is #1 on @Billboard 's Hot Latin Songs chart! #Chantaje #1 en el chart de Hot Latin Songs! ShakHQ pic.twitter.com/PEL0E6Beuk"
TweetsData/shakira.csv;2016-11-30 23:48;1425;7002;"Acabo de recibir una noticia increíble. La @fpiesdescalzos sede Barranquilla lidera la lista de los mejores colegios públicos de Colombia! pic.twitter.com/yD4SPeoijM"
TweetsData/shakira.csv;2016-11-30 22:08;1298;9348;"50MM de visitas en 11 días con el vídeo de #Chantaje !! Vamos por los 100? / 50M views of the #Chantaje vid in 11 days!! Let's go for 100? pic.twitter.com/g4DVePjHyk"
TweetsData/shakira.csv;2016-11-30 05:56;504;2744;"A Playmobil me in a pink wig with my friend Pig Floyd. Spot on @youareclick #Chantaje pic.twitter.com/avyAE6ETAu"
TweetsData/shakira.csv;2016-11-29 06:09;819;4823;"40 millones de visitas el video de #Chantaje en solo 10 días! Gracias a todos por esta noticia!! Shak pic.twitter.com/lBQDK1JPnU"
TweetsData/shakira.csv;2016-11-29 06:09;1503;12353;"40 million views on the #Chantaje vid in only 10 days! Incredible, thank you all for making my day! Shak pic.twitter.com/SrtaWMPkbl"
TweetsData/shakira.csv;2016-11-27 05:26;1133;5971;"30 million views in 8 days! Thank you! / 30 millones de reproducciones en 8 días! Gracias! #Chantaje https:// youtu.be/6Mgqbai3fKo ShakHQ pic.twitter.com/29cyx0nHOI"
TweetsData/shakira.csv;2016-11-26 04:13;921;7877;"Sometimes I like to play at being behind the camera for a change / A veces me gusta creer que soy yo quien está detrás de cámaras. Shak pic.twitter.com/vNttiAL16u"
TweetsData/shakira.csv;2016-11-25 03:35;1757;8189;"Y por el amor y la familia / And thanks for love and family! pic.twitter.com/jz2ml3ygUp"
TweetsData/shakira.csv;2016-11-25 02:17;716;6826;"En este día con mi gran amiga @GabyVacaGuzman . Gracias a la vida también por la amistad! Shak pic.twitter.com/IGCsXV0QNJ"
TweetsData/shakira.csv;2016-11-25 01:01;21853;54937;"Happy Thanksgiving! pic.twitter.com/iaNjTIPB63"
TweetsData/shakira.csv;2016-11-24 05:40;587;2927;"Gracias x enviar miles de nombres xa mi cerdito de #Chantaje ( https:// youtu.be/6Mgqbai3fKo ). He escogido el de @verbenapopular 's como mi favorito pic.twitter.com/QnxJw0F4SQ"
TweetsData/shakira.csv;2016-11-24 05:35;581;3024;"Thanks for sending thousands of names for my #Chantaje piglet ( https:// youtu.be/6Mgqbai3fKo )! I picked @verbenapopular ’s as my fav… pic.twitter.com/2KU8cELacp"
TweetsData/shakira.csv;2016-11-23 23:11;1489;9700;"Qué nombre artístico se les ocurre para mi cerdito? / What stage name can you all think of for my piglet? Shak pic.twitter.com/9COcDqsHT1"
TweetsData/shakira.csv;2016-11-23 07:23;464;1860;"#Chantaje recibe más de un millón de reproducciones al día en @Spotify ! http:// spoti.fi/2efs0f1 ShakHQ"
TweetsData/shakira.csv;2016-11-23 07:22;617;3021;"#Chantaje is now getting more than a million plays per day on @Spotify ! http:// spoti.fi/2efs0f1 ShakHQ"
TweetsData/shakira.csv;2016-11-23 01:02;813;4668;"Check out my other feature in the video for Chantaje! / Aquí está mi otro invitado en el video de #Chantaje ! pic.twitter.com/mprFQ46Zmu"
TweetsData/shakira.csv;2016-11-21 23:11;1239;5974;"10m views in 3 days! 10m de reproducciones en 3 días! #Chantaje https:// youtu.be/6Mgqbai3fKo ShakHQ pic.twitter.com/mFam0VIAvC"
TweetsData/shakira.csv;2016-11-20 02:31;1229;5947;"Did you watch the new #Chantaje video yet? / Ya han visto el nuevo video de Chantaje con @maluma ? https:// youtu.be/6Mgqbai3fKo ShakHQ pic.twitter.com/8JdGXs6hmt"
TweetsData/shakira.csv;2016-11-19 04:51;815;3112;"Aquí está Shak en el bar del video de #Chantaje . Pueden ver el video aquí https://www. youtube.com/watch?v=6Mgqba i3fKo … ShakHQ pic.twitter.com/j869tCFVB6"
TweetsData/shakira.csv;2016-11-19 04:49;968;5054;"Here's Shakira at the bar on the #Chantaje shoot. Watch the full video at https://www. youtube.com/watch?v=6Mgqba i3fKo … now! ShakHQ pic.twitter.com/zbcGzBo0RX"
TweetsData/shakira.csv;2016-11-18 22:03;1176;2484;"Ya está aquí! El video oficial de #Chantaje con @Maluma ! https://www. youtube.com/watch?v=6Mgqba i3fKo … ShakHQ"
TweetsData/shakira.csv;2016-11-18 22:02;4090;13836;"It's here! Watch the official video for #Chantaje ft @Maluma now! https://www. youtube.com/watch?v=6Mgqba i3fKo … ShakHQ"
TweetsData/shakira.csv;2016-11-18 20:32;1224;6472;"Thanks to my fans for these two Grammys, @carlosvives , Afo Verde, my team, my angels Sasha and Milan and the love of my life, @3gerardpique . pic.twitter.com/z1uLMdijwx"
