TweetsData/shakira.csv;2018-05-05 02:23;280;1206;"30 días hasta el primer show, la cuenta regresiva empieza ahora! 30 days until showtime - countdown starts now! Shak #ElDoradoWorldTour pic.twitter.com/4IqeJPrnDw"
TweetsData/shakira.csv;2018-05-04 17:15;1580;17234;"Con mi paisano Yerry Mina! Shak pic.twitter.com/kpB3lSTFud"
TweetsData/shakira.csv;2018-04-30 19:04;638;5492;"Sasha photobombing @andresiniesta8 ! Shak pic.twitter.com/USUsI2bSWX"
TweetsData/shakira.csv;2018-04-27 22:27;759;5760;"Qué lindo es despertar con la noticia de haber ganado CINCO Premios Latin Billboard de doce nominaciones! Gracias a ustedes, mis fans, por hacer que cada minuto de mi vida y de mi carrera valga la pena. Ustedes son definitivamente uno de los más grandes regalos que he recibido."
TweetsData/shakira.csv;2018-04-27 22:26;925;8227;"Woke up to the amazing news that we've won FIVE Latin Billboard Awards out of 12 nominations! Just incredible. I love my fans so much for making every minute of my life and my career worth it. You're one of the greatest gifts. Thank you all. Shak"
TweetsData/shakira.csv;2018-04-20 05:34;1317;14080;"Damn, I wish I’d worn a hat for this one too! Ojalá hubiera llevado yo también un sombrero en esta foto! Shak pic.twitter.com/bEmaP0OXOv"
TweetsData/shakira.csv;2018-04-20 03:15;1146;10543;"Damn I look tall in this photo! Uy! Parezco súper alta en esta foto! Shak pic.twitter.com/fNZYdUgqyq"
TweetsData/shakira.csv;2018-04-19 23:29;1294;7805;"Shak and @Maluma are the cover stars of @Billboard ’s new Latin Music Issue! Read the interview: https://www. billboard.com/articles/colum ns/latin/8347120/shakira-maluma-interview-billboard-cover-story-2018 … Shak y Maluma en la portada de la revista Billboard! ShakHQ pic.twitter.com/IyM2Ae3W5i"
TweetsData/shakira.csv;2018-04-18 05:18;873;6604;"El Dorado has been nominated for Top Latin Album at this year's @Billboard Music Awards! #BBMAs / El Dorado ha sido nominado en la categoría de Top Latin Album en los @BBMAs ! ShakHQ pic.twitter.com/YfYjVGl3tl"
TweetsData/shakira.csv;2018-04-12 17:00;399;2888;"Great to see She Wolf added to @Spotify 's #ThrowbackThursday playlist today! Que bueno ver She Wolf hoy en el playlist #ThrowbackThursday de Spotify! Aaaauuuuuu! ShakHQ https:// open.spotify.com/user/spotify/p laylist/37i9dQZF1DWXF8Nf1uycDZ?si=CirWlfF1RMCOq4-wVdeScQ …"
TweetsData/shakira.csv;2018-04-10 23:06;1894;24494;"It’s a red and Black day! Shak pic.twitter.com/i1yHPauhBw"
TweetsData/shakira.csv;2018-04-03 01:50;2066;21914;"Staring at the sun. Shak pic.twitter.com/0IHegD3HSw"
TweetsData/shakira.csv;2018-04-02 07:09;994;13008;"Happy Easter painting Easter eggs! Shak pic.twitter.com/ST5MRrXyR1"
TweetsData/shakira.csv;2018-03-28 23:18;760;8073;"...also sharing some laughs with @TheAnnaKaiser @AKTINMOTION ! Shak pic.twitter.com/my9n1UfAth"
TweetsData/shakira.csv;2018-03-27 21:58;1110;14991;"Working hard with @TheAnnaKaiser @AKTINMOTION ! Shak pic.twitter.com/RJGcdGUclC"
TweetsData/shakira.csv;2018-03-22 03:26;599;5786;"Ready for my closeup! Shak https:// youtu.be/zkG4Xpz6t68 pic.twitter.com/QbuaUiCiVg"
TweetsData/shakira.csv;2018-03-19 23:55;688;5422;"Thanks for keeping my head above water on this shoot @jaumedelaiguana ! Shak pic.twitter.com/lbqmPOrGo4"
TweetsData/shakira.csv;2018-03-14 01:21;697;5943;"A one of a kind jacuzzi! Un jacuzzi único! Shak https:// youtu.be/zkG4Xpz6t68 pic.twitter.com/HKyNI2wBoq"
TweetsData/shakira.csv;2018-03-13 04:36;639;4985;"Not as comfortable as it looks! No es tan cómodo cómo parece! Shak #TrapVideo https:// youtu.be/zkG4Xpz6t68 pic.twitter.com/7A8KjtgfML"
TweetsData/shakira.csv;2018-03-13 00:41;768;4906;"El Dorado was named Latin Album of the Year at last night’s @iHeartRadio Music Awards! / El Dorado ganó anoche el Premio Álbum Latino del Año en los Premios #iHeartAwards2018 ! ShakHQ pic.twitter.com/DnIQ7lks13"
TweetsData/shakira.csv;2018-03-12 00:44;978;8790;"Want to be a #FlyOnTheWall during the #Trap video shoot? Over the next few posts I’ll show you how we made the magic! Let’s start with this one: first challenge was to make sure my makeup was waterproof! Shak https:// youtu.be/zkG4Xpz6t68 pic.twitter.com/jQdywVBjMt"
TweetsData/shakira.csv;2018-03-09 06:21;556;3063;"By sending a girl to school, she is far more likely to ensure that her children also receive an education. Investing in a girl’s education is investing in a nation. #IWD2018 , #TimeIsNow #GlobalGoals"
TweetsData/shakira.csv;2018-03-09 06:21;2197;11473;"It’s International Women’s Day! An African proverb says, “If we educate a boy, we educate one person. If we educate a girl, we educate a family – and a whole nation.” pic.twitter.com/mD31cTZ6DH"
TweetsData/shakira.csv;2018-03-07 05:06;554;4117;"Check out our GIFs from Shak's Trap video with @Maluma over on her official @Giphy page - https:// giphy.com/channel/shakira / En el perfil oficial de Shak en @GIPHY encontrarán los GIFs del video de Trap con Maluma! ShakHQ pic.twitter.com/t7yqEMCC8p"
TweetsData/shakira.csv;2018-03-05 04:25;417;4815;"Happy Birthday @EmilioEstefanJr , love Shak"
TweetsData/shakira.csv;2018-03-03 04:50;1922;17157;"Happy birthday Chris, and thanks for being there for me when I needed you! pic.twitter.com/b6QpWVXZ95"
TweetsData/shakira.csv;2018-02-24 03:12;803;5827;"It’s exactly 100 days until the #ElDoradoWorldTour begins in Hamburg on June 3! Who’s coming? Hoy faltan exactamente 100 días para que empiece #ElDoradoWorldTour en Hamburgo el 3 de Junio! Quién viene? Info / tickets http://www. shakira.com/tour ShakHQ pic.twitter.com/2JWXWOR8d7"
TweetsData/shakira.csv;2018-02-23 02:50;545;3285;"Flashback to 2007 when Shak performed "Día Especial" with @cerati at the Live Earth concert in Hamburg (the same city where the #ElDoradoWorldTour kicks off on June 3rd). #TBT ShakHQ pic.twitter.com/c10vWvCcn1"
TweetsData/shakira.csv;2018-02-23 02:49;987;5654;"Hoy recordamos esta actuación de Shakira y @cerati en el concierto Live Earth que se celebró en Hamburgo en el 2007 donde interpretaron "Día Especial" (la gira de #ElDoradoWorldTour empezará en esta misma ciudad el 3 de Junio!) #TBT ShakHQ pic.twitter.com/PfCyh16qhB"
TweetsData/shakira.csv;2018-02-17 01:52;1974;11305;"Check out this amazing footage of Shak singing Trap in the studio with @Maluma last year! No se pierdan este video de Shak y Maluma cantando Trap en el estudio! ShakHQ pic.twitter.com/4EvcBnKTYv"
TweetsData/shakira.csv;2018-02-15 02:30;638;5675;"Happy Valentine’s day! Feliz día de San Valentín! http:// smarturl.it/ShakiraBeauty2 017 … ShakHQ pic.twitter.com/wepQPHvCBg"
TweetsData/shakira.csv;2018-02-14 21:10;1697;15951;"pic.twitter.com/DJjqabHKtA"
TweetsData/shakira.csv;2018-02-12 02:31;636;4642;"The video for Shak’s new single Trap ft @maluma just hit 50m views! Thanks guys! / El video del nuevo sencillo de Shak con Maluma, Trap, ya tiene más de 50 millones de reproducciones! Muchas gracias! ShakHQ https:// youtu.be/zkG4Xpz6t68"
TweetsData/shakira.csv;2018-02-10 04:56;534;3098;"Discover Rock The Night, the new masculine fragrance by Shak! Descubran Rock The Night, la nueva fragancia masculina de Shak ShakHQ pic.twitter.com/fyAdZEQdso"
TweetsData/shakira.csv;2018-02-10 04:49;1196;10831;"… and now for the boys! Here’s Rock The Night, my first masculine fragrance! … Y ahora para los chicos! Aquí está Rock The Night, mi primera fragancia masculina! Shak pic.twitter.com/jhTD7yK9Gs"
TweetsData/shakira.csv;2018-02-09 23:22;1435;13037;"Training with mom! pic.twitter.com/wa7d29dDJy"
TweetsData/shakira.csv;2018-02-09 04:52;407;4186;"#TBT cuando Shakira actuó el el Global Citizen Festival que se celebró en el @BcardArenaHH de Hamburgo el pasado mes de julio - el mismo lugar donde empezará #ElDoradoWorldTour este mes de junio ( http:// shakira.com/tour )! ShakHQ pic.twitter.com/gHsuTOV9ux"
TweetsData/shakira.csv;2018-02-09 04:50;697;9382;"#TBT to when Shak performed at July’s Global Citizen Festival in Hamburg’s @BcardArenaHH - the very same venue where she’s kicking off her #ElDoradoWorldTour in June ( http://www. shakira.com/tour )! ShakHQ pic.twitter.com/BRGMdXkiM5"
TweetsData/shakira.csv;2018-02-08 21:04;1614;25087;"En la cafetería del cole de mis hijos. “Chilling” Para esto sirve el café pic.twitter.com/aSi8PXXVbj"
TweetsData/shakira.csv;2018-02-08 04:47;1298;10220;"Thanks for these 12 nominations for the @LatinBillboards Awards! Gracias por estas 12 nominaciones a los Premios Billboard Latino! Shak pic.twitter.com/M85FmVSpqp"
TweetsData/shakira.csv;2018-02-06 21:03;706;5030;"This is hilarious! Shak https:// twitter.com/qpark/status/9 36307581131329536 …"
TweetsData/shakira.csv;2018-02-05 01:54;2234;15921;"Sunday vibes! Shak pic.twitter.com/khLMe73MxV"
TweetsData/shakira.csv;2018-02-04 01:33;3607;22875;"Para mis fans que “nunca me dejan caer tan bajo, me levantan”. Shak pic.twitter.com/Q9SMWLg2GA"
TweetsData/shakira.csv;2018-02-03 08:37;1198;15921;"El cumple es siempre una buena excusa para estar con los amigos más queridos!! Shak pic.twitter.com/9395qxggGV"
TweetsData/shakira.csv;2018-02-03 06:29;1430;14111;"Gracias a todos por sus mensajes tan cariñosos en este día! Los quiero!! Thank you guys for all your affectionate messages today! Love you!! Shak"
TweetsData/shakira.csv;2018-02-02 05:58;1156;11342;"Y si firmo el contrato, contigo quiero repetir #tbt to when Shakira and @maluma recorded Trap last year/ Un #tbt de cuando Shakira y Maluma grabaron Trap el año pasado! ShakHQ pic.twitter.com/HRELXONEfF"
TweetsData/shakira.csv;2018-02-01 02:31;1370;9158;""Con Trap estábamos todos como sumergidos, debajo del agua, en trance absoluto". De esta manera Shakira definió el proceso de creación de Trap con @maluma (No se pierdan el nuevo video que pueden ver aquí https:// shakir.as/trapvideo ) ShakHQ pic.twitter.com/2eCxoziuxU"
TweetsData/shakira.csv;2018-02-01 02:30;557;3562;"“We were all submerged, underwater in this complete trance!” Here’s Shakira and @maluma chatting about the making of the new Trap video. (And watch the finished video at https:// shakir.as/trapvideo ) ShakHQ pic.twitter.com/KMyurdfl7I"
TweetsData/shakira.csv;2018-01-30 01:58;815;5688;"pic.twitter.com/LT6PrcbVAb"
TweetsData/shakira.csv;2018-01-30 01:57;2071;14708;"Celebrating the Grammy! / Celebrando el Grammy! Shak pic.twitter.com/53csXcDZs0"
TweetsData/shakira.csv;2018-01-29 08:09;695;4218;"Happy birthday @maluma ! I hope you are celebrating with some trap! Feliz cumple Maluma Espero que estés celebrando con algo de trap! https:// youtu.be/zkG4Xpz6t68"
TweetsData/shakira.csv;2018-01-29 07:28;4300;27006;"Gracias por este Grammy #GRAMMYs pic.twitter.com/pEFHdpJNFu"
TweetsData/shakira.csv;2018-01-29 07:26;2733;17455;"Thank you for this Grammy #GRAMMYs pic.twitter.com/tth4lZeMRZ"
TweetsData/shakira.csv;2018-01-29 03:23;639;3764;"Wow, the new Trap video ft @maluma has had 13m views in two days! Incredible. Thanks everyone. Increíble! El nuevo video de Trap con Maluma ha tenido 13m de reproducciones en 2 días! Muchas gracias! ShakHQ https:// youtu.be/zkG4Xpz6t68"
TweetsData/shakira.csv;2018-01-27 08:18;865;4652;"Thanks for making my new Trap video with @maluma the #1 trending video on YouTube! Gracias por hacer mi nuevo video Trap con Maluma el número uno en YouTube! Shak https:// shakir.as/trapvideo pic.twitter.com/QZGJvdWMrv"
TweetsData/shakira.csv;2018-01-26 22:01;2435;8626;"Ya está aquí! Here it is! Trap ft @Maluma . https:// youtu.be/zkG4Xpz6t68 #TrapVideo"
TweetsData/shakira.csv;2018-01-26 18:38;507;4100;"Tickets’s for Shak’s new shows in London, Hamburg & Bordeaux are on sale now! Ya a la venta las entradas para los nuevos conciertos de Shakira en Londres, Hamburgo y Burdeos! -> http:// bit.ly/shak-tour ShakHQ pic.twitter.com/qebdUWMiKH"
TweetsData/shakira.csv;2018-01-26 07:07;2685;12277;"Mañana / tomorrow. 9am EST #TrapVideo @maluma pic.twitter.com/EFYe1T1LbG"
TweetsData/shakira.csv;2018-01-26 02:25;2737;18187;"pic.twitter.com/0retAuYFjK"
TweetsData/shakira.csv;2018-01-24 03:34;1811;11323;"pic.twitter.com/WN2glR9A0H"
TweetsData/shakira.csv;2018-01-23 23:41;469;3326;"~ The @Viber presale for Shak’s Hamburg, London & Bordeaux shows is open now! Click http:// vb.me/7fc5b498 to get your code. ~ La preventa en Viber para los shows de Shak en Hamburgo, Londres y Burdeos ya ha empezado. Aquí http:// vb.me/7fc5b498 encontrarán su código. ShakHQ pic.twitter.com/vUGUSuNNsi"
TweetsData/shakira.csv;2018-01-22 17:02;620;4096;"Shak acaba de añadir nuevas fechas en Hamburgo, Londres y Burdeos en la gira de #ElDoradoWorldTour este verano. La venta general empieza este Viernes pero si siguen a Shakira en @viber ( https:// vb.me/7fc5b498 ) tendrán acceso a pre-venta a partir de mañana! ShakHQ pic.twitter.com/pZsBhdHioO"
TweetsData/shakira.csv;2018-01-22 17:00;545;3734;"TOUR NEWS! Shak just added new dates in Hamburg, London & Bordeaux to the European leg of her #ElDoradoWorldTour this summer. Tickets go on sale on Friday, but follow Shak on @Viber now at https:// vb.me/7fc5b498 for exclusive presale access tomorrow! ShakHQ pic.twitter.com/esjJlhY8YW"
TweetsData/shakira.csv;2018-01-17 00:39;824;5384;"This album is as much yours as it is mine-thanks for the love / Este álbum es tan mío como de uds, gracias por tanto cariño! Shak https://www. idolator.com/7673110/best-p op-albums-eps-2017?view-all …"
TweetsData/shakira.csv;2018-01-09 06:55;522;4632;"Con muchas ganas de hacer lo mismo en Colombia con la población vulnerable! Shak @fundaciobrugada pic.twitter.com/QCKPfcN9lP"
TweetsData/shakira.csv;2018-01-09 00:03;1782;16689;"What a nice way to start the new year knowing of all the great support you’ve all given me!! Love u so much! / Qué manera de empezar el año, sabiendo del inmenso apoyo que me han dado! Los quiero muuucho! Shak pic.twitter.com/Q8JIL8AZPw"
TweetsData/shakira.csv;2018-01-02 02:48;670;7563;"Gracias a mi club de fans en Barranquilla por entregar regalos en nombre de la @fpiesdescalzos a los niños desfavorecidos. Shak pic.twitter.com/6WjzGFQjhX"
TweetsData/shakira.csv;2018-01-01 06:50;3836;32495;"Deseo que sus deseos se hagan realidad y que el 2018 traiga todo el amor y la paz a sus vidas! Shak pic.twitter.com/DPvADUHf26"
TweetsData/shakira.csv;2017-12-31 06:20;1467;21392;"At the airport in NYC. Saying hi to my amazing NY fans. Shak pic.twitter.com/fc2xjVmFFy"
TweetsData/shakira.csv;2017-12-30 22:45;743;6730;"Check out Shak’s incredible end of year @Spotify stats! Thanks to you all for the amazing support / No se pierdan este increíble resumen del año 2017 de Shak en Spotify! Muchas gracias a todos por su apoyo. ShakHQ pic.twitter.com/dWCK2gdG0x"
TweetsData/shakira.csv;2017-12-27 22:12;2394;15649;"pic.twitter.com/WhuAZOQKAK"
TweetsData/shakira.csv;2017-12-26 19:19;842;5948;"Check out the new @costacrociere commercial, featuring Shak! No se pierdan el nuevo anuncio de @costacruceros con Shak! #shakiraonboard #felicitaalquadrato ShakHQ pic.twitter.com/WaLzcg6k32"
TweetsData/shakira.csv;2017-12-25 04:36;1631;14925;"Felices fiestas para ustedes, los mejores fans del mundo! El apoyo y el amor que me han transmitido estos últimos meses ha sido un verdadero motor! En los próximos días tendré más noticias sobre mi gira, hasta entonces, les deseo mucha paz y una muy feliz navidad! Shak pic.twitter.com/FttYkDg8D7"
TweetsData/shakira.csv;2017-12-25 04:36;787;5516;"Happy holidays to the best fans any artist could hope for. The love you guys have shown me over the last few months has been my rock! I should have more news on the tour to give you in the next few days. Until then, sending love and peace to you and yours. Merry Christmas! Shak pic.twitter.com/OXqm7LtycL"
TweetsData/shakira.csv;2017-12-24 07:46;1142;14418;"My first self baked gingerbread man cookie! My house now smells like cinnamon, ginger, and sugar! Shak pic.twitter.com/LO9dihRjLm"
TweetsData/shakira.csv;2017-12-22 00:11;588;5031;"Happy Holidays! Felices Fiestas! http:// smarturl.it/ShakiraBeauty2 017 … ShakHQ pic.twitter.com/Cof0VpKOFU"
TweetsData/shakira.csv;2017-12-18 00:50;460;4061;"Felicitaciones Dayana de Barranquilla por tu medalla de Oro en el campeonato Suramericano de Patinaje y a Ricardo de Cartagena por el reconocimiento de Pilo Pago! Shak @fpiesdescalzos pic.twitter.com/QIzopHcTTj"
TweetsData/shakira.csv;2017-12-13 00:36;1310;7917;"Shak has been named as the most-streamed Latin female on @Spotify in 2017! Thanks for all the listening, guys! / Shak es la artista latina femenina con más reproducciones en Spotify en 2017! Muchas gracias por escucharla! ShakHQ pic.twitter.com/OAM6MeHn5E"
TweetsData/shakira.csv;2017-12-10 00:21;1155;6604;"Hoy escuchando al Joe y el piano de Chelito De Castro con nostalgia de mi tierra. Shak https:// open.spotify.com/track/3WXfQDsA SfXrSojk9WB3aR?si=cQ34iuvdRxqHKef0VVdhYw …"
TweetsData/shakira.csv;2017-12-06 09:53;1963;24891;"Cosa guapa con botas. Shak pic.twitter.com/EPYNxFjQoL"
TweetsData/shakira.csv;2017-12-05 05:43;822;4805;"Wow, the Chantaje video reached TWO BILLION views! El video de Chantaje ya tiene más de 2 MIL MILLONES de reproducciones! Thank you! Gracias! https:// youtu.be/6Mgqbai3fKo ShakHQ"
TweetsData/shakira.csv;2017-11-29 02:32;771;4664;"Thanks to all of you for making that Latin Grammy win a reality and this nomination for an American Grammy possible! It's all because of you!! Shak pic.twitter.com/qMHlQKC3va"
TweetsData/shakira.csv;2017-11-29 02:32;1164;8731;"Gracias por hacer realidad ese Grammy latino y esta nominación de hoy al Grammy americano! Todo se los debo a ustedes!! Los quiero mucho! Shak pic.twitter.com/zMpvS5tKYw"
TweetsData/shakira.csv;2017-11-29 01:21;1210;6911;"El Dorado, después de ganar en la categoría de Mejor Álbum Vocal Pop Contemporáneo en los #LatinGrammys acaba de recibir la nominación de Mejor Álbum Latino Pop en los #GRAMMYs ! ShakHQ pic.twitter.com/Es3muVxrTz"
TweetsData/shakira.csv;2017-11-29 01:20;1331;7971;"After winning best Best Contemporary Pop Vocal Album at the #LatinGrammys , El Dorado just scored a #GRAMMYs nomination for Best Latin Pop Album! ShakHQ pic.twitter.com/EssIoZAbhh"
TweetsData/shakira.csv;2017-11-21 08:35;762;4879;"Eu tamben te amo Brasil! Shak https:// youtu.be/OTOiV0D4C9A"
TweetsData/shakira.csv;2017-11-20 23:59;965;4579;"Our children. Our future. This #WorldChildrensDay , join @UNICEF to make children’s voices heard across the → https:// uni.cf/worldchildrens day … ShakHQ"
TweetsData/shakira.csv;2017-11-20 03:05;851;10096;"Feeling your loss my dear friend Azzedine, wherever you are now, your love and your ingenious legacy will always be with us, with me. I will miss you so much. Shak pic.twitter.com/PIEJgpUe01"
TweetsData/shakira.csv;2017-11-17 05:08;185;809;"Gracias Juanes! Shak"
TweetsData/shakira.csv;2017-11-17 03:01;2598;24623;"Ustedes son mi más grande incentivo. Y cuando cante otra vez para ustedes querré que no acabe jamás! Shak pic.twitter.com/ACkZIEqgsq"
TweetsData/shakira.csv;2017-11-16 22:11;1507;10838;"Quiero felicitar a mi amigo @AlejandroSanz por ser la Persona del Año esta noche en los @LatinGRAMMYs @Univision . Para mí es el amigo del año y de todos los años, y un talento al que ningún otro se compara! Te quiero mucho Ale! Gracias por darnos tanto!!! Shak"
TweetsData/shakira.csv;2017-11-16 21:20;762;5574;"Los quiero tanto! Gracias por ser mi apoyo. Shak pic.twitter.com/hSmZCDDT1V"
TweetsData/shakira.csv;2017-11-14 20:50;3342;17177;"pic.twitter.com/jUTgDMfnKj"
TweetsData/shakira.csv;2017-11-10 03:22;1509;10138;"pic.twitter.com/L7Sk6jm1dQ"
TweetsData/shakira.csv;2017-11-07 17:39;571;3339;"Message from Shakira re the Cologne show / Nota de Shakira sobre el show de Colonia. http://www. shakira.com/news/1056 ShakHQ"
TweetsData/shakira.csv;2017-11-04 00:49;1213;9527;"#ElDoradoWorldTour #5days #5días ShakHQ pic.twitter.com/RrqdU1d0SL"
TweetsData/shakira.csv;2017-11-03 01:46;1325;10853;"Ensayos generales / full-production rehearsal! Shak pic.twitter.com/RwFIlYrUJZ"
TweetsData/shakira.csv;2017-11-02 01:43;852;5373;"#ElDoradoWorldTour empieza este MES! Aquí les mostramos cómo van los ensayos... ShakHQ pic.twitter.com/KHjdt9bLaw"
TweetsData/shakira.csv;2017-11-02 01:40;868;6001;"The El Dorado World Tour starts THIS MONTH! Here’s our latest look at rehearsals… ShakHQ pic.twitter.com/TBj0h1dQDj"
TweetsData/shakira.csv;2017-10-31 06:06;544;3572;"#MeetTheBand @Mit_C_Hell_ (guitar), @BrendanDrums (drums), @sterlinblu (keys), @caitlinbird (strings) & @erikkertes (bass) ShakHQ pic.twitter.com/tnBSnWAh35"
TweetsData/shakira.csv;2017-10-29 02:50;1978;13413;"Sale El Sol es el video número VEINTE que consigue más de 100 millones de reproducciones! Increíble! Muchas gracias! ShakHQ pic.twitter.com/Tw8QdtNMba"
TweetsData/shakira.csv;2017-10-29 02:49;949;6373;"Sale El Sol has just become Shak’s TWENTIETH video to reach 100m views! Amazing. Thanks guys! ShakHQ pic.twitter.com/nB0LCoIux9"
TweetsData/shakira.csv;2017-10-27 02:35;1258;9072;"#EDoradoWorldTour rehearsals/ensayos. 13 days / días! ShakHQ pic.twitter.com/DWdExYUqp1"
TweetsData/shakira.csv;2017-10-26 18:46;578;4346;"Adjourned meeting with my super team at 3 am! / En reunión con mi equipo a las 3 am! Shak pic.twitter.com/T6vMICRfYD"
TweetsData/shakira.csv;2017-10-26 06:45;434;3082;"Aún están a tiempo para ganar un viaje a París y conocer a Shakira! Participen aquí @Viber http:// bit.ly/2hEAuz9 ShakHQ pic.twitter.com/zB9UlIt9G7"
TweetsData/shakira.csv;2017-10-26 06:44;347;2481;"Still time to win a trip to Paris & meet Shakira! Enter here @Viber http:// bit.ly/2hEAuz9 ShakHQ pic.twitter.com/a8TWIyLczL"
TweetsData/shakira.csv;2017-10-25 18:24;809;6698;"Let's go! Vamos! 14 días/days! #ElDoradoWorldTour ShakHQ pic.twitter.com/GGbp9dtI8x"
TweetsData/shakira.csv;2017-10-25 03:04;1370;3348;"Envíen un tweet con @shakira + Favorite Artist Latin + #AMAs para votar por Shakira en los @AMAs ! (o hagan RT a este tweet) ShakHQ pic.twitter.com/PQwfdxj3K3"
TweetsData/shakira.csv;2017-10-25 02:59;1115;2764;"Tweet @shakira + Favorite Artist Latin + #AMAs or RT this tweet to vote for Shak at the @AMAs ! (Then watch LIVE 11/19 at 8/7c on ABC) ShakHQ pic.twitter.com/Q9qTBQsI47"
TweetsData/shakira.csv;2017-10-24 02:44;647;5079;"#ElDoradoWorldTour #16days #16días ShakHQ pic.twitter.com/1KKUl1HYT5"
TweetsData/shakira.csv;2017-10-23 22:11;1100;7273;"Who says you can't have fun while working hard? / Quién dice que no se puede pasarlo bien mientras se trabaja duro? Shak pic.twitter.com/Ra4w7cZIOy"
TweetsData/shakira.csv;2017-10-21 01:22;497;3259;"Ganen un viaje a París y conozcan a Shakira! Ingresen aquí @Viber http:// bit.ly/2hEAuz9 ShakHQ pic.twitter.com/QEOxBT9rc1"
TweetsData/shakira.csv;2017-10-21 01:20;450;2948;"Win a trip to Paris & meet Shakira! Enter here @Viber http:// bit.ly/2hEAuz9 ShakHQ pic.twitter.com/jVKsHH4sGj"
TweetsData/shakira.csv;2017-10-20 20:38;887;9722;"Playing with my vocoder toy! Shak pic.twitter.com/1S9WTZrqrE"
TweetsData/shakira.csv;2017-10-20 04:37;3681;22185;"This song makes me move! Cómo me hace bailar esta canción! Shak pic.twitter.com/4JrTmDcWoY"
TweetsData/shakira.csv;2017-10-19 03:48;725;4984;"#ElDoradoWorldTour #21days #21días ShakHQ pic.twitter.com/xjMzrdd6Iy"
TweetsData/shakira.csv;2017-10-17 06:08;783;6914;"I ordered these online! Shak pic.twitter.com/m2e1JP8B6x"
TweetsData/shakira.csv;2017-10-17 04:13;349;2142;"Aún hay tiempo para terminar la encuesta en @viber y ganar viaje a Barcelona para ver un ensayo de la gira! http:// bit.ly/2hEAuz9 ShakHQ pic.twitter.com/zxHuBb26tF"
TweetsData/shakira.csv;2017-10-17 04:13;313;1972;"Still time to complete the poll in Shak’s @Viber chatbot for chance to fly to Barcelona for tour rehearsals! http:// bit.ly/2hEAuz9 ShakHQ pic.twitter.com/aCzfNuP9lz"
TweetsData/shakira.csv;2017-10-16 22:14;793;6012;"Comprando máscaras! Pronto sabrán por qué! #ElDoradoWorldTour ! Shak https:// twitter.com/3gerardpique/s tatus/919577921001545729 …"
TweetsData/shakira.csv;2017-10-14 00:05;2643;18691;"My glam team doubling as dancers for my tour. What do you guys think? Hired?? Shak pic.twitter.com/ssPmCERNGC"
TweetsData/shakira.csv;2017-10-13 03:17;574;4322;"Empieza el primer reto en @viber ! El ganador viajará a Barcelona y verá un ensayo de la gira de Shakira! http:// bit.ly/2hEAuz9 ShakHQ pic.twitter.com/xPmZeE3Zk5"
TweetsData/shakira.csv;2017-10-13 03:14;391;2727;"Check out our challenge in Shak’s chatbot on @viber for the chance to fly to Barcelona to see tour rehearsals! http:// bit.ly/2hEAuz9 SHQ pic.twitter.com/8vLUpvmTgC"
TweetsData/shakira.csv;2017-10-13 01:09;548;2973;"Shakira está nominada en la categoría de Favorite Latin Artist en los @AMAs ! Pueden votar aquí http://www. billboard.com/amas/shakira . Gracias! ShakHQ pic.twitter.com/atVeM9Bjs2"
TweetsData/shakira.csv;2017-10-13 01:08;721;3827;"Shakira's been nominated for Favorite Latin Artist at the @AMAs ! You can vote at http://www. billboard.com/amas/shakira . Thanks! ShakHQ pic.twitter.com/Wrzx8Gu40j"
TweetsData/shakira.csv;2017-10-12 03:10;965;8521;"Planeando el orden de canciones, sumergida en mis pensamientos / Planning the set list submerged in my thoughts. Shak pic.twitter.com/x7NcAqMlA9"
TweetsData/shakira.csv;2017-10-11 08:26;580;3693;"Muy pronto podrán conseguir premios increíbles de #ElDoradoWorldTour en la aplicación de mensajería de @Viber http:// bit.ly/2wwD8N5 ShakHQ pic.twitter.com/ntsOLjUhP1"
TweetsData/shakira.csv;2017-10-11 08:25;392;2516;"Amazing #ElDoradoWorldTour prizes coming very soon on the @Viber messenger app... http:// bit.ly/2wwD8N5 ShakHQ pic.twitter.com/vUeLMF92zO"
TweetsData/shakira.csv;2017-10-11 03:32;1490;9348;"When one of your musical icons does a cover of your song ! Cuando uno de tus iconos musicales hace una versión de tu canción ! Shak pic.twitter.com/FrtIixSfpN"
