TweetsData/shakira.csv;2016-11-18 19:05;2537;12909;"Gracias a mi público por estos 2 Grammy's, a @carlosvives , a Afo, a mi equipo, a mi vida @3gerardpique y a mis angelitos Sasha y Milan! pic.twitter.com/oDVpLy2CbW"
TweetsData/shakira.csv;2016-11-18 12:18;1069;6037;"En pocas horas! Les prometo que el agua no estaba fría sino no me estaría riendo! Shak pic.twitter.com/lbw01Fjqro"
TweetsData/shakira.csv;2016-11-18 12:16;887;5210;"Just hours away! I promise the water wasn't cold or I wouldn't be laughing! Shak pic.twitter.com/9BijPijOxF"
TweetsData/shakira.csv;2016-11-18 07:09;671;2349;"No se pierdan un adelanto del video de #Chantaje hoy en la alfombra roja de los @LatinGrammys en @univision ! ShakHQ pic.twitter.com/RbyjWLKxZk"
TweetsData/shakira.csv;2016-11-18 07:09;655;3146;"Look out for an exclusive teaser of the #Chantaje video tonight on the @LatinGrammys ' red carpet on @Univision ! ShakHQ pic.twitter.com/sRngXsEqek"
TweetsData/shakira.csv;2016-11-18 06:05;857;3712;"Un beso para mis amigos de @LatinGRAMMYs . Esta noche podrán ver un adelanto de mi nuevo video ft @maluma por @Univision en la Alfombra Roja"
TweetsData/shakira.csv;2016-11-18 03:04;823;3835;"Did you check out the new lyric video Chantaje ft @maluma ? / Ya han visto el video con la letra de #Chantaje ? https:// youtu.be/kIrnLpFK8To ShakHQ pic.twitter.com/5egsplXWC0"
TweetsData/shakira.csv;2016-11-17 05:18;1293;5643;"Recipe for sexiness: just add water. ShakHQ pic.twitter.com/JJCNjFQxqk"
TweetsData/shakira.csv;2016-11-17 01:08;582;2171;"It’s almost Friday-sit back and relax to Shak's hypnotic official lyric video for #Chantaje https://www. youtube.com/watch?v=kIrnLp FK8To … ShakHQ"
TweetsData/shakira.csv;2016-11-17 01:07;710;2619;"Ya casi es viernes! Relájate y disfruta de este hipnótico video de Shakira con la letra oficial de #Chantaje https://www. youtube.com/watch?v=kIrnLp FK8To … ShakHQ"
TweetsData/shakira.csv;2016-11-16 05:06;1368;8645;"Mis niñitos! pic.twitter.com/a9OLk4t3j4"
TweetsData/shakira.csv;2016-11-16 03:13;886;5413;"Thanks for all the messages you sent for Sasha while he was sick. Everything is under control now, and he's back to his cheerful self! pic.twitter.com/vbBihoMYaC"
TweetsData/shakira.csv;2016-11-16 03:12;2645;25232;"Gracias a todos x los mensajes cariñosos a sasha durante los días que estuvo enfermito. Ahora todo bajo control y con la alegría de siempre! pic.twitter.com/ZAnXCRPe7J"
TweetsData/shakira.csv;2016-11-15 23:47;775;2823;"Proud of you @3gerardpique ! http://www. espn.co.uk/football/blog/ espn-fc-united/68/post/2986436/espn-fc-100-barcelona-star-gerard-pique-is-top-centre-back-in-soccer …"
TweetsData/shakira.csv;2016-11-15 02:05;726;2698;"Shak es la artista latina más escuchada en @Spotify en todo el mundo! http:// spoti.fi/2efs0f1 ShakHQ"
TweetsData/shakira.csv;2016-11-15 02:04;555;2077;"Shak is currently the number one Latin artist on @Spotify worldwide! http:// spoti.fi/2efs0f1 ShakHQ"
TweetsData/shakira.csv;2016-11-13 23:02;2364;12575;"Happy 15th birthday Laundry Service! / Feliz cumple Laundry Service que hoy celebra 15 años! ShakHQ pic.twitter.com/Zqpy0SP6fa"
TweetsData/shakira.csv;2016-11-09 08:36;3137;8107;"Choose hope. Choose hope. Choose HOPE. #imwithher"
TweetsData/shakira.csv;2016-11-09 08:27;2117;6413;"The Latino vote can help decide the fate of a nation and the world's, don't stand still vote now! Shak"
TweetsData/shakira.csv;2016-11-09 07:27;669;2261;"El nuevo sencillo de Shakira, #Chantaje con @maluma , debuta en @Billboard en lo más alto! ShakHQ pic.twitter.com/xCHgZ1Sei9"
TweetsData/shakira.csv;2016-11-09 07:27;671;3136;"Shak's new single, #Chantaje ft @Maluma , is off to an amazing start on @Billboard ! ShakHQ pic.twitter.com/tdkEKbCQbx"
TweetsData/shakira.csv;2016-11-09 01:44;605;2776;"Momentos como éste hacen que la música tenga sentido / Moments like these are what make music make sense! https://www. facebook.com/salguero.oscar /videos/10211240167029388/?pnref=story … Shak"
TweetsData/shakira.csv;2016-11-08 06:01;366;1596;"I will be accompanying @carlosvives in spirit @LatinGRAMMYs , celebrating this incredible year that we’ve shared together with #LaBicicleta"
TweetsData/shakira.csv;2016-11-08 06:01;431;1563;"Due to personal matters, I won't be able to travel to Las Vegas & LA to attend the @LatinGRAMMYs or the @AMAs this year."
TweetsData/shakira.csv;2016-11-08 06:01;450;1931;"Estaré de corazón acompañando a @carlosvives con "la Bicicleta" en los @LatinGRAMMYs celebrando este gran año que hemos compartido juntos!"
TweetsData/shakira.csv;2016-11-08 06:00;688;3442;"Debido a motivos que me impiden viajar a Las Vegas /Los Angeles esta vez no podré asistir a la 17 edición de los @LatinGRAMMYs ni los @AMAs"
TweetsData/shakira.csv;2016-11-07 23:54;1104;5072;"Un poco más de ser una #moscaenlapared del estudio con Shak y @maluma ! ShakHQ #ChantajeBTS pic.twitter.com/thBDxehiFa"
TweetsData/shakira.csv;2016-11-07 23:52;797;3917;"A bit more of being a #flyonthewall in the studio with Shak and @maluma making #Chantaje ! ShakHQ #ChantajeBTS pic.twitter.com/bRVsm4TgMf"
TweetsData/shakira.csv;2016-11-06 05:58;1278;6449;"Quieres pasar más tiempo conmigo y @maluma en el estudio? #moscaenlapared . Esta historia continuará mañana! Shak pic.twitter.com/XxdN9nlo9x"
TweetsData/shakira.csv;2016-11-05 03:52;2005;9305;"Quieres ser una mosca en la pared y espiar como Shakira y @maluma hacen #Chantaje ? No te pierdas el segundo episodio mañana! ShakHQ pic.twitter.com/0oqPoAUZEk"
TweetsData/shakira.csv;2016-11-05 03:50;1749;8916;"Wanna be a fly on the wall and spy on Shakira and @maluma ? This is how they made Chantaje. Stay tuned for episode 2 tomorrow! ShakHQ pic.twitter.com/4CgTKM9Fpj"
TweetsData/shakira.csv;2016-11-02 23:39;638;2727;"Wow! #Chantaje con @Maluma ya tiene 16 millones de reproducciones en YouTube en 5 días! https://www. youtube.com/watch?v=pMxJgB oosU0 … ShakHQ"
TweetsData/shakira.csv;2016-11-02 23:38;466;1872;"Wow, #Chantaje ft @Maluma has 16m YouTube plays after just 5 days! https:// youtu.be/pMxJgBoosU0 ShakHQ"
TweetsData/shakira.csv;2016-10-31 21:51;789;2800;"Listen to Shakira's hit new single / Escuchen #Chantaje ft @maluma --> @AppleMusic ! ShakHQ http:// apple.co/chantaje"
TweetsData/shakira.csv;2016-10-29 21:40;1385;6244;"Gracias a todos por hacer #Chantaje número 1 en 16 países. Los quiero! / Thanks everybody for making Chantaje #1 in 16 countries! Shak pic.twitter.com/RaqVvcOg8t"
TweetsData/shakira.csv;2016-10-29 05:14;1015;3403;"Shakira's new single, #Chantaje , ft @Maluma is out now on @iTunes ! / Chantaje ya está aquí! --> http:// smarturl.it/Chantaje ShakHQ pic.twitter.com/SUcoUQfKUi"
TweetsData/shakira.csv;2016-10-29 03:43;1490;4650;"Cuando @3gerardpique se ríe de ti mientras intentas grabar un video sobre #Chantaje y descubres que tienes una abeja en un brazo pic.twitter.com/pohrwqHweO"
TweetsData/shakira.csv;2016-10-29 03:18;4722;16420;"When your man laughs at you while you try to make a video about your new single and then you discover a bee on your arm… #Chantaje ( ) pic.twitter.com/Nr1Xct82xe"
TweetsData/shakira.csv;2016-10-29 01:30;845;2837;"No se pierdan mi nuevo sencillo #Chantaje ft @maluma en @Spotify http:// spoti.fi/2efs0f1 Shak pic.twitter.com/reickBjU8j"
TweetsData/shakira.csv;2016-10-29 01:28;686;2324;"Check out my new single Chantaje ft @maluma out NOW on @Spotify http:// spoti.fi/2efs0f1 Shak pic.twitter.com/YP7uX7cZNd"
TweetsData/shakira.csv;2016-10-28 21:34;1072;2360;"Here it is! #Chantaje , ft @maluma - out now! Ya está aquí! #Chantaje - ft Maluma ya está disponible. ShakHQ https:// youtu.be/pMxJgBoosU0"
TweetsData/shakira.csv;2016-10-28 15:12;1281;3396;"#Chantaje Out Now / Ya Disponible @maluma pic.twitter.com/NvYxNH6LMc"
TweetsData/shakira.csv;2016-10-28 11:00;976;4056;"1 hour to go / Falta una hora pic.twitter.com/88sOI6zvB4"
TweetsData/shakira.csv;2016-10-28 10:00;1079;3416;"2 hours to go / Faltan 2 horas pic.twitter.com/Ss8Ayx4S6t"
TweetsData/shakira.csv;2016-10-28 06:41;561;1988;"Shakira just called a fan and played him her new song #Chantaje before its release tomorrow! https:// youtu.be/y_QD9B2BKbM ShakHQ"
TweetsData/shakira.csv;2016-10-28 06:41;534;1997;"Shakira llamó a un fan y le tocó un pedacito de #Chantaje antes de su lanzamiento mañana! https:// youtu.be/y_QD9B2BKbM ShakHQ"
TweetsData/shakira.csv;2016-10-28 05:53;454;1036;"eres un pro! Gracias por participar conmigo en esta canción. Shak"
TweetsData/shakira.csv;2016-10-28 00:01;417;1626;"https://www. instagram.com/p/BMEnzgyjEQP/"
TweetsData/shakira.csv;2016-10-27 21:31;898;3410;"Shak y @carlosvives actuarán en los @AMAs de este año! Se emitirán por @ABCNetwork el próximo 20 de Noviembre! #AMAs ShakHQ pic.twitter.com/33Sdxwb6aM"
TweetsData/shakira.csv;2016-10-27 21:29;1078;3731;"Shak is performing at this year's @AMAs with @carlosvives ! It's live on @ABCNetwork on 20 Nov. #AMAs ShakHQ pic.twitter.com/FDqSqkC976"
TweetsData/shakira.csv;2016-10-27 00:35;1280;4878;"Shak dio en exclusiva a un fan el arte de su próximo sencillo: Chantaje con @maluma ! ShakHQ pic.twitter.com/yLdPygc2CM"
TweetsData/shakira.csv;2016-10-27 00:34;979;3738;"Shak just let a fan exclusively reveal the artwork for her new single, Chantaje! ShakHQ @maluma pic.twitter.com/YKIuiyYhyV"
TweetsData/shakira.csv;2016-10-26 22:55;336;1673;"https://www. instagram.com/p/BMB7jjdjGur/"
TweetsData/shakira.csv;2016-10-26 04:23;892;4043;"#regram @omaardleon Resuelto el acertijo.. y esta confirmado! #Chantaje es el próximo sencillo de @Shakira ft @Maluma Gracias Shaki! pic.twitter.com/pcj1gB6vF4"
TweetsData/shakira.csv;2016-10-26 03:13;388;1695;"https:// instagram.com/p/BL_yYDJjdqw/"
TweetsData/shakira.csv;2016-10-26 00:36;1194;8912;"Selfie del dia - nada especial o si? Selfie of the day. Nothing special or maybe? pic.twitter.com/YDhYzz14XY"
TweetsData/shakira.csv;2016-10-25 22:24;1467;7428;"Abracadabra! pic.twitter.com/n40FLDIVII"
TweetsData/shakira.csv;2016-10-21 06:20;568;3856;"My team waiting for me to approve a mix. Shak pic.twitter.com/XCRRz4nBfL"
TweetsData/shakira.csv;2016-10-18 23:48;1425;11141;"Para celebrar el lanzamiento de Dance, la nueva fragancia de Shak, nos gustaría ver Boomerangs con sus mejores movimientos #DanceShakira SHQ pic.twitter.com/crSkqEibGc"
TweetsData/shakira.csv;2016-10-18 23:43;1398;9126;"To celebrate the new Dance Shakira fragrance, we'd like to see a Boomerang vid of your best moves. Send them using #DanceShakira ! ShakHQ pic.twitter.com/oBrIAoT3xE"
TweetsData/shakira.csv;2016-10-17 06:38;1524;10094;"Braid day! Walking in Barcelona. Shak pic.twitter.com/pmBlGoryp5"
TweetsData/shakira.csv;2016-10-09 04:32;1366;8953;"Bathroom photo shoot! Shak pic.twitter.com/wWK0ENy1yD"
TweetsData/shakira.csv;2016-10-09 01:04;1072;7442;"Girls' night out! pic.twitter.com/tHSNdDV2p5"
TweetsData/shakira.csv;2016-10-08 03:56;549;2828;"El 15 Oct muchos colegas y amigos darán concierto por una causa importante https://www. youtube.com/watch?v=TJ6m7M Lq6CY … @Univision #RiseUpAsOne"
TweetsData/shakira.csv;2016-10-07 02:07;1324;5533;"Check out the brand new TV ad for Shak's latest fragrance, #Dance ! http://www. shakira-beauty.com/en/dance pic.twitter.com/zMEYygGKkY"
TweetsData/shakira.csv;2016-10-07 02:03;1088;4889;"No se pierdan el último tv-spot de la nueva fragancia de Shakira, #Dance ! ShakHQ http://www. shakira-beauty.com/es/dance pic.twitter.com/OqEVgOWQMK"
TweetsData/shakira.csv;2016-10-05 22:05;1086;6066;"Working on my volley!! pic.twitter.com/3FaD9OvHjz"
TweetsData/shakira.csv;2016-10-03 04:48;3579;8695;"Gigante @3gerardpique ! Orgullosa de ti en el campo y fuera de él! Shak"
TweetsData/shakira.csv;2016-10-01 00:23;1298;9027;"Aquí está #Dance , mi última fragancia! / Excited to reveal #Dance , my new fragrance! Look out for the TV ad soon… Shak pic.twitter.com/HyA2iJwFL2"
TweetsData/shakira.csv;2016-09-28 00:59;619;2455;"Shak participa en nuevo video de @UNICEFenEspanol que nos hace imaginar un mejor futuro para nuestros niños https:// youtu.be/RWKtPRMX0MY ShakHQ"
TweetsData/shakira.csv;2016-09-28 00:53;486;2202;"Shak features in @UNICEF 's powerful new video which asks us to imagine a better future #foreverychild - https:// youtu.be/RWKtPRMX0MY ShakHQ"
TweetsData/shakira.csv;2016-09-27 19:48;3747;12586;""Se hace camino al andar"... Colombia mía, queda mucho por delante; cuidar y educar a nuestros niños es cementar el camino de la paz. Shak"
TweetsData/shakira.csv;2016-09-27 00:04;552;2722;"Aquí está Shak cantando y bailando en vivo Ojos Así en el año 2003. Creen que pueden bailar así? https:// youtu.be/G0DYW8cshxo ShakHQ #dance"
TweetsData/shakira.csv;2016-09-27 00:03;494;2509;"Here's Shak throwing some serious moves while performing Ojos Así in 2003. Think you can #dance like that? https:// youtu.be/G0DYW8cshxo ShakHQ"
TweetsData/shakira.csv;2016-09-24 03:24;1111;9325;"Disfrutando con mis papis en el estudio con la nueva música!!! Shak pic.twitter.com/HIZ11nODCp"
TweetsData/shakira.csv;2016-09-19 22:54;627;2936;"Shak is supporting the #HispanicHeritage campaign. Read her interview on being an #advocate for #education : http:// bit.ly/2d03KAz ShakHQ"
TweetsData/shakira.csv;2016-09-19 01:12;576;2396;"Join me in creating a #LearningGeneration to provide #Education to the world’s children. WATCH: http:// bit.ly/LearningGenera tion …"
TweetsData/shakira.csv;2016-09-16 00:10;708;4064;"All kids deserve to have access to a bright future. Wishing @usedgov a great trip as they hit the road for this year’s #OpportunityTour SHQ"
TweetsData/shakira.csv;2016-09-14 21:45;549;3601;"This is how I leave them after a marathon studio session @SupaDups pic.twitter.com/n8Sop9b16N"
TweetsData/shakira.csv;2016-09-13 00:55;1505;9187;"Studio pedicure. Shak pic.twitter.com/qyYgymrywd"
TweetsData/shakira.csv;2016-09-12 02:40;3739;17027;"Prepárense para lo que estamos cocinando aquí en el estudio @maluma pic.twitter.com/btfQnuTWSS"
TweetsData/shakira.csv;2016-09-11 08:30;569;2488;"Así se hizo el video de #LaBicicleta con @carlosvives en Colombia! @carlosvives - https:// youtu.be/KN49Q8lENmI ShakHQ"
TweetsData/shakira.csv;2016-09-11 08:29;468;2560;"Check out this great new behind-the-scenes film from the #LaBicicleta video shoot with @carlosvives - https:// youtu.be/KN49Q8lENmI ShakHQ"
TweetsData/shakira.csv;2016-09-09 05:31;582;2693;"Estén muy atentos esta noche a @TheVoiceChile : les anunciarán algo muy especial #LoveRockByShakira ShakHQ"
TweetsData/shakira.csv;2016-09-08 23:55;697;4525;"Feeling my farmer's tan. Tennis feet = #sexyfeet pic.twitter.com/KYguziBlPv"
TweetsData/shakira.csv;2016-09-07 05:53;866;6408;"Gracias a todos por sus mensajes de cariño y buenos deseos para mi papa en su cumple!! Muah! Shak pic.twitter.com/6Roy2R0pUH"
TweetsData/shakira.csv;2016-09-07 05:52;963;8451;"Feliz 85avo cumpleaños papi!! Shak pic.twitter.com/r7Vw5oPFmh"
TweetsData/shakira.csv;2016-09-07 03:29;1146;5838;"Wait, let's hear that again...Shak pic.twitter.com/nYWwrjN0y2"
TweetsData/shakira.csv;2016-09-06 08:54;830;5024;"Video: Fundación Brindemos Sonrisas on instagram #LaBicicletaKids ShakHQ @carlosvives pic.twitter.com/RxJEWW8ThF"
TweetsData/shakira.csv;2016-09-06 04:54;331;2101;"So pleased to report that the #ALASIDBAwards received 1101 proposals from 20 LATAM countries @MorenoBID ShakHQ"
TweetsData/shakira.csv;2016-09-06 04:54;370;2372;"Nos complace mucho poder anunciar que los #PremiosALASBID recibieron 1101 iniciativas procedentes de 20 países. @MorenoBID ShakHQ"
TweetsData/shakira.csv;2016-09-05 00:15;1265;9436;"Sunday bunday! Shak pic.twitter.com/De400ACzo6"
TweetsData/shakira.csv;2016-09-01 01:33;506;2440;"Hemos organizado por años los recuerdos que nos compartieron en #LoveRockByShakira ! http:// bit.ly/LoveRockTLes ShakHQ pic.twitter.com/sdQU1frXBi"
TweetsData/shakira.csv;2016-09-01 01:30;434;1976;"Check out all the amazing Shak memories you guys sent to the #LoveRockByShakira site! http:// bit.ly/LoveRockTLen ShakHQ pic.twitter.com/QPriImmAfk"
TweetsData/shakira.csv;2016-08-30 22:54;697;3830;"El video de #LaBicicleta ya tiene 150m de reproducciones! https:// youtu.be/-UV0QGLmYys ShakHQ CC: @carlosvives pic.twitter.com/vpaVS1MgDC"
TweetsData/shakira.csv;2016-08-30 22:53;596;2802;"The #LaBicicleta video now has 150m views! https:// youtu.be/-UV0QGLmYys ShakHQ CC: @carlosvives pic.twitter.com/0fxy2faMox"
TweetsData/shakira.csv;2016-08-30 03:18;446;2333;"Felicidades @NairoQuinCo ! Shak https:// twitter.com/lavuelta/statu s/770282178630524928 …"
TweetsData/shakira.csv;2016-08-26 02:29;650;4152;"I call this part of the beach "Tailandia" Shak #LaBicicleta #tbt pic.twitter.com/8cyNMSbNE7"
TweetsData/shakira.csv;2016-08-25 04:37;2215;9210;"Hard at work. Shak pic.twitter.com/5qC2bMmbRB"
TweetsData/shakira.csv;2016-08-25 02:33;358;1401;"Ya se descargaron la aplicación GROW que Shak desarrolló con @FisherPrice ? http:// smarturl.it/GROWapp ShakHQ https:// amp.twimg.com/v/393cc8e7-06c 4-4b5f-9518-770fb34546d1 …"
TweetsData/shakira.csv;2016-08-25 02:31;299;1267;"Check out the free GROW parenting app, which Shak developed with @FisherPrice http:// smarturl.it/GROWapp ShakHQ https:// amp.twimg.com/v/d7daeb78-2b6 8-47a9-aae0-65899e50f13f …"
TweetsData/shakira.csv;2016-08-23 09:56;466;3391;"Video: @soffyml on Instagram #LaBicicletaKids @carlosvives ShakHQ pic.twitter.com/aFXABV6BXT"
TweetsData/shakira.csv;2016-08-21 02:30;370;2647;"Video: @cervantesied on Instagram #LaBicicletaKids ShakHQ @carlosvives pic.twitter.com/Womo4KeJBb"
TweetsData/shakira.csv;2016-08-20 08:16;1010;4454;"Qué alegría! #Oro y #Bronce para Colombia en Río! Felicitaciones @MarianaPajon y @RamirezBmx ! Shak"
TweetsData/shakira.csv;2016-08-20 04:12;517;2039;"Celebren la llegada del fin de semana con este remix de @maluma de #LaBicicleta en @Spotify https:// open.spotify.com/track/7IRuf7Fr dQvOGs0g9mSNGr … ShakHQ CC: @carlosvives"
TweetsData/shakira.csv;2016-08-20 04:10;399;1636;"Celebrate the weekend with the new @maluma remix of La Bicicleta on @Spotify ! ShakHQ CC: @carlosvives https:// open.spotify.com/track/7IRuf7Fr dQvOGs0g9mSNGr …"
TweetsData/shakira.csv;2016-08-17 19:12;896;7054;"In the studio with my homies Stephen, Supa and Dave and the birthday boy Luisfer Ochoa! Shak pic.twitter.com/TBtSNaSvPc"
TweetsData/shakira.csv;2016-08-16 04:48;413;2279;""Shakira Shares Adorable Videos of Kids Dancing to Her Song La Bicicleta" @enews #LaBicicletaKids ShakHQ http:// m.eonline.com/news/787420/sh akira-shares-adorable-videos-of-kids-dancing-to-her-song-la-bicicleta …"
TweetsData/shakira.csv;2016-08-16 03:09;494;2900;"Video: @jackiee80 on Instagram #LaBicicletaKids ShakHQ @carlosvives pic.twitter.com/wfV6kHFA7T"
TweetsData/shakira.csv;2016-08-16 02:03;1177;5762;"Feliz con los éxitos de Colombia en #Rio2016 . Felicitaciones Catherine y Óscar por hacernos soñar con el Oro! Vamos por más! Shak"
TweetsData/shakira.csv;2016-08-14 04:49;788;3418;"El video de #LaBicicleta con @carlosvives certificado por @vevo al superar los 100 millones de reproducciones http:// youtu.be/-UV0QGLmYys ShakHQ"
TweetsData/shakira.csv;2016-08-14 04:48;467;1944;"The video for #LaBicicleta has just been @Vevo Certified for 100m views! @CarlosVives http:// youtu.be/-UV0QGLmYys ShakHQ"
TweetsData/shakira.csv;2016-08-13 20:02;442;3219;"Video: @lorenagomezfernandez on Instagram #LaBicicletaKids ShakHQ @carlosvives pic.twitter.com/MgoG7Ctimj"
TweetsData/shakira.csv;2016-08-13 19:56;265;2069;"Video: @piita5 on Instagram #LaBicicletaKids ShakHQ @carlosvives pic.twitter.com/5oUUPKVODT"
TweetsData/shakira.csv;2016-08-13 03:28;931;6079;"Late night delirium in the studio with Nasri from @ournameisMAGIC and @SupaDups ! Shak pic.twitter.com/yit4dm1emd"
TweetsData/shakira.csv;2016-08-11 22:37;1182;7549;"Flares pic.twitter.com/StDlmnUhnG"
TweetsData/shakira.csv;2016-08-11 19:38;393;2067;""Los niños más adorables bailando 'La Bicicleta' de Shakira y @carlosvives " vía @Univision ShakHQ #LaBicicletaKids http://www. univision.com/personas/shaki ra/estos-ninos-bailando-la-bicicleta-prueban-que-la-musica-mueve-al-mundo-entero …"
TweetsData/shakira.csv;2016-08-11 06:35;423;3134;"Video: @natalia .rincontorres on Instagram #LaBicicletaKids ShakHQ @carlosvives pic.twitter.com/6CF9exERbm"
TweetsData/shakira.csv;2016-08-10 04:46;310;1946;"Video: @dreaffogle on Instagram #LaBicicletaKids ShakHQ pic.twitter.com/WIhutxRqBX"
TweetsData/shakira.csv;2016-08-10 04:42;324;2205;"Video: @josebw on Instagram #LaBicicletaKids ShakHQ pic.twitter.com/yeC1v8GONy"
TweetsData/shakira.csv;2016-08-10 04:40;223;1558;"Video: @susankdelarosa on Instagram #LaBicicletaKids ShakHQ pic.twitter.com/XHB6oSsdHm"
TweetsData/shakira.csv;2016-08-10 04:37;261;1976;"Video: @mariavanessa03 on Instagram #LaBicicletaKids ShakHQ pic.twitter.com/qWKD2p35XG"
TweetsData/shakira.csv;2016-08-10 04:28;355;2407;"Muchas gracias por todos los videos que nos mandaron con #LaBicicletaKids ... Aquí algunos de nuestros favoritos. ShakHQ"
TweetsData/shakira.csv;2016-08-10 04:28;305;1551;"Thank you for all the amazing #LaBicicletaKids videos. Here are some of our favorites… ShakHQ"
TweetsData/shakira.csv;2016-08-08 05:55;1277;6437;"Feliz cumpleaños @carlosvives pic.twitter.com/SrsnIDH5MJ"
TweetsData/shakira.csv;2016-08-07 01:36;461;2014;"Nos muestran los bailes de sus hijos usando el hashtag #LaBicicletaKids ? Vamos a compartir nuestros favoritos! ShakHQ"
TweetsData/shakira.csv;2016-08-07 01:35;371;1533;"Show us your kids moves by tagging #LaBicicletakids and we'll share our favorites! ShakHQ"
TweetsData/shakira.csv;2016-08-07 01:34;746;2929;". @ivanrakitic 's daughter dancing to #labicicleta . Sooo cute! Shak https:// twitter.com/ivanrakitic/st atus/761886182598971392 …"
TweetsData/shakira.csv;2016-08-05 03:54;1470;6338;"Barranquilla más linda que siempre! #tbt Shak pic.twitter.com/vpUmfufloD"
TweetsData/shakira.csv;2016-08-02 22:38;1415;9028;"Countryside! Shak pic.twitter.com/yzGQHVg9Rb"
TweetsData/shakira.csv;2016-07-31 04:05;1034;6087;"With @carlosvives ! #LaBicicleta pic.twitter.com/THBtE93qb9"
TweetsData/shakira.csv;2016-07-28 23:00;812;3462;"The #LaBicicleta video now has 50M views! El video de La Bicicleta ya tiene más de 50M de reproducciones! https:// youtu.be/-UV0QGLmYys ShakHQ"
TweetsData/shakira.csv;2016-07-27 22:39;726;3784;"Nada puede competir con cantar con amigos en un auto! https:// youtu.be/-UV0QGLmYys ) ShakHQ #LaBicicleta @carlosvives pic.twitter.com/NS24hb19Sr"
TweetsData/shakira.csv;2016-07-27 22:36;641;3214;"You can’t beat a car singalong! (Watch the full #LaBicicleta video at https:// youtu.be/-UV0QGLmYys now.) ShakHQ pic.twitter.com/7CsqDy8yqo"
TweetsData/shakira.csv;2016-07-25 00:35;2320;10939;"Papa’s hair!! pic.twitter.com/LHxnp7ypyE"
TweetsData/shakira.csv;2016-07-22 22:25;1039;5627;"To be or not to be (blonde) that is the question! Shak pic.twitter.com/Jyyenupw5L"
TweetsData/shakira.csv;2016-07-21 21:57;547;2381;"Muchas gracias a todos los fans que compartieron sus recuerdos en la web de #LoveRock http:// bit.ly/LoveRockTLes ShakHQ https:// amp.twimg.com/v/b94ab248-b22 2-4db3-97e2-87ca4b696e25 …"
TweetsData/shakira.csv;2016-07-21 21:53;453;1774;"Thanks to everyone who sent their Shak memories to the #LoveRockByShakira site! http:// bit.ly/LoveRockTLen ShakHQ https:// amp.twimg.com/v/9c3a964d-fbb 6-4bcc-8b72-2008ee5907f6 …"
TweetsData/shakira.csv;2016-07-21 02:21;1106;7082;"Recordando el concierto Por La Paz en 2008 con @CarlosVives ! Feliz día de la Independencia #Colombia . pic.twitter.com/6k9ekis08n"
TweetsData/shakira.csv;2016-07-21 02:19;1127;7599;"Remembering the concert for the Peace in 2008 with Carlos Vives! Happy Independence Day Colombia! pic.twitter.com/2iVAap2Rh7"
TweetsData/shakira.csv;2016-07-19 23:20;935;6037;"De “la" bicicleta al caballo y del caballo a “la bicicleta" Shak pic.twitter.com/RVznP0kHcv"
TweetsData/shakira.csv;2016-07-18 21:35;388;1718;"Hola! Ya han hecho el test de #LaBicicletaQuiz ? Nos comparten su puntaje? http:// bit.ly/LaBiciQuiz ShakHQ pic.twitter.com/VmCeCcuREG"
TweetsData/shakira.csv;2016-07-18 21:32;368;1506;"Hey, did you take #LaBicicletaQuiz yet? Let us know your score! http:// bit.ly/LaBicQuiz ShakHQ pic.twitter.com/WN8H6VfBZy"
TweetsData/shakira.csv;2016-07-16 21:48;478;1897;"Hagan el test #LaBicicletaQuiz para poner a prueba sus conocimientos sobre la canción y el vídeo! http://www. labicicletaoficial.com/questions.php? lang=es … ShakHQ"
TweetsData/shakira.csv;2016-07-16 21:47;393;1651;"Take the #LaBicicletaQuiz to test your knowledge of the new song & video - then let us know your score! http://www. labicicletaoficial.com/questions.php? lang=en … ShakHQ"
TweetsData/shakira.csv;2016-07-14 23:07;879;4847;"Ciruela, corozo, guayaba agria y mango verde! #LaBicicletavideo Shak pic.twitter.com/8WFze9VwUM"
TweetsData/shakira.csv;2016-07-14 00:14;660;2624;"Empire ya es el decimocuarto video de Shak certificado por @Vevo al superar las 100 millones de ! https:// youtu.be/QapfTGTXbxc ShakHQ"
TweetsData/shakira.csv;2016-07-14 00:11;589;2553;"The Empire video just became Shak's 14th video to be @Vevo certified for 100m views! https:// youtu.be/QapfTGTXbxc ShakHQ"
TweetsData/shakira.csv;2016-07-13 03:42;720;4576;"With Friend @KathyKopp / Con mi amiga Kathy Kopp #LaBicicletaVideo http:// youtu.be/-UV0QGLmYys Shak pic.twitter.com/tlGzcxUIeq"
TweetsData/shakira.csv;2016-07-12 04:18;1143;4852;"Ten million views!! 10 millones de reproducciones!! #LaBicicletaVideo @CarlosVives https:// youtu.be/-UV0QGLmYys ShakHQ pic.twitter.com/iG5gQvCeCU"
TweetsData/shakira.csv;2016-07-10 00:01;910;4890;"With director @JaumedeLaiguana eating mango with salt and pepper #LaBicicletaVideo http:// youtu.be/-UV0QGLmYys pic.twitter.com/HdrbM0PXfU"
TweetsData/shakira.csv;2016-07-09 07:26;1072;4285;"A million views in 16 hours! Un millón de reproducciones en 16h! #LaBicicletaVideo http:// youtu.be/-UV0QGLmYys ShakHQ pic.twitter.com/FbiHHzIVBs"
