TweetsData/YouTube.csv;2018-05-05 01:38;227;977;"When it's #MayTheFourth and everything is suddenly Star Wars-themed: http:// youtu.be/FQC29joihwU #MayThe4thBeWithYou pic.twitter.com/VXnaYl8EdO"
TweetsData/YouTube.csv;2018-05-04 23:16;305;1316;"Happy #StarWarsDay ! Here's Ron Howard narrating Star Wars as if it were Arrested Development: https:// youtu.be/o6XERmXsP-U . #MayThe4thBeWithYou #MayTheFourth pic.twitter.com/rfybvpOWS0"
TweetsData/YouTube.csv;2018-05-04 22:52;1;5;"It will be free to watch!"
TweetsData/YouTube.csv;2018-05-04 22:50;0;1;"This will be available in the US! And for free, too."
TweetsData/YouTube.csv;2018-05-04 22:01;65;632;"There’s only one man we would trust with the world’s best footballers. He was busy, so we got @jackwhitehall instead. #TrainingDays , only on YouTube. Watch the trailer here: http:// goo.gl/nXcx4X . pic.twitter.com/pX9lsB1Hrb"
TweetsData/YouTube.csv;2018-05-04 10:08;7;100;"Thanks for this. It brings us joy too! We're adding more original programming to YouTube—we're not taking anything away. We know that creators are what make YouTube special."
TweetsData/YouTube.csv;2018-05-04 09:58;1;26;"Thanks for this feedback. We know that demonetization has been a source of pain, and we're working on a more accurate solution that includes more human review. We also know that creators have felt a lack of communication in the past, and we want to improve that too!"
TweetsData/YouTube.csv;2018-05-04 08:39;292;1684;"We're excited to announce our new slate of YouTube Originals! Coming soon: Will Smith @KingJames @ddlovato @priyankachopra @KevinHart4Real The Slow Mo Guys @jackwhitehall Read more: https:// goo.gl/H2iNdh"
TweetsData/YouTube.csv;2018-05-04 05:02;137;1103;"This is your regular reminder that jellyfish are terrifying: https:// youtu.be/8sO3XJY1hro . pic.twitter.com/HXpKGccGmn"
TweetsData/YouTube.csv;2018-05-03 05:30;520;2689;"ICYMI, @ArianaGrande sang "God's Plan" as a 90's diva hit on @FallonTonight . https:// youtu.be/NaY91YjVbEM pic.twitter.com/GBbzCyf7og"
TweetsData/YouTube.csv;2018-05-03 01:00;186;970;"The #KarateKid legacy continues. All 10 episodes of @CobraKaiSeries are now streaming on YouTube Red! Watch the first episode: https:// bit.ly/2HAfYeS . #CobraKai pic.twitter.com/FI3xrWsAvS"
TweetsData/YouTube.csv;2018-05-02 23:27;109;974;"Neverland has been found, and it's in Belize: https:// youtu.be/oRSm7DUvykk . pic.twitter.com/mVYC5A7dBu"
TweetsData/YouTube.csv;2018-05-02 22:01;25911;61325;"Over 300 days on tour and we've got footage of it all! The penultimate episode of Burn The Stage is here! #BTSxYouTubeRed https:// goo.gl/T1QeLb pic.twitter.com/S754KHsf6c"
TweetsData/YouTube.csv;2018-05-02 05:32;182;1404;"That moment when someone says Sebastian Stan looks like a potato. https:// youtu.be/OrnpSe4OChM pic.twitter.com/AyYTbfIlEl"
TweetsData/YouTube.csv;2018-05-02 02:33;181;1930;"When internet friends meet for the first time. https:// youtu.be/AlZXOs7Wl2k pic.twitter.com/EYsr8jC0Ff"
TweetsData/YouTube.csv;2018-05-01 06:13;112;1316;"Watch this if you wish you could leave everything behind and live in the wilderness. https:// youtu.be/_3N4h-Psb70 pic.twitter.com/TwtUuhbY88"
TweetsData/YouTube.csv;2018-05-01 03:00;81;686;"This video shows the incredible difference one person can make in a shelter pet's life. https:// youtu.be/7Zxm2wcgeYI #NationalAdoptAShelterPetDay pic.twitter.com/qLTMVtTsbC"
TweetsData/YouTube.csv;2018-05-01 02:40;43;1099;""
TweetsData/YouTube.csv;2018-05-01 02:30;87;817;"Buster is a Chihuahua mix who likes afternoon walks and movie nights on the couch. #NationalAdoptAShelterPetDay https:// youtu.be/e514J-hM0B0 pic.twitter.com/iCtyzQV1YP"
TweetsData/YouTube.csv;2018-05-01 02:11;254;1703;"Cat videos as a force for good: this #NationalAdoptAShelterPetDay , we're celebrating the people who use YouTube to help animals find their forever homes. TinyKittensHQ runs a 24/7 livestream of their "caternity ward" where kittens play, nurse, and nap. https:// youtu.be/PowGFq6X3Co pic.twitter.com/poqnFEsyc7"
TweetsData/YouTube.csv;2018-04-30 22:42;86;880;"How a secret message in a children's book led to a real-life treasure hunt: https:// youtu.be/3yaHBdhIsCo . pic.twitter.com/4z7sKlzFlB"
TweetsData/YouTube.csv;2018-04-30 08:19;255;1984;"You could test every possible combination of flour/fat/sugar in your search for the perfect chocolate chip cookie. Or you could watch this video: https:// youtu.be/rEdl2Uetpvo . pic.twitter.com/MMo9V3H6GM"
TweetsData/YouTube.csv;2018-04-29 19:55;231;2430;"TFW you really want to be part of that world. https:// youtu.be/PZxyNX8J7Y4 pic.twitter.com/OUtZ6Hb2t2"
TweetsData/YouTube.csv;2018-04-28 02:15;345;1994;"Happy #ArborDay ! Trees use underground networks to share resources with each other. https:// youtu.be/Tuxc9URHYFc pic.twitter.com/JusRhy1L2N"
TweetsData/YouTube.csv;2018-04-27 22:10;244;1805;"Here we go again. https:// youtu.be/unfzfe8f9NI #FridayFeeling pic.twitter.com/wtQyMlhLIW"
TweetsData/YouTube.csv;2018-04-27 06:04;281;3048;"You have $15 to build the perfect man: $300 - well-dressed $200 - good at sports $400 - read your favorite book $10 - plays music $5 - is a spider $500 - opposable thumbs https:// twitter.com/YouTube/status /989581858089422848 …"
TweetsData/YouTube.csv;2018-04-27 05:35;132;1088;"You need this: https:// youtu.be/NHZr6P1csiY . pic.twitter.com/fS4D23VU9r"
TweetsData/YouTube.csv;2018-04-27 05:04;2;11;"You just did!"
TweetsData/YouTube.csv;2018-04-27 04:42;1;10;"Adorable."
TweetsData/YouTube.csv;2018-04-27 04:05;192;2509;"The tarantula's name is Louise. https:// youtu.be/ieIeBWulAiQ pic.twitter.com/8mPuqf8hO5"
TweetsData/YouTube.csv;2018-04-27 03:07;625;6942;"If this picture of a tarantula watching Lucas the Spider gets 1,000 likes, we'll post...another picture of a tarantula watching Lucas the Spider. https:// goo.gl/cR4Rbk pic.twitter.com/PH8Gx1pqeD"
TweetsData/YouTube.csv;2018-04-27 02:11;74;720;"No tapping out here! Watch @KevinHart4Real & @JoelMcHale get in the boxing ring with heavyweight champ Evander @Holyfield on an all new episode of @WhatTheFit ! http:// goo.gl/Lyotxa pic.twitter.com/T9FiyHjGq8"
TweetsData/YouTube.csv;2018-04-27 00:01;1;9;"That's @sofiedossi ."
TweetsData/YouTube.csv;2018-04-26 23:31;164;1379;"This is your #NationalPretzelDay reminder that humans are amazing. https:// youtu.be/4XfBA_-BIZI pic.twitter.com/RVdmqV1rqQ"
TweetsData/YouTube.csv;2018-04-26 22:01;15968;36974;"They put on the most epic show EVER. Stay tuned for a new episode of Burn The Stage. #BTSxYouTubeRed https:// goo.gl/t5TNSK pic.twitter.com/2IslEcrl2c"
TweetsData/YouTube.csv;2018-04-26 09:01;18591;43104;"Sweet shades, Jin Did you bask in the awesomeness of @bts_twt ? Catch up on new episodes of Burn The Stage! #BTSxYouTubeRed https:// goo.gl/b6ezS5 pic.twitter.com/eko4ofZufv"
TweetsData/YouTube.csv;2018-04-26 05:24;210;1279;"The internet is just penguins now. https:// youtu.be/Z-bxsuS88n4 #WorldPenguinDay pic.twitter.com/r1wUfYPkG8"
TweetsData/YouTube.csv;2018-04-26 05:16;775;3556;"Happy #WorldPenguinDay , the day when we acknowledge that nothing makes sense, only penguins. https:// youtu.be/k22Gg13ahDc pic.twitter.com/rLtpOJXYUs"
TweetsData/YouTube.csv;2018-04-26 02:44;75;777;"It's as close to hanging out with Steph Curry as most of us will ever get. @StephenCurry30 's new YouTube series, 5 Minutes From Home, premieres May 1st. Subscribe here so you don't miss it: https:// goo.gl/nSVzBg . pic.twitter.com/KwodPir6Mp"
TweetsData/YouTube.csv;2018-04-26 02:27;155;1378;"This is amazing. Please DM us an address where we can send you a care package. https:// twitter.com/TheWittleDemon /status/988920938921189376 …"
TweetsData/YouTube.csv;2018-04-26 02:23;4;176;"He's beautiful!"
TweetsData/YouTube.csv;2018-04-26 02:07;0;11;""
TweetsData/YouTube.csv;2018-04-26 00:34;133;1343;"Simone Biles has returned to the gym after a long break. This is Simone Biles WHEN SHE'S OUT OF SHAPE. https:// youtu.be/C54cHGCwBdk . pic.twitter.com/GIMWGSyrrL"
TweetsData/YouTube.csv;2018-04-25 10:26;123;1074;"There he sat, with 37 different guitar pedals. And then it hit him. "I should play them all at the same time." https:// youtu.be/rUcLtEaHLvs pic.twitter.com/ZgnwyiSIzQ"
TweetsData/YouTube.csv;2018-04-25 04:15;187;1482;""Some people choose to see the ugliness in this world, the disarray. I choose to see the beauty. To believe there is an order to our days. A purpose." https:// youtu.be/_u9jjcbgMpk pic.twitter.com/gwRhPk6XNB"
TweetsData/YouTube.csv;2018-04-25 02:09;335;1343;"Bob Dorough, the composer and jazz musician responsible for much of Schoolhouse Rock, has died at 94. Here's a video of him singing Conjunction Junction, which he wrote: https:// youtu.be/kMlRcOsEzhM pic.twitter.com/pdboeBQ8qT"
TweetsData/YouTube.csv;2018-04-25 00:04;2;41;"This."
TweetsData/YouTube.csv;2018-04-24 23:29;1024;6178;""I'm not a hero," says the unarmed man who disarmed the Waffle House gunman. https:// youtu.be/ZeKeA21_BFo pic.twitter.com/yASgWFJnFa"
TweetsData/YouTube.csv;2018-04-24 09:23;3;32;"It is really amazing. Which channels are your favorites?"
TweetsData/YouTube.csv;2018-04-24 05:17;301;2006;"Happy #WorldBookDay to everyone who uses YouTube to find new books to read and new friends to talk about them with. https:// youtu.be/xzf1GnWVuIA pic.twitter.com/53OjL4IE10"
TweetsData/YouTube.csv;2018-04-24 01:04;204;1846;"There they are! https:// youtu.be/_h_qM52ljBc pic.twitter.com/KMEPfui2bP"
TweetsData/YouTube.csv;2018-04-24 00:40;4;227;"Happy birthday!"
TweetsData/YouTube.csv;2018-04-24 00:25;3432;13588;"The first video on YouTube was posted 13 years ago today: https:// youtu.be/jNQXAC9IVRw . pic.twitter.com/hrTy1niqSl"
TweetsData/YouTube.csv;2018-04-23 23:11;3;22;"not all heroes wear capes"
TweetsData/YouTube.csv;2018-04-23 23:09;157;1804;"pic.twitter.com/w0ZGGNjVPR"
TweetsData/YouTube.csv;2018-04-23 22:45;217;2496;"You won't see the #royalbaby , but this live feed of self-conscious police officers and passerby outside St. Mary's Hospital is surprisingly entertaining. https:// youtu.be/_h_qM52ljBc pic.twitter.com/BQG6cSajNw"
TweetsData/YouTube.csv;2018-04-23 05:45;750;2538;"Plastic pollution is a deadly threat to our ocean. Watch @NatGeo explain how we can clean up our act: https:// youtu.be/HQTUWK7CM-Y . #EarthDay pic.twitter.com/yjxCy8xZGI"
TweetsData/YouTube.csv;2018-04-23 01:39;194;1118;""We're trashing our planet to grow food that no one eats." @UCLA teamed up with @voxdotcom to explain why food waste is the world's dumbest problem: https:// youtu.be/6RlxySFrkIM . #EarthDay pic.twitter.com/7ASITSgBSz"
TweetsData/YouTube.csv;2018-04-22 21:42;1079;4786;"Happy #EarthDay ! This is what the looks like from space: https:// goo.gl/kZt1kV . Watch our playlist to learn what you can do to protect it → https:// goo.gl/DzXL1u . pic.twitter.com/yJSIuJHQ8J"
TweetsData/YouTube.csv;2018-04-22 00:16;490;4814;"It's the weekend, it's finally spring, and these rescue kittens think this golden retriever is their mother. https:// youtu.be/Q-gCKhink30 pic.twitter.com/VmuCCD9Ut7"
TweetsData/YouTube.csv;2018-04-21 05:33;1;19;"Who are your favorites?"
TweetsData/YouTube.csv;2018-04-21 05:29;211;1543;"The 4 basic conflicts: egg vs. man egg vs. nature egg vs. self egg vs. the refrigerator → https:// youtu.be/Ib6vtahzDyc pic.twitter.com/zcBVDx0Qkx"
TweetsData/YouTube.csv;2018-04-21 02:49;200;1243;"TIL that Reefer Madness is on YouTube. https:// youtu.be/zhQlcMHhF3w #420day pic.twitter.com/GQkl31c71C"
TweetsData/YouTube.csv;2018-04-21 02:16;3;105;"Yes."
TweetsData/YouTube.csv;2018-04-21 02:11;133;1557;"extreme same https:// twitter.com/netflix/status /987105307695329280 …"
TweetsData/YouTube.csv;2018-04-20 23:09;152;1146;"Today is the #NationalSchoolWalkout , and students across the country have made videos to explain why they're walking out. Here's one of them → https:// youtu.be/ALgA7YpinBc . pic.twitter.com/YFGKqOAGmk"
TweetsData/YouTube.csv;2018-04-20 07:44;233;1175;"Prince's estate just released the original studio recording of "Nothing Compares 2 U," and it's amazing → https:// youtu.be/cpGA0azFdCs . pic.twitter.com/go91n4aF7m"
TweetsData/YouTube.csv;2018-04-20 04:35;203;1624;"When you've been watching tiny food videos for three hours → https:// youtu.be/v0cKmGJbuYc . pic.twitter.com/j2bPMNwsM5"
TweetsData/YouTube.csv;2018-04-20 02:02;12;347;"where's the robot-with-heart-eyes emoji when we need it"
TweetsData/YouTube.csv;2018-04-20 01:59;0;100;"@MKBHD , apparently"
TweetsData/YouTube.csv;2018-04-20 01:54;341;4660;"Meet the camera robots who film the shots that humans can't take → https:// youtu.be/UIwdCN4dV6w pic.twitter.com/9ePoGYKoiB"
TweetsData/YouTube.csv;2018-04-20 00:22;0;5;"Dog who is also an influencer on YouTube."
TweetsData/YouTube.csv;2018-04-20 00:15;160;1350;"Teach your dog to high-five → https:// youtu.be/j-TeeAhtVzo . #NationalHighFiveDay pic.twitter.com/N3zhepb8Is"
TweetsData/YouTube.csv;2018-04-19 22:57;155;1119;""Then the door burst open and Security put his hand on my face and shoved me out of the way like he never saw the Fresh Prince." Will Smith tells the story of the time he met Michael Jackson → https:// youtu.be/SM6350PPCpw pic.twitter.com/CzuTw8ZAb5"
TweetsData/YouTube.csv;2018-04-19 07:27;51;948;"GO TEAM https:// twitter.com/_katxlyn/statu s/986745631430664192 …"
TweetsData/YouTube.csv;2018-04-19 07:13;66;1157;"PSA: There's an entire category about YouTube on @Jeopardy RIGHT NOW."
TweetsData/YouTube.csv;2018-04-19 06:47;165;1072;"LIVE NOW: @SpaceX is launching @NASA_TESS into space to search for new planets. → https:// youtu.be/aY-0uBIYYKk #TESS pic.twitter.com/lkOHopYAhJ"
TweetsData/YouTube.csv;2018-04-19 05:03;185;1372;"Historically accurate longsword move: if your opponent is too close, hit them with the hilt. https:// youtu.be/vyVu0z4aGFc pic.twitter.com/kBAbok1Lls"
TweetsData/YouTube.csv;2018-04-19 01:08;114;1039;"Sometimes, being a scientist means replacing a bunch of male toads with 3D printed replicas. For science. https:// youtu.be/m0K6Co8hxBk pic.twitter.com/9JUeAbwrj6"
TweetsData/YouTube.csv;2018-04-18 06:14;482;2726;"Baby goat siblings Whispering to each other Only 2 days old → https:// youtu.be/UmY2jW17EUo #NationalHaikuDay pic.twitter.com/8dxMgxue3z"
TweetsData/YouTube.csv;2018-04-18 04:44;301;1442;"It's getting easier and easier to create fake videos of real people, like this deepfake featuring @BarackObama : https:// goo.gl/7Mvjiv . Read these tips on how to spot a deepfake: https:// goo.gl/J2dnQd . pic.twitter.com/OgCFFUAgNu"
TweetsData/YouTube.csv;2018-04-18 02:06;0;34;"We're here for you!"
TweetsData/YouTube.csv;2018-04-18 01:51;411;4447;"Shout-out to all of the people searching "How to do my taxes" on YouTube right now. #TaxDay"
TweetsData/YouTube.csv;2018-04-18 01:23;79;961;"#BatAppreciationDay https:// twitter.com/YouTube/status /984848174224461824 …"
TweetsData/YouTube.csv;2018-04-17 05:42;175;1620;"" @SimoneGiertz made a new video!" "Cool, I'll make some popcorn." → https:// youtu.be/2X33X5jkzPI pic.twitter.com/gayKQe3EW7"
TweetsData/YouTube.csv;2018-04-17 03:12;73;912;"THIS IS TERRIFYING → https:// youtu.be/6zA5nLp8AS4 pic.twitter.com/7tuTX1HFpb"
TweetsData/YouTube.csv;2018-04-16 23:21;254;1857;"When the "easy" goal is way harder than going after what you actually want. https:// youtu.be/2Bxrw_OMVeg #MondayMotivation pic.twitter.com/GqAazXP9pZ"
TweetsData/YouTube.csv;2018-04-16 22:12;1;15;"Hi! That's a temporary icon that was created by a Googler to show support for our YouTube family in the wake of the recent shooting. It's only up for a week (and will change back soon)."
TweetsData/YouTube.csv;2018-04-16 22:04;84;1262;"Monday mood. https:// youtu.be/GpBFOJ3R0M4"
TweetsData/YouTube.csv;2018-04-16 02:50;390;2987;"Piece of cake. https:// youtu.be/auIlGqEyTm8 pic.twitter.com/7agzX4yCJB"
TweetsData/YouTube.csv;2018-04-15 00:35;577;3269;""I went to the woods because I wanted to live deliberately. I wanted to live deep and suck out all the marrow of life. To put to rout all that was not life; and not, when I had come to die, discover that I had not lived." —A crocodile eating a watermelon https:// youtu.be/QmQwh_ju47o pic.twitter.com/RHSVb7xfie"
TweetsData/YouTube.csv;2018-04-14 09:29;87;1105;"We’re with @DVF at the #DVFAwards celebrating women creating change in their communities around the world. #INCHARGE Follow along on our Instagram stories https:// goo.gl/jbNDsq"
TweetsData/YouTube.csv;2018-04-14 05:04;202;1372;"This is why some people fear the number 13 → https:// youtu.be/quOdF1CAPXs . #FridayThe13th #YouTubeTaughtMe pic.twitter.com/ogAOvpwzqz"
TweetsData/YouTube.csv;2018-04-14 01:37;92;1030;"A correspondent from @NatGeo traveled across Mexico to film this love letter to bats. https:// youtu.be/87rzxT9p2gs #FridayThe13th pic.twitter.com/KbpQEuBT5Q"
TweetsData/YouTube.csv;2018-04-13 23:22;567;3099;"Happy #FridayThe13th to all the strange and unusual people out there. https:// youtu.be/ic87SfqQAAM pic.twitter.com/jPuSD6Epry"
TweetsData/YouTube.csv;2018-04-13 09:13;1274;7152;"When you're only a tiny bit hungry. https:// youtu.be/7TnCM30xREM #CreatorOnTheRise pic.twitter.com/K7wylXZxxc"
TweetsData/YouTube.csv;2018-04-13 05:09;101;911;"Your #Oceans8 name is the first name of your maternal grandmother + an unbelievable outfit. https:// youtu.be/n5LoVcVsiSQ pic.twitter.com/F3Zsso6mbd"
TweetsData/YouTube.csv;2018-04-13 02:58;199;1719;"Regular brain: "I'm not going to play hopscotch; there's probably a hidden camera somewhere." Galaxy brain: https:// youtu.be/7P-PNa0bxQg pic.twitter.com/CkRLqscqiL"
TweetsData/YouTube.csv;2018-04-13 01:21;241;1880;"Happy #NationalGrilledCheeseDay ! Don't overthink it. https:// youtu.be/hwjdXBxeWsc pic.twitter.com/heRq412ep8"
TweetsData/YouTube.csv;2018-04-13 01:06;0;4;"Thanks for sharing!"
TweetsData/YouTube.csv;2018-04-13 00:12;0;6;"We try to do both of these things—we just don't see it as an either/or situation! What are your favorite educational channels?"
TweetsData/YouTube.csv;2018-04-13 00:10;2;10;"YouTube is a safe space for hydraulic presses."
TweetsData/YouTube.csv;2018-04-12 23:55;77;1175;"How to turn aluminum foil into something beautiful and unexpected, then crush it in a hydraulic press → https:// youtu.be/oJ2faqXlU1s pic.twitter.com/K70EvC9Xwr"
TweetsData/YouTube.csv;2018-04-12 05:21;116;1760;"#NationalPetDay https:// twitter.com/faulty_female/ status/983572175197126656 …"
TweetsData/YouTube.csv;2018-04-12 04:30;0;10;"Soon!"
TweetsData/YouTube.csv;2018-04-12 04:12;70;1015;"It looks like the kitten and @Lesdoggg are about to race each other for @MiniatureDream 's tiny samosas. https://www. instagram.com/youtube/ pic.twitter.com/DdXhuNY7Vg"
TweetsData/YouTube.csv;2018-04-12 03:58;215;1116;"Incredible video of @virgingalactic 's VSS Unity as it made its first rocket-powered, supersonic flight last week. Space just got a little closer. https:// youtu.be/yVETvuGsv-w pic.twitter.com/wSeUB0YFyr"
TweetsData/YouTube.csv;2018-04-12 02:05;575;3332;"Happy #NationalPetDay ! RT if your pet is actually a video of kittens in slow motion. https:// youtu.be/YHdOh90kGHQ pic.twitter.com/9gCRcQrJBC"
TweetsData/YouTube.csv;2018-04-12 00:30;0;7;""
TweetsData/YouTube.csv;2018-04-12 00:17;1;9;"Hi there! Please don't worry—as we've explained before, this is actually a normal part of how YouTube validates views to make sure they're real. Temporarily slowing down or even freezing a video's view count is expected. More details here: https:// goo.gl/S7DIry"
TweetsData/YouTube.csv;2018-04-12 00:12;161;1420;"Your cat says "I love you" with a long, slow blink. It's actually saying "I trust you not to kill me," but hey—take what you can get. https:// youtu.be/yEhIpQvJRdM #NationalPetDay pic.twitter.com/x63XHpZ6ZG"
TweetsData/YouTube.csv;2018-04-11 23:09;160763;510423;"We're already getting ready for the Friday feeling! A new episode of Burn The Stage is here! #BTSxYouTubeRed https:// goo.gl/VzmJcQ pic.twitter.com/9fELpR8xo3"
TweetsData/YouTube.csv;2018-04-11 06:28;13836;24662;"YouTubeRed: is an ARMY"
TweetsData/YouTube.csv;2018-04-11 06:01;843;4700;"Happy #NationalSiblingsDay to ours! @TeamYouTube : the nice one @youtubemusic : only talks about @iamcardib @YTCreators : vlogs @the dinner table @YouTubeGaming : yells "Dream Daddy, but with zombies!" @YouTubeTV : prefers unlimited DVR to actual friendships"
TweetsData/YouTube.csv;2018-04-10 23:13;358;2415;"Happy #NationalSiblingsDay , whatever your family might look like. https:// youtu.be/tgRjq29TIJo pic.twitter.com/Nt4yDE0Tt3"
TweetsData/YouTube.csv;2018-04-10 22:01;24538;52778;"Did you see the premiere of Burn The Stage? It got our s pumping. Get to know @bts_twt and keep an out for the next episode! #BTSxYouTubeRed https:// goo.gl/XXK4jY pic.twitter.com/WIxBz7mUIy"
TweetsData/YouTube.csv;2018-04-10 03:43;553;2189;"This is the Moon's south pole. The highlighted areas show possible water ice. Thanks, @NASA . https:// youtu.be/nr5Pj6GQL2o pic.twitter.com/j1VUra91nB"
TweetsData/YouTube.csv;2018-04-10 01:00;307;1198;"Lando: A Star Wars Story (2018) https:// youtu.be/jPEYpryMp2s pic.twitter.com/hlR1gLfF2g"
TweetsData/YouTube.csv;2018-04-10 00:35;0;11;""
TweetsData/YouTube.csv;2018-04-09 23:55;0;11;"Thank you!"
TweetsData/YouTube.csv;2018-04-09 22:58;353;2470;"We're back, and we've been watching dog grooming videos for 4 hours. https:// youtu.be/avPzcSTysw0 #CreatorOnTheRise pic.twitter.com/DXPFeDLcoe"
TweetsData/YouTube.csv;2018-04-06 21:37;1;35;"Thank you."
TweetsData/YouTube.csv;2018-04-06 21:32;7;76;"Thank you."
TweetsData/YouTube.csv;2018-04-06 21:27;1;32;""
TweetsData/YouTube.csv;2018-04-06 21:18;5;349;"Thank you!"
TweetsData/YouTube.csv;2018-04-06 21:13;3;95;"Thank you."
TweetsData/YouTube.csv;2018-04-06 21:12;2;39;"Thank you!"
TweetsData/YouTube.csv;2018-04-06 21:11;1;22;""
TweetsData/YouTube.csv;2018-04-06 21:09;490;6323;"From all of us at YouTube, we want to thank the San Bruno Police Department and first responders again for your swift and attentive response. https:// twitter.com/SanBrunoPolice /status/981929828696797184 …"
TweetsData/YouTube.csv;2018-04-05 06:20;8105;74449;"Dear YouTube Community, As you know, yesterday was an incredibly difficult day for our teams in San Bruno and around the world. Thank you so much for your concern and support. All of us working here at YouTube are very grateful for this amazing community."
TweetsData/YouTube.csv;2018-04-04 03:06;11;192;"pic.twitter.com/LcAPnNWySP"
TweetsData/YouTube.csv;2018-04-04 03:01;383;3679;"Machine learning is artificial intelligence, but not all artificial intelligence is machine learning. @neiltyson , @MKBHD , and @chucknicecomic explain: https:// youtu.be/y9U10qdDQqk . #YouTubeTaughtMe pic.twitter.com/RNd4lv757O"
TweetsData/YouTube.csv;2018-04-04 01:28;206;2069;"We all love Lucas. https:// twitter.com/Gwar56/status/ 981220666153238528 …"
TweetsData/YouTube.csv;2018-04-04 00:21;435;2673;"You're probably wondering how I learned to sing Well, it's not important Watch me play this thing → https:// youtu.be/CUNq2_VjRn4 pic.twitter.com/CvjD5spDfA"
TweetsData/YouTube.csv;2018-04-04 00:12;1;9;"please subscribe us to this list."
TweetsData/YouTube.csv;2018-04-03 23:33;33507;70742;"Think fast, BTS fans. Tap to pause on your favorite @bts_twt member and don't forget to catch up on Burn The Stage before the next episode! #BTSxYouTubeRed #BTSArmy pic.twitter.com/EaJtqG26nq"
TweetsData/YouTube.csv;2018-04-03 09:40;170;1312;"When we use social media to amplify the voices of those directly affected by sexual violence, it can become a powerful force for justice. https:// youtu.be/2ZviHInGBJQ #SexualAssaultAwarenessMonth pic.twitter.com/x1I83pNlzp"
TweetsData/YouTube.csv;2018-04-03 05:17;136;1417;"We're working on it right now— @TeamYouTube will send an update as soon as it's fixed! https:// twitter.com/joshcookYT/sta tus/980916166515417088 …"
TweetsData/YouTube.csv;2018-04-03 05:12;193;1061;"Keep telling people. #SexualAssaultAwarenessMonth https:// youtu.be/xHu4h9zMt8Q pic.twitter.com/yg1roCpslO"
TweetsData/YouTube.csv;2018-04-03 03:17;25;127;"Yes, unfortunately. @TeamYouTube is working on it right now!"
TweetsData/YouTube.csv;2018-04-03 02:52;532;1886;"April is #SexualAssaultAwarenessMonth , a time to lift up the voices of sexual assault survivors and work together to prevent sexual violence. Here's a playlist to learn more: https:// goo.gl/MGQrWA . pic.twitter.com/ZK1Wrco08m"
TweetsData/YouTube.csv;2018-04-02 23:10;96;1409;"Happy April? #snow https:// youtu.be/Z7J7My8hgdQ"
TweetsData/YouTube.csv;2018-04-01 21:56;36185;81533;"Happy Easter, #BTSARMY . #BTSxYouTubeRed https:// twitter.com/btsstan155/sta tus/980440089284218880 …"
TweetsData/YouTube.csv;2018-04-01 21:39;1038;5770;"Happy #Easter ! We're celebrating with a rabbit hole of rabbit videos: https:// goo.gl/f2QQ3P pic.twitter.com/rlYPBSTx66"
TweetsData/YouTube.csv;2018-04-01 01:41;121;1301;"Yes, I'm watching YouTube With nipple grafts And trying to pass And taking T "A Song About Being Trans," by @jammi_dodger94 and @sherbetlemon007 → https:// youtu.be/oauFfro1NTQ #TransDayOfVisibility pic.twitter.com/fqIo0peDPg"
TweetsData/YouTube.csv;2018-03-31 21:05;233;1539;""We have always existed, and we continue to fight." We love this trans history from @zackarydrucker , @Lavernecox , and the @ACLU . Happy #TransDayOfVisibility ! https:// youtu.be/N-lhWEVByZo pic.twitter.com/29Y3eQmVFq"
TweetsData/YouTube.csv;2018-03-31 04:50;88;1004;"Creators: Let's do this! https:// youtu.be/Y3_CtTBNcHA #ILoveBeingTransBC https:// twitter.com/glaad/status/9 79773566253182976 …"
TweetsData/YouTube.csv;2018-03-31 03:42;292;2332;"#HappyPassover to everyone who has ever searched YouTube for "animals eating matzo," and to everyone who's about to search right now. https:// youtu.be/-UfeiRfn-JU pic.twitter.com/wD9BI2YgPn"
TweetsData/YouTube.csv;2018-03-30 08:32;235;1969;"Welp, this video went downhill fast. https:// youtu.be/dij-y9hVSn4 pic.twitter.com/nYukRg93PO"
