TweetsData/YouTube.csv;2018-05-05 01:38;227;977;"When it's #MayTheFourth and everything is suddenly Star Wars-themed: http:// youtu.be/FQC29joihwU #MayThe4thBeWithYou pic.twitter.com/VXnaYl8EdO"
TweetsData/YouTube.csv;2016-09-15 18:14;5;14;"What better way to end a brilliant hour than with a #selfie . Thanks to everyone who tuned in to #AskJuncker . pic.twitter.com/WFdjsMyAKa"
TweetsData/YouTube.csv;2016-09-15 18:05;1;0;"Get pumped! @lukaszjakobiak steps up to the plate with his questions for #AskJuncker #SOTEU http:// goo.gl/m4yJhJ pic.twitter.com/iZbvub7mt5"
TweetsData/YouTube.csv;2016-09-15 17:50;6;5;"This is your moment @corpsmaisonespr . It's time to #AskJuncker . Tune in live: http:// goo.gl/2Pq64w #SOTEU pic.twitter.com/0YxFpzQWTe"
TweetsData/YouTube.csv;2016-09-15 17:48;1;1;"This is your moment @corpsmaisonespr . It's time to #AskJuncker . Tune in live: http:// goo.gl/2Pq64w #SOTEU pic.twitter.com/Ml7GvKNlCI"
TweetsData/YouTube.csv;2016-09-15 17:47;1;1;". @corpsmaisonespr takes her seat, ready to #AskJuncker . Tune in live: http:// goo.gl/2Pq64w #SOTEU pic.twitter.com/394CJJeAK1"
TweetsData/YouTube.csv;2016-09-15 17:45;3;7;"C'est à ton tour @corpsmaisonespr , à toi de jouer ! Suivez #AskJuncker en live : http:// goo.gl/jDcil4 #SOTEU pic.twitter.com/fePD5JKrHq"
TweetsData/YouTube.csv;2016-09-15 17:30;14;37;"We've got some massive news from #Brandcast ... @VidCon is coming to Melbourne in 2017! pic.twitter.com/oNzLGb5JcA"
TweetsData/YouTube.csv;2016-09-15 17:25;0;2;"À toi de jouer @Jonas_EMS ! Suivez le #AskJuncker en direct : http:// goo.gl/U45DkW #SOTEU pic.twitter.com/gaj8tEBULk"
TweetsData/YouTube.csv;2016-09-15 17:24;7;18;"Das ist dein Moment @Jonas_EMS ! Jetzt mitfiebern auf http:// goo.gl/WXedL0 ! #AskJuncker #SOTEU pic.twitter.com/P1J3AMp73I"
TweetsData/YouTube.csv;2016-09-15 17:22;0;1;"It's time to shine @Jonas_EMS . Watch #AskJuncker live: http:// goo.gl/03pB7m #SOTEU pic.twitter.com/LQ4Mm6E1fN"
TweetsData/YouTube.csv;2016-09-15 17:22;0;0;"It's time to shine @Jonas_EMS . Watch #AskJuncker live: http:// goo.gl/03pB7m #SOTEU pic.twitter.com/d9C3pDmbpw"
TweetsData/YouTube.csv;2016-09-15 17:21;5;6;"It's time to shine @Jonas_EMS . Watch #AskJuncker live: http:// goo.gl/03pB7m #SOTEU pic.twitter.com/cyq3KRfl6d"
TweetsData/YouTube.csv;2016-09-15 17:18;2;3;"Los geht’s! @Jonas_EMS & die anderen Youtuber stellen die Fragen, die zählen! #AskJuncker http:// goo.gl/VqlUlJ pic.twitter.com/WLb68p9R02"
TweetsData/YouTube.csv;2016-09-15 17:16;7;4;"Peeps, politics and questions that matter. LIVE NOW: The creators #AskJuncker everything. http:// goo.gl/IK1wT7 pic.twitter.com/Cmtlq203dS"
TweetsData/YouTube.csv;2016-09-15 17:15;0;0;"Peeps, politics and questions that matter. LIVE NOW: The creators #AskJuncker everything. http:// goo.gl/IK1wT7 pic.twitter.com/KNSwwuXWvW"
TweetsData/YouTube.csv;2016-09-15 17:15;3;0;"Peeps, politics and questions that matter. LIVE NOW: The creators #AskJuncker everything. http:// goo.gl/IK1wT7"
TweetsData/YouTube.csv;2016-09-15 10:30;190;1181;"List of strange things: Eleven’s origins Demogorgon Pop Rocks Gak https:// goo.gl/CzppFb pic.twitter.com/VgzPo1vWcc"
TweetsData/YouTube.csv;2016-09-15 09:30;183;925;". @Beck ’s #WOW got us like … wow. https:// goo.gl/oZYnz7 pic.twitter.com/IuV2M42GT4"
TweetsData/YouTube.csv;2016-09-15 08:30;73;639;"Back in school we used to dream about this every day. BBD make a comeback → https:// goo.gl/0mQUGE pic.twitter.com/TA29W318NY"
TweetsData/YouTube.csv;2016-09-15 07:30;168;959;"This is why you don’t let robots go outside unsupervised. https:// goo.gl/uT5e9s pic.twitter.com/bX0a7UZgLd"
TweetsData/YouTube.csv;2016-09-15 06:30;99;754;"Would you pay 100K for a cat? Neither would 2Chainz. https:// goo.gl/XNjtBH pic.twitter.com/0iGDM8JP7W"
TweetsData/YouTube.csv;2016-09-15 06:16;599;1406;". @justinbieber , @MAJORLAZER & @MOMOMOYOUTH dropped the dance vid for #ColdWater and it’s → https:// goo.gl/jeS5fN pic.twitter.com/5lDi2yqyg1"
TweetsData/YouTube.csv;2016-09-15 05:30;199;949;"American Idiots no more. @GreenDay ’s new “Bang Bang” → https:// goo.gl/SfwHVP pic.twitter.com/Ug7DQaXRfa"
TweetsData/YouTube.csv;2016-09-15 04:30;151;843;"“I’m Real” was the #1 song 15 years ago today. Yet the question remains: Are you Ellie? https:// goo.gl/s0bjNH pic.twitter.com/JjoL371dIs"
TweetsData/YouTube.csv;2016-09-15 03:44;83;565;"When someone asks if you wanna fight zombies today … #FOTLD Episode 6 is up now → http:// goo.gl/nIkoKK pic.twitter.com/9UR5h9TZC4"
TweetsData/YouTube.csv;2016-09-15 03:19;153;880;"What’s the best love song ever written? Did Peter nail it? http:// goo.gl/ouLhOx #SingleBy30 pic.twitter.com/49bkFIq0sq"
TweetsData/YouTube.csv;2016-09-15 00:00;458;2312;"Satisfaction: off the charts. @danisnotonfire , @amazingphil , & more react → http:// goo.gl/t4vlYt pic.twitter.com/3tahKz6UC7"
TweetsData/YouTube.csv;2016-09-14 23:00;207;1036;"Domi-yes. Very rare triple spiral → http:// goo.gl/RFdxoj pic.twitter.com/uuOiDgxNom"
TweetsData/YouTube.csv;2016-09-14 08:40;10;60;"We'd subscribe."
TweetsData/YouTube.csv;2016-09-14 08:40;11;78;""
TweetsData/YouTube.csv;2016-09-14 08:40;5;22;"The BEST kind of business"
TweetsData/YouTube.csv;2016-09-14 08:40;5;23;"We bet you appreciate it. Sorry, we couldn't resist..."
TweetsData/YouTube.csv;2016-09-14 08:29;16;171;"Happy decade on YouTube, Natalie!"
TweetsData/YouTube.csv;2016-09-14 08:27;198;365;"Congratulations, Najwa!"
TweetsData/YouTube.csv;2016-09-14 08:00;195;883;"Getting ready for bed like → http:// goo.gl/jhtQbC pic.twitter.com/VLiZ0RbF1y"
TweetsData/YouTube.csv;2016-09-14 07:00;90;588;"Oh he’s smooth. Real smooth.“The Final Countdown” cover with keytars → http:// goo.gl/D5dbD2 pic.twitter.com/TD7Ds9Uwdl"
TweetsData/YouTube.csv;2016-09-14 06:00;263;1187;"It’s not a trick, it’s an illusion. 10 bets you’ll always win → http:// goo.gl/t9eXWZ pic.twitter.com/t2YhQgtDW1"
TweetsData/YouTube.csv;2016-09-14 05:00;141;823;"Name this trick! http:// goo.gl/urQf5d pic.twitter.com/bJD9YH3lyZ"
TweetsData/YouTube.csv;2016-09-14 04:21;211;909;"Think Ken Block’s ever asked a friend to help him parallel park? GYMKHANA NINE → http:// goo.gl/ICgkT4 pic.twitter.com/M87gnNuGvz"
TweetsData/YouTube.csv;2016-09-14 02:49;383;2201;"We’re making @JKCorden king for a day. Congrats on the Emmys, James! http:// goo.gl/GzK51k pic.twitter.com/9H1XuvLvcL"
TweetsData/YouTube.csv;2016-09-14 01:13;236;1171;"| \ \ | \ Goats on a vertical dam → http:// goo.gl/hA6CkW pic.twitter.com/PFxGBCVUf9"
TweetsData/YouTube.csv;2016-09-14 00:00;126;664;"What really goes into that French Press every morning? Hand-making coffee from scratch → http:// goo.gl/64kWvW pic.twitter.com/iZxmiHJ7b2"
TweetsData/YouTube.csv;2016-09-13 23:00;217;836;"Make sure you turn off the SmellTube™ feature for this one. Hydraulic Press vs. Durian → http:// goo.gl/6lewx6 pic.twitter.com/4ILIWx63Y3"
TweetsData/YouTube.csv;2016-09-13 22:56;190;953;"Yo! Siri raps. http:// goo.gl/OkXOmz pic.twitter.com/ym8LOo4PYQ"
TweetsData/YouTube.csv;2016-09-13 10:00;111;820;"This summer blockbuster is rated G. Action Movie Kid defuses a bomb → http:// goo.gl/QTQVrG pic.twitter.com/nM3q7XsGr6"
TweetsData/YouTube.csv;2016-09-13 09:00;171;865;"Now that's a symphonic power-up. Dance the demons away. http:// goo.gl/9uPd9H #NationalVideoGamesDay #YouTubeMusic pic.twitter.com/uuEjdtfPli"
TweetsData/YouTube.csv;2016-09-13 08:00;165;941;"2 Fast But Not 2 Furious. http:// goo.gl/uDaNbu pic.twitter.com/PYw0Qp1ZhG"
TweetsData/YouTube.csv;2016-09-13 07:06;11;24;"#YouTubeBlack"
TweetsData/YouTube.csv;2016-09-13 06:57;217;1149;"What's a game without its soundtrack? Share your favorite video game songs for #NationalVideoGamesDay #YouTubeMusic pic.twitter.com/aWO7mfzuXu"
TweetsData/YouTube.csv;2016-09-13 06:00;230;1082;"A Paralympian shows off his incredible ride → http:// goo.gl/w6PGMN pic.twitter.com/4LR7AhzD8Q"
TweetsData/YouTube.csv;2016-09-13 05:50;383;1242;"Mind = blown. @DUALIPA 's new music video's got us like http:// goo.gl/Kveh1N #mwah pic.twitter.com/jkSOYxZNTP"
TweetsData/YouTube.csv;2016-09-13 05:00;130;766;"Hallelujah, It’s raining stuffed animals → http:// goo.gl/6iT3AW pic.twitter.com/08XGaZOboc"
TweetsData/YouTube.csv;2016-09-13 04:00;134;1002;"When you play the game of pizza, everyone wins. http:// goo.gl/qnPNEz pic.twitter.com/2vPXyVhB1K"
TweetsData/YouTube.csv;2016-09-12 23:24;1;1;"1 Président de @uefrance 3 créateurs @YouTube = La réponse bientôt http:// goo.gl/KNKslq #AskJuncker #SOTEU pic.twitter.com/j0gtCaVKez"
TweetsData/YouTube.csv;2016-09-12 23:20;0;3;"1 Präsident der @EU_Commission + 3 Youtuber ergibt was? Finde es heraus! http:// goo.gl/URuwnS #AskJuncker #SOTEU pic.twitter.com/VJifJuH8qC"
TweetsData/YouTube.csv;2016-09-12 23:07;0;1;"What does 1 Head of the @EU_Commission + 3 creators equal? Find out soon. http:// goo.gl/Cg4BZT #AskJuncker #SOTEU pic.twitter.com/EX1ViEHcJh"
TweetsData/YouTube.csv;2016-09-12 22:57;10;8;"What does 1 Head of the @EU_Commission + 3 creators equal? Find out soon. http:// goo.gl/Cg4BZT #AskJuncker #SOTEU pic.twitter.com/93ehVsl5Vn"
TweetsData/YouTube.csv;2016-09-12 22:48;2;0;"What does 1 Head of the @EU_Commission + 3 creators equal? Find out soon. http:// goo.gl/Cg4BZT #AskJuncker #SOTEU pic.twitter.com/dWSGtIeGM7"
TweetsData/YouTube.csv;2016-09-11 06:00;198;1086;"New @ChiliPeppers has us feeling like → http:// goo.gl/2eWLE3 pic.twitter.com/nSccW7GySo"
TweetsData/YouTube.csv;2016-09-11 03:00;338;1772;"Eruption selfie! Close-Up View of Mount Semeru Volcano → http:// goo.gl/Ajf5ZC pic.twitter.com/s5UhOK6UyJ"
TweetsData/YouTube.csv;2016-09-11 00:00;345;1492;"+ = Extreme basketball freestyle → http:// goo.gl/V41sVM pic.twitter.com/yQMAgj07qr"
TweetsData/YouTube.csv;2016-09-10 08:00;288;1636;"They can send you to your room but they can’t take away your dignity. http:// goo.gl/rSWGsJ pic.twitter.com/K7pw13P8V3"
TweetsData/YouTube.csv;2016-09-10 07:18;10;47;"So close! Won't be much longer"
TweetsData/YouTube.csv;2016-09-10 07:18;3;36;"Now that's a billboard. Congrats Shanna!"
TweetsData/YouTube.csv;2016-09-10 07:18;5;52;"We second that shout-out! We're especially fans of this @NotJustSaiyanX vid: https://www. youtube.com/watch?v=ef22Pk ZG2T4 …"
TweetsData/YouTube.csv;2016-09-10 07:17;0;26;"LIKE."
TweetsData/YouTube.csv;2016-09-10 07:17;8;52;"That reason, is the best reason."
TweetsData/YouTube.csv;2016-09-10 07:17;2;17;"Congratulations Ambrosia! You're going to be an incredible mom!!"
TweetsData/YouTube.csv;2016-09-10 07:16;2;26;"A YouTube video of Twitter questions. DIGITAL MASTERY. Also you can sing a lot higher than we thought you could."
TweetsData/YouTube.csv;2016-09-10 07:16;1;14;"Another perfect skincare video! Awesome job, Nastazsa!"
TweetsData/YouTube.csv;2016-09-10 07:16;1;12;"Très bien!"
TweetsData/YouTube.csv;2016-09-10 07:16;40;446;"Maximum insanity. Congratulations Joey!"
TweetsData/YouTube.csv;2016-09-10 07:16;1;18;"Congrats Cody! You look great next to all that"
TweetsData/YouTube.csv;2016-09-10 07:00;689;2482;"A whole new take on sand castles. http:// goo.gl/9CScbi pic.twitter.com/JDxgUKWJ6K"
TweetsData/YouTube.csv;2016-09-10 06:00;168;971;"He was a sk8r boi, she said “wow ur fast boi” The fastest boarder ever → http:// goo.gl/rJQjxu pic.twitter.com/Wtc9VlzPMY"
TweetsData/YouTube.csv;2016-09-10 05:34;348;1833;"Is this the cutest thing in the world? Yes Yas Certainly Definitely http:// goo.gl/WKqBHh pic.twitter.com/zrbrIRJruW"
TweetsData/YouTube.csv;2016-09-10 05:00;148;872;". @NathanBarnatt shows us how to bounce, bounce, bounce, bounce, bounce on that Koopa Troopa! http:// goo.gl/J3iea7 pic.twitter.com/WTHqcDIhpd"
TweetsData/YouTube.csv;2016-09-10 04:05;110;760;"It’s like you're always stuck in a story all about how … FRIENDS THEME - 90s RAP VERSION → http:// goo.gl/nKgRg0 pic.twitter.com/RoCzMSOwy8"
TweetsData/YouTube.csv;2016-09-10 01:35;211;1621;"IN LIVING COLOR http:// goo.gl/xIFbmS pic.twitter.com/yf1gfWWodS"
TweetsData/YouTube.csv;2016-09-10 00:34;413;1357;"Let the spirit of #NationalTeddyBearDay take over your body and soul. Now Dance. http:// goo.gl/u3JQEs pic.twitter.com/lfjDvpjPzG"
TweetsData/YouTube.csv;2016-09-09 07:00;226;1196;"Skate or meow → http:// goo.gl/1PJjaQ pic.twitter.com/FaXTFaIRqQ"
TweetsData/YouTube.csv;2016-09-09 06:00;174;860;"Vaya con caballos, brah. http:// goo.gl/MHg5WE pic.twitter.com/OiganOA3HQ"
TweetsData/YouTube.csv;2016-09-09 05:00;111;844;"We’ll take an order of bleep-bloopberry pancakes, please. http:// goo.gl/Qb1hWs #PancakeRobot pic.twitter.com/aEOeg8aSxQ"
TweetsData/YouTube.csv;2016-09-09 04:11;226;1398;"Let’s melt a donut → http:// goo.gl/liQ4Iw pic.twitter.com/kNvW1eE9e0"
TweetsData/YouTube.csv;2016-09-09 04:00;137;859;"Design never tasted so good. http:// goo.gl/k4WxXQ pic.twitter.com/KSYCjcXWzF"
TweetsData/YouTube.csv;2016-09-09 02:08;194;1030;"And the world spins madly on. http:// goo.gl/1dbh1a pic.twitter.com/qcxOzEcK0Y"
TweetsData/YouTube.csv;2016-09-08 08:47;3;49;"You are the coolest family. What an awesome cake!"
TweetsData/YouTube.csv;2016-09-08 08:46;46;179;"Such an accomplishment! Congratulations, you incredible artist you."
TweetsData/YouTube.csv;2016-09-08 08:45;9;83;"That looks so nice next to the . Congrats dudes!"
TweetsData/YouTube.csv;2016-09-08 08:45;3;27;"Woof!"
TweetsData/YouTube.csv;2016-09-08 08:44;2;37;"Congrats Quinta! We cannot wait for this show to come out."
TweetsData/YouTube.csv;2016-09-08 08:00;200;1274;"We’re not in Friday anymore. @MsRebeccaBlack belts it out through #TheGreatDivide → http:// goo.gl/yrTmVU pic.twitter.com/Aa2APBpv0m"
TweetsData/YouTube.csv;2016-09-08 07:00;872;3347;". @Sup3rfruit + @marylambertsing + @brianjustincrum + @heyitsmariojose = RISE http:// goo.gl/pn2lD4 pic.twitter.com/CycQYMr79N"
TweetsData/YouTube.csv;2016-09-08 06:00;264;1218;"#TheGreatest is back. @Sia teams up with @kendricklamar → http:// goo.gl/SZnn5q pic.twitter.com/gDVa5tHtsl"
TweetsData/YouTube.csv;2016-09-08 05:00;311;1149;"Not as clumsy or random as a blaster; an elegant weapon for a more civilized age. http:// goo.gl/1R6oZ9 pic.twitter.com/MS4pZqiSUu"
TweetsData/YouTube.csv;2016-09-08 03:54;129;902;"OMG, how awkward can a house party be? Find out on the latest episode of #SingleBy30 . http:// goo.gl/4SGvQJ pic.twitter.com/6rcgwMTIG4"
TweetsData/YouTube.csv;2016-09-08 03:20;169;1036;"When your friend gets infected, comes back to life and then acts like it’s all good. http:// goo.gl/rjFCrO #FOTLD pic.twitter.com/MCaU7R97V5"
TweetsData/YouTube.csv;2016-09-08 00:00;547;2165;"tfw you’re no longer endangered http:// goo.gl/uRqOsc pic.twitter.com/3H1dSm2Vs3"
TweetsData/YouTube.csv;2016-09-07 09:00;151;1074;"They can make you go back to school, but they’ll never take your style. http:// goo.gl/GkrciJ pic.twitter.com/zqsLvhW1s2"
TweetsData/YouTube.csv;2016-09-07 08:30;178;1145;"Always stoked to see YouTubers on TV. Congrats, @SimoneGiertz http:// goo.gl/KLTYIS pic.twitter.com/H6i9PhlPdD"
TweetsData/YouTube.csv;2016-09-07 07:51;4;22;"So good! Those eyes are so blue ... so Bunny!"
TweetsData/YouTube.csv;2016-09-07 07:50;529;2154;"We’ve seen you again … over 2 billion times. Congratulations @wizkhalifa and @charlieputh . http:// goo.gl/tmBeXE pic.twitter.com/NyvrZXSyzh"
TweetsData/YouTube.csv;2016-09-07 07:00;81;712;"Proof that you’ve only gotta be 5 years old to hang 10. Quincy the surfer → http:// goo.gl/VisJkb pic.twitter.com/WmDbTUVRoy"
TweetsData/YouTube.csv;2016-09-07 06:00;251;1102;"*ears perk up* *third eye opens* New @GROUPLOVE , “Enlighten Me” → http:// goo.gl/js6NXJ pic.twitter.com/j0WrKbSEZL"
TweetsData/YouTube.csv;2016-09-07 05:00;179;722;"생일축하해! What’s your Korean age? http:// goo.gl/BMNNQC pic.twitter.com/Lg21NnkrjU"
TweetsData/YouTube.csv;2016-09-07 04:00;229;1172;"“I cannot live without jelly beans.” — Thomas Jefferson, probably. http:// goo.gl/ayvzGJ pic.twitter.com/5Kv9EWamZv"
TweetsData/YouTube.csv;2016-09-07 00:54;622;1904;"The @bep team up with today’s top stars to remake #WheresTheLove for a new generation. http:// goo.gl/JndLmo pic.twitter.com/2ZVAN7p9y0"
TweetsData/YouTube.csv;2016-09-06 06:00;272;1295;"It is nowhere. It is nothing. It is endless. It is … Infinity Potato. http:// goo.gl/f9KddF #PotatoLyfe pic.twitter.com/zjxGfPdtD5"
TweetsData/YouTube.csv;2016-09-06 03:00;445;1766;"Bigger. Stronger. Keyboardier. Keyboard Cat v2.0 → http:// goo.gl/n771le pic.twitter.com/tYeXM0BbwW"
TweetsData/YouTube.csv;2016-09-06 00:00;232;1268;""Finding Dory" told by emojis → http:// goo.gl/2RYgTc pic.twitter.com/3UqekocIqd"
TweetsData/YouTube.csv;2016-09-05 06:00;317;1931;"New @SkylarGrey → http:// goo.gl/84Yb3v pic.twitter.com/DEJ3edev4h"
TweetsData/YouTube.csv;2016-09-05 03:00;127;866;"“Your mind will be blown very soon.” http:// goo.gl/3d3Qsr pic.twitter.com/Jsoq3Rqxpe"
TweetsData/YouTube.csv;2016-09-05 00:00;185;1247;"The first time Phelps has cracked under pressure. http:// goo.gl/KC3w5M pic.twitter.com/AI1T2Zg9d2"
TweetsData/YouTube.csv;2016-09-04 06:00;421;2142;"Waking up on a long weekend like → http:// goo.gl/d8UKaz pic.twitter.com/9CgRAMKpTi"
TweetsData/YouTube.csv;2016-09-04 00:00;185;1577;"Water you doing to that melon?! http:// goo.gl/ohcHZX pic.twitter.com/tICavzfebL"
TweetsData/YouTube.csv;2016-09-03 05:00;180;1037;"Let's get some shoes! 100 Years of High Heels → http:// goo.gl/za2WUG pic.twitter.com/JBXSfWxu9z"
TweetsData/YouTube.csv;2016-09-03 04:00;166;931;"Lucky Barb! The "Stranger Things" theme, in a major key → http:// goo.gl/i3AOi1 pic.twitter.com/vaqCa70zte"
TweetsData/YouTube.csv;2016-09-03 03:00;367;1485;"Human Skateboard by @PESfilm . Now in flashy HD → http:// goo.gl/dWmV5k pic.twitter.com/ErNAjpHp1q"
TweetsData/YouTube.csv;2016-09-03 00:00;342;1750;"When you sit on your Rubik’s Cube, you have a whole new problem. http:// goo.gl/geGfBz pic.twitter.com/fcunByToTN"
TweetsData/YouTube.csv;2016-09-02 22:25;83;747;"Sweatin’ to the oldies with Nick Offerman and Michelle Obama → http:// goo.gl/VKTi2j pic.twitter.com/rKbBxFl81X"
TweetsData/YouTube.csv;2016-09-02 06:27;282;1605;"Music that exists outside the space-time continuum. This is #Hitchhiker : http:// goo.gl/UhmVgH pic.twitter.com/J7ghN2Z0eS"
TweetsData/YouTube.csv;2016-09-01 10:02;180;1022;"Star in your own futuristic rainforest epic with this new @EmpireOfTheSun track→ http:// goo.gl/KqehE2 pic.twitter.com/noWKByGuFv"
TweetsData/YouTube.csv;2016-09-01 08:01;123;762;"WoooOOOoooᵒᵒp! It’s the Millennial whoop → http:// goo.gl/HSGse4 pic.twitter.com/3tDUjpB69S"
TweetsData/YouTube.csv;2016-09-01 07:00;154;1039;"He’s about that slug lyfe. http:// goo.gl/VpNO0s pic.twitter.com/zhKFTsiVh2"
TweetsData/YouTube.csv;2016-09-01 06:36;174;977;"Weapon Of Choice → #KENZOWorld http:// goo.gl/eo2WTF → http:// goo.gl/kgOXdG pic.twitter.com/USPLn8gScD"
TweetsData/YouTube.csv;2016-09-01 05:50;265;1420;"http:// goo.gl/gT98oc pic.twitter.com/DfUT1dwJbI"
TweetsData/YouTube.csv;2016-09-01 05:00;147;1032;"Don’t have a meltdown, man. http:// goo.gl/hV7fK2 #WednesdayWisdom pic.twitter.com/WSVBC7j9dc"
TweetsData/YouTube.csv;2016-09-01 03:58;241;1201;"Peter and Joanna party like college kids in the latest episode of #SingleBy30 . http:// goo.gl/2CmZ2A pic.twitter.com/vqeMsuqGat"
TweetsData/YouTube.csv;2016-09-01 02:50;137;875;"Knock, knock! Who’s there? BRAAAAINS!!! #FOTLD episode 4 starts now → http:// goo.gl/E4DRKO pic.twitter.com/jmNwqJ6zxC"
TweetsData/YouTube.csv;2016-08-31 22:37;8;84;"Everybody loves tricks. Especially @YouTubeGaming ."
TweetsData/YouTube.csv;2016-08-31 22:36;15;56;"Whhooaa that is insane. Your skills are DANGEROUS. https://www. youtube.com/watch?v=n_NGku UpwB8 …"
TweetsData/YouTube.csv;2016-08-31 22:36;9;112;"Congratulations, Jerome! Nothing like a most viewed day."
TweetsData/YouTube.csv;2016-08-31 22:36;5;30;"Of course! Good luck next week!"
TweetsData/YouTube.csv;2016-08-31 22:35;85;742;"And we're such a huge fan of you. Consider yourself followed."
TweetsData/YouTube.csv;2016-08-31 22:35;2;30;"Enjoy your break! We'll see you ... in the fall?!"
TweetsData/YouTube.csv;2016-08-31 09:00;154;1000;"Feel young again with @GlassAnimals ’ #Youth → http:// goo.gl/tTt0Sb pic.twitter.com/Q0Bhp6rFGD"
TweetsData/YouTube.csv;2016-08-31 08:00;218;1296;"Roboto Picasso Man and machine paint together → http:// goo.gl/t32yjb pic.twitter.com/dEVVSzoQWh"
TweetsData/YouTube.csv;2016-08-31 07:00;525;2005;"look @the look how they shine 4 u & all the vids u view it's called light pollution, dude http:// goo.gl/mLjXMg pic.twitter.com/Nyfx25zLMN"
TweetsData/YouTube.csv;2016-08-31 06:18;104;811;"PRO TIP: if you're in the US, type "Register to vote" in @google and get ready for Election Day! https:// twitter.com/tyleroakley/st atus/770403184015712256 …"
TweetsData/YouTube.csv;2016-08-31 06:00;129;807;"Air. How does THAT work? → http:// goo.gl/vmBPB5 pic.twitter.com/9RG59JIJfc"
TweetsData/YouTube.csv;2016-08-31 05:00;145;831;"Step 1: Get in your car. Step 2: Bump this. Step 3: Drive. New @ZHUmusic → http:// goo.gl/NJTQAv pic.twitter.com/4exIXp9GrR"
TweetsData/YouTube.csv;2016-08-31 04:00;158;1125;"It’s Hammer vs. Glass. Guess who wins? http:// goo.gl/t8rmGY pic.twitter.com/EisN3u4JBH"
TweetsData/YouTube.csv;2016-08-30 08:00;185;1116;"Go go bat-gadget! Officially the most tricked-out Batman cosplay ever → http:// goo.gl/uXDNpI pic.twitter.com/mhIu5iPjkw"
TweetsData/YouTube.csv;2016-08-30 07:30;167;961;"The world’s coolest night light. → http:// goo.gl/64Utij pic.twitter.com/aHEbPrJ6IB"
TweetsData/YouTube.csv;2016-08-30 06:30;100;811;"Upgrade your instrument, upgrade your life. Homemade pipe organ unveiling → http:// goo.gl/Y7kigB pic.twitter.com/sGssRPe1FR"
TweetsData/YouTube.csv;2016-08-30 06:24;19;85;"AH this is a video we always go back to. https://www. youtube.com/watch?v=Z4zsCJ tJ7yA …"
TweetsData/YouTube.csv;2016-08-30 06:23;4;46;"Yay! Welcome back!"
TweetsData/YouTube.csv;2016-08-30 06:23;12;64;"We love everything you do on YouTube ... never stop!"
TweetsData/YouTube.csv;2016-08-30 06:22;2;24;"Alright fine, you WinFace McWinFace."
TweetsData/YouTube.csv;2016-08-30 06:22;6;15;""
TweetsData/YouTube.csv;2016-08-30 05:30;208;1019;"Watch this whenever. Contortionists have flexible schedules. http:// goo.gl/f6Untk pic.twitter.com/ycAf65w9qD"
TweetsData/YouTube.csv;2016-08-30 04:52;661;2509;"Remembering the legendary actor Gene Wilder with a @blankonblank interview about truth. http:// goo.gl/6k4nJY pic.twitter.com/dabFwKhVFk"
TweetsData/YouTube.csv;2016-08-30 04:00;323;1487;"Taking name ideas for a newly discovered planet! No “Earthy McEarthface” allowed. http:// goo.gl/YtV6tC pic.twitter.com/4jnzLSBr3D"
TweetsData/YouTube.csv;2016-08-29 20:25;3;34;"nice job! This one goes out to you. http:// goo.gl/lpP1Cb"
TweetsData/YouTube.csv;2016-08-29 20:24;2;18;"you came in like a wrecking ball with those guesses. Yeah... we went there. http:// goo.gl/lKDcIB"
TweetsData/YouTube.csv;2016-08-29 09:10;279;1926;"Music isn’t just what we listen to, it's what we watch Can you guess these previous winners of tonight’s vid awards? pic.twitter.com/Zh07TLxNfz"
TweetsData/YouTube.csv;2016-08-29 04:31;282;2034;"Music's biggest night covered by YouTube's biggest creators. Watch for their #VMAs live streams, starting soon! pic.twitter.com/UgVh5AkPAq"
TweetsData/YouTube.csv;2016-08-29 02:00;334;1735;"Hey @britneyspears , do you wanna come over … to @JKCorden ’s carpool lane? http:// goo.gl/1clKXg pic.twitter.com/ZMIgka0Oq0"
TweetsData/YouTube.csv;2016-08-29 01:00;470;2165;"Walking outside in August like → http:// goo.gl/dbu4NQ pic.twitter.com/UqjCUGrZK0"
TweetsData/YouTube.csv;2016-08-29 00:00;340;1696;"Somewhere over the rainbow, there’s cheesecake like this http:// goo.gl/VoOzLY pic.twitter.com/xMdMfXZgrQ"
TweetsData/YouTube.csv;2016-08-28 23:00;743;2513;"We’re Still Falling For You, @elliegoulding . http:// goo.gl/HOyulL pic.twitter.com/JE5EoqFooG"
TweetsData/YouTube.csv;2016-08-28 03:00;196;1331;"Learning about black holes while blindfolded will turn your brain into a black hole. http:// goo.gl/e40wVR pic.twitter.com/t8k6pMFgA6"
TweetsData/YouTube.csv;2016-08-28 01:00;353;1708;"The first person to land the double front flip 360. → http:// goo.gl/x1Eft1 pic.twitter.com/3Xa5A8AgjB"
TweetsData/YouTube.csv;2016-08-27 23:00;140;798;"The history of an internet cafe, from a time when people said “wait, what’s email?” http:// goo.gl/vo3KTW pic.twitter.com/hNpUxUDJCP"
TweetsData/YouTube.csv;2016-08-27 08:30;247;1457;"“Best Flappy Lips” winner at last year’s Westminster. Go for #NationalDogDay gold → http:// goo.gl/GXl318 pic.twitter.com/1o0vaFvXPK"
TweetsData/YouTube.csv;2016-08-27 08:00;127;1028;"[LIVE] @smosh in front of a live audience. It’s about to get really real. → http:// goo.gl/U9iA5U pic.twitter.com/VfTo50vsd5"
TweetsData/YouTube.csv;2016-08-27 07:30;332;1470;"Mad Max: Furry Road. Happy #NationalDogDay → http:// goo.gl/rOUoUm pic.twitter.com/GQi2MxJ7mM"
TweetsData/YouTube.csv;2016-08-27 06:30;266;1515;"Ahh, the feeling of the wind in your fur. Happy #NationalDogDay → http:// goo.gl/UlzyYC pic.twitter.com/b0pLh57j4B"
TweetsData/YouTube.csv;2016-08-27 06:20;2;26;"All about that editing life"
TweetsData/YouTube.csv;2016-08-27 06:19;13;117;"Can't wait for his Official Book Club selections, too."
TweetsData/YouTube.csv;2016-08-27 06:12;0;20;"Same"
TweetsData/YouTube.csv;2016-08-27 06:11;1;29;"That's 31 more videos than a lot of people made. Congrats!"
TweetsData/YouTube.csv;2016-08-27 05:30;163;1063;"Fritz has great mouth-eye coordination. Achieve your dreams on #NationalDogDay → http:// goo.gl/iW4dkP pic.twitter.com/dTt8MJJQup"
TweetsData/YouTube.csv;2016-08-27 04:30;169;1081;"#NationalDogDay , slowed way down → http:// goo.gl/5KUHF2 pic.twitter.com/hEtbzWkNeh"
