TweetsData/YouTube.csv;2018-05-05 01:38;227;977;"When it's #MayTheFourth and everything is suddenly Star Wars-themed: http:// youtu.be/FQC29joihwU #MayThe4thBeWithYou pic.twitter.com/VXnaYl8EdO"
TweetsData/YouTube.csv;2017-03-14 06:30;348;1678;"tfw you really want the belly rub https:// goo.gl/bjpO18 pic.twitter.com/xITrKukEHo"
TweetsData/YouTube.csv;2017-03-14 05:30;566;2167;"A for Effort, buddy. https:// goo.gl/LEAmYw pic.twitter.com/gMzN1i8MNj"
TweetsData/YouTube.csv;2017-03-14 05:08;380;3547;"*cancels gym membership just in case this happens*"
TweetsData/YouTube.csv;2017-03-14 05:07;6;234;"Every second counts!"
TweetsData/YouTube.csv;2017-03-14 05:07;27;307;"Gotta blast!"
TweetsData/YouTube.csv;2017-03-14 05:06;5;28;"Relatable."
TweetsData/YouTube.csv;2017-03-14 05:05;4;78;"Better late than never?"
TweetsData/YouTube.csv;2017-03-14 04:24;269;1521;"Go, get ur freak on Po, get ur freak on https:// goo.gl/6mQFo9 pic.twitter.com/tpRetQnCMm"
TweetsData/YouTube.csv;2017-03-14 02:46;196;1101;".@Stormzy1’s album went gold. Celebrate with a new video for “Cold” → https:// goo.gl/u8XRt6 pic.twitter.com/1lfGFIv7HD"
TweetsData/YouTube.csv;2017-03-14 02:18;254;1295;"Did you have a nap today? https:// goo.gl/kfnaEC #nationalnappingday pic.twitter.com/m24PQWRzLR"
TweetsData/YouTube.csv;2017-03-13 03:21;167;1106;"Molten copper: SO hot right now. https:// goo.gl/LMfmPD pic.twitter.com/0kQicUb0kV"
TweetsData/YouTube.csv;2017-03-12 07:18;124;984;"Rock out in every color of the rainbow. @thehalocline goes “Violet” → https:// goo.gl/JrNj4M pic.twitter.com/ujvbhvLge3"
TweetsData/YouTube.csv;2017-03-12 04:16;120;977;"tfw the jazz club is lit Most finger snaps in one minute → https:// goo.gl/C7IG37 pic.twitter.com/pYOfFyMyKQ"
TweetsData/YouTube.csv;2017-03-12 01:12;141;1113;"Iceland sounds just as beautiful as it looks. See how @MusicLapsley makes her music → https:// goo.gl/rDp9ma pic.twitter.com/yO3ZnxQTCN"
TweetsData/YouTube.csv;2017-03-11 10:10;204;1534;"Love’s just a feeling. Thanks, @LindseyStirling → https:// goo.gl/14qglS pic.twitter.com/yFI2ggyXL7"
TweetsData/YouTube.csv;2017-03-11 09:09;177;1029;"In the depths of winter, she thrives. @_iamamiwhoami_ ’s new project with @COMMEGARCONS → https:// goo.gl/6SVUU9 pic.twitter.com/ViB04vPfWv"
TweetsData/YouTube.csv;2017-03-11 08:08;852;3183;"I tried so hard / and got so far / and in the end / you get a whole new single @linkinpark is back → https:// goo.gl/skNJDC pic.twitter.com/B45dvmBHrf"
TweetsData/YouTube.csv;2017-03-11 07:07;119;774;"tfw you catch a virtual fish with no real-life application → https:// goo.gl/rqT1wr pic.twitter.com/7NxKJyA3r0"
TweetsData/YouTube.csv;2017-03-11 06:07;95;826;"Fight your demons with @Imaginedragons . “Believer” → https:// goo.gl/kiEvBD pic.twitter.com/G1tyQbABX0"
TweetsData/YouTube.csv;2017-03-11 05:56;5;31;"Can we be YOUR guest so we can eat this???"
TweetsData/YouTube.csv;2017-03-11 05:56;4;69;"We approve of this logic."
TweetsData/YouTube.csv;2017-03-11 05:52;6;105;"*makes grabby hands at pasta but remembers to say please*"
TweetsData/YouTube.csv;2017-03-11 05:51;148;1638;"Worth the wait, this was."
TweetsData/YouTube.csv;2017-03-11 05:51;2;89;"We like your sneakers."
TweetsData/YouTube.csv;2017-03-11 05:30;151;1070;". @PatinkinMandy and @theIRC chat with a 10-year-old refugee who just wants to be an artist in America → https:// goo.gl/iCwRK2 pic.twitter.com/r9A0uw72d7"
TweetsData/YouTube.csv;2017-03-11 05:00;107;744;"Take a stroll down a happy animated street with Bill Murray → https:// goo.gl/xr0v62 pic.twitter.com/a11hmgmxZV"
TweetsData/YouTube.csv;2017-03-11 04:05;133;909;"The greatest '90s toy you never owned → https:// goo.gl/tHQ6gP pic.twitter.com/Mgg7MNbzz3"
TweetsData/YouTube.csv;2017-03-11 00:36;303;1267;"Go on an interstellar retro slow-jam journey with Starboy and Daft Punk. @theweeknd ’s “I Feel It Coming” → https:// goo.gl/8hxrPx pic.twitter.com/tuAa4Wqh60"
TweetsData/YouTube.csv;2017-03-10 09:00;111;792;"What would you say to your younger self? @1future ’s “Use Me” → https:// goo.gl/xTGcEm pic.twitter.com/FUMgDrf3LS"
TweetsData/YouTube.csv;2017-03-10 08:00;102;739;"Who said “I love you” first? And who said “cool” back? https:// goo.gl/RXpBnS pic.twitter.com/AqoS3nGSTU"
TweetsData/YouTube.csv;2017-03-10 07:00;128;1069;"Trying to be normal around a big group of strangers like → https:// goo.gl/GB5Isl pic.twitter.com/RJyIVSbr58"
TweetsData/YouTube.csv;2017-03-10 06:42;73;584;"Which squad nailed the story on the latest episode of #SquadWarsShow ?"
TweetsData/YouTube.csv;2017-03-10 06:14;4;56;"That doesn’t even LOOK real."
TweetsData/YouTube.csv;2017-03-10 06:13;3;24;"GO GO Andre Meadows"
TweetsData/YouTube.csv;2017-03-10 06:12;34;494;"Perfection."
TweetsData/YouTube.csv;2017-03-10 06:11;5;86;"yes please"
TweetsData/YouTube.csv;2017-03-10 06:00;95;849;"*Tame Impala voice* It feels like we only go backwards … https:// goo.gl/RUQ7dV pic.twitter.com/7vQyCkGB98"
TweetsData/YouTube.csv;2017-03-10 04:40;139;954;"It’s time to trust my instincts Close my eyes, and LEEEEEEAAAP https:// goo.gl/0U0kz3 pic.twitter.com/CIhHIRjGzH"
TweetsData/YouTube.csv;2017-03-10 04:07;166;929;"We’ll have what he’s having. ◉‿◉ https:// goo.gl/GaeTOH pic.twitter.com/i8SH0Ip8hu"
TweetsData/YouTube.csv;2017-03-10 03:49;53;613;". @FunhausTeam & @The_Dudesons get their Anchorman on in the new #SquadWarsShow Don’t act like you’re not impressed. https:// goo.gl/AAAf66 pic.twitter.com/XPvp8Jq61u"
TweetsData/YouTube.csv;2017-03-09 07:35;8;49;"#HerVoiceIsMyVoice"
TweetsData/YouTube.csv;2017-03-09 06:42;6;25;"YES. #HerVoiceIsMyVoice"
TweetsData/YouTube.csv;2017-03-09 06:41;8;31;"Living for the livestream #HerVoiceIsMyVoice"
TweetsData/YouTube.csv;2017-03-09 06:41;4;16;"#HerVoiceIsMyVoice"
TweetsData/YouTube.csv;2017-03-09 06:19;170;953;"Take the pledge to #EmbraceAmbition with @ToryBurchFdn ’s crew of tough and powerful women. https:// goo.gl/p3RhHz pic.twitter.com/GPp4ehArD5"
TweetsData/YouTube.csv;2017-03-09 04:57;4;12;"A++++ History Report! #HerVoiceIsMyVoice"
TweetsData/YouTube.csv;2017-03-09 04:56;3;18;"Who's cutting onions?! So much #HerVoiceIsMyVoice"
TweetsData/YouTube.csv;2017-03-09 04:56;4;15;"#HerVoiceIsOurVoice"
TweetsData/YouTube.csv;2017-03-09 04:02;4;11;"Ayyyy. Te amamos! #HerVoiceIsMyVoice"
TweetsData/YouTube.csv;2017-03-09 04:01;3;10;"Amen! #HerVoiceIsMyVoice"
TweetsData/YouTube.csv;2017-03-09 03:59;10;54;"Gracias a TI por ser una inspiración! #HerVoiceIsMyVoice"
TweetsData/YouTube.csv;2017-03-09 03:57;115;866;"Siiiii! Polinesios ay que unirse! #HerVoiceIsMyVoice"
TweetsData/YouTube.csv;2017-03-09 03:15;3;10;"Lipstick robot 4 life. Amazing playlist! #HerVoiceIsMyVoice"
TweetsData/YouTube.csv;2017-03-09 03:15;3;31;"This video's got us all hopped up on girl power. #HerVoiceIsMyVoice"
TweetsData/YouTube.csv;2017-03-09 03:08;3;11;"#HerVoiceIsMyVoice"
TweetsData/YouTube.csv;2017-03-09 02:54;3;11;"Music to live by. Thank you @pegiyoung ! #HerVoiceIsMyVoice"
TweetsData/YouTube.csv;2017-03-09 02:54;3;36;"#HerVoiceIsMyVoice"
TweetsData/YouTube.csv;2017-03-09 02:54;2;9;"Slay. Slay. Slay. #HerVoiceIsMyVoice"
TweetsData/YouTube.csv;2017-03-09 02:53;2;7;"P R E A C H #HerVoiceIsMyVoice"
TweetsData/YouTube.csv;2017-03-09 02:53;0;6;"Annie Easley and her extraodinary legacy! #HerVoiceIsMyVoice"
TweetsData/YouTube.csv;2017-03-09 02:11;459;3043;"Lilly Singh and her #GirlLove crew launch the #BraToss Challenge. Because a little support goes a long way → https:// goo.gl/EA6YcS #IWD pic.twitter.com/XQb68UOY6v"
TweetsData/YouTube.csv;2017-03-09 01:58;4;10;"Who run the world? FEMALE SCIENTISTS! #HerVoiceIsMyVoice"
TweetsData/YouTube.csv;2017-03-09 01:58;5;14;"#HerVoiceIsMyVoice"
TweetsData/YouTube.csv;2017-03-09 01:33;156;759;"Let these certified badasses inspire you on #InternationalWomensDay → https:// goo.gl/ARQEfO #HerVoiceIsMyVoice pic.twitter.com/eaoV8pWYfv"
TweetsData/YouTube.csv;2017-03-09 01:29;3;12;"This playlist has: heart soul feels #HerVoiceIsMyVoice"
TweetsData/YouTube.csv;2017-03-09 01:28;0;7;"Malala is magic #HerVoiceIsMyVoice"
TweetsData/YouTube.csv;2017-03-09 01:27;0;7;"Here's to the OG rebel #HerVoiceIsMyVoice"
TweetsData/YouTube.csv;2017-03-09 00:51;789;2021;"It’s #InternationalWomensDay so give it up for the women around the world who inspire us all. https:// goo.gl/iA7oRW #HerVoiceIsMyVoice pic.twitter.com/Q16VwRBPul"
TweetsData/YouTube.csv;2017-03-08 23:55;3;7;"We love a (historical) collab! #HerVoiceIsMyVoice"
TweetsData/YouTube.csv;2017-03-08 23:54;3;11;"See. You. There. #HerVoiceIsMyVoice"
TweetsData/YouTube.csv;2017-03-08 23:52;2;7;"This playlist is #HerVoiceIsMyVoice"
TweetsData/YouTube.csv;2017-03-08 23:47;2;12;"#HerVoiceIsMyVoice"
TweetsData/YouTube.csv;2017-03-08 23:39;436;1156;"Kicking off #InternationalWomensDay with a shout-out to women and girls who get things done. pic.twitter.com/QYwa6BHdBI"
TweetsData/YouTube.csv;2017-03-08 09:43;3;19;"Raise up that voice! #HerVoiceIsMyVoice"
TweetsData/YouTube.csv;2017-03-08 09:43;0;14;"#HerVoiceIsMyVoice"
TweetsData/YouTube.csv;2017-03-08 08:02;19;232;"Always and forever #HerVoiceIsMyVoice"
TweetsData/YouTube.csv;2017-03-08 08:01;2;11;"So inspiring. Thank you for sharing! #HerVoiceIsMyVoice"
TweetsData/YouTube.csv;2017-03-08 06:52;350;1457;"@IISuperwomanII goes hard for #GirlLove . https:// goo.gl/nkvH5S #IWD #HerVoiceIsMyVoice pic.twitter.com/ODyGv25xI3"
TweetsData/YouTube.csv;2017-03-08 05:29;1;14;"Looooove"
TweetsData/YouTube.csv;2017-03-08 05:29;4;16;"Oh oh oh oh oh oh oh oh Oh oh oh oh oh oh oh oh Oh oh oh oh oh oh oh oh You're gonna hear (us) roar! #HerVoiceIsMyVoice"
TweetsData/YouTube.csv;2017-03-08 05:28;2;9;"We can feel the love washing over us #HerVoiceIsMyVoice"
TweetsData/YouTube.csv;2017-03-08 05:10;307;1347;"You are not alone. A collection of videos from women opening up about mental health issues → https:// goo.gl/gyuH0U #HerVoiceIsMyVoice pic.twitter.com/9Ac0W9spWW"
TweetsData/YouTube.csv;2017-03-08 03:53;163;721;"preach https:// goo.gl/iA7oRW #HerVoiceIsMyVoice pic.twitter.com/E3egdmdYzt"
TweetsData/YouTube.csv;2017-03-08 03:09;4;12;"Hi mum #HerVoiceIsMyVoice"
TweetsData/YouTube.csv;2017-03-08 03:08;0;5;"#HerVoiceIsMyVoice"
TweetsData/YouTube.csv;2017-03-08 03:06;2;6;"This video is everything! #HerVoiceIsMyVoice"
TweetsData/YouTube.csv;2017-03-08 03:06;2;6;"Powerful video and playlist. Thanks for sharing! #HerVoiceIsMyVoice"
TweetsData/YouTube.csv;2017-03-08 03:03;2;5;"S A M E #HerVoiceIsMyVoice"
TweetsData/YouTube.csv;2017-03-08 02:55;93;652;"These women and girls kick ass at sports → https:// goo.gl/3Pn8fG #HerVoiceIsMyVoice pic.twitter.com/7FA1H8q2Kr"
TweetsData/YouTube.csv;2017-03-08 02:42;2;6;"keeping this playlist on loop today #HerVoiceIsMyVoice"
TweetsData/YouTube.csv;2017-03-08 02:31;5;9;"Girl power is in the air. #HerVoiceIsMyVoice"
TweetsData/YouTube.csv;2017-03-08 02:30;2;7;"Let us know when you want ALL THE FEELS you just gave us back. #HerVoiceIsMyVoice"
TweetsData/YouTube.csv;2017-03-08 02:30;141;750;"Use #HerVoiceIsMyVoice to share vids of inspiring women and stay tuned for more of our faves. First Up: Power Jamz → https:// goo.gl/T2ZPjb pic.twitter.com/nYCQzaHUmx"
TweetsData/YouTube.csv;2017-03-08 02:29;0;3;"Yesssssss thanks for sharing and spreading the #HerVoiceIsMyVoice"
TweetsData/YouTube.csv;2017-03-08 02:28;5;19;"*crying* #HerVoiceIsMyVoice"
TweetsData/YouTube.csv;2017-03-08 02:16;850;2377;"Let's come together to celebrate women who lead by example and inspire us every day #IWD #HerVoiceIsMyVoice → https:// goo.gl/iA7oRW pic.twitter.com/sbB6XvKQED"
TweetsData/YouTube.csv;2017-03-08 01:51;91;666;"Need these summer vibes right now. @gnash will warm you up with “something” → https:// goo.gl/kuvyyl pic.twitter.com/zYuQKjVsa2"
TweetsData/YouTube.csv;2017-03-08 01:35;72;582;"We don’t know what this is, but it doesn’t feel wrong. @The_xx get nostalgic in #SaySomethingLoving → https:// goo.gl/3nSVd9 pic.twitter.com/HUC6Sv69yW"
TweetsData/YouTube.csv;2017-03-08 01:14;79;591;"Six years of silence. Broken on the “Third of May” by #FleetFoxes → https:// goo.gl/HCP2xA pic.twitter.com/fLs0psp0Pm"
TweetsData/YouTube.csv;2017-03-07 09:15;326;1750;". @HayleyKiyoko sings about unrequited love in #Sleepover → https:// goo.gl/p1lbrj pic.twitter.com/upZ00gask5"
TweetsData/YouTube.csv;2017-03-07 08:30;71;500;"Add the whole top diamond and the bottom row's gold The Secret History of Grillz → https:// goo.gl/uva00m pic.twitter.com/Q2dESxB0qK"
TweetsData/YouTube.csv;2017-03-07 07:45;122;764;"The Hydraulic Press goes for the gold. https:// goo.gl/S8X3K7 pic.twitter.com/fCM7fQBWGv"
TweetsData/YouTube.csv;2017-03-07 06:15;82;748;"Dealing with homework like … @TheNewPornos “High Ticket Attractions” → https:// goo.gl/fPt2VY pic.twitter.com/inyfoekKSI"
TweetsData/YouTube.csv;2017-03-07 05:34;176;945;"#YouTube is returning to #SXSW for 3 days of performances from music's hottest artists. https:// goo.gl/27ZZqB pic.twitter.com/L3EUSURqsc"
TweetsData/YouTube.csv;2017-03-07 05:29;95;816;"SNAKE PEOPLE DON’T READ THIS . . . . . . . . . Why are snakes so creepy? https:// goo.gl/ptr68w pic.twitter.com/Vb6DD2JaNT"
TweetsData/YouTube.csv;2017-03-07 03:51;162;785;"130 MM girls don’t have access to education. Help @ONECampaign visualize this number with your own #GirlsCount vid → https:// goo.gl/ZKCh2Q pic.twitter.com/DGLg71T0WH"
TweetsData/YouTube.csv;2017-03-06 18:05;147;1195;"[LIVE] Head to Tokyo for a live performance from the King of #PPAP , PIKOTARO → https:// goo.gl/M9zVKC pic.twitter.com/lieiK0zpqS"
TweetsData/YouTube.csv;2017-03-06 05:00;185;1308;"Still kawaii, still hardcore. @ladybaby2015 may be missing Ladybeard, but this song still rules → https:// goo.gl/hXr1Ri pic.twitter.com/hcwIxa4A1d"
TweetsData/YouTube.csv;2017-03-05 07:00;1002;3239;"A rush of relaxation to the head. “Hypnotised” by @coldplay → https:// goo.gl/4PJQGQ pic.twitter.com/HOSZWs1SWR"
TweetsData/YouTube.csv;2017-03-05 04:00;145;1189;"The guy from You Suck at Cooking has a robot. That robot sucks even more → https:// goo.gl/X0Qcq3 pic.twitter.com/zzcnvT30NP"
TweetsData/YouTube.csv;2017-03-05 01:00;90;794;"The last time you heard from @OHYESMARIO , he wanted to love you. Now he’s just interested in helping → https:// goo.gl/UZs9kd pic.twitter.com/DWXvbvBs8M"
TweetsData/YouTube.csv;2017-03-04 09:30;106;751;"Does this mean the sword is actually mightier than the pen? https:// goo.gl/mUoOoj pic.twitter.com/uRiFNxQKpG"
TweetsData/YouTube.csv;2017-03-04 08:30;269;1609;"She’s a lady, and don’t you forget it. @meghan_trainor tells it like it is → https:// goo.gl/R0UQz3 pic.twitter.com/fVbU3Sf6MT"
TweetsData/YouTube.csv;2017-03-04 07:30;186;1174;"Ain’t no high enough Ain't no low enough Ain’t no deep enough To beep boop beep boop boop boop https:// goo.gl/xHuAKN pic.twitter.com/SBL7MuJJtr"
TweetsData/YouTube.csv;2017-03-04 06:45;73;619;"We’d body slam someone for you."
TweetsData/YouTube.csv;2017-03-04 06:44;9;44;"“um woooooow.” - Literally us watching this."
TweetsData/YouTube.csv;2017-03-04 06:42;618;5066;"What in video modification"
TweetsData/YouTube.csv;2017-03-04 06:40;7;33;"You, mini s AND @iJustine ?! We’re in."
TweetsData/YouTube.csv;2017-03-04 06:30;223;1299;"Feel like a crazy cat lady, just by clicking a link → https:// goo.gl/HTDLLF pic.twitter.com/HWZpLSp15B"
TweetsData/YouTube.csv;2017-03-04 05:34;110;738;"Ever seen The Wizard of Oz & listened to “Dark Side of the Moon” simultaneously? Try this: https:// goo.gl/OYUrZ8 https:// goo.gl/ebsuLn pic.twitter.com/uUzkZedYmm"
TweetsData/YouTube.csv;2017-03-04 04:45;528;2668;"Zoom in on @jiffpom 's nose. https:// goo.gl/DtGcMm pic.twitter.com/MnHHth1bvL"
TweetsData/YouTube.csv;2017-03-04 01:07;434;1779;"OMG, @edsheeran released on YouTube Listen to the whole album now → https:// goo.gl/0bQjzX #DIVIDE pic.twitter.com/7yceBdtUn6"
TweetsData/YouTube.csv;2017-03-03 10:18;139;918;"You might believe what happens next. https:// goo.gl/KYv6Qr pic.twitter.com/DwUwDmjhsq"
TweetsData/YouTube.csv;2017-03-03 09:16;195;1378;"same https:// goo.gl/ryt3hN pic.twitter.com/sCsl4RJAQb"
TweetsData/YouTube.csv;2017-03-03 08:16;333;1153;"Dance and the world dances with you. @BrunoMars gets funky in #TWILVIDEO → https:// goo.gl/xglfom pic.twitter.com/KrIZlPEd0i"
TweetsData/YouTube.csv;2017-03-03 07:53;24;428;"Sorry but we gotta go with Alfie here."
TweetsData/YouTube.csv;2017-03-03 07:52;3;35;"If only we could actually do that while we slept."
TweetsData/YouTube.csv;2017-03-03 07:52;4;65;"That’s the perfect way to describe this video."
TweetsData/YouTube.csv;2017-03-03 07:52;8;191;"We LOVE this. What a perfect way to celebrate."
TweetsData/YouTube.csv;2017-03-03 07:35;153;808;"Who do you think should take home the Try-Phy this week on #SquadWarsShow ?"
TweetsData/YouTube.csv;2017-03-03 07:15;86;623;"Sick of shoveling snow? There’s an app (and a robot) for that → https:// goo.gl/T2Vxsm pic.twitter.com/TJMcpshYaO"
TweetsData/YouTube.csv;2017-03-03 06:43;81;876;"Can’t wait for the trailer to drop. https:// twitter.com/TheRock/status /837420663803523073 …"
TweetsData/YouTube.csv;2017-03-03 06:40;235;943;"The wait is over. You now have the #GreenLight to enjoy a new @lorde single → https:// goo.gl/LzzMFy pic.twitter.com/08jLp3pq1d"
TweetsData/YouTube.csv;2017-03-03 06:12;71;542;"“Ran” by @futureislands → https:// goo.gl/IZPDtA pic.twitter.com/zSZcESFAbY"
TweetsData/YouTube.csv;2017-03-03 05:30;82;627;"Shades of Keanu. #WHOA @officialjaden blows your mind with shocking facts → https:// goo.gl/P5SdEm pic.twitter.com/FkKFbpO91E"
TweetsData/YouTube.csv;2017-03-03 05:11;70;551;"Have you ever hung out with cool people? It ROCKS → https:// goo.gl/AvVSB1 pic.twitter.com/xNVqQAwAqN"
TweetsData/YouTube.csv;2017-03-03 04:45;152;798;"LET'S GET READY TO RUMBLE You don't want to miss #SquadWarsShow 's insane wrestling challenge → https:// goo.gl/bjmx63 pic.twitter.com/zAFXdEoEDt"
TweetsData/YouTube.csv;2017-03-03 04:08;55;554;"<( what’s up dude ) <( nm just talking to myself ) @SoGallant → https:// goo.gl/TEW7T7 pic.twitter.com/eypJvtTiPh"
TweetsData/YouTube.csv;2017-03-03 03:21;340;1482;"Two wrestlers read “Green Eggs and Ham” for #WorldBookDay . It’s what Dr. Seuss would have wanted → https:// goo.gl/aNmWsq pic.twitter.com/SmdzNkL8vJ"
TweetsData/YouTube.csv;2017-03-03 02:57;87;661;". @passengermusic drops an epic mashup of #LetHerGo covers to thank fans for getting him into the Billion Views Club→ https:// goo.gl/3Ar0Kc pic.twitter.com/tk10CpvKaU"
TweetsData/YouTube.csv;2017-03-02 09:00;250;1866;"Grand Central train ticket: $2.75 Advice from @EmmaWatson : $2 Her cheese advice: Priceless https:// goo.gl/uuzLfg pic.twitter.com/nlLFIaRpS2"
TweetsData/YouTube.csv;2017-03-02 08:30;95;708;". @SylvanEsso ’s plans: 1. Steal a car 2. Drive to the desert 3. #DieYoung https:// goo.gl/ICCIxb pic.twitter.com/iC6DKBnC1S"
TweetsData/YouTube.csv;2017-03-02 08:23;146;886;"A man of many talents ... and vocal styles @edsheeran dabbles in spoken-word on his new song #ERASER Only on YT→ https:// goo.gl/eIPgGJ pic.twitter.com/8KVXLbZlqk"
TweetsData/YouTube.csv;2017-03-02 08:00;117;712;"When you play the game of zorbs, you win or you die. King of the Mountain with @devinsupertramp → https:// goo.gl/Z9tLx7 pic.twitter.com/TSPFoCqLWF"
TweetsData/YouTube.csv;2017-03-02 07:30;240;965;"Autobots … roll out. https:// goo.gl/m5ND5z pic.twitter.com/1Gz6KPBK0w"
TweetsData/YouTube.csv;2017-03-02 07:05;64;556;"Put this on at your next house party and get ready for FUN Fun Fun Fun FUN! https:// goo.gl/yChkGZ pic.twitter.com/OabyniNd31"
TweetsData/YouTube.csv;2017-03-02 06:42;16;185;"We approve."
TweetsData/YouTube.csv;2017-03-02 06:41;5;40;"That YouTuber Life section"
TweetsData/YouTube.csv;2017-03-02 06:40;3;20;"This shot is so great."
TweetsData/YouTube.csv;2017-03-02 06:39;12;223;"Us watching the camera on top of the car:"
TweetsData/YouTube.csv;2017-03-02 06:38;15;342;"Just trying to help you out, Hank."
TweetsData/YouTube.csv;2017-03-02 06:15;165;888;"If you’re feeling Lonely, talk to @AugustAlsina → https:// goo.gl/QLdzW8 pic.twitter.com/ZHtjAPfEf5"
TweetsData/YouTube.csv;2017-03-02 05:47;183;1130;"If you love bacon, this video’s gonna be hard to watch. #NationalPigDay → https:// goo.gl/1BVJl2 pic.twitter.com/o6wfTOYSU3"
TweetsData/YouTube.csv;2017-03-02 05:36;108;1104;"What makes you … you? @tweetsauce explains why it's not always easy to say in the finale of #MindfieldShow → https:// goo.gl/CXG0eT pic.twitter.com/6ZaZ4sIEm0"
TweetsData/YouTube.csv;2017-03-02 02:33;2421;3882;"Dear @justinbieber , Have a happy birthday. Love, YouTube https:// goo.gl/qVug6s #HappyBirthdayJustinBieber pic.twitter.com/1XxE1u0hqH"
TweetsData/YouTube.csv;2017-03-02 01:19;61;689;"Thanks to those who joined Thursday’s #SquadWarsShow livestream! ICYMI, watch the whole thing here → http:// goo.gl/c35QF3 pic.twitter.com/wJsxhRM4xY"
TweetsData/YouTube.csv;2017-03-02 00:22;734;2530;". @TheChainsmokers and @coldplay ’s hit collab blasts into history with 9MM views on a lyric video in 24 hours → https:// goo.gl/T4xm2r pic.twitter.com/y5QW8hyEcN"
TweetsData/YouTube.csv;2017-03-01 10:02;124;829;"[LIVE] Coverage of President Donald Trump's 2017 Joint Address To Congress begins now → https:// goo.gl/cjMmN5 pic.twitter.com/qZalTHhmva"
TweetsData/YouTube.csv;2017-03-01 09:00;455;2994;". @thatpoppy is … mysterious fascinating ??? https:// goo.gl/wmg97l pic.twitter.com/ojrWNh81bR"
TweetsData/YouTube.csv;2017-03-01 08:20;130;794;"Is it worth it? Let me work it. I put my thing down, flip it and reverse it. https:// goo.gl/7qSfC2 pic.twitter.com/uq7nEzGxa8"
TweetsData/YouTube.csv;2017-03-01 06:29;1173;3036;"SPOILER ALERT: No missing your favorite shows or live sports again! Introducing YouTube TV. Coming soon to the US → http:// tv.youtube.com pic.twitter.com/Gq7W9vJXbW"
TweetsData/YouTube.csv;2017-03-01 06:14;110;1045;"When your friend keeps talking to themselves and you’re like, mildly concerned → https:// goo.gl/FNrGgT pic.twitter.com/LZ29LHHvG7"
TweetsData/YouTube.csv;2017-03-01 05:51;6;47;"This is so sweet. :’)"
TweetsData/YouTube.csv;2017-03-01 05:49;10;219;"Knew it."
TweetsData/YouTube.csv;2017-03-01 05:49;5;105;""
TweetsData/YouTube.csv;2017-03-01 05:03;76;939;"Inspiring, personal, fun. Meet @TTLYTEALA for this #BlackHistoryMonth spotlight → https:// goo.gl/jJS2oj pic.twitter.com/CNuRddJJWh"
TweetsData/YouTube.csv;2017-03-01 04:07;254;1638;"If you watch this ( https:// goo.gl/fZkIHU ) we’ll hit 1,000,000,010 hours of YouTube today → https:// goo.gl/tG6ahn pic.twitter.com/BFqx0cJnqh"
TweetsData/YouTube.csv;2017-03-01 01:52;139;836;"Playing matchmaker with @ArianaGrande and @1future like → https:// goo.gl/wavIxu pic.twitter.com/O1Ya6SHkWi"
TweetsData/YouTube.csv;2017-02-28 08:30;136;902;"Woo! Let's do this! Excited! Hmm This is hard Umm I don't wanna Argh NOOOO Oh, cool https:// goo.gl/lrOUzX pic.twitter.com/cfBxhUhlO5"
TweetsData/YouTube.csv;2017-02-28 08:00;470;1946;"I have a burrito. I have a kitty. UNH! Burrito-kitty! https:// goo.gl/vMQA70 pic.twitter.com/aBBQxiFlWF"
TweetsData/YouTube.csv;2017-02-28 07:30;128;704;"Heritage meets huge drops. A Tribe Called Red plays pow wow club music → https:// goo.gl/p73QG9 pic.twitter.com/cbyfSrTu4S"
TweetsData/YouTube.csv;2017-02-28 07:00;177;854;"But what if "La La Land" had a scene with Pizza Rat? Welcome to "NY NY Land" → https:// goo.gl/SyypDd pic.twitter.com/PLuKWXtZgs"
TweetsData/YouTube.csv;2017-02-28 06:30;86;787;"INTERSECTIONALITY #BlackHistoryMonth spotlight on LGBTQ creators → https:// goo.gl/IZsw3j pic.twitter.com/z2pSnHNV7X"
TweetsData/YouTube.csv;2017-02-28 05:58;123;769;""I Eat a Picture of Jason Segel Everyday Until He Eats A Picture of Me." Day 11 → https:// goo.gl/xRQgwG pic.twitter.com/BtiF9pd0tA"
TweetsData/YouTube.csv;2017-02-28 04:46;195;1726;"smash that like button if u h8 mondays https:// goo.gl/zZmFVa pic.twitter.com/BW9B3FHYl3"
TweetsData/YouTube.csv;2017-02-27 09:32;70;701;"Watch @TheGigiGorgeous ’ critically acclaimed documentary here → https:// goo.gl/wfY0MK #ThisIsEverythingDoc pic.twitter.com/DWzFd2NeaW"
TweetsData/YouTube.csv;2017-02-27 07:00;70;589;"Are women socialized differently? The women of @AsapSCIENCE explain → https:// goo.gl/ySvA2s pic.twitter.com/3IMc2AOGD5"
TweetsData/YouTube.csv;2017-02-27 05:28;117;691;"A 360° view into the Black American experience for #BlackHistoryMonth → https:// goo.gl/j7K6Ry pic.twitter.com/dwhGSoMWQ2"
TweetsData/YouTube.csv;2017-02-27 05:00;79;665;"Bling on bling on bling on 18 wheels. Japan's Dekotora culture → https:// goo.gl/lNUkOM pic.twitter.com/LEJA1jIp2p"
TweetsData/YouTube.csv;2017-02-27 03:00;85;658;"Heavy is the head that wears the 187-pound turban → https:// goo.gl/a7jaJS pic.twitter.com/J7d3l1PKBY"
TweetsData/YouTube.csv;2017-02-26 08:24;90;804;"Don't you need a little positivity in your life? Check out Positive Black People News, episode 2 → https:// goo.gl/02TXLl pic.twitter.com/m2hd1FPLul"
TweetsData/YouTube.csv;2017-02-26 06:23;249;1464;"Weekend plans. https:// goo.gl/0ciXui pic.twitter.com/9aqRWNNjaS"
TweetsData/YouTube.csv;2017-02-26 05:25;136;1003;"Not all heroes wear capes. Thought leaders you should know. #BlackHistoryMonth → https:// goo.gl/Xfj5ZS pic.twitter.com/mOotqvV77L"
TweetsData/YouTube.csv;2017-02-26 03:15;120;1106;"Raise your hand if you luv hand-made pasta. https:// goo.gl/PTsLdI pic.twitter.com/Qu7hOFoVcl"
TweetsData/YouTube.csv;2017-02-25 09:30;125;950;"Batteries are full of energy. Especially if you explode them with a blowtorch. https:// goo.gl/TmMgxE pic.twitter.com/cKlEJu954L"
TweetsData/YouTube.csv;2017-02-25 07:30;81;636;"o hai there @chescaleigh See her YouTube journey for our #BlackHistoryMonth highlight → https:// goo.gl/WSCgZN pic.twitter.com/n2XcJWxlVG"
