callieabost;2018-05-10 03:28;0;1;"only if you get our hashtag tattooed on you"
callieabost;2018-04-29 02:38;0;1;"Happy birthday!"
callieabost;2018-04-29 00:34;0;1;"!!!https://www.wral.com/suspect-in-custody-after-person-shot-in-downtown-raleigh/17513636/ …"
callieabost;2018-04-27 23:43;1;4;"It’s interesting how most of these streaks occur during the escalation of macro events: 1) April 2017 2) Nov. 2016 (presidential election) 3) June 2015 (Brexit) 4) November 2012 (Hurricane Sandy/presidential election) 5) June 2012 (Euro debt crisis)https://twitter.com/callieabost/status/989889725694664706?s=21 …"
callieabost;2018-04-27 23:31;1;4;"If $ SPX closes down today, it’d be $SPX’s 5th straight down Friday (a streak that’s occurred 5 times since July 2006)."
callieabost;2018-04-21 00:51;0;0;"Thanks for playing https://twitter.com/eddyelfenbein/status/987363655254728704?s=21 …"
callieabost;2018-04-18 23:39;0;3;"“Do one thing every day that scares you”"
callieabost;2018-04-11 22:42;0;0;"I was just thinking yesterday about how badly I wanted @ matt_levine to cover the LIBOR-SOFR migration... https://www.bloomberg.com/amp/view/articles/2018-04-11/banks-will-miss-libor-when-it-s-gone#click=https://t.co/Cr8S5NNfo8 …"
callieabost;2018-04-10 05:12;0;0;"yes they did"
callieabost;2018-04-10 04:32;0;0;""
callieabost;2018-04-10 04:31;1;10;"When was the last time $ SPX dropped 1.5% from its intraday high, but still finished up for the day? Sept. 27, 2011."
callieabost;2018-04-08 23:20;0;3;"Spinach in my teeth but IDC because yo gurl booked a 15-minute PR… https://www.instagram.com/p/BhUHPyrnhHGSDV6oRfwW3ysADKBF8tZJoSB5Jk0/ …"
callieabost;2018-04-06 01:32;2;3;"Curves flattening everywhere!https://twitter.com/sm_sears/status/981868055805472768 …"
callieabost;2018-04-05 03:12;0;0;"nope, not according to BBG data. the opening tick on 8/24/2015 was 1965.15, 0.3% below the prev close (although I obviously remember what happened that day)"
callieabost;2018-04-05 02:59;0;0;"Today’s opening tick was ~1.2% below yesterday’s close (that’s the “gap down” I’m referring to). Obviously it’s a random stat, but interesting"
callieabost;2018-04-05 02:55;2;5;"$ SPX has gapped down 1% or more on the opening tick in 4 days since 2000: 1) 10/24/2008 (-3.5% at close) 2) 2/17/2009 (-4.6% at close) 3) 2/6/2018 (+1.7% at close) 4) 4/4/2018 (TBD)"
callieabost;2018-04-05 02:41;0;0;"I just checked on Bloomberg and that’s correct (or at least according to BBG/Yahoo)"
callieabost;2018-04-04 22:10;0;0;"yep, according to Yahoo Finance data (the best I can get right now)"
callieabost;2018-04-04 22:05;0;4;"$SPX’s opening tick today was 1.2% below its close yesterday, the second time $SPX’s opening tick was more than 1% below the previous close since Feb. 2009"
callieabost;2018-04-03 06:21;0;0;"*streak (Autocorrect claims another victim)https://twitter.com/callieabost/status/980899466227175424 …"
callieabost;2018-04-03 04:15;0;4;"SAVE US RAMP"
callieabost;2018-04-03 04:07;10;13;"$ SPX broke its 643-day streak of closing above the 200-DMA today. That was the second-longest such stream of resilience since at least 2000."
callieabost;2018-04-03 03:43;11;18;"$ SPX is poised to close below its 200-day moving average for the first time since Brexit (breaking a 643-day streak above the trend line)"
callieabost;2018-03-31 08:12;0;1;"I don’t think so!"
callieabost;2018-03-31 02:25;0;0;"booger yellow"
callieabost;2018-03-30 20:32;0;1;"pic.twitter.com/fXkRFAHcIt"
callieabost;2018-03-30 20:31;0;7;"My car has that distinctive yellow tint to it. You know what that means.pic.twitter.com/eNwrkTj9I8"
callieabost;2018-03-28 04:42;8;8;"Most volatile four days in $ SPX since Oct. 2011 if you’re looking at the smallest absolute move over a 4-day period (or 1.73% for the last 4 days)"
callieabost;2018-03-27 05:15;1;12;"$ SPX has risen more than 2.5% in a single day 31 times in the current bull market. Only 5 of those gains (including today’s) happened when $ SPX wasn’t in correction territory (or more than 10% below a 12-month high)"
callieabost;2018-03-26 19:30;0;1;"oooo thank you, I’ll read later"
callieabost;2018-03-26 07:31;0;6;"Rock CHALK (BROUGHTON) HAWK (Devonte Graham is from Raleigh)"
callieabost;2018-03-26 07:30;0;1;"yep. just too bad."
callieabost;2018-03-24 03:53;0;1;"dunno why he’s allowed to take vacation when we need him the most"
callieabost;2018-03-24 03:36;1;7;"$ SPX is poised for its second drop larger than 1% on a Friday since Brexit. cc: @ RampCapitalLLC"
callieabost;2018-03-23 23:28;0;1;"long $ XIV"
callieabost;2018-03-23 23:24;0;1;"yeah, I’m with you in that it’s prob a function of multiple factors, but I think repatriation is playing a big role"
callieabost;2018-03-23 23:18;0;2;"How big of a story is this? Serious q, I’m not sure what to thinkhttps://twitter.com/callieabost/status/975838324282753024 …"
callieabost;2018-03-23 05:30;2;6;"Year-to-date, the Dow has moved an average of 0.93% daily, 12 bps higher than the S&P 500’s average daily move of 0.81%. Got to love those high-beta stocks"
callieabost;2018-03-20 04:56;2;6;"As of Friday, the spread between 1-month and 3-month LIBOR was the widest since May 2009."
callieabost;2018-03-19 06:52;0;3;"SORRY FRIENDS WE MADE IT WORSE"
callieabost;2018-03-19 06:17;0;9;"Matt and I are going somewhere else to watch the second half, so hopefully we can break this jinx on the Heels. # goheels"
callieabost;2018-03-17 11:40;1;8;"You win some, you Hoos some."
callieabost;2018-03-17 11:32;0;5;"UMBC should send in the scrubs to twist the knife further."
callieabost;2018-03-17 11:12;0;5;"Me: UVA will never win a national championship with their style of play. Also me: PICK UVA TO WIN IT ALL.pic.twitter.com/vfQWYSFL4n"
callieabost;2018-03-17 11:00;0;1;"I’m with you Mike!"
callieabost;2018-03-17 09:45;0;2;"I bet he could feel the chippy-ness from those seats"
callieabost;2018-03-17 08:58;0;1;""
callieabost;2018-03-17 06:35;0;0;""
callieabost;2018-03-17 05:18;0;2;"sorry, I meant: “You win some, you Duke some.”"
callieabost;2018-03-17 05:17;33;163;"You win some, you Lipscomb. # goheels"
callieabost;2018-03-17 04:57;0;0;"SHEA RUSH DUNK ALERT # goheels"
callieabost;2018-03-16 21:46;0;0;"oh now THAT is silly"
callieabost;2018-03-16 21:43;0;0;"*equally silly IMO"
callieabost;2018-03-16 21:40;0;3;"Technical analysis on Bitcoin prices? That’s just silly.https://www.bloomberg.com/news/articles/2018-03-16/bitcoin-s-death-cross-looms-as-strategist-eyes-2-800-level …"
callieabost;2018-03-15 22:27;2;4;"$ SPX has fallen below its opening tick intraday for 59 straight days, the second-longest streak since 1988 (according to my intraday data)"
callieabost;2018-03-14 20:46;0;1;"of course"
callieabost;2018-03-12 06:35;0;1;"ALSO NO KANSAS YASSSSSSSS # goheels"
callieabost;2018-03-12 06:34;1;3;"OMG Duke got a TOUGH bracket."
callieabost;2018-03-12 06:15;0;4;"I think this is the year of picking my bracket based on the mascots."
callieabost;2018-03-11 11:26;0;0;"they’re a tough match-up for us, they’re really good and Tony Bennett deserves it"
callieabost;2018-03-11 11:22;1;3;"If we have to lose to somebody, I’m happiest losing to Virginia. # goheels"
callieabost;2018-03-11 09:31;0;2;"haha thanks Bear! not expecting us to win, but good game"
callieabost;2018-03-10 12:51;0;3;"WE WANT THE #2 SEED IN CHARLOTTE (AND UVA, WE’LL TAKE UVA TOO) # goheels"
callieabost;2018-03-10 12:45;0;2;"I DON’T THINK MY HEART CAN HANDLE OVERTIME GUYS"
callieabost;2018-03-10 10:53;1;35;"CAM3RON, JO3L AND K3NNY # goheels"
callieabost;2018-03-10 05:54;1;3;"Tweeps, you’ve once again earned those drinks. Best Friday for $ SPX today since Feb. 2016.https://twitter.com/callieabost/status/967143368844333056 …"
callieabost;2018-03-09 12:31;0;4;"Theo to Duke right nowpic.twitter.com/POid20kdT5"
callieabost;2018-03-09 12:19;0;0;"(because Theo)"
callieabost;2018-03-09 12:18;1;2;"RIP BROOKLYN, TIME OF DEATH: 11:17 P.M. # goheels"
callieabost;2018-03-09 11:01;0;1;"if only. that'd make more sense than what we've done so far"
callieabost;2018-03-09 11:01;0;0;"my feelings exactly"
callieabost;2018-03-09 10:39;0;3;"7 minutes and 5 seconds before our first basket. That's gotta be a record. # goheels"
callieabost;2018-03-06 04:57;0;3;"!!! https://twitter.com/nickatfp/status/970668467023237125 …"
callieabost;2018-03-05 22:49;0;5;"The last time $ SPX posted a five-day losing streak was 11/4/2016 (or you know, in the days leading up to the presidential election)"
callieabost;2018-03-04 11:23;0;0;"George."
callieabost;2018-03-04 11:13;0;3;"Seriously can’t believe a Duke player fouled out in Cameron."
callieabost;2018-03-04 10:35;0;0;"oh yeah, every time he pulls back to shoot I’m like NO THEO"
callieabost;2018-03-04 10:33;0;1;"CAM33333333RON # goheels"
callieabost;2018-03-04 10:32;0;0;"...but I love Theo"
callieabost;2018-03-04 10:31;0;1;"Theo just makes me feel all the feels # goheels"
callieabost;2018-03-04 06:43;0;5;"When bae is a crazy Tar Heel like you are # goheels # GTHD… https://www.instagram.com/p/Bf4NTnbHbtm7SvBLM2zPTduD5tegYoqL82gaP40/ …"
callieabost;2018-03-04 03:38;1;8;"NBD, just sitting here in tears watching Joel and Theo’s senior speeches...how’s your # BeatDuke day going?"
callieabost;2018-03-02 23:08;6;7;"$ SPX has dropped >1% for four straight days in three instances since 2002: 8/25/2015, 3/2/2009 and 10/10/2008"
callieabost;2018-03-02 21:56;0;1;"YES! I just drove through there 10 mins ago. it’s insane"
callieabost;2018-03-02 02:56;0;1;"*three"
callieabost;2018-03-02 02:56;0;0;"wow, thanks for sharing"
callieabost;2018-03-02 02:48;1;1;"which time?"
callieabost;2018-03-02 02:43;5;7;"Also, $ SPX has posted theee straight declines >1% only four times in the current bull market (1/8/2016, 8/25/2015, 10/13/2014, 1/22/10)https://twitter.com/callieabost/status/969268485196009474 …"
callieabost;2018-03-02 01:49;2;5;"The last time $ SPX declined more than 0.5% on three consecutive days was Jan. 2016 (more than two years ago). # BTFD"
callieabost;2018-02-28 12:03;0;3;"HAVING VILLANOVA FLASHBACKS NOW UGH"
callieabost;2018-02-28 11:44;0;1;"S3NIOR NIGHT IN THE D3AN DOM3 # goh33ls # nothingfin3r"
callieabost;2018-02-28 05:29;0;1;"Unsurprisingly, we have none so far this month (but $ SPX did endure a correction)https://twitter.com/callieabost/status/968598524119134210 …"
callieabost;2018-02-28 05:27;1;4;"Wow — I’m a month late on this, but $ SPX closed at 14 record highs in January (or 2/3 of all trading days), the most records in a month since at least 1960."
callieabost;2018-02-28 04:34;0;0;"and that’s a bubble"
callieabost;2018-02-28 03:26;0;0;"where’s the ultra-short ETF version of this market"
callieabost;2018-02-24 23:12;0;3;"Steve! So sad to hear this — good luck in your next step!"
callieabost;2018-02-24 05:05;4;7;"Tweeps, get thee to happy hour, because $ SPX just posted its biggest gain on a Friday since March 2016."
callieabost;2018-02-22 09:50;0;1;"Welp. # goheels"
callieabost;2018-02-22 09:12;0;1;"you are not. this feed is hot garbage"
callieabost;2018-02-22 08:41;0;2;"A RARE TH3O! # goheels"
callieabost;2018-02-18 11:10;0;0;"Watching UNC play Louisville really makes me really want @ PapaJohns # goheels"
callieabost;2018-02-18 10:48;0;1;"# goheels"
callieabost;2018-02-15 22:35;0;0;"hahaha ah that’s awesome"
callieabost;2018-02-15 22:31;0;0;"you can still access it? I got kicked off the UNC server a year after graduation"
callieabost;2018-02-15 22:26;0;4;"Your girl just changed the email address on her Twitter account from her http://unc.edu email. So yeah, good morning. # tbt # goheels"
callieabost;2018-02-14 22:37;1;8;"Roses are red Traders are blue Inflation is back So long vol, short spoos *not reflective of my own stocks position"
callieabost;2018-02-13 22:29;1;4;"$ SPX climbed 1% in back-to-back trading sessions (through yesterday) for the first time since the post-Brexit recovery in June 2016."
callieabost;2018-02-13 09:51;12;63;"ME WHEN BLUE STEEL STUFFS A SHOT # goheelspic.twitter.com/GI4ARiQ44f"
callieabost;2018-02-13 09:48;0;0;"fingers crossed this is our last game against ND this season"
callieabost;2018-02-13 09:39;0;1;"Notre Dame is just one of those teams that will always give us inexplicable fits. # goheels"
callieabost;2018-02-13 08:36;0;0;"K333NNY # goheels"
callieabost;2018-02-13 05:04;3;9;"The Dow’s intraday range has been >1% for nine straight days through today. In 2017, the Dow posted that wide of an intraday range in seven days *total*."
callieabost;2018-02-13 04:21;0;0;"his blankie says otherwise"
callieabost;2018-02-13 04:20;0;1;"He’s more of an SPX put man"
callieabost;2018-02-13 04:17;0;24;"Jackson (my nephew) is bearish.pic.twitter.com/cGQG6Tn0l7"
callieabost;2018-02-10 05:06;0;0;"praying for you Luke"
callieabost;2018-02-10 05:04;1;8;"Before this week, the Dow has risen at least 2% and fallen at least 2% in 22 trading sessions since 1985 (and most were in 2008). That happened in two session *this week*."
callieabost;2018-02-10 01:38;0;1;"k noted, grabbing my hat"
callieabost;2018-02-10 01:21;4;16;"Are we breaking out our Dow hats for 1K milestones on the market’s way down?"
callieabost;2018-02-09 11:57;0;7;"That was pure, raw effort right there. Proud of Roy’s boys. # goheels"
callieabost;2018-02-09 11:30;0;0;"we did it for the market, George"
callieabost;2018-02-09 11:13;0;16;"IN HERE # goheelspic.twitter.com/nkbYDxETJ5"
callieabost;2018-02-09 05:10;1;5;"Oh also congrats on the first stock-market correction since 2015, Finance Twitter."
callieabost;2018-02-09 05:07;0;1;"Pretty crazy to think that even after a few rough days, stocks are still trading at levels we last saw at Thanksgiving."
callieabost;2018-02-08 21:38;3;6;"Crazy chart — AUM in levered ETPs dropped from ~$4.5B to ~$1B (per SocGen estimates) this week after the short vol implosion https://www.bloomberg.com/amp/news/articles/2018-02-07/vix-may-form-mother-of-all-inverted-vs-as-positioning-calms …pic.twitter.com/PnnzGRV4ie"
callieabost;2018-02-08 20:20;5;18;"Waking up on # BeatDuke day likepic.twitter.com/yHFDht0OZm"
callieabost;2018-02-07 05:53;0;3;"%age-wise, the up/down intraday moves (2.5% up, 2.3% down from previous close) in the Dow were the widest since 12/5/2008 (FWIW)"
callieabost;2018-02-07 04:38;18;43;"Wow — the Dow has both risen at least 2% and fallen at least 2% from the previous close in trading today, the first time that’s happened since 12/5/2008."
callieabost;2018-02-06 23:04;0;0;"FASTEN YOUR SEATBELT LUKE"
callieabost;2018-02-06 23:04;0;5;"The last time the Dow’s intraday low was 2% below its previous close AND its intraday high was 1% above the previous close was Oct. 4, 2011. ...and we’re only 30 minutes into the trading session."
callieabost;2018-02-06 22:25;0;2;"Haha. Moral of the story is know what you’re trading."
callieabost;2018-02-06 22:10;0;12;"Please tell me more about how you made so much money “trading the VIX”. PLEASE."
callieabost;2018-02-06 21:53;0;3;"Wow — Credit Suisse is considering redeeming $ XIV (one of the most popular $ VIX ETNs over the past few years)https://www.bloomberg.com/news/articles/2018-02-06/credit-suisse-is-said-to-consider-redemption-of-volatility-note …"
callieabost;2018-02-06 07:19;0;1;"declines, drops, decreases, retreats, slumps...there are so many we used"
callieabost;2018-02-06 05:11;0;4;"Makes me nostalgic of my Bloomberg days, when we had to get creative on market verbs to avoid word echoeshttps://twitter.com/marketblondes/status/960620976030601216 …"
callieabost;2018-02-06 04:51;0;1;"lol"
callieabost;2018-02-06 04:41;11;27;"The $ VIX is up 16.71 points today, poised for its largest one-day increase on record. Think the market was a little one-sided there."
callieabost;2018-02-06 04:21;4;25;"Friends don’t let friends quote Dow moves in points."
callieabost;2018-02-05 11:18;0;5;"SOMEBODY CRYING JORDAN BRADY PLEASE"
callieabost;2018-02-05 11:10;0;9;"FINISH THEM"
callieabost;2018-02-04 03:35;1;6;"Duke is the high-beta stock of college basketball."
callieabost;2018-02-03 05:07;2;8;"After today’s massive selloff, the $ SPX closed at levels not seen since three weeks ago."
callieabost;2018-02-01 04:30;0;3;"soooooo busy Helene! trying to be more present on here now that we have some market vol"
callieabost;2018-02-01 04:29;0;4;"$ SPX is poised for a 1.9% drop over the past three days, the worst such drawdown in the index since Sept. 2016."
callieabost;2018-01-31 23:05;0;1;"Wow (from yesterday).https://twitter.com/bespokeinvest/status/958446363926237186 …"
callieabost;2018-01-28 03:05;0;6;"Rebuilding year, rebuilding year, rebuilding year *breathes into paper bag* # goheels"
callieabost;2018-01-28 02:57;0;4;"Ugh."
callieabost;2018-01-26 03:07;0;4;"No YOU are having such a bad day that you just blared “Who Let the Dogs Out” while you cried in your car."
callieabost;2018-01-26 00:50;0;0;"3"
callieabost;2018-01-24 20:29;0;0;"The general rule-of-thumb is 300 hours though"
callieabost;2018-01-24 20:28;0;0;"Thanks! I don’t have a business degree (I graduated w/ a journalism degree) so I studied a solid 8 months (~400 hours)"
callieabost;2018-01-24 00:59;0;1;"ah good luck! so close"
callieabost;2018-01-24 00:59;0;0;"thanks Greg!"
callieabost;2018-01-23 23:31;0;0;"thanks David!"
callieabost;2018-01-23 23:23;0;0;"THANK YOU! hahaha that’s a brave effort (to be a grader)"
callieabost;2018-01-23 22:56;0;1;"THANK YOU! Yeah — luckily not tackling L2 until June 2019. Just saw your bio too — congrats on becoming a charterholder!"
callieabost;2018-01-23 22:49;0;32;"<—— in the 43% (!!!) # WEWANTLEVEL2https://twitter.com/cfainstitute/status/955809868610379777 …"
callieabost;2018-01-23 09:45;1;8;"Yep, living and dying by the 3. Tonight, we are dying. # goheels"
callieabost;2018-01-23 09:05;0;1;"So our perimeter D is extra bad tonight."
callieabost;2018-01-23 08:11;0;0;"Luk3 on pace for 67 points tonight. # goheels"
callieabost;2018-01-21 10:33;0;0;"I’d be pretty frustrated too. It’s getting a little out of hand."
callieabost;2018-01-21 09:48;0;0;"you guys hang banners for that, right?"
callieabost;2018-01-21 09:19;1;6;"Now definitely a lock for their third straight Preseason National Championship.https://twitter.com/sethdavishoops/status/954885231626149889 …"
callieabost;2018-01-21 04:13;0;1;"FIERCE (JALEK) FELTON # goheels"
callieabost;2018-01-19 11:53;0;3;"Didn’t get on any flights to RDU and no rental cars left, but a gracious couple offered to drive M and me to Raleighhttps://twitter.com/callieabost/status/954131213656223745 …"
callieabost;2018-01-19 08:40;0;1;"thank you!"
callieabost;2018-01-19 07:34;0;0;"hopefully renting a 4-WD"
callieabost;2018-01-19 07:25;0;0;"oh maaaaaaan. thanks George. tryna get out of the CLT airport tonight"
callieabost;2018-01-19 07:19;0;1;"Twitter friends: how bad is the interstate from Charlotte to Raleigh right now? Too dangerous to drive on?"
callieabost;2018-01-18 04:35;0;1;"truuuuuuue"
callieabost;2018-01-18 04:32;0;0;"OMG. I was friends with him before he was famous!"
callieabost;2018-01-18 02:01;0;2;"Also in Miami! (at the Clevelander?)pic.twitter.com/HoevL1bgep"
callieabost;2018-01-18 01:28;0;5;"Snow in Raleigh, but best beach day of the week in Miami. Funny how that worked out."
callieabost;2018-01-17 10:56;0;0;"and they haven’t had much of a better chance than they had tonight"
callieabost;2018-01-17 10:13;0;4;"or Clemson’s record *all-time* in CH because I’m a dummy and the Dean Dome hasn’t been around that longhttps://twitter.com/callieabost/status/953449078406504448 …"
callieabost;2018-01-17 10:09;0;2;"LLLLLLLLLLLLLLLLLLLLLLLLLLLLLLLLLLLLLLLLLLLLLLLLLLLLLLLLLLL ...aka Clemson’s record in the Dean Dome since 1926 (0-59)"
callieabost;2018-01-17 09:40;0;1;"AND SOMEHOW TAKE THE D OUT OF CAROLINAhttps://twitter.com/callieabost/status/953436452897132544 …"
callieabost;2018-01-17 09:34;0;1;"BEAR"
callieabost;2018-01-17 09:26;0;2;"B3RRY IN TH3 BUILDING # goheels"
callieabost;2018-01-17 09:24;0;1;"Twitter machine says CAM3RON"
callieabost;2018-01-17 09:23;0;1;"Doesn’t feel like we’re winning by 12."
callieabost;2018-01-17 09:18;0;4;"I need a way to incorporate 3 into Cam’s name now. # goheels"
callieabost;2018-01-16 09:27;0;2;"“Sweet dreams are made of these. Sounds like a Jeopardy question” — @ mlcc1991"
callieabost;2018-01-16 00:44;0;0;"Took his talents to South Beach @Miami Beach, Florida https://www.instagram.com/p/Bd-i5t9H8asmgv46oiShV7orWR34v-ERqpevqQ0/ …"
callieabost;2018-01-14 09:13;0;0;"*puts down the paper bag* LET’S GO HEELS # heartattack"
callieabost;2018-01-14 00:42;0;5;"Thankful that trips to RDU now mean I’m flying somewhere with him (and not away from him).pic.twitter.com/5mcoc3a8pS – bei Raleigh-Durham International Airport (RDU)"
callieabost;2018-01-14 00:38;0;3;"So sorry to hear that. Condolences to you and the rest of the family."
callieabost;2018-01-10 10:50;0;7;""Luke Maye was a walk-on!" DRINK."
callieabost;2018-01-10 09:06;0;0;"OMG SMALL BALL TIME # goheels"
callieabost;2018-01-09 10:55;0;2;"HUNKER DOWN, HAIRY DAWGS"
callieabost;2018-01-07 11:13;0;0;"He’s a great coach."
callieabost;2018-01-07 03:55;0;2;"<—— trusting in Roy. # goheels"
callieabost;2018-01-06 05:12;2;3;"$ SPX just capped 4 straight days of gains to kick off 2018. This last happened in 2010 (then 2006), two years with >10% annual gains"
callieabost;2018-01-05 05:03;0;2;"$ SPX trying for a 4-day winning streak tmrw to kick off the year, which has happened twice since 1990 (2006 & 2010)https://twitter.com/callieabost/status/948938964416843777 …"
callieabost;2018-01-04 23:27;1;6;"$ SPX has gained the first 3 days of a year in 4 years since 1990: 2012, 2010, 2006 and 2002. (and we’re poised to see that again this year)"
callieabost;2018-01-04 11:50;0;2;"UGH SAME I wanna sleep in, but no word yet on if my office is closed"
callieabost;2018-01-04 11:48;0;1;"that’s about what we have now!pic.twitter.com/OUwePsVt97"
callieabost;2018-01-04 11:45;0;0;"that’s so much snow! there’s a light dusting in DTR"
callieabost;2018-01-04 10:53;0;0;"!!! are you in Raleigh?"
callieabost;2018-01-04 10:03;0;1;"Sure, we’ll probably lose here. But who’s the real winner? TV TEDDY."
callieabost;2018-01-04 09:57;0;1;"B3333333333RRY # goheels"
callieabost;2018-01-04 09:38;0;1;"hahahaha...UNC basketball coach likes trying out new lineups in pivotal games sometime"
callieabost;2018-01-04 09:36;0;8;"OKAY ROY NO MORE LINEUP BINGO PLEASE"
callieabost;2018-01-04 09:29;0;4;"THEO DA GAWD"
callieabost;2018-01-04 08:12;0;1;"ESPN announcer just said Cam Johnson wears #23. ...come on, @ espn"
callieabost;2018-01-02 09:57;0;0;"I have a special place in my heart for UGA."
callieabost;2018-01-02 09:56;0;0;"Will."
callieabost;2018-01-02 09:52;0;1;"also Tigers (like that was ever a q)"
callieabost;2018-01-02 09:50;0;3;"TONIGHT WE ARE ALL DAWGS"
callieabost;2017-12-31 04:49;0;0;"Yeah...I was freaking a little"
callieabost;2017-12-31 03:14;0;0;"OTOH, I have a feeling the Heels will take us to the brink in most ACC games this season. Take your heart meds, friends."
callieabost;2017-12-31 03:12;0;9;"You come at the king, you best not miss # goheelspic.twitter.com/4b3IxhzuPD"
callieabost;2017-12-30 11:49;0;0;""
callieabost;2017-12-30 10:49;1;7;"2017 was the quietest year quite possibly in the history of the stock market (according to several measures). Who called that a year ago?"
callieabost;2017-12-30 05:12;0;1;"So sorry for your loss, David. Thinking of you and your family."
callieabost;2017-12-28 22:19;0;3;"I can’t feel my face around you (Raleigh)"
callieabost;2017-12-25 05:11;0;0;"CARDIAC CATS # keeppounding"
callieabost;2017-12-25 04:11;0;1;"“Oh look, a new guy! He’s a blondie. Very pretty hair.” — Mama Bost on Bersin # keeppounding"
callieabost;2017-12-24 21:07;0;1;"I’m so sorry :("
callieabost;2017-12-24 03:44;3;15;"Basketball Santa, all I want for Christmas is a Heels team that doesn’t live and die by the 3. I’ve been good this year so..."
callieabost;2017-12-21 23:32;1;4;"$ SPX has closed within 1% of a record high (or at a record) in 197 of 244 trading days this year (or 81% of trading days)."
callieabost;2017-12-21 12:13;0;2;"Woof. (Terriers)"
callieabost;2017-12-21 11:38;0;6;"Basketball Santa, all I want for Christmas is some defense. # goheels"
callieabost;2017-12-21 10:11;0;1;"I SPY CAM JOHNSON # goheels"
callieabost;2017-12-20 08:13;0;4;"M: “Wanna see Star Wars tonight?” Me: “IDK, I was planning on cleaning the bathroom.” *long pause* M:”...IDK if this is gonna work out”"
callieabost;2017-12-18 09:18;0;6;"Anybody wanna start a crowdfunding campaign for the Panthers? # keeppounding"
callieabost;2017-12-18 09:17;0;3;"Today has been a rollercoaster ride in my sports world.https://twitter.com/deadspin/status/942562537685573633 …"
callieabost;2017-12-18 08:18;1;4;"WOW robbery in Pittsburgh!"
callieabost;2017-12-18 06:12;0;2;"Wow, what a win. # goheels"
callieabost;2017-12-18 05:49;0;5;"CARDIAC CATS & HEART-ATTACK HEELS # goheels # keeppounding"
callieabost;2017-12-18 04:53;0;0;"Woof, Heels."
callieabost;2017-12-15 06:57;0;2;"YES.https://twitter.com/johnarnoldfndtn/status/941322428713750529 …"
callieabost;2017-12-15 05:06;0;0;"Also, insider trading."
callieabost;2017-12-15 03:55;0;1;"If it were me, my latest Tweet would be the Fed funds rate."
callieabost;2017-12-15 03:54;0;4;"Somebody should start a Twitter account that tweets out everything that has been mansplained to them."
callieabost;2017-12-15 01:07;0;0;"LOL good one"
callieabost;2017-12-14 23:58;0;0;"Fed: we’ll have another (not O/N, I know)"
callieabost;2017-12-10 06:41;0;2;"totally not making excuses. ahaha"
callieabost;2017-12-10 05:05;0;0;"ACC road games are really tough though..."
callieabost;2017-12-10 03:06;17;87;"Duke: #1 in the nation, #15 in the ACC."
callieabost;2017-12-10 03:05;0;6;"EEEEEEEEEEEEAGLES"
