ErikFossing;2018-05-11 23:56;3;15;"Maybe so for you and (unfortunately) for Hungary. If so, pls build a wall around your country, decline EU massive subsidies - and ask someone to call us when you are gone.https://twitter.com/anneapplebaum/status/994967357796880384 …"
ErikFossing;2018-05-11 20:25;0;3;"Yes, implicitly.... Don’t pretend voters can - or want to - vote for details like budget deficits. That for the elected officials to sort out, and then be held accountable T the next ballot box.https://twitter.com/ferdigiugliano/status/994893303345831936 …"
ErikFossing;2018-05-11 05:34;0;8;"And a great place to work!https://twitter.com/unicredit_pr/status/994443164290347008 …"
ErikFossing;2018-05-10 22:44;1;5;"A piece of beauty indeed. Just gotta hope we don’t get bulldozed by ignorants before the statue gets visible and appreciated.https://twitter.com/ferdigiugliano/status/994584460111896577 …"
ErikFossing;2018-05-09 22:13;0;0;"It was worth a try! - (even though we all know that Trump doesn’t listen, read or think.)https://twitter.com/sbg1/status/993920507979419649 …"
ErikFossing;2018-05-09 21:59;0;1;"That’s the appropriate response!https://twitter.com/micha_bild/status/993803764569137153 …"
ErikFossing;2018-05-09 21:37;0;0;"@ thomasforth work on regional GDP throughout Europe is highly recommended. Great tool - a d very revealing.https://twitter.com/thomasforth/status/994206563354251264 …"
ErikFossing;2018-05-09 15:49;1;15;"The day after Trump (partly swayed by Netanyahu’s tragic-comic attempt at reality TV to “prove” WMD) pulled the US out of the Iran deal, Vienna airport has the good grace of putting El Al and Iran Air at adjacent gates. Well done!pic.twitter.com/LjPNP0wQp5"
ErikFossing;2018-05-08 18:49;0;6;"Exactly. Hence, no compromise in euro structure. And hence no Weidmann.https://twitter.com/federicofubini/status/993749051689480192 …"
ErikFossing;2018-05-08 01:24;0;0;"Good luck to her....https://twitter.com/bill_easterly/status/993519565404561408 …"
ErikFossing;2018-05-08 01:22;0;2;"I would indeed, assuming: 1. The price is right, including appropriate common fiscal and banking and capital markets union. 2. A president Weidmann will align with GC majority. That’s two big conditions, particularly the first one, but a must.https://twitter.com/jfkirkegaard/status/993525653558513664 …"
ErikFossing;2018-05-08 00:11;0;9;"Unlikely Merkel can pay price (of EMU reforms) required to get Weidmann appointed! ..and, come on, “[contrary to other big CBs] ECB, as a multilateral institution, always have to contend with politics”. Powell, Kuroda, Yi Gang appointments not politics?https://piie.com/blogs/realtime-economic-issues-watch/politics-selecting-new-ecb-president-2019 …"
ErikFossing;2018-05-07 23:56;0;0;"Undskyld, @ politiken men det her er simpelthen for uinformeret til at være læseværdigt. Eksemplerne er mangfoldige,men - fx - Tyskland’s FDP som mulig Macron støtte? Laughable.https://politiken.dk/debat/klummer/art6492461/Status-er-at-Macron-fortsat-er-en-enlig-foie-gras-g%C3%A5s.-Der-er-ikke-sket-en-fl%C3%B8jtende-fis.-Hvorfor …"
ErikFossing;2018-05-06 23:06;3;13;"Today’s Sunday Wrap from my colleague, our Chief Italian Economist, Loredana Federico, on her expectations for the Italian political scene - and on latest Italian macro numbers. https://www.research.unicredit.eu/DocsKey/economics_docs_2018_164616.ashx?EXT=pdf&KEY=C814QI31EjqIm_1zIJDBJGQcHI2xgyYmYBBW6Morqgg=&T=1 …"
ErikFossing;2018-05-06 15:55;0;13;"Good Sunday morning from Denmark!pic.twitter.com/1xVZmYu0AV"
ErikFossing;2018-05-04 00:26;0;1;"I have little doubt about that. (And in the final analysis, I’m pretty sure the ECB will too)https://twitter.com/sylviawalter13/status/991977122653786112 …"
ErikFossing;2018-05-03 01:58;0;1;"Not so failing, it seems....https://twitter.com/peteralexander/status/991721466352762880 …"
ErikFossing;2018-05-03 01:51;0;9;"Hmm, I rarely disagree w @ fwred tweets, but here, I think the ECBs challenge post-Draghi is grander than whether inflation is x or y (within the forecasts around), and more about whether it’ll play the needed role in the next crisis (assuming we don’t gethe needed architecture)https://twitter.com/fwred/status/991718900764209152 …"
ErikFossing;2018-05-03 00:03;0;6;"As a consumer, I have always struggled to understand why farmers need to be subsidised.https://twitter.com/philhoganeu/status/991667711292989441 …"
ErikFossing;2018-05-03 00:00;0;2;"He spoke in English - for which, btw, he deserves much more credit than any fuzz about an imprecise transliteration.https://twitter.com/jfkirkegaard/status/991706082388176896 …"
ErikFossing;2018-05-02 23:18;2;0;"Cutting exactly what Germany needs the most now. Problematic, to put it mildly.http://www.handelsblatt.com/politik/deutschland/bundeshaushalt-scholz-drosselt-die-investitionen-bis-2022-deutlich/21232836.html …"
ErikFossing;2018-05-02 22:33;1;3;"Nope, sorry. Check the data; control for import composition, elasticities and anything else you fancy. FX regime and FX moves don’t drive productivity.https://twitter.com/peppefab/status/991679345298165760 …"
ErikFossing;2018-05-02 21:07;0;2;"Love it! I wish other leaders would be equally prepared to speak a foreign language (despite the occasional mishap any non-native speaker all know too well).https://twitter.com/abcsydney/status/991534448830169088 …"
ErikFossing;2018-05-02 21:03;0;3;"I want one of those ... looks wonderfully thin.https://twitter.com/flacqua/status/991578841499013120 …"
ErikFossing;2018-05-01 02:04;0;1;"Not to belittle Amsterdam, but you could find such two pictures 40-50 years apart from every single European city and town.https://twitter.com/alexsteffen/status/990280034647601157 …"
ErikFossing;2018-04-30 17:08;2;8;"Would it be reasonable to demand that all senior EU, incl ECB, officials need to speak at least two languages?https://twitter.com/anderspreben/status/990232719253823488 …"
ErikFossing;2018-04-29 20:48;0;0;"Those “few months” will be intense in terms of Germany trying to dial those measures down, while talking cars with the US. Meanwhile, roadmap on EMU architecture and decision on Greece ....https://twitter.com/tom_nuttall/status/990570534927851521 …"
ErikFossing;2018-04-29 20:22;6;17;"Today’s Sunday Wrap: Why Eurozone growth is better than you think, why US-EU trade frictions will ease, but only if Germany gets help from EU partners to protect its auto industry. That’s burden sharing, but when/how Germany will reciprocate is unknown. https://www.research.unicredit.eu/DocsKey/economics_docs_2018_164532.ashx?EXT=pdf&KEY=C814QI31EjqIm_1zIJDBJBNZkngPAEt1gqhBok4BLJ4=&T=1 …"
ErikFossing;2018-04-29 02:10;0;5;"Good thing they don’t have to worry about complaints from the European Commission or the IMF ..... or maybe such checks and balances might have been helpful in guiding a rampant President and obedient congress?https://twitter.com/brookingsinst/status/990290814180954112 …"
ErikFossing;2018-04-28 17:14;4;12;"No, that’s definitely NOT the question! (unless you can show evidence that the FX regime, FX level, or FX depreciations drive productivity. And good luck w that.)https://twitter.com/aszigetvari/status/990134013208743936 …"
ErikFossing;2018-04-27 20:42;0;1;"Germans providing moral leadership!https://twitter.com/libyaliberty/status/989579459283050496 …"
ErikFossing;2018-04-27 15:37;2;3;"Great piece!https://twitter.com/pisaniferry/status/989745622742790145 …"
ErikFossing;2018-04-26 19:36;0;2;"A very good piece, indeed. I hope it’ll be read, understood and appreciated in all of the euro area capitals.https://voxeu.org/article/deepening-emu-requires-coherent-and-well-sequenced-package …"
ErikFossing;2018-04-26 16:51;0;0;"Lykke, er du ikke “nord-tysker”? Bayern fan?https://twitter.com/lykkefriis/status/989243158260256768 …"
ErikFossing;2018-04-24 23:00;0;2;"I beg to differ. Trying to do the responsible thing for your country, even at the risk of death, is usually called bravery, and should not be confused with suicidal instincts.https://twitter.com/ferdigiugliano/status/988781709331222529 …"
ErikFossing;2018-04-24 22:52;0;1;"Nice. Let’s touch base again at 3.5% - only question is whether we can discuss the ramifications of that while sitting outside, or whether it’ll then already be too hot to be outside.https://twitter.com/ferdigiugliano/status/988776660697780224 …"
ErikFossing;2018-04-24 01:55;11;16;"Let’s put that in today’s media lingo: “Due to the financial and sov debt crises, ECB has had to keep rates lower for longer. As a result, €162bn has been reallocated from those savers who refuse risk on their savings, to the German taxpayer. Very good for German society.”https://twitter.com/fwred/status/988466614889836544 …"
ErikFossing;2018-04-22 20:08;7;11;"Today’s Sunday Wrap by my colleague, our Chief German Economist, Andreas Rees, on the disappointing back-pedalling in Berlin on Eurozone architecture. https://www.research.unicredit.eu/DocsKey/economics_docs_2018_164433.ashx?EXT=pdf&KEY=C814QI31EjqIm_1zIJDBJPrrBUT1UIQKqYHsyT2wr_c=&T=1 …"
ErikFossing;2018-04-21 04:12;0;2;"Ah, it’s you! I walked by half an hour ago, and wondered who it might be...https://twitter.com/shahinvallee/status/987344280430764032 …"
ErikFossing;2018-04-19 20:13;0;3;"The weaker euro helped, but if your exports grow faster than global demand (and global trade) while your domestic demand grows faster than potential, then you’ll have a hard time convincing me that you are not competitive. So how did that come about?https://twitter.com/robinbrooksiif/status/986938714826903552 …"
ErikFossing;2018-04-19 19:35;0;0;"Indeed indeed. Thanks.https://twitter.com/carlobaron/status/986866932887498752 …"
ErikFossing;2018-04-19 06:05;0;0;"Oops.... yes.https://twitter.com/moncaballa/status/986711310896377856 …"
ErikFossing;2018-04-19 04:15;0;3;"Economics 101 at work. Following internal devaluations in the periphery (which took care of the current account deficits), Germany is now embarking on an internal devaluation. Eurozone more robust than you thought!https://twitter.com/jandritzky/status/986679311498391552 …"
ErikFossing;2018-04-18 23:48;0;2;"Excellent piece.https://twitter.com/edwardgluce/status/986612507539398656 …"
ErikFossing;2018-04-18 00:54;0;3;"Intriguing indeed. But if ECB related, then the implication is that QE flows are more important than QE stocks. And if not, he suggests it’s simply a return to trend. But surely, the output gap hasn’t closed yet. So, why?https://twitter.com/pisaniferry/status/986164184764309505 …"
ErikFossing;2018-04-17 19:58;0;0;"An A+ for chose of pictures...https://twitter.com/thehill/status/986211695126294530 …"
ErikFossing;2018-04-17 19:52;0;1;"Ohhh, our favourite topic in the coffee shops... I vote for a woman, and not a French citizen (to keep the option of a Frenchman coming back to the ECB top job next year.) PS I have no vote, in case you wondered https://twitter.com/imateosylago/status/986196039433629696 …"
ErikFossing;2018-04-17 04:21;0;4;"Wow, so you got legal opinions from him without ever paying him. Who do you feel you owe something for that?https://twitter.com/thedailybeast/status/985975515386347524 …"
ErikFossing;2018-04-16 06:04;2;6;"Indeed, as I discussed in my Sunday Wrap today: https://www.research.unicredit.eu/DocsKey/economics_docs_2018_164350.ashx?EXT=pdf&KEY=C814QI31EjqIm_1zIJDBJPh1ynUDKrQlOaj38TdrZYs=&T=1 …https://twitter.com/saraeisen/status/985621936221900800 …"
ErikFossing;2018-04-15 20:02;1;5;"Today’s Sunday Wrap on (1) Trump’s apparent change of heart when it comes to international cooperation - positive news. (2) his disruptive impact on Markets (example from last week), and (3) week ahead: Abe/Trump, IMF meetings, Earnings. https://www.research.unicredit.eu/DocsKey/economics_docs_2018_164350.ashx?EXT=pdf&KEY=C814QI31EjqIm_1zIJDBJPh1ynUDKrQlOaj38TdrZYs=&T=1 …"
ErikFossing;2018-04-15 19:59;0;1;"Excellent piece. Indeed, one of the best “Lunch with the FT” I have read in a long while.https://twitter.com/financialtimes/status/985436328333643777 …"
ErikFossing;2018-04-15 00:31;0;1;"“The Cold War is back — with a vengeance but with a difference” said the U.N. Secr Gen yesterday - I have no illusion that he had been inspired by my claim of “Cold War II”, but I did discuss it in last Sunday’s Wrap.... sec 3 here: https://www.research.unicredit.eu/DocsKey/economics_docs_2018_164262.ashx?EXT=pdf&KEY=C814QI31EjqIm_1zIJDBJP4Wq2Mk9XHPbsibyV-1xLw=&T=1 … https://www.un.org/sg/en/content/sg/statement/2018-04-13/un-secretary-generals-remarks-security-council …"
ErikFossing;2018-04-14 04:47;0;5;"They should raise all the peripheral sovereign ratings by 2-4 notches to correct for their panicked overshoot of downgrades during the crisis - to bring ratings back to be in line with economic fundamentals, according to their own published parameters.https://twitter.com/atalaveraecon/status/984774974232842240 …"
ErikFossing;2018-04-13 02:05;0;1;"Right! Now, as the story goes, one side (north) is pushing, so, in reaction, south is resisting. If so, it seems to me that the accusation of politicising should be aimed at “North” and not those resisting the pressure? (PS I’m in favour of policies to encourage lower NPLs)https://twitter.com/nicolas_veron/status/984476699739017216 …"
ErikFossing;2018-04-13 01:00;0;2;"The politicisation you refer to the claimed German and Northern European push, or the claimed Italian and Southern European resistance? Just wondering.https://twitter.com/nicolas_veron/status/984474159211339776 …"
ErikFossing;2018-04-12 19:56;0;1;"Cool. I don’t like debating with people hiding their identity anyway.https://twitter.com/purpleline/status/984395636035522560 …"
ErikFossing;2018-04-12 19:21;0;2;"Right, but free-riding on your friends doesn’t feel like reasonable strategy for a wealthy guy/country.https://twitter.com/skmacro/status/984347614522101760 …"
ErikFossing;2018-04-12 19:20;0;2;"Forever grateful (and to the US who was probably even more important in terms of saving the world at the time), but also capable of moving forward.https://twitter.com/purpleline/status/984349036391075841 …"
ErikFossing;2018-04-12 16:23;0;3;"There would be no way Denmark could better its friendship with Germany than by committing to Europe, incl join the euro, lift its border controls, and generally stop being a mini-UK of multiple exceptions.https://twitter.com/botschafterdk/status/984344257845760000 …"
ErikFossing;2018-04-12 02:57;3;11;"True, but let’s also be clear about this: The insistence (obsession) with markets as police force for politicians is only heard in core EMU towards periphery. Not the other way around - and in no other country in the world. Why? Because of the lack of fiscal Union.https://twitter.com/angelubide/status/984139693989269506 …"
ErikFossing;2018-04-12 00:52;0;3;"With all respect, is that really a reasonable question (whether policy makers or markets have made more mistakes)? Different roles, different objectives. Apples vs oranges.https://twitter.com/isabel_schnabel/status/984102262682333185 …"
ErikFossing;2018-04-12 00:00;0;3;"Agreed, but the market is a beast prone to well documented periods of complacency, panic and other irrationalities not well suited as signals for ST policy reactions. Take Italian BTPs 2011-12 - crazy panic. Take them now - a bit complacent?https://twitter.com/isabel_schnabel/status/984070873165557763 …"
ErikFossing;2018-04-11 21:03;0;0;"Yeah, I hate the way my used car keeps falling in value... And apparels? More surprising. My apparels surely decline in price, but - somehow - my wife says her apparels keep going up.... (and trust me, the weight of her apparel in our household basket is a heck bigger than mine.)https://twitter.com/saraeisen/status/984051967264739328 …"
ErikFossing;2018-04-11 20:15;4;7;"Too much confusion: it’s not for markets to police policies - and @ LBiniSmaghi is right. When some in Europe think they can rely on markets for this policing role, it’s no more than an escape from the responsibilities of politicians. The role of Markets is to allocate capital!https://twitter.com/keinewunder/status/983992903256158208 …"
ErikFossing;2018-04-11 00:25;0;0;"I’m in. Everyone else should be too....https://twitter.com/carolecadwalla/status/983738651824807937 …"
ErikFossing;2018-04-09 23:27;1;1;"But yet, you argue against Brexit for purely commercial reasons. Is this not the core U.K. problem w the EU? In it for the money, but not for the values? Freudian slip?https://twitter.com/gideonrachman/status/983353461537431552 …"
ErikFossing;2018-04-09 23:18;0;0;"@ gideonrachman introduces new definition for decent democracy: “But something has surely gone wrong in any democratic country that finds itself imprisoning non-violent, elected politicians.” - politicians above the law so long as not violent? Really!https://www.ft.com/content/84b9a32e-3bd9-11e8-b9f9-de94fa33a81e …"
ErikFossing;2018-04-09 19:22;0;0;"1. Don’t know, but frequent (huge) delays, and hardly comfortable. 2. Me neither (because taxi stands are not common in London) 3. True. I took an Uber this morning to work: 16km, 1 hour, £24. Time to move away from the big cities...https://twitter.com/ferdigiugliano/status/983290607228669953 …"
ErikFossing;2018-04-09 18:27;0;1;"Stunning, but not surprising. Difficult to see how anything good can come out of such a process (as I discussed in yesterday’s Sunday Wrap, pkt 2. https://www.research.unicredit.eu/DocsKey/economics_docs_2018_164262.ashx?EXT=pdf&KEY=C814QI31EjqIm_1zIJDBJP4Wq2Mk9XHPbsibyV-1xLw=&T=1 …)https://twitter.com/saraeisen/status/983123477531189248 …"
ErikFossing;2018-04-09 18:22;5;6;"Looks a heck of a lot more comfortable than London this morning!https://twitter.com/ferdigiugliano/status/983279235824607232 …"
ErikFossing;2018-04-09 01:59;0;6;"The fact that Facebook only reacts when someone else finds deficiencies gives you exactly zero trust in their ability to manage the monster they have created.https://twitter.com/cnbcjou/status/983039915322740736 …"
ErikFossing;2018-04-09 00:56;0;4;"Thank you.https://twitter.com/maciejonoszko/status/983018382801842176 …"
ErikFossing;2018-04-08 22:14;2;5;"Sometimes an event is so utterly mad - driven by foreign manipulation, lies and likely illegal funding, leading to a result all experts agree is bad - that any intellectually honest news outlet would, and should, report it as such. Not a matter of bias, but about honesty.https://twitter.com/fbpemike/status/981725224142909440 …"
ErikFossing;2018-04-08 21:43;0;1;"Everybody ... please contribute to Guardian’s @ carolecadwalla vital work on the infiltration of British democracy! The vital questions Mark Zuckerberg must answerhttps://www.theguardian.com/commentisfree/2018/apr/08/vital-questions-mark-zuckerberg-must-answer-facebook-cambridge-analytica?CMP=Share_iOSApp_Other …"
ErikFossing;2018-04-08 21:19;0;3;"On Friday the US imposed the toughest sanction yet on Russia, w Mnuchin referring to it as reaction to totality of Russia’s meddling around the world, corrupt regime etc. Now Trump blames Putin (by name) for chemical attacks. Something has changed. Trump’s Putin love over?https://twitter.com/realdonaldtrump/status/982966315467116544 …"
ErikFossing;2018-04-08 21:01;5;11;"Today’s Sunday Wrap on why recent economic releases and market moves should make you worry, but not panic - unless Trump takes us into a trade war. And I explain how we got into “Cold War II” with Russia, and where it may lead us. https://www.research.unicredit.eu/DocsKey/economics_docs_2018_164262.ashx?EXT=pdf&KEY=C814QI31EjqIm_1zIJDBJP4Wq2Mk9XHPbsibyV-1xLw=&T=1 …"
ErikFossing;2018-04-08 15:50;1;6;"Well said, Madame Secretary! Will We Stop Trump Before It’s Too Late?, via @ nytimeshttps://www.nytimes.com/2018/04/06/opinion/sunday/trump-fascism-madeleine-albright.html?smprod=nytcore-ipad&smid=nytcore-ipad-share …"
ErikFossing;2018-04-06 20:52;0;1;"We are always ready ....https://twitter.com/jsmauro13/status/982206377236967424 …"
ErikFossing;2018-04-06 20:51;0;5;"Thanks. A discussion well steered by @ CNBCJouhttps://twitter.com/dominicdeban/status/982203715359670272 …"
ErikFossing;2018-04-06 15:55;0;4;"Looking forward to it.https://twitter.com/cnbcjou/status/982150410633756674 …"
ErikFossing;2018-04-06 05:30;0;4;"... but I’m sure she is very sorry ....https://twitter.com/lionelbarber/status/982005984548868096 …"
ErikFossing;2018-04-06 04:21;0;7;"Why don’t I believe this? Maybe because - if really concerned - you could (i) store less personal data, and (ii) give users easy option not to share personal data.https://twitter.com/tictoc/status/981975214987788288 …"
ErikFossing;2018-04-05 01:52;1;9;"The top economic advisor to the US president! Wow. There is a loooooong way out of this hole.https://twitter.com/foxbusiness/status/981535857487306754 …"
ErikFossing;2018-04-05 01:20;0;2;"Fully agreed.https://twitter.com/merlialess/status/981577475657486338 …"
ErikFossing;2018-04-03 15:43;2;7;"As predicted in my Sunday Wrap earlier this year (if I may). European Central Bank’s marathon man moves to front of the pack via @ FThttps://www.ft.com/content/1a45cc18-329f-11e8-ac48-10c6fdc22f03 …"
ErikFossing;2018-04-03 03:34;1;2;"Is he really a “supply side purist”? - or just a talking head putting his pretend-economics to the service of whatever political stream he is catering to at the moment?http://www.newsweek.com/larry-kudlow-donald-trump-economic-adviser-459226 …"
ErikFossing;2018-04-03 03:08;0;3;"You are being rather unkind to Chamberlain here. He was a decent politician, who (unsuccessfully) tried appeasement before then drawing the red line on Poland. In contrast, Trump is. I thing more than a charlatan reality TV star miscast as president.https://www.washingtonpost.com/news/democracy-post/wp/2018/04/02/donald-trump-isnt-winston-churchill-hes-neville-chamberlain/ …"
ErikFossing;2018-04-03 03:01;0;4;"@ elerianm This does not feel like just a return to normal volatility, unfortunately. Rather, it looks to me as Markets (belatedly) reprising to a world of a madman in the WH with no knowledge of, or interest in, basic economics.https://twitter.com/johnauthers/status/980880954951684096 …"
ErikFossing;2018-04-03 02:55;0;0;"Jonathan, you are always welcome to come around my house for a cooking segment!https://twitter.com/ferrotv/status/980561322432761856 …"
ErikFossing;2018-04-03 02:53;0;0;"Some sort of employment contract there w Sinclair’s in the US.https://twitter.com/fawfulfan/status/980817461225369600 …"
ErikFossing;2018-04-03 02:49;0;1;"The same old party politics: Any question on any issue at your party’s leadership is met not by any reflection at all, but by an immediate - and ferocious - attack on “the other party”. Sickens me.https://twitter.com/owenjones84/status/980466641652867073 …"
ErikFossing;2018-04-03 01:52;4;6;"Thanks Mr Trump. When will people realise that nothing good comes out of electing as president a complete know-nothing.https://twitter.com/thestalwart/status/980864277925023752 …"
ErikFossing;2018-04-03 01:45;1;3;"We are missing you, Sir, in the front line of British politics.https://twitter.com/haggis_uk/status/980763972860248064 …"
ErikFossing;2018-04-03 00:56;1;1;"Willkommen indeed! @ Lars_Feld needs many more follows.https://twitter.com/isabel_schnabel/status/980850503679541248 …"
ErikFossing;2018-04-03 00:53;1;7;"How do all you so-called TV personalities in these clips feel? Like manipulated by your paymaster? Like small puppets at the end of a string? Like talking parrots? Like prostitutes? I hope you feel okay when looking yourself in the mirror.https://twitter.com/deadspin/status/980175772206993409 …"
ErikFossing;2018-04-01 15:54;0;5;"Phew. I had been wondering. Good to get that settled.https://twitter.com/reuters/status/980351639457497089 …"
ErikFossing;2018-03-31 18:48;0;6;"A time when vision ruled the world.https://twitter.com/guntramwolff/status/980001779894161409 …"
ErikFossing;2018-03-31 15:49;2;4;"Yeah, we got lots of problems here in Europe as well, but nothing this bad and disturbing for the future....https://twitter.com/cnn/status/979950415507795968 …"
ErikFossing;2018-03-31 15:47;1;4;"Agreed. Impatience must not send us down the wrong road towards eg ex ante rules and structures for sovereign debt restructuring. The sov is sov! - with the right and obligation to tax, run police, security etc. Its signature can never be in doubt in a civilised society.https://twitter.com/axachiefecon/status/979943050851086336 …"
ErikFossing;2018-03-31 04:14;2;10;"Imagine there's no heaven It's easy if you try No hell below us Above us only sky Imagine all the people Living for today... Imagine there's no countries It isn't hard to do Nothing to kill or die for And no religion, too Imagine .....http://www.bbc.com/news/world-europe-43596919 …"
ErikFossing;2018-03-31 04:02;1;1;"Gee! Turns out Russian state TV is as disloyal as CNBC and CNN. Reportedly, Trump has asked Mnuchin to figure out how he can tax Russian State TV to tame them - or maybe break them up!https://twitter.com/juliadavisnews/status/979465218559565826 …"
ErikFossing;2018-03-31 03:16;0;5;"It’s indeed been a gorgeous day in Berlin today.https://twitter.com/doberah/status/979732710334910464 …"
ErikFossing;2018-03-30 15:03;1;5;"To all my friends in Bavaria and Baden-Württemberg: Good thing Germany has the growth powerhouse of Berlin...https://twitter.com/mfratzscher/status/979360513036562432 …"
ErikFossing;2018-03-30 03:07;0;2;"No surprise if you are in Berlin, city of diversity, vitality and beauty!https://twitter.com/mfratzscher/status/979358910481076225 …"
