ErikFossing;2017-02-19 22:21;2;5;"Sunday Wrap: 1. Greece:There'll be a deal w debt relief; the Econ + politics of it all. 2 Eurozone: why fiscal transfers not that important"
ErikFossing;2017-02-19 04:46;2;9;"Yeah, let's blame the euro .... just funny how there has been more populism in other countries: Poland, Hungary, India, Turkey, US, Brexithttps://twitter.com/astuttaford/status/833037195065884673 …"
ErikFossing;2017-02-19 03:25;0;0;"On what basis do you say that?https://twitter.com/astuttaford/status/833011288921997313 …"
ErikFossing;2017-02-19 01:42;4;11;"That would be one impressive landing in your feet for a man who gambled with his country's future - and lost.https://twitter.com/tommctague/status/832871199680102400 …"
ErikFossing;2017-02-18 02:40;0;0;"Right - but a large share of the 80% EU supporter apparently don't appreciate it enough to vote for pro-EU politicians.https://twitter.com/mmpiatkowski/status/832650212351045633 …"
ErikFossing;2017-02-18 01:54;0;0;"Phew, makes me feel better.https://twitter.com/constelz/status/832645185880219648 …"
ErikFossing;2017-02-18 01:53;0;0;"Indeed, it's beautiful. Not surprising the Polish people and their government like the EU so much.https://twitter.com/mmpiatkowski/status/832425829770620928 …"
ErikFossing;2017-02-18 01:36;0;0;"It's been 30 min since you posted this. You still there, Constanza? Or have you been carried out, sword in stomach?https://twitter.com/constelz/status/832638746348511232 …"
ErikFossing;2017-02-18 01:34;0;0;"Hmm, are you sure you want Boris speaking without notes?https://twitter.com/jasonlknoll/status/832640576478605312 …"
ErikFossing;2017-02-17 19:07;0;1;"Annoying politics: instead of "US demand", let's call it smart fiscal policy, incl employm, infrastructure and IT...http://www.reuters.com/article/us-nato-defence-eu-idUSKBN15V31F?utm_campaign=trueAnthem:+Trending+Content&utm_content=58a6a0a404d3012f7703a782&utm_medium=trueAnthem&utm_source=twitter …"
ErikFossing;2017-02-17 17:35;0;1;"Right - and the fact that wasn't the chosen route tells you that this crazy over-simplified characterisation of "German thinking" is wronghttps://twitter.com/ojessen/status/832518968934023168 …"
ErikFossing;2017-02-17 16:50;3;5;"Right - and Germany would have spent maybe 15% of GDP (instead of 12%) and France maybe 3% (instead of 0%) bailing out their banks.https://twitter.com/yannikouts/status/832502714588336128 …"
ErikFossing;2017-02-17 15:04;0;1;"True - but those young people don't vote, but those old grumpy taxi driver (and ex-drivers) do.https://twitter.com/ferdigiugliano/status/832226708757606400 …"
ErikFossing;2017-02-16 06:41;1;0;"Do I read this right: Biggest recipient of Juncker Plan money so far is .... The U.K.! (along with Spain)?https://twitter.com/miguelgiltertre/status/831934137065877504 …"
ErikFossing;2017-02-16 01:48;0;4;"But Trump does not dispute that Flynn talked sanctions with Russians, and then misled the VP? Where is the unfair treatment, or fake news?https://twitter.com/thehill/status/831918788870287360 …"
ErikFossing;2017-02-16 01:44;2;4;"How can it even be legal to have Russian (or any other foreign) entities finance political parties in Europe?https://twitter.com/bruceestokes/status/831913372912406529 …"
ErikFossing;2017-02-16 01:42;0;1;"I wonder what Trump was thinking when Bibi called for substance over slogans?https://twitter.com/business/status/831919646336970752 …"
ErikFossing;2017-02-16 00:57;0;0;"Great! Now, remind us please which EU country has received the biggest part of the Juncker Plan investments so far.https://twitter.com/eu_commission/status/831905922943315968 …"
ErikFossing;2017-02-16 00:51;0;1;"Hilarious! We were all wondering....https://twitter.com/flacqua/status/831903444369862656 …"
ErikFossing;2017-02-15 20:28;0;3;"Right, and if you ask the European regulators, it'll need to be low-risk (as assessed by the rating agencies!) as well...https://twitter.com/thestalwart/status/831841938387107842 …"
ErikFossing;2017-02-15 17:31;0;3;"Only a surprise for those who refused to listen to the (way too timid) serious remain campaign.https://twitter.com/theeconomist/status/831797448628695040 …"
ErikFossing;2017-02-15 16:21;1;1;"Really!https://twitter.com/thehill/status/831735048114155521 …"
ErikFossing;2017-02-15 07:23;0;0;"Sounds like a generous interpretation (even w the comfort of knowing that you know the realty is more complicated than it seems!)https://twitter.com/skmacro/status/831643607400603649 …"
ErikFossing;2017-02-15 06:57;0;0;"Still wondering if Flynn's true locality lies with Russia rather than the US, or whether he is just naive beyond imagination.https://twitter.com/cnn/status/831637144405995521 …"
ErikFossing;2017-02-15 06:11;1;1;"Great German diplomacy!https://twitter.com/germanembassysa/status/831492419694772224 …"
ErikFossing;2017-02-14 20:17;1;3;"As distasteful as it is, if they all resign they can get as rich as they want (on Russian money), as far as I'm concerned.https://twitter.com/paulkrugman/status/831467036115087362 …"
ErikFossing;2017-02-14 03:22;3;1;"Of course - Brexiteers lied about almost everything, from the 350m to single market to the charlatan way of describing the UK and the world.https://twitter.com/jk_rowling/status/831157461042204677 …"
ErikFossing;2017-02-13 18:06;0;0;"@ markets @ BloombergTV - Looking forward to discussing Europe (and the world) from Berlin on Bloomberg DaybreakAmerica today 7.30am ET"
ErikFossing;2017-02-13 02:05;1;1;"And right they are to be outraged! Players should have walked off, and waited for correction.https://twitter.com/reuters/status/830832609995395073 …"
ErikFossing;2017-02-13 02:04;2;1;"Over to you, Ms May ... I'm sure you are glad you have Boris and Davis to sort this one out...http://www.independent.co.uk/news/uk/politics/european-commission-agree-48-billion-brexit-latest-eu-divorce-bill-uk-a7573291.html …"
ErikFossing;2017-02-12 22:25;1;3;"C'mon, even for Christie there must be limits for how many times you want to be humiliated.https://twitter.com/cnn/status/830782111330205699 …"
ErikFossing;2017-02-12 22:03;0;0;"Tough to know what to do the moment it happens, but I wish Petkovic had walked off the court. On the spot.http://www.espn.com/tennis/story/_/id/18669174 …"
ErikFossing;2017-02-12 21:56;3;7;"All of Europe - and the world, for that matter - is lucky to have the German political class-acts as an anchor in these turbulent times.https://twitter.com/germanydiplo/status/830768697992175616 …"
ErikFossing;2017-02-12 21:54;2;1;"Interesting - but before getting to those issues, stop + wonder about Putin's success: After 17 years in power: Men's life expect: < 65 yr.https://twitter.com/wef/status/830774737341132801 …"
ErikFossing;2017-02-12 21:50;0;5;"Sunday Wrap on why markets are too complacent about political risk from Trump, and excessively worried about eurozone politics."
ErikFossing;2017-02-12 03:58;0;3;"Hmm, funny. I was just thinking that it seems to be working exactly as intended. I must be missing something.https://twitter.com/thehill/status/830486831468859392 …"
ErikFossing;2017-02-10 04:37;1;1;"Lucky us the US president is such a faster learner, and always makes right decision without info "because he is smart". Seriously! SCARY!!!https://twitter.com/thehill/status/829780697992855554 …"
ErikFossing;2017-02-10 04:34;1;1;"By Ivanka?https://twitter.com/cnnbrk/status/829780641529098241 …"
ErikFossing;2017-02-09 20:26;0;0;"Again, lowest net contribution per capita among the Western European (wealthy) members - in spite of being one of the wealthiest. https://twitter.com/gavinhjackson/status/829665359171051520 …"
ErikFossing;2017-02-09 19:56;0;0;"Hmm, really? Celebrating the smallest net contributor per capita among the rich Western Europeans? https://twitter.com/gavinhjackson/status/829611471462072320 …"
ErikFossing;2017-02-09 16:30;3;5;"Maybe someone could remind me of some of the great things the UK has contributed to the EU in recent years?https://twitter.com/yougov/status/829290556736098304 …"
ErikFossing;2017-02-09 04:19;3;2;"Welcome to the club...https://twitter.com/business/status/829421390034042884 …"
ErikFossing;2017-02-08 19:34;0;1;"So we value health, edu + equality vs employment differently. That's fine. I like ur banner btw: UK only "democracy" w unelected upper househttps://twitter.com/drewedgar_cb/status/829268385498296321 …"
ErikFossing;2017-02-08 17:55;0;0;"Nobody's excusing it, or thinking it's even remotely okay. We are trying to provide a bit of perspective.https://twitter.com/drewedgar_cb/status/829257500125954049 …"
ErikFossing;2017-02-08 17:12;0;5;"Wow. You call child mortality, teenage death rates, drug misuse, prison rates, etc "irrelevance". We got different value parameters, mate!https://twitter.com/drewedgar_cb/status/829251091325927425 …"
ErikFossing;2017-02-08 16:17;1;2;"Yes agreed - although on broader social indicators, US hardly the model state for youth. But agreed, EZ must do much better here.https://twitter.com/micheal_lunny/status/829088921795571713 …"
ErikFossing;2017-02-08 05:23;0;0;"Right! "Will you then accept the outcome?" "Yes .... If I win"https://twitter.com/thehill/status/829077040557068288 …"
ErikFossing;2017-02-08 05:21;1;1;"Right - nobody can be BFF with either of these two men. But Trump did react to Fox: "Putin is a murderer" with "we have murderers too" - wowhttps://twitter.com/cnn/status/829076222948700160 …"
ErikFossing;2017-02-08 05:05;11;7;"Eurozone growth > US growth, and productivity growth a lot faster. US protectionism will further widen the gaphttp://www.politico.eu/article/psst-europes-economy-is-doing-well/?utm_content=buffer51813&utm_medium=social&utm_source=twitter.com&utm_campaign=buffer …"
ErikFossing;2017-02-08 03:30;0;0;"Bruce Springsteen: Born to Runhttps://twitter.com/thestalwart/status/828997048716365824 …"
ErikFossing;2017-02-08 03:04;1;0;"How did I miss this wonderful piece about my favourite neighbourhoods in my favourite city?https://twitter.com/carlandry_afp/status/826862408501252106 …"
ErikFossing;2017-02-08 00:57;0;3;"What do you mean "dress her"? Last time I checked, there were American labels in virtually every shop on 5 th Ave, right down from her placehttps://twitter.com/gabyhemeryck/status/829005379132596224 …"
ErikFossing;2017-02-07 23:51;2;4;"That why he needs walls and protection! In a world of the free, people would always buy European first!https://twitter.com/nytimes/status/828987444557119488 …"
ErikFossing;2017-02-07 18:34;3;6;"Is this another "Goldman" (started by thinking Trump okay/good, only now to realise the madness)? Le Pen NOT some minor market adjustment!https://twitter.com/icouet/status/828890201183363072 …"
ErikFossing;2017-02-07 06:00;1;6;"They are pulling their punches! A Le Pen victory will cause more damage than that.https://twitter.com/saraeisen/status/828713977450549248 …"
ErikFossing;2017-02-07 00:09;0;0;"If only that was all ....https://twitter.com/dvdbllrd/status/828636311896653825 …"
ErikFossing;2017-02-07 00:06;36;62;"With all due respect, what took them so long to see the madness?https://twitter.com/thestalwart/status/828597314847666177 …"
ErikFossing;2017-02-07 00:02;1;4;"Easy to imagine - the competition isn't that great.https://twitter.com/politico/status/828609221121998849 …"
ErikFossing;2017-02-06 23:52;1;1;"Excellent piece by @ federicofubini What's the Matter With Germany? by Federico Fubini via @ ProSyn http://prosyn.org/oIPtmlE"
ErikFossing;2017-02-06 22:21;0;0;"It was exactly good people like you I had in mind....https://twitter.com/jandritzky/status/828568658507096064 …"
ErikFossing;2017-02-06 19:40;8;8;"Example: Had labour market participation rates in US and Eurozone not changed last ten 10years, then now: US unemployment > EMUhttps://twitter.com/andrewmacdowall/status/828526927250079745 …"
ErikFossing;2017-02-06 18:17;0;0;"Works too - no shortage of optionshttps://twitter.com/merlialess/status/828540623762374656 …"
ErikFossing;2017-02-06 16:42;0;3;"Agreed. How about a sizeable salary increase for all public employees?https://twitter.com/jandritzky/status/828502820575928320 …"
ErikFossing;2017-02-06 08:58;15;21;"Truly exceptional. When will GOP insist on seeing Trump's tax return? Who do they think he is in debt to? https://www.washingtonpost.com/politics/trumps-continued-defense-of-putin-confounds-republicans/2017/02/05/fc082ada-ebd1-11e6-b7e8-df81bd6c4c30_story.html?tid=sm_tw&utm_term=.6107f1e63f15 …"
ErikFossing;2017-02-05 22:39;1;6;"Today's Sunday Wrap on Navarro's confusion about Europe, and the German current account surplus properly understood in Eurozone context."
ErikFossing;2017-02-05 06:18;0;0;"Someone to follow...https://twitter.com/jzettelmeyer/status/827950339961843713 …"
ErikFossing;2017-02-05 02:51;0;0;"Ah, that explains the blow-up w Australia.Trump was speaking with the wrong guy....https://twitter.com/scclemons/status/827936350515187712 …"
ErikFossing;2017-02-05 02:47;1;1;""Who wants to be second" Hilarious display of absurdity of Trump "America First" - start w NL, then DK, then Germany http://www.everysecondcounts.eu/"
ErikFossing;2017-02-05 02:42;0;3;"Who cares. We watch @ CNN and @ cnni for their news, analysis and debate (excl Quest), not for the appearance of the "so-called VP"https://twitter.com/thehill/status/827949134397186048 …"
ErikFossing;2017-02-05 02:34;3;1;"The "so-called president" attacks a "so-called judge" whose judgement of law I guess he doesn't like, via @ nytimeshttps://www.nytimes.com/2017/02/04/us/politics/visa-ban-trump-judge-james-robart.html?smprod=nytcore-ipad&smid=nytcore-ipad-share …"
ErikFossing;2017-02-05 02:28;0;2;"I, for one, will not buy anything from any shop selling his stuff, via @ nytimes https://www.nytimes.com/2017/02/04/business/the-trump-brand.html?smprod=nytcore-ipad&smid=nytcore-ipad-share …"
ErikFossing;2017-02-05 02:20;1;0;""France .. Beacon of hope .. Rather than culmination of move to populism" Well said! http://on.ft.com/2jETBNf via @ FT"
ErikFossing;2017-02-05 02:14;2;7;"He is my man....https://twitter.com/clairefournier_/status/827895379018539008 …"
ErikFossing;2017-02-04 06:39;2;12;"Got tears in my eyes: Lockheed thanks Trump for involving himself to reduce price for 90 F-35s they sell to Pentagon. Give me a f... break!https://twitter.com/thehill/status/827646353664835586 …"
ErikFossing;2017-02-03 04:08;2;1;"Ugly reality.https://twitter.com/ianbremmer/status/827218497038143488 …"
ErikFossing;2017-02-02 02:44;1;3;"Latest poll has Macron beat Fillon into the second round - where he'll beat Le Pen.https://twitter.com/imateosylago/status/826511076720308225 …"
ErikFossing;2017-02-01 03:56;0;2;"German government should "revalue" the euro????https://twitter.com/clausvistesen/status/826516150196510720 …"
ErikFossing;2017-02-01 03:55;0;2;"On 1) yes, but not gonna strengthen the euro measurably. 2) right, but fiscal Union must come w political union. Merkel offered thathttps://twitter.com/hrreisen/status/826517664583602176 …"
ErikFossing;2017-02-01 03:40;0;3;"So help us out here: What should the German Govn do about the euro?https://twitter.com/hrreisen/status/826511019518414848 …"
ErikFossing;2017-02-01 02:32;1;5;"Yes, getting used to it, but that just raises the need for us all to speak up.https://twitter.com/johanluthor/status/826497396981059584 …"
ErikFossing;2017-02-01 02:30;5;0;"... And the revolving door between UK tabloids and No 10 continues. They never learn. Amazing - and sad.https://twitter.com/politicoeurope/status/826494480421363712 …"
ErikFossing;2017-02-01 02:25;6;4;"Right. And, ironically, since German foreign FI investments have provided poor return, there is your (hidden, and un-intended) transfer.https://twitter.com/mfratzscher/status/826494575955025920 …"
ErikFossing;2017-02-01 02:11;9;13;"Nonsense! Yes, German fiscal policy is too tight and spending composition not optimal, but to think this is fatal flaw in EMU is mad.https://twitter.com/hrreisen/status/826490115644063744 …"
ErikFossing;2017-01-31 23:04;0;9;"I think he should prioritise facts and clear and logical thinking....https://twitter.com/huffpostpol/status/826436396705513472 …"
ErikFossing;2017-01-31 21:33;0;2;"So don't say the French socialists are not high-tech - or that tech cannot be put to good use for the less educated and the poor!https://twitter.com/flacqua/status/826368544522829825 …"
ErikFossing;2017-01-30 19:44;3;3;"Agreed!https://twitter.com/yahoofinance/status/826032970184146944 …"
ErikFossing;2017-01-30 19:43;1;1;"Me too (but at more human hour ...) - and the topic was .... Trump. Question#1 How long will markets buy this incompetent policymaker?https://twitter.com/kingeconomist/status/826013969659863040 …"
ErikFossing;2017-01-30 19:42;0;0;"That came across more harshly than intended. Said in the context of French elections, where all markets want is "NOT Le Pen"https://twitter.com/bsurveillance/status/826013887858372608 …"
ErikFossing;2017-01-30 02:26;0;0;"Careful there- before you know it, you may be on a flight out .... maybe to "the consortium"https://twitter.com/dolcemc/status/825760563846275073 …"
ErikFossing;2017-01-29 23:01;1;2;"Sunday wrap: where markets are right on econ but wrong on Trump, EMU real data (quite nice) and elusion of the US-UK 'special relationship'"
ErikFossing;2017-01-29 17:36;0;3;"Not an issue of expertise here, but one of basic values and respect.https://twitter.com/skmacro/status/825634600332435457 …"
ErikFossing;2017-01-29 16:01;2;3;"Isabel, we really need to speak. You are degrading the sovereign to a simple credit, with all respect. That's not what people pay tax to!https://twitter.com/isabel_schnabel/status/825029054667583488 …"
ErikFossing;2017-01-29 04:36;0;1;"With Putin, it looks like Trump is doing the listening (taking instructions?) With Merkel et al, WH chose photos of Trump doing the talking!https://twitter.com/PressSec/status/825389810869219328 …"
ErikFossing;2017-01-27 19:55;0;3;"Stunning in its big-(read: "pig") headed nonsense. He didn't help bring down the USSR more than my cat did. And he won't help bring down EU!https://twitter.com/olaf_alex/status/824939985832914944 …"
ErikFossing;2017-01-27 16:19;1;0;"Hilarious. Theresa May tweets up the most special relationship ever http://on.ft.com/2jB1Qpw via @ FT"
ErikFossing;2017-01-27 07:41;0;5;"If you hold your nose and don't listen to first parts on shared values etc, it's actually a pretty good and important speech.https://twitter.com/washingtonpost/status/824754308025548800 …"
ErikFossing;2017-01-27 07:40;2;15;""It's fake. Totally fake. Those pollsters are losers. The real number is 90%. It's huge. People tell me this. Never seen before. Huge."https://twitter.com/politico/status/824756086662107136 …"
ErikFossing;2017-01-27 04:33;0;0;"And this is where quality of US media will be tested. Not @ thehill or @ nytimes, but will @ FoxNews report and discuss this false statement?https://twitter.com/thehill/status/824715822899822594 …"
ErikFossing;2017-01-27 04:30;6;16;"If so, I can tell you exactly who'll be paying for it: American consumers!https://twitter.com/mviser/status/824713896502169601 …"
ErikFossing;2017-01-27 02:45;0;3;"Trump has no concern for authenticity of sources, so long as the story told fits his screwed-up vision. Can't wait for investigationhttps://twitter.com/thehill/status/824688393871392768 …"
ErikFossing;2017-01-27 02:40;0;0;"Strong statement by State Dept leadership today! Wrt other governments, let's see what May may say, or Maybe not say...https://twitter.com/dolcemc/status/824666719897522176 …"
ErikFossing;2017-01-27 02:38;4;6;"Well saidpic.twitter.com/jlvfzV86mZ"
ErikFossing;2017-01-26 16:02;0;5;"Must read. Possibly single biggest issue in US today. "I worry the people in charge of our companies are afraid to speak up" against Trump.https://twitter.com/flacqua/status/824522818452881409 …"
ErikFossing;2017-01-26 05:06;1;7;"At least now we know how Trump learned of voter fraud! I wonder if he still wants that investigation...https://twitter.com/thehill/status/824362005381398528 …"
ErikFossing;2017-01-26 05:04;1;1;"Yours UniCredit: Banker who called end of the 2015 dollar rally is telling clients to short the buck - MarketWatchhttp://www.marketwatch.com/story/banker-who-called-end-of-the-2015-dollar-rally-is-telling-clients-to-short-the-buck-2017-01-25 …"
ErikFossing;2017-01-25 19:59;0;11;"So true - although my experience would suggest that that statement also applies to us who don't run for office.https://twitter.com/brankomilan/status/824222215520550914 …"
ErikFossing;2017-01-25 14:47;0;1;"This is hilarious.https://twitter.com/dolcemc/status/824038051160567809 …"
ErikFossing;2017-01-25 00:54;0;2;"Broadly same percentage wants out as anti-eurozone in most EMU.http://thehill.com/blogs/blog-briefing-room/news/315804-more-californians-than-ever-want-state-to-secede-from-us …"
ErikFossing;2017-01-24 23:59;0;0;"Surprise! One job for the other...https://twitter.com/huffpostpol/status/823922328488779776 …"
ErikFossing;2017-01-24 23:22;1;2;"Shocking! What type of society is this?https://twitter.com/lbc/status/823911015373041664 …"
ErikFossing;2017-01-24 22:44;0;1;"The real question here is who'll be worse off if they pick @ tomkeene ? @ flacqua or the accused in court?https://twitter.com/flacqua/status/823893181557342208 …"
ErikFossing;2017-01-24 06:45;0;5;"Surely, there must be some alternative facts on this matter....https://twitter.com/thehill/status/823661603358998528 …"
ErikFossing;2017-01-23 23:13;0;1;"Why did Olivier take this beautiful picture down? Good to see implied commitment to European cooperation.pic.twitter.com/DBpsON00Cq"
ErikFossing;2017-01-23 22:33;0;1;"I hear Putin has offers it to Trump if he recognises Crimea as Russian, and lifts sanctions (this is so-called "alternative facts")https://twitter.com/nfl/status/822187295952355328 …"
ErikFossing;2017-01-23 04:20;5;7;"Oh dear, Donald! What have you done? Putin not happy with you, and he has loaded his gun.https://twitter.com/thehill/status/823260724348719105 …"
ErikFossing;2017-01-22 21:24;1;2;"Russia displaying its usual finessed form of flattery...https://twitter.com/huffingtonpost/status/823158402734034944 …"
ErikFossing;2017-01-22 21:23;2;1;"It's getting more and more bizarre.https://twitter.com/huffingtonpost/status/823158402734034944 …"
ErikFossing;2017-01-22 20:55;3;0;"Today's Sunday Wrap on 4 key speeches of past week: Trump inaug (oh dear), Xi in Davos (hmm), May on Brexit (better but ...), Merkel (phew)"
ErikFossing;2017-01-22 05:31;1;6;"The National Park service is apparently not allowed to tweet about this - so I will...https://twitter.com/thehill/status/822916444354703360 …"
ErikFossing;2017-01-22 05:29;1;4;"Oh well. Then I'll tweet for them...Trump admin tells National Park Service to halt tweets - http://CNNPolitics.com http://edition.cnn.com/2017/01/21/politics/trump-national-park-service-tweets/index.html …"
ErikFossing;2017-01-20 23:34;0;0;"Is that meant as good or bad?https://twitter.com/business/status/822466996973531137 …"
ErikFossing;2017-01-20 18:06;1;1;"Hilarious. Welcome to the new world of Trump and - apparently - May and the ONS.https://twitter.com/chrisgiles_/status/822383049643937792 …"
ErikFossing;2017-01-20 16:24;2;3;"Why doesn't @ BILD go after "bad" firms who raise their prices, or "bad" people who buy too much? It's demand-pull inflation after all! @ ecbhttps://twitter.com/henrikenderlein/status/821993668806578176 …"
ErikFossing;2017-01-20 00:09;0;2;"Of course he would. Not needed; we got reality TV.https://twitter.com/thehill/status/822101826308816897 …"
ErikFossing;2017-01-19 22:09;0;2;"Right, but Draghi doesn't usually (and shouldn't) comment in market moves, so... (Completely agreed on Trump)https://twitter.com/ferdigiugliano/status/822082309931274240 …"
ErikFossing;2017-01-19 22:03;0;4;"Have you forgotten that "whatever it takes" was translated into a policy?https://twitter.com/ferdigiugliano/status/822080456963346432 …"
ErikFossing;2017-01-19 21:56;0;1;"Brilliant, particularly reflection on UK and Trump's US. Brexit, Donald Trump and the threat to Europe http://on.ft.com/2k5MSvY via @ FT"
ErikFossing;2017-01-19 21:54;0;4;"Sorry! What dilemma? ECB holds steady on rates amid inflation dilemma http://on.ft.com/2jrFTdq via @ FT"
ErikFossing;2017-01-19 21:53;0;2;"Look + reflect! Brexiters and now UK government will have you believe Coventry's misery is caused by the EU. But how come Sachsen, then?https://twitter.com/thomasforth/status/821823595483697152 …"
ErikFossing;2017-01-19 19:11;2;3;"Nice, but does she know that to vast majority of Europeans, incl all present leaders, "Europe" IS the EU? http://on.ft.com/2iMtOOd via @ FT"
ErikFossing;2017-01-19 00:16;1;2;"Come on! 2016 turned out to be v good year for Cont Europe - particularly relative to most expectations a year ago - and real to US/UKhttps://twitter.com/prebeneuspox/status/821724045926420480 …"
ErikFossing;2017-01-18 07:36;1;0;"Excellent piece!https://twitter.com/ft/status/821120356060725248 …"
ErikFossing;2017-01-18 05:11;0;0;"Well put, but i don't sense the same reaction here in Berlin as the one expressed by the poor guy lifting the bedsheet in The Godfather.https://twitter.com/sam1fleming/status/821456570856906758 …"
ErikFossing;2017-01-18 00:48;1;4;"I used to think that that's because he is a hopeless narcissist, but now I wonder if it's also because he simply knows nothing?https://twitter.com/thehill/status/821395936207405057 …"
ErikFossing;2017-01-17 23:17;0;1;"We love you, @ Peston but this is too close-up for comfort. Reminds me of the "talk to close to you" guy in Seinfeld.https://twitter.com/peston/status/821368193000292353 …"
