ErikFossing;2016-08-26 04:20;0;2;"True - I'm all for it. I'm just VERY worried if ECB were to set mon pol in way to push politicians to certain pol.https://twitter.com/isabel_schnabel/status/768839307536785408 …"
ErikFossing;2016-08-25 23:02;0;2;"You blow my mind with such insight!https://twitter.com/theeconomist/status/768825693362872320 …"
ErikFossing;2016-08-25 22:28;1;0;"Hi @ stefanwagstyl, does @ martinwolf_ agree a bigger surplus is a "better" result? German surplus ... Merkel http://on.ft.com/2bNGRMO via @ FT"
ErikFossing;2016-08-25 22:11;0;0;"Right, but the usual structural reforms (labour and product) take at least 18 months before that effect becomes pos.https://twitter.com/isabel_schnabel/status/768752942673432576 …"
ErikFossing;2016-08-25 13:54;0;1;"You are not serious, right? But even if u want to go there, you'll note pol conditionality in OMT is by politicians.https://twitter.com/jandritzky/status/768554360053895169 …"
ErikFossing;2016-08-25 13:51;0;3;"Really? We all want reforms b/c they increase pot output, but => bigger output gap => less inflation!https://twitter.com/isabel_schnabel/status/768590455911120896 …"
ErikFossing;2016-08-25 02:16;0;1;"Yeah, they'll connect beautifully with your English Pub banter nonsense down there in the Deep South.https://twitter.com/zschneeweiss/status/768505357505355780 …"
ErikFossing;2016-08-25 01:02;0;0;"Sad view, and problematic too. But as an aside, what type of beach is that with those stones?https://twitter.com/bill_easterly/status/768482483067297793 …"
ErikFossing;2016-08-24 22:38;1;0;"True. And if anyone in doubt, check OECD stat. https://twitter.com/angelubide/status/768453491207438337 …"
ErikFossing;2016-08-24 22:36;1;3;"Ouch! - you need to do this in terms of per capita growth! Of course eastern states grow less - people are leaving!https://twitter.com/doberah/status/768453178471907328 …"
ErikFossing;2016-08-24 21:11;13;5;"Wieland seems to struggle with fact that @ ECB has ONE mandate only, and it's NOT: "Force pol-makers to do reforms.https://twitter.com/mxsba/status/768427959359148032 …"
ErikFossing;2016-08-24 21:07;1;0;"clear + unemotional analysis by @ JeremyWarnerUK of "condescending" policymakers' "stupidity". But he likes Stiglitz.https://twitter.com/kingeconomist/status/768345890436284416 …"
ErikFossing;2016-08-24 04:45;8;12;"Excellent must-read Bruegel piece for anyone thinking - or talking - about Europe! http://bruegel.org/2016/08/how-to-make-the-single-market-more-inclusive-in-the-aftermath-of-brexit/?utm_content=buffer2904b&utm_medium=social&utm_source=twitter.com&utm_campaign=buffer+(bruegel …)"
ErikFossing;2016-08-24 03:43;0;1;"Very good piece, but not right to equate QE w neg rates. Negative interest rates are not the drama they seem http://on.ft.com/2byTaAG via @ FT"
ErikFossing;2016-08-23 04:09;1;0;"Larry King, then CNN now Russian TV, was paid cash by Russian connection in Ukraine - Larry King in 'bribe books'http://bit.ly/2bcc1PG"
ErikFossing;2016-08-23 01:47;1;3;"A stunningly positive statistic. But which countries are included? I hope it's done correctly.https://twitter.com/ianbremmer/status/767769439236395008 …"
ErikFossing;2016-08-23 01:27;4;0;"The magic of a visit to Italy, a little checking - a good meal and a class of wine. And spoken by a Real Politician!https://twitter.com/mxsba/status/767768971953266688 …"
ErikFossing;2016-08-22 21:48;0;1;"Weird illustration: A lot less certain than that these boys will plunge - and if it happens, a lot less fun.https://twitter.com/yahoofinance/status/767719254665953281 …"
ErikFossing;2016-08-22 20:00;0;0;"Right! - and what an irony that the best example of how EMU-break could happen that he could come up with is Brexit!https://twitter.com/mxsba/status/767665193883164673 …"
ErikFossing;2016-08-22 15:11;1;0;"U call these unemploym rates "normalised cap utilisation"? Monetary policy lacks the muscle to boost growth http://on.ft.com/2bEgCIv via @ FT"
ErikFossing;2016-08-22 04:02;1;1;"I also like Khan, but isn't it time to focus on what he does, rather than his working class background and religion?https://twitter.com/owenjones84/status/767442819682369537 …"
ErikFossing;2016-08-22 02:40;1;0;"Oh, but Leadsom will make sure he keeps his subsidy - she'll easily persuade Hammond.... Hmmm.https://twitter.com/frances_coppola/status/767364329343709184 …"
ErikFossing;2016-08-22 02:08;1;0;"Stan Fischer's analysis and delivery as sharp (and agreeable) as ever - but will Yellen make up her mind, please!https://twitter.com/flacqua/status/767421413393305600 …"
ErikFossing;2016-08-22 00:48;2;1;"Again - so easy to agree with Stan Fischer! Fed’s Fischer upbeat on economic targets http://on.ft.com/2bEdSuG via @ FT"
ErikFossing;2016-08-21 23:27;0;2;"Now I'm getting more concerned about you eavesdropping in restaurants than about people w strange parenting ideas.https://twitter.com/poetic_endings/status/767355784061710336 …"
ErikFossing;2016-08-21 19:20;1;3;"Must have been a tourist from another part of town (or country). No Chiswick citizen would have been so obnoxious.https://twitter.com/poetic_endings/status/767305966174044161 …"
ErikFossing;2016-08-21 03:11;0;1;""Non je ne regrette rien" - oh well, Edit Piaf had something different in mind ... and truly nothing to regrethttps://twitter.com/thehill/status/767047809258385408 …"
ErikFossing;2016-08-21 02:58;0;0;"Donald Trump's sitting room?https://twitter.com/dreadfulpoint/status/767051378946637824 …"
ErikFossing;2016-08-20 17:25;2;2;"This otherwise fine piece does not appreciate that policy making is about app flexibility rather than enforcement. https://www.ceps.eu/publications/silent-death-eurozone-governance …"
ErikFossing;2016-08-20 17:16;2;4;"Very illustrative - and just one (of many) reasons why we love Berlin (and how Germany is getting this one right). https://twitter.com/codendahl/status/766905842352480256 …"
ErikFossing;2016-08-20 02:27;1;0;"And right you are, Ms Rowling. Great reason for you to keep writing!https://twitter.com/jk_rowling/status/766683212810690560 …"
ErikFossing;2016-08-20 01:03;1;1;"Confusion: "Fed ... won't necessarily put a quick end to the party" - they don't want a "quick end" but a slow movehttps://twitter.com/flacqua/status/766678258352029696 …"
ErikFossing;2016-08-19 14:42;2;6;"Clear sign of GB's power and capabilities when not held back by the EU! Brexiteers win....https://twitter.com/kingeconomist/status/766403065691996160 …"
ErikFossing;2016-08-19 02:51;0;1;"What I find most amazing is that 44% think Trump only has "some" - or "no" - chance of making major mistake.https://twitter.com/pewresearch/status/766345950927335424 …"
ErikFossing;2016-08-18 23:26;2;0;"If growth the same in EMU and US, if too low, problem probably the same. And yes: Productivity! @ tomkeene @ flacquahttps://twitter.com/stiglitzian/status/766245781988904962 …"
ErikFossing;2016-08-18 23:25;2;5;"I respectfully disagree w Stiglitz? Fact: EMU per capita GDP same as US for all but top-10%. @ tomkeene @ flacquahttps://twitter.com/stiglitzian/status/766245781988904962 …"
ErikFossing;2016-08-18 22:45;1;2;"ECB shd indeed be worried about bank share prices: u squeeze profitability, share price down, lending less http://on.ft.com/2b6MhCY via @ FT"
ErikFossing;2016-08-18 19:57;2;1;"Great piece by @ MESandbu (prob clearer for us Danes in UK) - trust me! Free Lunch: Old country vs New World http://on.ft.com/2bE06f7 via @ FT"
ErikFossing;2016-08-18 05:46;2;1;"Hilarious!https://twitter.com/elliosch/status/766021223415439361 …"
ErikFossing;2016-08-18 00:47;0;0;"It's getting better and better. Would be easier for him to say who he does trust!https://twitter.com/thehill/status/765952855287197696 …"
ErikFossing;2016-08-17 23:00;0;2;"Time to kill this stupid thing and begin to provide clarity and predictability for the financial sector!https://twitter.com/nicolas_veron/status/765923629691469824 …"
ErikFossing;2016-08-17 21:56;1;1;"Seems Trump has 3 problems: 1 No coherent policy, 2 personality, 3 political amateur. Trump shakes up team http://on.ft.com/2bqGis7 via @ FT"
ErikFossing;2016-08-17 20:52;0;1;"Good job, Perry, remembering his name.https://twitter.com/thehill/status/765892222529273857 …"
ErikFossing;2016-08-17 20:30;0;0;"Very funnyhttps://twitter.com/huffingtonpost/status/765804559356817409 …"
ErikFossing;2016-08-17 20:01;0;3;"Great. So now they have sorted out who the good and bad guys are.https://twitter.com/huffingtonpost/status/765880385200848896 …"
ErikFossing;2016-08-17 19:45;0;1;"Time for US (and Europe) to stop being naive about Russian meddling in Dom politics. Easy to legislate against.https://twitter.com/thehill/status/765875584912257024 …"
ErikFossing;2016-08-17 19:41;1;0;"Sometimes it's better not to plan and legislate everything ex ante. And yes,if speculative attack, solidarity neededhttps://twitter.com/jandritzky/status/765865961866092548 …"
ErikFossing;2016-08-17 00:18;2;1;"Civilised society w well functioning market economy all have a risk free rate - b/c those govns don't default.https://twitter.com/jandritzky/status/765541311323729920 …"
ErikFossing;2016-08-16 21:19;0;0;"Right - a "credit" it is - like 3 big financials and 5 major corporates defaulting simultaneously, maybe!https://twitter.com/jandritzky/status/765536011686379521 …"
ErikFossing;2016-08-16 21:18;0;1;"Right, but one hell of a big "credit" - show me Europe scenario w German, French or Italian sov debt restructuring.https://twitter.com/jandritzky/status/765536011686379521 …"
ErikFossing;2016-08-16 20:41;1;2;"Dangerous to play w fire. Sovereigns not like any other credit: They are mirror imagine of the economy.https://twitter.com/jandritzky/status/765525401271689216 …"
ErikFossing;2016-08-16 20:37;0;0;"Happy to take the other side (for the time being)https://twitter.com/yahoofinance/status/765527482376257536 …"
ErikFossing;2016-08-16 16:58;1;2;"That's exactly right - European banks okay (we have infrastructure already) - US, UK, Asian banks in tough spot.https://twitter.com/flacqua/status/765441782729572352 …"
ErikFossing;2016-08-15 15:26;1;1;"Great piece by @ D_Schwarzer: Resilience is important for societies as well as individuals http://on.ft.com/2brWhtt via @ FT"
ErikFossing;2016-08-14 18:07;1;1;"Parallel universe!https://twitter.com/thehill/status/764763765820751872 …"
ErikFossing;2016-08-14 17:44;0;1;"Great piece by Portes. Yes, EU-27 may become flexible after elections, but their immigration issue all about non-EUhttps://twitter.com/wef/status/764102923777404929 …"
ErikFossing;2016-08-14 17:04;1;1;"Reflecting Brexiteer issues, or just two extraordinarily difficult and narcissistic personalities?https://twitter.com/jolyonmaugham/status/764579583437996032 …"
ErikFossing;2016-08-13 19:55;0;0;"Haha - good one. (For the record, I'm primarily a UK taxpayer)https://twitter.com/matthewbray16/status/764414504683712512 …"
ErikFossing;2016-08-13 17:55;1;0;"Who sh carry cost? UK taxpayers or Chinese investors? When UK lost on Iceland scam, U.K. Govn forced Iceland to pay.http://www.reuters.com/investigates/special-report/china-investment-eurofx/?utm_source=twitter&utm_medium=Social …"
ErikFossing;2016-08-13 17:49;1;0;"Wow: Only an American could say that: 2nd Amendm "to defend ourselves against our own government." http://www.huffingtonpost.com/entry/us-olympic-star-kim-rhode-shoots-down-gun-control_us_57ad9b8ee4b069e7e504b0b1?ncid=tweetlnkushpmg00000016&section=politics …"
ErikFossing;2016-08-13 02:22;2;2;"If this is his level of information gathering and analysis -my God, am I happy that I'm not invested with this dude!http://fortune.com/2016/08/11/gundlach-clinton-wikileaks/ …"
ErikFossing;2016-08-13 02:16;2;3;"Hilarious! - maybe Boris, Fox or Davis would like to comment though?https://twitter.com/chrisgiles_/status/764122764785623041 …"
ErikFossing;2016-08-12 03:51;1;0;"Great idea and timing (so long as money is well spent) Renzi eyes fresh stimulus package for Italy http://on.ft.com/2b8uJpe via @ FT"
ErikFossing;2016-08-12 03:35;1;0;"Why does Giuliani seem so intend on destroying his reputation?https://twitter.com/thehill/status/763820796250820608 …"
ErikFossing;2016-08-12 03:34;1;1;"What's your guess, James? After Spain and Portugal - and staring at the alternative to Renzi in Italy!https://twitter.com/jamespoliti/status/763819155497816065 …"
ErikFossing;2016-08-12 02:59;0;0;"My Gosh! You really do have short fingers!https://twitter.com/politico/status/763809749594939392 …"
ErikFossing;2016-08-12 02:58;0;3;"Good for him. People his age, who have spent their life in public service, deserves a house on the lake! Seriously.https://twitter.com/flacqua/status/763803559863476230 …"
ErikFossing;2016-08-11 23:40;0;0;"The oddest of bed fellows....https://twitter.com/ianbremmer/status/763698644973395968 …"
ErikFossing;2016-08-11 00:43;1;1;"In 2007, Trump was forced to own up to his falsehoods. And he did. Sort of. - great piece from the Washington Post https://www.washingtonpost.com/graphics/politics/2016-election/trump-lies/ …"
ErikFossing;2016-08-10 20:47;0;1;"So far US told UK to wait, China threatens relationship, Norway to block EFTA access. Where are all the new friends?https://twitter.com/simon_nixon/status/763354232951074816 …"
ErikFossing;2016-08-10 20:40;0;0;"How does short term sub-letting help the housing shortage?https://twitter.com/jandritzky/status/763303870588186624 …"
ErikFossing;2016-08-09 03:31;1;1;"Hm, Brexiteers, what now? You told us UK big enough to stand up on its own. China warns UK on nuclear deal http://on.ft.com/2aGPVDo via @ FT"
ErikFossing;2016-08-07 02:48;0;1;"Hilarious- has Trump been anything but negative from day one?https://twitter.com/theonion/status/761976404795858944 …"
ErikFossing;2016-08-07 02:46;2;1;"Keep going, Chris! Someone has to keep them accountable.https://twitter.com/chrisgiles_/status/761965644531298304 …"
ErikFossing;2016-08-06 19:54;1;0;"Agreed - but before just asking for risk sharing, let's define who is at risk and how much. Will make sharing easier https://twitter.com/angelubide/status/761881704638341121 …"
ErikFossing;2016-08-06 18:59;1;1;"Let's end the use of these catchy phrases (risk reduction vs sharing). Rather: how much risk is okay and to whom? https://twitter.com/angelubide/status/761856045526446080 …"
ErikFossing;2016-08-05 18:24;1;3;"Oh Clint, I used to love your tough guy acting, but don't go spoil your reputation as a good human being.https://twitter.com/flacqua/status/761455413107781632 …"
ErikFossing;2016-08-04 15:22;1;2;"Wow - you are hopefully not suggesting that it hasn't already been cast (way) too wide?https://twitter.com/tjagland/status/761098428516474880 …"
ErikFossing;2016-08-03 15:41;1;1;"Who would buy Bitcoin anyway?What's the underlying asset! Bitcoin plunges after Hong Kong hack http://on.ft.com/2aOFilf via @ FT"
ErikFossing;2016-08-03 03:15;1;3;"Best news of the day!https://twitter.com/thestalwart/status/760552514295099392 …"
ErikFossing;2016-08-03 02:36;1;0;"Forgive my ignorance, but isn't the Japanese decease all about demographics (ch per cap GDP) and structural rigid?https://twitter.com/kingeconomist/status/760542654681710592 …"
ErikFossing;2016-08-02 18:09;1;2;"Right - and because of the increasing (if misled) focus on "fiscal room".https://twitter.com/imateosylago/status/760378467540168704 …"
ErikFossing;2016-08-02 18:04;2;1;"Surprising King would work for bank - shocking that neither he nor Citi announced it. Good work @ FT spotting ithttps://twitter.com/tommaso_arenare/status/760384594084524032 …"
ErikFossing;2016-08-02 02:50;1;1;"I know you call yourself a "provocateur", but this degree of gross simplification adds nothing to the thinking.https://twitter.com/baldingsworld/status/760184379478016000 …"
ErikFossing;2016-08-01 16:52;1;1;"Sounds like usual EU bashing nonsense. Is un-reg taxi good? +Uber works well in Berlin in coop w normal taxis.https://twitter.com/daveg/status/760030371035672580 …"
ErikFossing;2016-08-01 16:26;0;2;"If it isn't real, Trump should be able to release his tax returns. (And why the GOP change on Ukraine?)https://twitter.com/flacqua/status/759843672393342976 …"
ErikFossing;2016-08-01 14:03;1;0;"What poll is that? The ARD on July 7 (latest) had her number jump to 59%. (PS "approval" can't apply to opposition)https://twitter.com/wess_mitchell/status/759905154321686529 …"
ErikFossing;2016-08-01 05:08;3;7;"Show me any other political leader in democracy with free press - and an approval rating matching Merkel's https://twitter.com/ande_coach/status/759853055969853440 …"
ErikFossing;2016-08-01 00:17;1;0;"True, although more than election. There were the con't job creation, Iran deal, Cuba opening - the Seinfeld show...https://twitter.com/thestalwart/status/759743345925222400 …"
ErikFossing;2016-07-31 20:17;1;0;"When did "support" begin to mean "obligation"?https://twitter.com/jonathanalgar/status/759723426948919298 …"
ErikFossing;2016-07-31 17:09;5;9;"You need update: MPS well known +announced cap increase (support by JP et al) on Friday. Bad surprise was Ireland.https://twitter.com/nebuer42/status/759675858000814080 …"
ErikFossing;2016-07-31 04:47;1;4;"Horrible horrible answer by a self-consumed man apparently incapable of showing any respect for even this poor man.https://twitter.com/sopandeb/status/759463389202640896 …"
ErikFossing;2016-07-31 02:22;2;3;"With all respect, this is completely mad: We shouldn't listen to - or take serious - what a candidate says?https://twitter.com/baldingsworld/status/759446241432395780 …"
ErikFossing;2016-07-31 01:56;2;4;"You need better sources than British tabloid! Approx 1000 turned up inBerlin - and another 1000 demo for solidarityhttps://twitter.com/wess_mitchell/status/759437436581613569 …"
ErikFossing;2016-07-30 05:21;2;0;"By any measure, this feels troublesome.https://twitter.com/cnn/status/759136420422352897 …"
ErikFossing;2016-07-30 05:20;6;5;"No great shocks in EBA's bank stress tests. On Bloomberg Surveillance w @ flacqua and @ tomkeene Monday morning to discuss what it all means."
ErikFossing;2016-07-29 17:19;1;4;"Let's have a vote: who has the best looking green bow tie? Tom or Robert?https://twitter.com/bsurveillance/status/758954464053080067 …"
ErikFossing;2016-07-28 17:45;0;0;"That's a great staircase to have - if you struggle to remember who you are!https://twitter.com/politico/status/758597887274123264 …"
ErikFossing;2016-07-28 17:43;1;2;"Kevin Spacey's House Of Cards character would call it "POWERRR!"https://twitter.com/politicoeurope/status/758594144822525952 …"
ErikFossing;2016-07-28 17:36;0;0;"FFG - Convenient term for someone not knowing if they are the central bank for their country or for the world.https://twitter.com/richardbarley1/status/758593818845413376 …"
ErikFossing;2016-07-28 17:24;1;0;"It's been simmering for a while nowhttps://twitter.com/imateosylago/status/758432567557255168 …"
ErikFossing;2016-07-28 17:22;3;2;"Remember they started with 4 expected hikes in 2016 - now "probably" 1. What type of (forward) guidance is that?https://twitter.com/guntramwolff/status/758591013116121089 …"
ErikFossing;2016-07-28 04:06;1;3;"... And now go persuade markets to add capital because future is brighter - oh what part of the future?https://twitter.com/jmackin2/status/758357841694617601 …"
ErikFossing;2016-07-28 03:57;0;1;"Missing Berlin - but Biarritz is not a bad (temporary) substitute.https://twitter.com/germanydiplo/status/758386804886241280 …"
ErikFossing;2016-07-27 23:03;0;2;"Of course you do. Because if they have them then you have them!https://twitter.com/politico/status/758316302272454657 …"
ErikFossing;2016-07-27 23:01;1;2;"Great @ FT piece new @ UniCredit research of EM opportunities: Ethiopia seen as hottest market for exporters http://on.ft.com/2a4NxW5 via @ FT"
ErikFossing;2016-07-27 20:12;0;0;"Maybe fair but how do u know specific NPLs are above mkt price? - and how do u determine right price for start-up?https://twitter.com/ferdigiugliano/status/758228986220740608 …"
ErikFossing;2016-07-27 16:22;1;2;"I love the US, but their elusion of what "freedom" is makes me cry. Remember "freedom fries"? Now "freedom kids".https://twitter.com/thehill/status/758214360183504896 …"
ErikFossing;2016-07-27 16:17;0;0;"Fox scoring cheap headlines. Only talk so long as deal w EU27 unknown : Whitehall split on a UK exit http://on.ft.com/2ahREBk via @ FT"
ErikFossing;2016-07-27 16:12;3;5;"Latest version of silly France-bashing. From previous reports, one would doubt the French even work 210 days a yearhttps://twitter.com/politicoeurope/status/758030443761561600 …"
ErikFossing;2016-07-27 16:08;0;1;"Anyone worrying about this only needs to ask Moscow how their East orientation is going - oh, and their gas deal.https://twitter.com/bruegel_org/status/758203569099210753 …"
ErikFossing;2016-07-27 02:53;1;0;"Link is for sure - only the extent and obligation to pay back in politics are unknownshttps://twitter.com/thehill/status/758009754107125760 …"
ErikFossing;2016-07-27 02:51;0;0;"Ha ha - surprising statement!https://twitter.com/thehill/status/758010506238124032 …"
ErikFossing;2016-07-26 04:36;2;6;"Excellent piece by @ D_Schwarzer - US and France should learn: Germany is reacting to the attacks with calm http://on.ft.com/2a4MndZ via @ FT"
ErikFossing;2016-07-25 20:30;0;1;"Troublesome - but can Turkish media be trusted after latest round-up of journalist by government?https://twitter.com/rodrikdani/status/757549173633851393 …"
ErikFossing;2016-07-25 17:45;0;1;"Hi Alessandro, come join me here on the Danish coast: No exhaustion or burnout in sight from here!https://twitter.com/merlialess/status/757510959917330432 …"
ErikFossing;2016-07-25 17:43;0;1;"How can this be compatible with even the pretence of EU candidacy? https://twitter.com/fercany/status/757501038509318144 …"
ErikFossing;2016-07-25 17:39;0;0;"Check out Trump's Russia connections: Trump Jr says "lots of Russian money" in firm + Manafort -> Yanakovych https://twitter.com/pmarca/status/757332002542465024 …"
ErikFossing;2016-07-25 17:31;0;0;"Hey UK! No need to be EU members to enjoy great well-being. You just need to follow the EU rules. And be chilled!https://twitter.com/theeconomist/status/757502924884963328 …"
ErikFossing;2016-07-25 17:12;0;0;"Forget high taxes, big Govn, poor weather and global power - when it comes to well-being, Norway's got the formula!https://twitter.com/theeconomist/status/757502924884963328 …"
ErikFossing;2016-07-25 16:39;1;6;"NEIN !!!!!!!https://twitter.com/norberthaering/status/757487488449601536 …"
ErikFossing;2016-07-25 16:27;1;1;"The man to follow....https://twitter.com/yannikouts/status/757476998658875392 …"
ErikFossing;2016-07-24 21:22;1;0;"Im aware. So, your conclusion is any new thinking must be opposed without waiting for the details eg price oh NPLs?https://twitter.com/erik_jones_sais/status/757196634254143488 …"
ErikFossing;2016-07-24 20:00;2;1;"Yeah, that's the heading that sells papers - only problem is this tragedy had nothing to do w Muslim immigrationhttps://twitter.com/theeconomist/status/757179321324867584 …"
ErikFossing;2016-07-24 19:54;1;0;"Completely agree, but there is no unified market w price determination. Assuming due diligence, what's wrong w this?https://twitter.com/axachiefecon/status/757156831059931136 …"
ErikFossing;2016-07-24 17:58;0;0;"Yes Mr Hammond, EU-27 (and the rest of the world) is waiting to hear what it is you want from others!http://www.politico.eu/article/phillip-hammond-a-clearer-path-to-brexit-later-this-year-g20-eu/?utm_content=buffercb967&utm_medium=social&utm_source=twitter.com&utm_campaign=buffer …"
ErikFossing;2016-07-24 17:54;1;0;"Yes, multiple objectives. No, there is not yet an efficient market in NPLs. But don't shoot down b/f facts are knownhttps://twitter.com/smerler/status/757135347797135360 …"
ErikFossing;2016-07-24 16:43;1;0;"Pension funds basically insolvent b/c of "no risk" policy. Putting risk on their books is good - at the right pricehttps://twitter.com/smerler/status/757133040711761920 …"
ErikFossing;2016-07-24 16:37;1;1;"Hold on! At the right price this isn't bad. Forcing pensioners to buy bunds + other AAA stuff is the dangerous stuffhttps://twitter.com/smerler/status/757131098711285760 …"
ErikFossing;2016-07-24 05:19;0;1;"@ Telegraph's strange reporting: what fighting for survival? Merkel's approval rating recently jumped 9pp to 59%!https://twitter.com/telegraph/status/756955939958321152 …"
ErikFossing;2016-07-24 05:13;1;0;"Hmm - Trump and Russia. Worth a read. Trump http://talkingpointsmemo.com/edblog/trump-putin-yes-it-s-really-a-thing … via @ TPM"
ErikFossing;2016-07-24 04:45;0;1;"An unusually blunt - but fully deserved - editorial from the Washington Post. America needs to speak up! https://www.washingtonpost.com/opinions/donald-trump-is-a-unique-threat-to-american-democracy/2016/07/22/a6d823cc-4f4f-11e6-aa14-e0c1087f7583_story.html …"
ErikFossing;2016-07-23 19:52;1;3;"And that's why I so rarely read @ Telegraph - why this nonsense?https://twitter.com/chrisgiles_/status/756749570588180480 …"
ErikFossing;2016-07-23 19:37;1;2;"And that's why u advocated Brexit! But even cricket is less beautiful in recession! Oh, those hit are football fanshttps://twitter.com/spectator/status/756814018040434688 …"
ErikFossing;2016-07-23 19:30;1;0;"Indeed - w stress tests, poor communication and general risk-off mood, the banks were hit - but excessively so.https://twitter.com/indiatro/status/756799558865264640 …"
ErikFossing;2016-07-23 17:46;2;0;"Periphery impacted ONLY via bank sell-off, but being corrected now. With except Ireland, no other measurable impacthttps://twitter.com/lady_crypto/status/756766517312839680 …"
