ErikFossing;2017-09-10 23:11;1;3;"More broadly, women are a lot less likely to vote for extreme parties. Let's get more involvement in active politics by women.https://twitter.com/doberah/status/906830761038422016 …"
ErikFossing;2017-09-10 20:52;1;4;"Sunday Wrap is back: Bermuda Triangle for markets btw great econ outlook, confusing cent banks, terrible geopolitics.pic.twitter.com/XV0WwWMVkU"
ErikFossing;2017-09-10 18:51;34;57;"The absurd degree of dis-information contained in UK tabloids begins to explain why the UK voted Brexit - and why the future is grim.https://twitter.com/skynews/status/906635566871187456 …"
ErikFossing;2017-09-09 03:49;0;2;"Hilarious. This is a man now realising that all his pre-referendum posturing was just that: Posturing. A pile of no-knowledge bravado bs.https://twitter.com/business/status/906242266012024832 …"
ErikFossing;2017-09-09 03:46;0;2;"What I want is to hear the German finance ministry and the IMF to sort out their differences on debt relief.https://twitter.com/financialtimes/status/906208746849923072 …"
ErikFossing;2017-09-09 00:52;2;7;"Hmm, I would have thought now would be an excellent time to talk about it - actually one of the best times to talk about it.https://twitter.com/thehill/status/906192432538284032 …"
ErikFossing;2017-09-08 23:21;1;3;"Who really gives a flying f... what this rambling idiot with no respect for facts is saying?https://twitter.com/daily_politics/status/906122855716237312 …"
ErikFossing;2017-09-07 21:47;0;1;"Hi Lloyd, what happened to your hair?https://twitter.com/lloydblankfein/status/905770862573441024 …"
ErikFossing;2017-09-07 04:36;5;20;""The things you do for love..."https://twitter.com/carlbildt/status/905474146003509248 …"
ErikFossing;2017-09-07 04:29;0;1;"With all respect to the Finns, I rather doubt the decision was based on a poll of staff to decide between Copenhagen, Stockholm and Helsinkihttps://twitter.com/nicolas_veron/status/905512752885760000 …"
ErikFossing;2017-09-07 03:56;1;4;"Anyone lucky enough to have interacted w Stanley Fischer surely thinks of him as one of the smartest + nicest people https://amp.ft.com/content/958a2a84-9314-11e7-a9e6-11d2f0ebb7f0 …"
ErikFossing;2017-09-07 02:48;0;1;"True, and in many other countries, helped when they had fled bad conditions in Hungary. Hungary then received tons of help from EU - alas.https://twitter.com/angiecavezzan/status/905494056251293696 …"
ErikFossing;2017-09-07 02:08;0;4;"As someone having work on (and believed in) CEE transition to EU world, this is just so hard to read! – POLITICO http://www.politico.eu/article/hungary-says-ecj-ruling-on-refugee-quotas-has-raped-eu-law-asylum-seekers-italy-greece-relocation-scheme/amp/ …"
ErikFossing;2017-09-06 23:58;0;2;"Is anyone really serious that this guy has a role in government?guardian's video https://instagram.com/p/BYsw7d5hKJk/"
ErikFossing;2017-09-06 02:03;0;0;"About right! Juncker slaps down Orbán over border funding request – POLITICO http://www.politico.eu/article/juncker-slaps-down-orban-over-border-funding-request/amp/ …"
ErikFossing;2017-09-06 02:00;1;9;"All you Dreamers, come to Europe!https://twitter.com/thehill/status/905127343898980353 …"
ErikFossing;2017-09-06 01:45;0;0;""changed ... conversation" seems a too generous characterisation. "Merged facts and fiction with specific aim" seems more accuratehttps://twitter.com/politico/status/905123897242251265 …"
ErikFossing;2017-09-06 01:43;0;1;"Sure, but cutting funding is hardly the solution. Indeed, whatever the solution is, it's likely to cost money.https://twitter.com/annadi_mario/status/905118733127077888 …"
ErikFossing;2017-09-06 01:38;0;0;"Me too - I'm surprised by the market reaction. Her statement didn't provide any news in terms of her and eg Dudley's views.https://twitter.com/elerianm/status/905122000426766336 …"
ErikFossing;2017-09-06 01:17;0;4;"Hoping for another "climate Macron" statement: any US Dreamer w education and job, you are welcome in EU | The Verge https://www.theverge.com/platform/amp/2017/9/5/16236602/daca-repeal-tech-companies-speaking-out-against-trump …"
ErikFossing;2017-09-06 01:12;0;3;"Different issue! (And may I say: I'm so sick and tired of this type of points every time a discussion of fiscal priorities is attempted.)https://twitter.com/annadi_mario/status/905110606344224770 …"
ErikFossing;2017-09-06 00:39;0;2;"You mean when you were the only member of Parliament?https://twitter.com/chrismullinexmp/status/904792114365702145 …"
ErikFossing;2017-09-06 00:34;1;4;"Time to move away from this primitive accounting approach to fiscal policy. Surely, investment and edu spending not the same as consumptionhttps://twitter.com/guntramwolff/status/905104960538517504 …"
ErikFossing;2017-09-05 16:00;3;4;"Hopeless pessimist! - If not hit by ext shock, Eurozone growth will remain > trend for at least another 18-24 months as investments kick inhttps://twitter.com/fwred/status/904975719238918144 …"
ErikFossing;2017-09-05 14:19;1;3;"Answer is simple: If you don't have access to information on which you can form an opinion about demand and supply ... Don't.https://twitter.com/skandistreet/status/904830851158040576 …"
ErikFossing;2017-09-05 04:42;1;4;"PBOC first important authority to say what we all know (and act accordingly): Bitcoin is not a currency! The emperor has no cloth on!https://twitter.com/flacqua/status/904798485786054657 …"
ErikFossing;2017-09-05 01:52;0;1;"Hold on! This reflects the different household income levels - that's where the divide is, not in tech aspirationshttps://twitter.com/politicoeurope/status/904761001370890240 …"
ErikFossing;2017-09-05 01:47;1;0;"Agreed. Virtually useless info.https://twitter.com/isabel_schnabel/status/904760512398884864 …"
ErikFossing;2017-09-05 01:34;0;1;"Truehttps://twitter.com/o530carrispt/status/904749331563110401 …"
ErikFossing;2017-09-04 21:44;1;1;"For what year?https://twitter.com/ralphatkins/status/904698237457747968 …"
ErikFossing;2017-09-04 19:34;1;1;"And the House of Lords and the MPC ....https://twitter.com/sonykapoor/status/904666277138063360 …"
ErikFossing;2017-09-04 19:09;1;5;"Did someone forget to tell them that they have joined the Eurozone?https://www.cnbc.com/2017/08/23/estonia-cryptocurrency-called-estcoin.html …"
ErikFossing;2017-09-04 18:38;0;2;"Crazy! Which part of the domestic UK debate has prevented UK government from defining their position, or helped EU in their negotiations?https://twitter.com/suzanneevans1/status/904358365094084609 …"
ErikFossing;2017-09-04 18:28;0;2;"Sounds like polite version of Trump: Tough general talk, but unable to provide any details - or results, for that matter.https://twitter.com/marrshow/status/904268532103315457 …"
ErikFossing;2017-09-04 18:25;4;5;"It's German internal revaluation getting under way! The periphery did its part by internal deval, now German private sector doing theirs.https://twitter.com/fwred/status/904640979885592576 …"
ErikFossing;2017-09-04 18:23;0;4;"If I were in charge of banners at linkswende, then I would chose a different font than the one used by Coca Cola.https://twitter.com/mfratzscher/status/904647686795792384 …"
ErikFossing;2017-09-04 17:16;0;1;"Ouch (if any confusion still existed in the U.K. Brexit camp).https://twitter.com/stefanleifert/status/903557218540429313 …"
ErikFossing;2017-09-04 16:25;0;1;"Davis commits to "moral" obligations, not necessarily "legal" ones - who'll be the judge? Banana Republic https://www.ft.com/content/8886b358-908e-11e7-a9e6-11d2f0ebb7f0 … via @ FT"
ErikFossing;2017-09-04 04:43;1;2;"I find it amazing that the small parties are not included, some of which have very real possibility of entering next coalition.https://twitter.com/alauraschneider/status/904441849154293763 …"
ErikFossing;2017-09-04 04:21;0;0;"He is not the only one finding the UK leadership clueless.https://twitter.com/zschneeweiss/status/904437573132668928 …"
ErikFossing;2017-09-04 03:04;2;3;"Great picture of amateurish policy. Maybe listening to "the experts" actually does make sense when considering policy changes!https://twitter.com/schuldensuehner/status/904285940541251584 …"
ErikFossing;2017-09-03 22:24;0;1;"Can one be confident that he and Trump know the difference between North and South Korea?https://twitter.com/politico/status/904347362671431680 …"
ErikFossing;2017-09-03 21:34;0;1;"Don't breath!https://twitter.com/mmpiatkowski/status/904336096300904448 …"
ErikFossing;2017-09-03 20:52;0;2;"Spent summer in French, German + Danish regions, marvelling quality of life outside capitals. Data from @ thomasforthpic.twitter.com/3fG32M4Eg3"
ErikFossing;2017-09-03 19:33;20;31;"Wow, that's some statement! (If you are familiar with the facts). US has worse social mobility than any European country.https://twitter.com/speakerryan/status/904008582290710528 …"
ErikFossing;2017-09-03 18:15;2;3;"I hope you are right. And I hope the 70% of Poles favouring EU do so for the values, rather than for the money. ... and happy birthday!https://twitter.com/mmpiatkowski/status/904166780481847296 …"
ErikFossing;2017-09-03 17:36;0;7;"Better question: Where is the Brexit-advocates' comparison of what they promised vs where we are today? State of negotiations, the economy?https://twitter.com/afneil/status/903582346938605568 …"
ErikFossing;2017-09-03 05:34;1;3;"Right - but yet, fiscal entity really only needed for Eurozone. EU payments for CEE didn't work so well, and ag subsidies ... hmm. https://twitter.com/angelubide/status/904088224389140481 …"
ErikFossing;2017-09-03 00:08;2;2;"I thought Swiss watches belonged to these wonderful goods where demand goes up, the more they cost!https://twitter.com/ralphatkins/status/904001398244769796 …"
ErikFossing;2017-09-02 18:51;1;2;"Is this for real? Trump Calls On A Bunch of Religious Leaders to Thank Him For His Harvey Efforts | Mediaite https://www.mediaite.com/tv/watch-as-trump-calls-on-a-bunch-of-religious-leaders-to-thank-him-for-his-harvey-efforts/amp/ …"
ErikFossing;2017-09-02 04:27;0;2;"I believe Denmark is putting this right in the qualifier right now against Poland ... 4-0. Just saying."
ErikFossing;2017-09-02 03:38;3;9;"As we at UniCredit have argued ad nauseum, Eurozone recovery would come, and EUR/USD at 1.20 is no problem https://www.ft.com/content/a67b0f66-8eff-11e7-9084-d0c17942ba93 … via @ FT"
ErikFossing;2017-09-02 03:30;0;1;"He even took a swipe at English football - so unfair ... oh wait a minute. England seems to struggle in their match now against Malta!https://twitter.com/kingeconomist/status/903694506511433729 …"
ErikFossing;2017-09-02 01:18;2;4;"Excellent interview. "Go gradual" to dieselgate justified by "expensive + technic difficult" argument. Didn't hear that for financial crisishttps://twitter.com/spiegel_english/status/903651709280333829 …"
ErikFossing;2017-09-02 00:55;0;0;"Great interview @ adsteel - so, on taxes, it's trickle-down (hmm) and he thinks growth can accelerate. (And doesn't rule out Fed job.)https://twitter.com/bpolitics/status/903658233310490624 …"
ErikFossing;2017-09-01 23:54;5;6;"More importantly, it's a sign of the ongoing much needed "internal revaluation" in Germany. Periphery did their int deval, now Germanys turnhttps://twitter.com/francescopapad1/status/903632306488958976 …"
ErikFossing;2017-09-01 18:47;0;0;"I would have thought that such a claim (true or not) would imply a freezing of all relations. Isn't safety of citizens objective number 1?https://twitter.com/alauraschneider/status/903561469110968320 …"
ErikFossing;2017-09-01 17:56;3;5;"D'oh! Enlightening is slowly coming to the Brexit camp! (Out of curiousity, is the UK interested in a deal that benefits anyone but the UK?)https://twitter.com/iaindale/status/903247466413350912 …"
ErikFossing;2017-09-01 03:05;0;0;"Said many times before, but this really is a strange set-up in the US these days.https://www.washingtonpost.com/world/national-security/with-a-drama-filled-white-house-mad-dog-mattis-has-shown-deft-political-touch/2017/08/30/f87621f8-8d96-11e7-8df5-c2e5cf46c1e2_story.html …"
ErikFossing;2017-09-01 01:15;0;1;"That's one way of seeing it. But I would suggest that if the gap was 100km 4 months ago, its no more than 10 km today.https://twitter.com/guntramwolff/status/903296133753122818 …"
ErikFossing;2017-08-31 23:22;0;1;"My guess is that Barnier reflects in reality, and Davis BS again. At no time have I heard the UK say anything concrete about what they want.https://twitter.com/ferdigiugliano/status/903217298806321154 …"
ErikFossing;2017-08-31 19:13;0;1;"We all agree with that - but where is there someone who can lead? From either side!https://twitter.com/george_osborne/status/903208141051109380 …"
ErikFossing;2017-08-31 19:11;0;1;"I don't blame them!https://twitter.com/doberah/status/903212284645957632 …"
ErikFossing;2017-08-31 15:34;1;3;"Absurd! Are you aware what the payments are for? COMMITMENTS made by the U.K.! Good luck to UK w MPs with such ignorance (or attitude)https://twitter.com/johnredwood/status/902819188527558656 …"
ErikFossing;2017-08-31 15:32;0;2;"Right - and eurozone "struggles" with the opposite: High participation rate (which explains big part of unemployment problem)https://twitter.com/bv/status/902633691083657217 …"
ErikFossing;2017-08-31 05:48;0;3;"And that's why we love Berlin!https://twitter.com/doberah/status/902993335870263298 …"
ErikFossing;2017-08-30 19:26;0;1;"At least they didn't cook the Target-2 nonsense that both ECB+Buba had to clarify. (+ see @ handelsblatt "falsche Prophet" Jan-15.)https://twitter.com/isabel_schnabel/status/902807639406587905 …"
ErikFossing;2017-08-30 16:04;0;1;"Or Greens? (Could Diesel gate throw a surprise)https://twitter.com/imateosylago/status/902801465416327169 …"
ErikFossing;2017-08-30 15:23;0;0;"I had hoped we were beyond "sides" in order to focus on fundamental issues, and get them broadly right.https://twitter.com/isabel_schnabel/status/902665770475380742 …"
ErikFossing;2017-08-30 05:21;1;1;"The US' support in WW1+2 hugely appreciated (and forever grateful) - Vietnam + Iraq not so much.https://twitter.com/robertgleeson1/status/902640732221181954 …"
ErikFossing;2017-08-30 04:44;0;1;"Hilarious - coming from a country (and apparent Trump supporter) who never criticise other countries or leaders - or?https://twitter.com/robertgleeson1/status/902617826623664128 …"
ErikFossing;2017-08-30 04:00;2;6;"And for a sounder and more balanced assessment of Europe and the ECB, it's worth visiting Berlin's @ DIW_Berlin ...https://twitter.com/zschneeweiss/status/902620669481017346 …"
ErikFossing;2017-08-29 21:57;1;3;"I thought @ handelsblatt had more accurate story on Hans Werner Sinn on 16 Jan 2015. Their 12-page piece was tittled: "Der Falsche Prophet"https://twitter.com/nicolas_veron/status/902402497830105088 …"
ErikFossing;2017-08-29 21:02;4;6;"... which explains why German public investments have been chopped and pensions boosted. Good politics, but terrible economics.https://twitter.com/marceldirsus/status/902259797130489856 …"
ErikFossing;2017-08-28 19:18;0;1;"Happy 60-birthday, Ai Weiwei ! @ aiww - and thanks for great piece in Copenhagen.pic.twitter.com/6yDTWAAf2z"
ErikFossing;2017-08-28 19:15;0;0;"Interesting piece, but Schröder parallel is a push. Anti-Iraq war not same as anti-Trump.https://twitter.com/tonybarber8/status/902062014087954432 …"
ErikFossing;2017-08-24 14:28;0;0;"Great piece: China reform plans could be stifled as economy cools https://amp.ft.com/content/ba01cd3e-87ea-11e7-8bb1-5ba57d47eff7 …"
ErikFossing;2017-08-23 05:33;0;2;"If you buy 5 or 10 year BTPs in anticipation the ECB will be there for you through the life of that bond you are part of strange minorityhttps://twitter.com/markus_krall/status/900107782086680577 …"
ErikFossing;2017-08-23 05:28;1;1;"I don't think the ECB "will go ballistic" - rather, they'll simply shake their heads about this voodoo nonsense.https://twitter.com/jandritzky/status/900094377359495168 …"
ErikFossing;2017-08-23 05:26;1;1;"Parallel currency: A profoundly absurd idea! https://amp.ft.com/content/4f663332-ecdb-3e99-9134-fe0813c5095c …"
ErikFossing;2017-08-23 05:16;3;3;"It doesn't surprise me. Lots of empirical work show little (if any) significance of debt levels (in these ranges) for spreads. https://twitter.com/jandritzky/status/900092247571668993 …"
ErikFossing;2017-08-22 23:22;1;2;"Probably a whole lot more telling about her feelings on this than the humorous word choice suggests. (Good for upcoming talks w Macron)https://twitter.com/patrickjdo/status/900004981184573440 …"
ErikFossing;2017-08-22 05:04;0;1;"Magic!https://twitter.com/guntramwolff/status/899731455139565570 …"
ErikFossing;2017-08-22 04:19;0;5;"Please do!https://twitter.com/thehill/status/899722291222900736 …"
ErikFossing;2017-08-22 03:06;0;0;"Guilty Man by Nina L. Khrushcheva via @ ProSynhttp://prosyn.org/s27SrM6"
ErikFossing;2017-08-22 01:49;0;3;"Indeed. At the same time puzzling to see the Europe-sceptical majority in Czech Rep, while Slovakia (doing better economically) embrace EUhttps://twitter.com/johnsimpsonnews/status/899582384886218756 …"
ErikFossing;2017-08-19 03:50;0;5;"What you mean? German Chancellor Merkel was the first foreign leader to raise concern about Trump!https://twitter.com/ianbremmer/status/898628554161659905 …"
ErikFossing;2017-08-19 03:21;0;1;"Trump decided - or Murdoch decided?https://twitter.com/flacqua/status/898588960431144962 …"
ErikFossing;2017-08-19 03:18;0;2;"Latest from Chinese authorities, which otherwise seem so admired ...https://twitter.com/johnsimpsonnews/status/898586548433637378 …"
ErikFossing;2017-08-16 05:27;0;3;"High time for GOP leaders to take a stand against their POTUShttps://twitter.com/thehill/status/897569106496540672 …"
ErikFossing;2017-08-16 05:23;0;1;"Well, no more Pepsi stuff for me .....https://twitter.com/business/status/897560164324265984 …"
ErikFossing;2017-08-16 05:22;0;0;"Well, no more Pepsi stuff for me .....https://twitter.com/business/status/897560164324265984 …"
ErikFossing;2017-08-15 15:50;0;1;"He is in right: see @ CCTV announce "4 great Chinese inventions" (fast train, online shop, shared bikes, e-pay) - none of w invented in Chinahttps://twitter.com/ft/status/897306882297262080 …"
ErikFossing;2017-08-15 14:29;2;4;"So, that's basically what you have now, Ms May. And afterwards? You want tariffs, administered by bureaucracy? How many officers in Dover?https://twitter.com/zschneeweiss/status/897342525635264512 …"
ErikFossing;2017-08-15 04:06;5;3;"Just latest piece of Chinese news which underlines that China is not a market economy. https://www.ft.com/content/a4b28218-80db-11e7-94e2-c5b903247afd … via @ FT"
ErikFossing;2017-08-15 03:42;0;0;"But can he bring back New Labour - and without the UK's historical uncritical and unwavering support for all things American (incl war)?https://twitter.com/imateosylago/status/897166078849294336 …"
ErikFossing;2017-08-14 23:27;5;9;"Respect!https://twitter.com/merck/status/897065338566791169 …"
ErikFossing;2017-08-12 03:47;0;1;"I'll bet a fair amount that its the pictures of Trump in high heels - you break the contract, and they'll come out (and more).https://twitter.com/mcfaul/status/896061763443081216 …"
ErikFossing;2017-08-10 18:13;0;3;"Of course it's fake. UK Govn does not go to the Norwegian Nat Gallery for their official photo! Or hey? A sign of Norway model for Brexit?https://twitter.com/boldtown1/status/895518543265112064 …"
ErikFossing;2017-08-10 04:10;1;1;"Just as I thought the @ Telegraph couldn't get any less serious, they managed. Let's get similar coverage of UK govn (or royal family!)https://twitter.com/telegraph/status/895370359821680640 …"
ErikFossing;2017-08-09 14:48;0;1;"Yes - for one thing, I didn't think the UK govn would go to Oslo for their photo shoot! (And apologies for auto spell mess of Munch)https://twitter.com/bob_loblaw420/status/894939423007272960 …"
ErikFossing;2017-08-08 23:11;27;49;"When the art predicts reality (Edvard Munich's The Scream) - officially included in UK government photo is a beauty.pic.twitter.com/oqH3trtorH"
ErikFossing;2017-08-08 03:39;2;4;"I didn't know there was any of that left to lose.https://twitter.com/politicoeurope/status/894641852477059073 …"
ErikFossing;2017-08-06 03:47;0;3;"In good old days, the Russians would love to do that work. Now no need to place mics. They just call POTUS @ nytimeshttps://www.nytimes.com/2017/08/04/us/politics/trump-vacation-west-wing-renovation.html?smprod=nytcore-ipad&smid=nytcore-ipad-share …"
ErikFossing;2017-08-05 14:38;0;1;"Thanks.https://twitter.com/hedgefund_ssf/status/893638245124198401 …"
ErikFossing;2017-08-05 04:38;0;0;"Looking forward to reading it - I absolutely loved the foothill diaries: Insightful and hilarious observations all in great context.https://twitter.com/chrismullinexmp/status/893566246033260545 …"
ErikFossing;2017-08-05 00:03;1;2;"Indeed. And we haven't even started talking about how limited the German public sector's digitalisation is relative to rest of EU.https://twitter.com/imateosylago/status/893493710209601537 …"
ErikFossing;2017-08-04 20:10;0;0;"Mad to draw macro conclusions from one example (and are Autobahns not congested? - eg German public sector one of least digitalised in EU.https://twitter.com/indysmith/status/893433877464842240 …"
ErikFossing;2017-08-04 18:49;0;1;"They should be!https://twitter.com/thomasforth/status/893420743916212228 …"
ErikFossing;2017-08-04 18:35;3;8;"Truly troublesome outcome of wrong fiscal priorities! Public investment should be boosted not to help Europe but to help young Germans!https://twitter.com/mfratzscher/status/893412601266360320 …"
ErikFossing;2017-08-04 00:25;3;9;"Since it's not my job to comment on UniCredit, it's good others do: UniCredit Widens Gap With Rivals - Bloomberghttps://www.bloomberg.com/news/articles/2017-08-03/unicredit-ceo-mustier-defies-doubters-with-surprise-profit-surge …"
ErikFossing;2017-08-03 05:28;8;12;"UniCredit's chief German economist Andreas Rees:"diesel gate" +German car makers well positioned in electric car racepic.twitter.com/1YIUQ5BSvZ"
ErikFossing;2017-08-03 05:16;9;14;"Really? Facts tell different story: Acc to Ifo: German share of patents worldwide for electric cars 2010-2015: 34%. Japan: 23%. US: 18%.https://twitter.com/groomb/status/892770458055192576 …"
ErikFossing;2017-08-03 05:03;0;5;"He obviously can't say anything on this. It's in the contract: If he does, Putin will release the pictures and the dirt!https://twitter.com/eliotacohen/status/892790330508152835 …"
ErikFossing;2017-08-02 22:32;0;1;"Given Anders Fogh's tough military stance, and alignment w the US' GOP, why did he do nothing as Danish PM to lift military spending to 2%?https://twitter.com/andersfoghr/status/892737677199646720 …"
ErikFossing;2017-08-02 18:16;1;5;"The military is taking over from a corrupt family dynasty... sounds familiar?https://twitter.com/flacqua/status/892688281372119040 …"
ErikFossing;2017-08-02 18:14;0;1;"About time!https://twitter.com/flacqua/status/892688281372119040 …"
ErikFossing;2017-08-02 17:42;1;3;"Don't look at charts! Look at UniCredit Research - our chief FX strat @ VasileiosGkion1 called it all the way. Still higher EUR/USD to come!https://twitter.com/business/status/892680021768368129 …"
ErikFossing;2017-08-02 17:38;0;2;"Good day for UniCredit chief FX strat @ VasileiosGkion1 . Also from UniCredit Research: no negative impact on EU equities this side of 1.30https://twitter.com/saraeisen/status/892678555804610562 …"
ErikFossing;2017-08-02 05:46;1;1;"Pence obviously didn't get the memo to Trump from Putin.https://twitter.com/edmorrissey/status/892498248006553603 …"
ErikFossing;2017-08-02 05:42;0;0;"But then again, he also analysed immigration with help of a bowl of M&M. Good thing he isn't near POTUS, but just running some NY business.https://twitter.com/dolcemc/status/892479971192471552 …"
ErikFossing;2017-08-01 22:55;0;7;"We all love our parents, but for most people the love matures from "know-all God-like" figures to something more real around age of 4 or 5.https://twitter.com/huffpost/status/892397189087068163 …"
ErikFossing;2017-08-01 20:12;1;3;"It's clear the one unbreakable part of the Trump-Putin contract is "zero criticism". You break that, and the pictures come out - or worsehttps://twitter.com/aaronblake/status/892058339290566656 …"
ErikFossing;2017-08-01 17:08;0;1;"You are right. Well spotted! Why did the FT write about his Bentley Continental, while picturing him (if it actually is him!) with a RR?https://twitter.com/malcolmmoore/status/892301905153728512 …"
ErikFossing;2017-08-01 16:29;0;2;"Indeed! - and a Bentley, as pictured, can be bought for probably no more than 20k. Welcome to the world of tabloids...https://twitter.com/malcolmmoore/status/892298524280401920 …"
ErikFossing;2017-08-01 16:26;0;4;"NO, they do not have a point!!! Making occasional mistakes does not put an expert at par with an ignorant! https://twitter.com/ralphmus/status/892299428475936769 …"
ErikFossing;2017-08-01 16:22;0;0;"Talking about seeing the glass half full! - Or rather: celebrate a drop of water after it had all dried up. https://www.ft.com/content/a6cb39dc-75d7-11e7-a3e8-60495fe6ca71 … via @ FT"
ErikFossing;2017-08-01 14:36;0;2;"Now waiting for David Davis, Boris Johnson, Leadsom to repeat that we don't need experts b/c they don't know https://www.ft.com/content/9fdf35a4-7610-11e7-a3e8-60495fe6ca71 … via @ FT"
ErikFossing;2017-08-01 06:00;2;4;"Ha ha, I'm not sure I see it either....https://twitter.com/iealondon/status/892014535913111553 …"
ErikFossing;2017-08-01 03:02;0;2;"LOLhttps://twitter.com/flacqua/status/892093956204498947 …"
