katyperry;2015-03-20 03:51;4493;8773;""Are you generally a happy man? All the time. What makes you happy? The whole world" Same. @… https://instagram.com/p/0a_H3DP-Vi/"
katyperry;2015-03-20 00:59;6395;15007;"See @ RyanSeacrest pic.twitter.com/eImw1RZG8L"
katyperry;2015-03-19 20:46;6604;10280;"SANTIAGO! R U ready 4 # ThePrismaticWorldTour? Pre-sale starts Mar 20 at 10a. I will see you at Pista Atletica Oct 6!http://www.puntoticket.cl/"
katyperry;2015-03-18 07:32;5302;10524;"My own mother surprised me today by going against her parental sugar cereal restrictions (and some… https://instagram.com/p/0WO1HlP-RV/"
katyperry;2015-03-18 01:10;2901;4602;"@ KatyCatsClub https://instagram.com/p/0VjGMwP-TS/"
katyperry;2015-03-17 19:27;4107;8875;"@ glamourmag: 10 women who have changed @ katyperry's life, from @ jennyslate to @ KaceyMusgraves to Cindy Sherman: http://glmr.me/1MGjlf3"
katyperry;2015-03-17 09:37;5305;10509;"LADIES OF THE ROAD MUST STICK TOGETHER & SUPPORT EACH OTHER! @Stockholm https://instagram.com/p/0T4aFfv-Yq/"
katyperry;2015-03-15 09:55;4690;10057;"beautiful berlin https://instagram.com/p/0Ow0Dzv-bd/"
katyperry;2015-03-15 00:09;4002;8889;"this Rauschenberg @Hamburger Bahnhof- Museum für Gegenwart https://instagram.com/p/0Nty1rv-Ra/"
katyperry;2015-03-13 21:03;7254;11598;"LIMA! You're next! I'm coming to you on September 22. Tix on sale March 18 at 8:00a: http://www.teleticket.com.pe/ # PrismaticWorldTour"
katyperry;2015-03-13 08:21;4577;9193;"# TBT to when I accidentally dressed like the Grim Reaper in The Catacombs @Paris, France https://instagram.com/p/0Jce3HP-el/"
katyperry;2015-03-12 21:13;6553;11256;"CATS! GRAB UR POPPYCORN & GET READY for MARCH 28th! # PrismaticOnEPIX Check dis delicious sampler platter: http://epx.ms/18AfToQ"
katyperry;2015-03-11 10:13;4575;9289;"Oh hey to you too, snack! (Also doing my best Lisa Loeb impression in these ) @The Green Light… https://instagram.com/p/0EfvtXP-cl/"
katyperry;2015-03-10 00:17;6082;14648;"Getting my foot cupped cause: fashion weekpic.twitter.com/qO8QPKD2dU"
katyperry;2015-03-09 22:57;4816;9848;"Twinning tour life with the love of my life https://instagram.com/p/0Ati5_P-as/"
katyperry;2015-03-09 21:55;7319;10715;"PUERTO RICO! I'm excited to bring # ThePrismaticWorldTour & visit San Juan 4 the 1st time on Oct12! Tix on sale Mar16http://www.ticketpop.com/"
katyperry;2015-03-09 07:06;8082;15477;"dreams of a matriarchy # InternationalWomensDay"
katyperry;2015-03-08 09:05;5943;13313;"Today has been a teleporting type day. 3 cities, 1 day. # tourlife"
katyperry;2015-03-08 09:03;7991;12992;"Do u hear me, Bogota? October 9 at Parque Deportivo! Tickets on sale March 13 at http://www.tuboleta.com . More shows soon!"
katyperry;2015-03-08 09:02;9853;13881;"SOUTH AMERICA! # ThePrismaticWorldTour is finally headed to u!"
katyperry;2015-03-07 23:16;4319;8755;"BE ON ALERT CITY OF HERNING: There's a half danish/half panda baby child walking my halls today in… https://instagram.com/p/z7mGGZv-Xg/"
katyperry;2015-03-07 05:03;3979;8385;"Went to the commune Christiania in Copenhagen to get some tips on how to plan my own in the future...… https://instagram.com/p/z5pDjjP-TG/"
katyperry;2015-03-06 22:23;6847;16816;"http://bitly.com/LeftSharkOnesie RT @ people: 5 places to wear your new # leftshark onesie http://peoplem.ag/PpP3tBT pic.twitter.com/97yUWtmsUJ"
katyperry;2015-03-06 20:04;4066;8806;"SOTD:https://soundcloud.com/jackgarratt/the-love-youre-given …"
katyperry;2015-03-05 21:54;9682;20264;"Me every day pic.twitter.com/dG7CL3etsD"
katyperry;2015-03-05 10:04;3374;7798;"Shanghai! So pleased to be able to play for you twice! Tickets on sale Mar 10 @2:00p. See you April 21st & NOW 22nd! http://www.katyperry.com/events"
katyperry;2015-03-05 06:35;5755;12579;"Finally. New music that makes my a flutter. Check this 17 yr old angel @ AURORAmusic RUNAWAY https://www.youtube.com/watch?v=d_HlPboLRL8 …pic.twitter.com/scJvDfDgSU"
katyperry;2015-03-04 02:54;4687;9526;"OMG people been selfie-ing for centuries! @Munich Residenz https://instagram.com/p/zxr8ylv-cD/"
katyperry;2015-03-04 02:26;7064;13515;"ILL BE YOUR WEASEL YOU BE MY WOODPECKER RIDE OR DIE"
katyperry;2015-03-03 07:36;11802;21671;"YOU CAN NOW BE A PROPER # LEFTSHARK WITH THIS OFFICIAL, GLORIOUS # LEFTSHARK ONESIE: http://bitly.com/LeftSharkOnesie pic.twitter.com/8RSgqZa6sq"
katyperry;2015-03-03 07:34;6951;15099;"ATTENTION INTERNET: NO LONGER DO YOU HAVE TO DIY LEFT SHARK COSTUME LIKE THIS GUY:pic.twitter.com/s5RjIa4RiC"
katyperry;2015-03-02 07:22;4903;9925;"March is Music in Our Schools Month. Follow @ vh1savethemusic to help put the power of music back in our schools! # SaveTheMusic"
katyperry;2015-03-01 04:26;3935;8840;"Napoleon's (son's) crib @Imperial Treasury, Vienna https://instagram.com/p/zqIGDRv-Sn/"
katyperry;2015-03-01 04:17;4154;8936;"Vienna is on firewith beauty, history and culture! Got to see THE KISS (not that band but ily)… https://instagram.com/p/zqG-4zP-QH/"
katyperry;2015-02-28 01:10;4678;9216;"MY POINT EXACTLY “ @ lindseyweber: @ katyperry it's a shark”"
katyperry;2015-02-28 01:05;11298;18442;"*SHAVES HEAD OVER DRESS*"
katyperry;2015-02-28 01:04;10268;17059;"DO YOU SEE THE DRESS NOW:pic.twitter.com/dUDmet5y3u"
katyperry;2015-02-28 00:05;2390;4436;"@ sofifii yeah, I would be mad if I had to get my eyes checked too."
katyperry;2015-02-28 00:01;15083;21464;"THIS IS HOW WARS START"
katyperry;2015-02-28 00:01;13765;21554;"The dress conversation is seriously going to make me have to take a Xanax."
katyperry;2015-02-27 23:55;6649;11895;"jk"
katyperry;2015-02-27 23:55;9734;14545;"BUT I've read though there's a vitamin d deficiency in people who see blue and black."
katyperry;2015-02-27 23:52;9370;18645;"So glad I slept through that dress debacle."
katyperry;2015-02-26 20:37;4587;9203;"Last night, I got into the Austrian spirit by watching the doc PUMPING IRON cause nothing says… https://instagram.com/p/zkIyVCv-WG/"
katyperry;2015-02-26 06:01;6520;10835;"My heart was heavy today. For ever let this place be a cry of despair and a warning to humanity,… https://instagram.com/p/zikh2GP-c8/"
katyperry;2015-02-25 00:32;4585;8613;"Missing home & Butterballface vid courtesy of @ joshlecash https://instagram.com/p/zfaG0Nv-Q-/"
katyperry;2015-02-24 22:14;4851;8337;"**IF YOU ONLY FORWARD THIS TO TEN PEOPLE** you will hear these chuckles in your dreams for one week.… https://instagram.com/p/zfKRXev-Xn/"
katyperry;2015-02-24 08:21;7142;10410;"Here's a sneak peek: http://epx.ms/17OkQtM . Stay tuned, !"
katyperry;2015-02-24 08:20;5094;9629;"USA If you didn't get to attend the # PrismaticWorldTour, I'm giving you the DOPE chance to see it on March 28th @8pm on @ EpixHD!"
katyperry;2015-02-21 23:14;7313;13764;"ITALY WE'RE BACK! (HELLO MILANO) Spent two days in Florence scarfing down your &… http://instagram.com/p/zXiwtbP-S7/"
katyperry;2015-02-21 10:57;4603;8885;"Nailed it III myassistant http://instagram.com/p/zWOdbeP-fS/"
katyperry;2015-02-21 10:54;4675;8938;"Nailed it II http://instagram.com/p/zWOFG0v-et/"
katyperry;2015-02-21 10:14;4632;8759;"nailed it http://instagram.com/p/zWJf3sv-Xg/"
katyperry;2015-02-21 08:53;7844;11791;"HBD to my flawless friend @ rihanna may I bestow this gift of beautiful fan art of us embracing in a… http://instagram.com/p/zWASU1P-aO/"
katyperry;2015-02-21 02:18;13072;24721;"They should have always spelt ItalyEATALYcause after two days off there I'm feeling like this (sorry Lyon)pic.twitter.com/6GwiY9QqNR"
katyperry;2015-02-20 10:27;4504;9477;"Found my wings in Florence... http://instagram.com/p/zTmO5Fv-Xc/"
katyperry;2015-02-19 06:27;4787;9804;"My new Gucci Cadi whip http://instagram.com/p/zQl6unv-Yx/"
katyperry;2015-02-19 06:12;4816;9527;"When I die bury me inside the Gucci... Museum. http://instagram.com/p/zQkPvNv-V-/"
katyperry;2015-02-19 05:22;6329;13237;"I just tasted a wine that smelled like the museum I visited earlier # italiansdoitbetter"
katyperry;2015-02-16 18:38;8133;15469;"...BARCELONAw/ @ charli_xcx tonight! R U COMING?! # PrismaticBarcelona"
katyperry;2015-02-16 18:37;6693;12824;"After all the tapas, sangria & Picasso, it's time to finally kick off the European section of # ThePrismaticWorldTour in..."
katyperry;2015-02-13 07:41;5847;11219;"So beautiful to see an artist grow brilliantly beyond it all: https://www.youtube.com/watch?v=XgeKHTcufLY … @ flo_tweet"
katyperry;2015-02-10 08:52;9444;17173;"i n t e r m i s s i o n"
katyperry;2015-02-09 06:59;12994;22595;"Full circle: playing the 1st song I wrote for the album to close out PRISM. Dont miss # ByTheGraceofGod my most personal song, on @ TheGRAMMYs"
katyperry;2015-02-08 04:16;7313;15614;"Any distribution or purchase of these type of photos anywhere is extremely against my will & is an endangerment to me & my family's privacy."
katyperry;2015-02-08 04:12;8460;17994;"Remember internet it's literally ILLEGAL to post pictures of me at my house w/my family that unethical paparazzi have taken on long lenses."
katyperry;2015-02-05 12:29;10594;27052;"Also shout out to this guy who loved the Sharks so much he drew blood for them pic.twitter.com/F89tfeKVq6"
katyperry;2015-02-05 12:27;6880;15245;"THE SHARKS FROM THE SUPER-BOWL SIT DOWN W/ @ JohnMayer WHO'S GUEST HOSTING THE LATE LATE SHOW ON CBS TONIGHT @12:35AM/11:35PM CT # leftshark"
katyperry;2015-02-05 12:10;3595;8364;"And last but not least, GUANGZHOU completes the Asia tour! http://www.katyperry.com/events/ # PrismaticWorldTour"
katyperry;2015-02-05 10:03;3924;8313;"More ASIA dates for you at http://www.katyperry.com/events ! See you soon Shanghai, Macao and Singapore! # PrismaticWorldTour"
katyperry;2015-02-05 08:22;6501;13600;"Bleach ya brows and call it FASHUN."
katyperry;2015-02-04 01:11;9939;23127;"Fashion! = adorable Giambattista Valli set and Chanel earrings Third time, and it's still a charm, @ ELLEmagazine!pic.twitter.com/5kebJA6VQh"
katyperry;2015-02-03 17:13;16249;35525;"Night'pic.twitter.com/CffDndSzS7"
katyperry;2015-02-03 11:12;15503;35421;"MOST WATCHED SHOW IN US HISTORY?! Whelp, I gotta keep reminding myself I put my pants on leg at a time... But, yes I am incredibly proud!"
katyperry;2015-02-03 00:30;10998;23949;"Mark your calendars! The Prismatic World Tour will premiere on March 28th at 8:00 PM ET on @ EpixHD! # PrismaticOnEPIXpic.twitter.com/iTluCfAxfJ"
katyperry;2015-02-02 16:09;8289;17901;"XLIX http://instagram.com/p/yl3Czqv-Rg/"
katyperry;2015-02-02 16:06;6236;14800;"I thought it would be appropriate to draw blood tonight... XLIX http://instagram.com/p/yl2vLTv-RF/"
katyperry;2015-02-02 05:50;9369;22222;"GUYS! Want the guitars that my band will be playing at # SB49? Bid now to benefit @ BreaktheCycleDV: http://nflauction.nfl.com/"
katyperry;2015-02-02 04:25;52226;103683;"Today is for this girl. She had the dream, always believed in herself & her worth. Today she is the one smiling.pic.twitter.com/9jMh3hWubz"
katyperry;2015-02-02 02:49;24849;50549;"Today is the day that the Lord has made! I will rejoice and be glad in it!"
katyperry;2015-02-01 07:48;9776;26266;"...Also if u wanna complete the lewk w/the necklace & earrings I wore to the press conference! http://www.claires.com/ProductDetails.ice?ProductID=3333345 …pic.twitter.com/YnXLp8y5il"
katyperry;2015-02-01 04:58;5373;13707;"OMG I made dis offish fuzzy sweater dress! buy RIGHT NOW @NFL EXPERIENCE in PHX or pre-order http://bit.ly/1Dr6xGe pic.twitter.com/FFzDBcuyen"
katyperry;2015-01-31 13:58;4677;10573;"# FBF to that one time I was hanging out in the Seahawks' locker room... http://instagram.com/p/ygeZsHP-Yr/"
katyperry;2015-01-31 13:42;5231;11445;"BILLBOARD. On stands tomorrow! http://instagram.com/p/ygclEqv-XF/"
katyperry;2015-01-31 08:51;15158;24336;"When someone says for you to "stay in your lane" just respond, "THIS IS MY HIGHWAY BISH!""
katyperry;2015-01-31 06:52;4955;12860;"If only I could have Mickey n Minnie on stage too http://youtu.be/a3-BRMEiFQ4 pic.twitter.com/clKa0hF5mH"
katyperry;2015-01-31 04:58;16729;32987;"What I don't have in thigh gap-ness I make up in eyebrow arch"
katyperry;2015-01-30 14:41;4682;9818;"Because: http://youtu.be/iR1kfwQ48f8"
katyperry;2015-01-30 11:01;10050;15984;"And for the rest of the world, PATIENCE is the key"
katyperry;2015-01-30 11:00;8381;10743;"Up next: TAIPEI - I'll see you April 28! MANILA - You're on May 7! JAKARTA - I'm coming back May 9! BANGKOK - get prismatic with me May 14!"
katyperry;2015-01-30 10:01;4623;9166;"First up, TOKYO, April 25 & 26! http://www.katyperry.com/events"
katyperry;2015-01-30 10:01;5419;10454;"Just when you thought the # PrismaticWorldTour was over, I'm pleased to announce that I'll be bringing it to ASIA this April and May!"
katyperry;2015-01-30 05:03;5443;11986;"Let's just say I am dressed for the ball today... tune in on @ nflnetwork # SB49 #"
katyperry;2015-01-27 11:18;5472;11841;"Even my tippy toes are ready #http://instagram.com/p/yV4995P-dN/"
katyperry;2015-01-27 05:21;5880;10913;"SuPeR BoWl LeAkhttp://youtu.be/qzgeyS_JRxE"
katyperry;2015-01-26 10:21;5753;17025;"WHAT A TRAP pic.twitter.com/2VMUPG9KJN"
katyperry;2015-01-25 09:58;6442;14210;"My dream for after SB is to have a procession of chilled Girl Scout thin mint cookies brought to me by Girl Scouts w/sparklers a la da club."
katyperry;2015-01-25 08:31;16917;24233;"WHAT I DON'T HAVE IN ABS, I MAKE UP FOR IN HEART!"
katyperry;2015-01-25 07:10;5463;10602;"YAS MJ YAS!!! SLAY MJ SLAY!!! HE HOLDS FOR APPLAUSE FOR A MINUTE & 30 SECONDS & MOVES ONCE! SLAYYY FOR THE GODS http://youtu.be/Qmwve14BKQI"
katyperry;2015-01-24 11:51;9500;23307;"Having a great rehearsal, hope everyone has a great Friday!!! #pic.twitter.com/q1nfp53xLm"
katyperry;2015-01-23 13:47;4730;10052;"V important puppy bowl meeting http://instagram.com/p/yL21q-P-R7/"
katyperry;2015-01-23 12:35;7276;19714;"Wore my slides to a FASHUN party tonight because @ ITSJEREMYSCOTT pic.twitter.com/xAbP8q5KZn"
katyperry;2015-01-22 09:31;11834;22669;"LATEpic.twitter.com/02PeWzeEhR"
katyperry;2015-01-22 09:11;3503;7533;"http://youtu.be/wjXSqaSmhh4"
katyperry;2015-01-21 10:17;3977;8448;"Let's go wide on that cover shot for @espnmag shall we @ jjwatt http://instagram.com/p/yGVLVjP-YF/"
katyperry;2015-01-21 06:39;6263;12193;"I think you spelt PHAT wrong “ @ swiftschrist: @ katyperry still fat”"
katyperry;2015-01-21 06:37;8564;17357;"Just finished a killer workout! Have a great day y'all pic.twitter.com/8smUnelXw3"
katyperry;2015-01-20 23:18;12751;29048;"Hey @ JJWatt what do you think of our @ESPNMag cover? TOUCHDOWN?! pic.twitter.com/ibGTW8tL7p"
katyperry;2015-01-18 12:46;11904;27802;"OMG “ @ BabyAnimalPics: i want a finger monkey! https://twitter.com/BabyAnimalPics/status/527642656370085888/photo/1pic.twitter.com/4ydqnxbgOk ”"
katyperry;2015-01-18 09:43;3047;4462;"@ snowhiteperry not today satan!"
katyperry;2015-01-18 09:39;1345;2864;"@ EmmaKPHughes goes for you too em!"
katyperry;2015-01-18 09:39;2032;4173;"@ katyslegend @ dansnierson umpic.twitter.com/leRKHw2y3w"
katyperry;2015-01-18 09:31;4095;8702;"Playing so many bowls this year. So scressful.http://insidetv.ew.com/2015/01/16/puppy-bowl-xi-katty-furry/?hootPostID=664f702569195321d5b08b695c3d15b5 …"
katyperry;2015-01-18 07:36;6092;16334;"GIRL SCOUT COOKIE SEASON IS LITERALLY CIRCLING MY SUPER BOWL BODY DEBUT. WHAT A SET UP!"
katyperry;2015-01-17 10:00;1805;3582;"@ prismaticwitch ninja skills"
katyperry;2015-01-17 09:58;1780;3367;"@ MDMOLINARI yeah but mine had a joker hat on it. Durh."
katyperry;2015-01-17 09:54;4089;8665;"when u hit the blunt too hard butters http://instagram.com/p/x7_bH3P-RG/"
katyperry;2015-01-17 09:19;5093;11885;"I want to be the Lucille Ball of pop music..."
katyperry;2015-01-16 09:38;3577;7657;"FASHIONISTAScheck http://www.lonelydot.com for Q-T vintage finds & rad new clothes. Follow them on Twitter @ lonelydot IG: lonelydot"
katyperry;2015-01-16 08:20;3592;7078;"IRL facetune # preppinforpuppybowl # swag # bringswagbackin2k15 http://instagram.com/p/x5P4drP-dw/"
katyperry;2015-01-14 12:51;4759;10014;"OK! Found a new jam to share for the new year: Desire by Years & Years http://soundcloud.com/yearsandyears/desire … more please!"
katyperry;2015-01-14 12:27;3438;7450;"Deep in SB rehearsals:http://youtu.be/zKGNB4Pry6U"
katyperry;2015-01-14 08:17;5009;10589;"Eagerly looking forward to the first big musical contribution of 2015 that just knocks me off my feet... Who's gonna take the title?!?!"
katyperry;2015-01-13 05:15;7765;14433;"Science says pic.twitter.com/QX8VMelwMi"
katyperry;2015-01-11 07:50;5171;9802;"ICYMI RT @ nfl:Joining @ KatyPerry during her @ pepsi @ superbowl # halftime show on @ SNFonNBC? Mr @ LennyKravitz. Feb 1 can’t come soon enough!"
katyperry;2015-01-11 06:25;7594;14772;"I have a big surprise announcement coming up at # halftime of this @ Ravens- @ Patriots game! Make sure you're !"
katyperry;2015-01-08 05:13;5284;11856;"If Sophia Grace plays her new trap hit at Coachella... I'll go. cc @ yungskeeter @ sofifii"
katyperry;2015-01-07 16:02;2025;4072;"@ yungskeeter I'm finnin to be on da remix"
katyperry;2015-01-07 15:56;10999;23192;"Sweet dreams habibispic.twitter.com/qvlyNBDSgn"
katyperry;2015-01-06 15:56;4223;8848;"Did some MAJEwerk w/THEE @ patmcgrathreal today for @ covergirl! We had quite the… http://instagram.com/p/xgUG_Cv-WQ/"
katyperry;2015-01-04 05:49;9526;16581;"Current mood: Speak if it only improves upon the silence - Mahatma Gandhi"
katyperry;2015-01-01 16:03;21068;36556;"Happy New Year. I love a fresh start."
katyperry;2015-01-01 12:41;9799;19384;"Ok!pic.twitter.com/gpqdCaGtb5"
katyperry;2015-01-01 10:18;2217;4325;"@ onlyLeah shit."
katyperry;2015-01-01 10:17;4106;6811;"@ yelyahwilliams @ XChadballX YAS! Now this is truly punk rock! CONGRATS!"
katyperry;2015-01-01 09:33;5749;12058;"I got so many mophies and lash glue for everyone. Come at me 2015, I'm ready."
katyperry;2015-01-01 09:28;3442;7732;"6th train squad game strongé http://instagram.com/p/xSvsN1v-Rl/"
katyperry;2015-01-01 08:28;7401;12323;"Reflective."
katyperry;2014-12-31 14:32;11704;20554;"Tip for tomorrow: remember to consider everyone's face when posting group photos!"
katyperry;2014-12-31 03:39;3947;8515;"# OOTW!!! I hope it's not too late to get best dressed 2k14 Thanks to my friends @ belovedshirts for… http://instagram.com/p/xPi8-dP-WN/"
katyperry;2014-12-30 13:18;4218;9832;"YOU ARE MY EMOTIONAL EPI PEN cc: @ sofifii"
katyperry;2014-12-26 07:23;18163;32726;"。 ° · 。 · ˚ ˚ ˛ ˚ ˛ 。° 。 ° 。˚ ˛ · ˚ ˚ ˛ ★MERRY★ 。 · ˚ ˚ 。CHRISTMAS 。 _Π_＿ 。 ˚ ˚ ˛ ˚ ˛ /____＿/ ＼。˚ ˚ ˛ ˚ l田田田 |門| ˚ ˛ ˚ ˛ · 2 all my BB's!"
katyperry;2014-12-26 05:50;5102;11561;"My parents are on my last Christmas nerve http://instagram.com/p/xC58wIv-T-/"
katyperry;2014-12-25 06:59;8359;19494;"Don't have enough treats for ur stocking! Well these rubber bb's are now back in stock! http://bit.ly/13yTzK8 pic.twitter.com/pG5Fy7ZFD3"
katyperry;2014-12-24 18:38;10782;18388;"I'm dreaming of a right Christmas..."
katyperry;2014-12-24 01:03;4585;9301;"Mornin friends! Time to huddle up! Go to http://pepsi.com/halftime & enter for a chance to see me @the Pepsi Super Bowl XLIX Halftime Show!"
katyperry;2014-12-23 17:13;9022;15931;"Nothing says I love you like a bowl of spaghetti bolognese"
katyperry;2014-12-23 00:48;6560;10820;"Taking a break from the # PrismaticWorldTour but come take a peek backstage w/ me & @ ferras:http://smarturl.it/PWTExposed"
katyperry;2014-12-22 16:57;4122;8646;"A casual sleighing w/santa http://instagram.com/p/w5zJ2Hv-YZ/"
katyperry;2014-12-20 13:03;7515;14802;"Tbh I get really turned on when people rsvp correctly."
katyperry;2014-12-17 15:53;6227;9924;"hi http://instagram.com/p/wsz0rCv-Xd/"
katyperry;2014-12-14 17:06;7711;13179;"Hakuna Matata bitches http://instagram.com/p/wlN0LSP-fI/"
katyperry;2014-12-13 16:57;6453;11917;"So far...“ @ katyperrylately: # ThePrismaticWorldTour is the TOP FEMALE TOUR of 2014! http://www.katyperrylately.com/post/105058190632/the-prismatic-world-tour-is-the-top-female-tour-of … https://twitter.com/katyperrylately/status/543610978546761728/photo/1pic.twitter.com/SE9Bimt5Dm ”"
katyperry;2014-12-12 23:50;7161;10870;"One of the most beautiful, vulnerable, REAL things I have ever seen, spoken like a proverb @ Beyoncehttp://youtu.be/x4pPNxUzGvc"
katyperry;2014-12-12 15:52;5613;9272;"SYDNEY! Tonight & tomorrow we'll b capturing the magic of # ThePrismaticWorldTour for the MAKE SURE 2 WERK DEM CAMERAS BB'S! SCREAM! SMIZE!"
katyperry;2014-12-11 20:26;5676;10957;"Saw the most exquisite production of The Nutcracker by the Australian Ballet at The Sydney Opera house! Finally, it feels like Christmas"
katyperry;2014-12-11 15:18;4798;9884;"Even though you know it's gonna be a safe flight, there's just comfort in someone telling you that. # itsthelittlethings"
katyperry;2014-12-11 15:10;2896;6606;"SAFE FLIGHT @ sofifii"
katyperry;2014-12-10 20:48;19763;37541;"Relationship goals:pic.twitter.com/OhVMmSUcfe"
katyperry;2014-12-09 19:11;7305;14880;"Eye on the prize not on the fries # SuperBowl"
katyperry;2014-12-08 21:31;4147;7718;"OOTD school girl raincoat vibez http://instagram.com/p/wWPWg7v-Vy/"
katyperry;2014-12-08 21:15;1698;3260;"@ anamanaguchi "mature""
katyperry;2014-12-08 20:54;3163;6348;"The man responsible for all things maritime stripes & more: Jean Paul Gaultier @ ngvmelbourne @… http://instagram.com/p/wWLHs5v-Rt/"
katyperry;2014-12-08 19:33;6823;9335;"RT if your favorite jelly belly is juicy pear."
katyperry;2014-12-08 10:26;3444;6907;"It's the last game of the day, but you can still get # HypedForHalftime with my -inspired # iTunesRadio playlist: https://itunes.apple.com/us/station/idra.691034299 …"
katyperry;2014-12-06 21:28;3468;5500;"@ Sia you too my fav aussie bear"
katyperry;2014-12-06 21:03;3697;7437;"# tiestoinaustralia http://instagram.com/p/wRCj4IP-U3/"
katyperry;2014-12-06 10:10;6872;11918;"Very cool way to wake up w/2 noms for the @ TheGRAMMYs s/o to my bro @ therealjuicyj for the collab nom! Imagine if I win for a trap record!"
katyperry;2014-12-05 12:17;8777;10665;"WHOAH my little niña @ iambeckyg is growing up right before my eyes https://www.youtube.com/watch?v=7NwzxGntDgs …"
katyperry;2014-12-05 12:06;3616;7152;"So that you guys are listening to these songs! https://www.spotify-yearinmusic.com/#section-top-categories …"
katyperry;2014-12-05 09:48;4919;11188;"I BELIEVE IN YOU ALLISON WILLIAMS!!!"
katyperry;2014-12-04 21:39;7316;13135;"If I could, I would be there laying in those streets of NYC, peacefully protesting. WE HAVE TO CHANGE. ALL LIVES MATTER # WeCantBreathe"
katyperry;2014-12-04 14:13;1698;3201;"@ sofifii send me the rest of the hair"
katyperry;2014-12-04 12:34;7036;8934;"Tonight in Melbourne we play our 100th show on # ThePrismaticWorldTour! I am SO proud & I think some ppl are noticing:http://bit.ly/1ynIffM"
katyperry;2014-12-03 00:10;8431;16422;"Congratulations to my parents Keith & Mary Hudson for on this day 35 years ago they were married & continue to be a love I look up to!"
katyperry;2014-12-01 14:02;3241;6549;"OOTD @Future Beauty: 30 years of Japanese Fashion @The GOMA http://instagram.com/p/wDaZb8P-Ql/"
katyperry;2014-11-30 17:28;4281;8937;"OMG THEE @ iamtovelo joins # ThePrismaticWorldTour tonight!!! Currently one of my FAVORITE songwriters! Myare so pleased!"
katyperry;2014-11-30 14:40;7084;14703;"Someone said to me today that I was a spiritual being having a human experience. I love this & agree"
katyperry;2014-11-30 13:23;3016;6682;"EMPATHY ADDICTS cc: @ sofifii"
katyperry;2014-11-30 08:32;5109;11004;"Ugh. Another cold in summer. Makes no sense!"
katyperry;2014-11-28 16:20;7556;13632;"Food so good it makes you shake ur leg"
katyperry;2014-11-28 10:56;5414;12034;"BUT I am SO thankful to be on this incredible worldwide journey seeing people filled w/joy night after night. Happy THANKSgiving everyone!"
katyperry;2014-11-28 10:51;4316;10893;"Just had 1st FaceTime Thanksgiving! What I would give 2b scraping marshmallow off of sweet potato, wearing fuzzy socks & holding my niece!"
katyperry;2014-11-28 07:01;7764;15385;"SYDNEY! I'll b back, but my pop-up shop won't LAST DAY to shop exclusive Oz merch TODAY! 624 George St, 10a-6ppic.twitter.com/8DWf8Dm5Yu"
katyperry;2014-11-27 15:26;3549;7276;"What a warm welcome from Brisbane! http://instagram.com/p/v5Q1DpP-fW/"
katyperry;2014-11-26 22:13;4278;8215;""Katy Perry, quite contrary, how do your lashes grow?" # GoBloom like a @ COVERGIRL: http://bit.ly/11QUEwI"
katyperry;2014-11-26 11:57;13157;23986;"Gonna roll up to the carpet in dis whippic.twitter.com/vaEFyZs3Kf"
katyperry;2014-11-26 11:52;7642;11312;"Peep my couture outfit fer tonight's @ ARIA_Official awards, a # TWISTIE (Oz's cousin to the cheeto fyi)pic.twitter.com/cT1aPf7sLR"
katyperry;2014-11-25 16:42;4363;9710;"Chicken noodle soup & chamomile tea cause: throat... Gonna need you more than ever tonight Sydney. Show #95 # ThePrismaticWorldTour"
katyperry;2014-11-25 11:22;7592;15920;"Feeling stuck all the way over here in Sydney seeing the news just now... Sending my prayers to Ferguson & praying for an equal America."
katyperry;2014-11-25 10:32;4037;8181;"FOR IMMEDIATE RELEASE: Pls keep the fruit out of the stuffing!"
katyperry;2014-11-24 22:31;14659;25087;"3 AMA'S & SUPER BOWL?! Not long ago I was playing guitar on the streets of Santa Barbara for maybe 20 bucks a day & an avocado. Wow, life!"
katyperry;2014-11-24 11:10;5041;9356;". @ SNFonNBC @ NFL Yeppers! And I've already started testing out ideas! http://bit.ly/KPSB49 # halftime"
katyperry;2014-11-24 10:59;5975;12770;"My band is in the other room screaming at the TV (and each other) over this Cowboys-Giants game. Can’t wait for February 1st..."
katyperry;2014-11-23 19:12;7340;16873;"SQUAD DAYpic.twitter.com/GRDsfIaFo6"
katyperry;2014-11-23 19:03;4069;8999;"I DID IT. Finally, after all these years talkin bout it I done climbed your bridge tonight Sydney!… http://instagram.com/p/vvWhd-v-az/"
