katyperry;2018-05-11 08:43;3536;20339;"Don’t forget to take everything with a himayalain grain of salt AND laugh at the devil daily"
katyperry;2018-05-11 07:43;858;5173;"3 Wise WOWmen # TBT @ ronyalwin @St Marks Hotel New York City https://www.instagram.com/p/BinaPqSlSO5/?utm_source=ig_twitter_share …"
katyperry;2018-05-11 05:00;10528;45632;"Isn’t it so wonderful that with every new day there is a new opportunity to see things differently and live more gracefully?"
katyperry;2018-05-10 16:29;5342;28279;"There’s only two states of being. Love or Fear. Which one will you choose?"
katyperry;2018-05-10 16:26;5576;33380;"Love you too my Earth Angel. https://twitter.com/mileycyrus/status/994251454616621058 …"
katyperry;2018-05-09 13:51;1452;10693;"Though I walk through the valley of the shadow of death...… https://www.instagram.com/p/Bii6SGmlpRp/?utm_source=ig_twitter_share …"
katyperry;2018-05-09 07:12;1148;7753;"! You asked for it! I'm ADDING MORE SHOWS! See you in Adelaide on July 28 and Sydney August 17 go on sale at 9am next Monday, May 14! http://katyperry.com/tour pic.twitter.com/G0WE48eu9x"
katyperry;2018-05-08 16:04;1838;15045;"Best dressed: Greta Gerwig # METGALA18"
katyperry;2018-05-07 09:17;1128;7960;"I knew I wore that Donald Duck hat for a reason! https://twitter.com/americanidol/status/993298504578621441 …"
katyperry;2018-05-07 08:53;5241;44613;"Are you watching?! # americanidolpic.twitter.com/OxHNxCJleZ"
katyperry;2018-05-07 08:52;774;6194;"“...when you gotta lil hitch in your giddy up...”- @ LukeBryanOnline # americanidol"
katyperry;2018-05-07 08:00;1067;8207;"TUNE IN NOW AND VOTE! # americanidol"
katyperry;2018-05-05 21:29;6458;28492;"I need a Mai Tai, so f*ckin' sci-fi Give me the password, to the fuckin' WiFi. (OMFG THESE LYRICS/LEWKS & VIDEOIM SCREAINFNEIMDING) GIVE @ NICKIMINAJ rings now # ChunLiMusicVideo"
katyperry;2018-05-05 02:15;1988;14647;"Y’ALL! I’m having TWO much fun to stop now... so why don’t we keep it going!? EXCITED TO ANNOUNCE that @lukebryanofficial, @ lionelrichie, @ ryanseacrest and yours truly will be BACK with another season of # AmericanIdol on @ ABCnetwork pic.twitter.com/WyhCHgYtDC"
katyperry;2018-05-04 07:32;9000;39699;"# TBT This weekend marked the 10th anniversary of the release of I Kissed A Girl! Thank you for believing in me then, and growing with me since # doublethrowbackpic.twitter.com/DujcXBOgyP"
katyperry;2018-05-01 07:58;1033;7600;"Cindy lent me her shoes https://www.instagram.com/p/BiNr026looE/?utm_source=twitter …"
katyperry;2018-05-01 05:48;1643;11155;"dress for the job you want, not for the job you have... https://www.instagram.com/p/BiNdG7NFSpb/?utm_source=twitter …"
katyperry;2018-04-30 11:49;4423;37014;"Someday my prince will comeToday I got Happy and Dopey And now I'm Sleepy. See you next week # AmericanIdolpic.twitter.com/9yp0MZeemR"
katyperry;2018-04-30 09:08;745;5826;"VOTE VOTE VOTE http://americanidol.com/vote @ AmericanIdol @ RyanSeacrestpic.twitter.com/eejrP8Bmdm"
katyperry;2018-04-30 07:42;3088;19056;"Not only is it # AmericanIdol, it's @ DISNEY-THEMED so prepare for wigs to fly whilst "letting it go" and finding your "hakuna matata" It's the first time you can watch and VOTE live COAST TO COAST pic.twitter.com/q7Y4QN7Cis"
katyperry;2018-04-29 14:40;3248;24905;"Honored to be in the presence of His Holiness @ Pontifex's compassionate heart and inclusivity. Thank you to @ meditationbob and # TheCuraFoundation for making it all possible. # UniteToCurepic.twitter.com/EEPWJI2gkT"
katyperry;2018-04-29 02:32;1470;8874;"I’m inspired & encouraged today & grateful to share how meaningful transcendental meditation has been for me. I hope you'll learn about @ CuraFdn & how the newest technologies & cutting edge therapies are bringing hope to the world! http://bit.ly/2HojlJY # UniteToCure pic.twitter.com/7k8wVDbDyq"
katyperry;2018-04-27 23:56;1182;7844;"Are you a BELIEVERListen to @ cynthialovely’s new song now http://smarturl.it/CYN_Believer and let me know if you’re a # BELIEVER! SOUND ONpic.twitter.com/h7Tt3nRt9S"
katyperry;2018-04-27 03:06;874;7013;"https://twitter.com/billboard/status/989572382997336072 …"
katyperry;2018-04-27 02:14;10050;41148;"You wanna open a big door? Try the kindness key"
katyperry;2018-04-24 14:38;1878;13784;"My has been on a roller coaster tonight Congratulations to the Top America, if you truly are a fan of one of these singers, you must vote # americanidolpic.twitter.com/Hr99QY6tda"
katyperry;2018-04-24 08:52;927;7469;""It's time to change their minds." THAT'S THE ATTITUDE, @ dennislorenzo # americanidol"
katyperry;2018-04-24 08:22;1020;9692;"One singer through and two in the danger zone already. R! U! WATCHING ?? hsiriehfjebdhdha # americanidol"
katyperry;2018-04-23 13:55;777;5780;"You got the POWERNow you can VOTE! # AmericanIdolpic.twitter.com/HnRAo9oHBc"
katyperry;2018-04-23 10:58;1509;11994;"What do you mean you don't have the app yet THE POWER IS IN YOUR HANDS (literally when you pick up the phone). VOTE! # americanidolpic.twitter.com/G8fzksH5dN"
katyperry;2018-04-23 08:01;1102;8034;"TUNE IN TONIGHT AT 8/7c FOR YOUR FIRST CHANCE TO VOTE FOR YOUR # AMERICANIDOL Download the app , vote on http://ABC.com or watch and text. Take the wheel!pic.twitter.com/GQYPDzu28H"
katyperry;2018-04-23 07:39;4676;24353;"If the word ear is in Earth, maybe we should listen to it. Peace be with you on this beautiful # earthday"
katyperry;2018-04-21 08:49;1853;9923;"Day isn't until Sunday, but I'm proud to announce that @ kpcollections will be donating 10% of your purchases from now through Monday to http://Water.org to provide safe water to the people who need it Have a great weekend! pic.twitter.com/Zre9reOptY"
katyperry;2018-04-20 00:42;1063;6029;"SANTA BARBARIANS! Join my friends at @ AHASBCal in an amazing living art piece this SATURDAY! You have until noon PT today to sign up. More info on this TEEN-LED community-building event is at http://www.ahapeacebuilders.com . Use promo code FREE when you check out.pic.twitter.com/kEalmtBNfh"
katyperry;2018-04-19 09:12;1110;9195;"I've officially e-scribed https://twitter.com/washingtonpost/status/986726657435324423 …"
katyperry;2018-04-18 23:56;1955;8520;"KatyCats! Remember that time I sent y’all on a disco ball scavenger hunt? Apparently it was cool enough to get nominated for an award! ‍ Vote for the # ChainedToTheRhythm scavenger hunt to win @ TheWebbyAwards!http://capitolrecords.lnk.to/KatyWebbys Voting ends 11:59p PT Thurs 4/19 pic.twitter.com/qvsY8sBVD5"
katyperry;2018-04-18 14:58;152;779;"go to bed dad you’re drunk"
katyperry;2018-04-18 14:56;1131;9439;"high of the day: 0 cavities low: @ washingtonpost won’t deliver physical newspapers to my zip code. Alas, I guess I’ll just have to stay w/my singular perspective of @ nytimes (also I am purposefully @ing WP so I can possibly get this “problem” fixed) anyway, keep scrolling."
katyperry;2018-04-18 12:34;1539;11269;"talking and communicating are two different things - Rebecca Lynn @ VCRebecca"
katyperry;2018-04-17 07:48;1578;10879;"I have good news and bad news today - : I won’t be able to live stream # AmericanIdol today but : I CAN promise you some pants splitting fun Tune in at 8/7c for round of All Star duets!pic.twitter.com/AaqCakSLdT"
katyperry;2018-04-16 07:38;1735;15237;"Ooh, almost time for another # americanidol! Going live with my mama again in under an hour. Get ready for roundwith Mary Christine, East Coast!pic.twitter.com/u3X28XSZt6"
katyperry;2018-04-15 14:30;1472;11533;"And that’s a wrap on the Asian leg of Witness The Tour! Fell in love with many different cherry… https://www.instagram.com/p/BhlMMoXF9QK/"
katyperry;2018-04-13 03:08;1395;11690;"https://twitter.com/forever21/status/984507690700304384 …"
katyperry;2018-04-12 21:41;3136;17266;"I had a wonderful chat with @ dualipa for @ vmagazine, coming soon to a newsstand near you. Nice catching up with her since the California Dreams tour! pic.twitter.com/1mFy1Zn6HD"
katyperry;2018-04-10 16:45;15003;48076;"even when you don’t believe in love, love believes in you."
katyperry;2018-04-10 14:46;724;5379;"To @ laylaspring @ LegitDominique @ BrandonDMusic @ kaykaydna @ TrevorMcBane just because your # americanidol journey has ended, please don’t let it discourage you. Keep singing, keep following your dreams! Trust and believe I heard no 1,786 times before I heard yes. KEEP SWINGING."
katyperry;2018-04-10 14:43;651;5279;"Unfortunately we had to make a drastic cut of 5 If the show is still stuck in your DVR you better press play! And SPOILER, DON’T READ THE NEXT TWEET IF YOU HAVEN’T WATCHED YET # americanidol"
katyperry;2018-04-10 14:42;515;3623;"@ hashtagcatie gives good hugs! @ DennisLorenzo sounds like a flock of beautiful doves! @ jonnybrenns did ballet! @michaeljwoodward & Pat avoided eye contact @ cadefoehner made mom swoon again @ michellesussett made me love her & @ gabbybarrett_ showed UP # americanidol"
katyperry;2018-04-10 14:36;598;5034;"Caught up on # AmericanIdol on the ! Here are my highlights:"
katyperry;2018-04-10 09:57;1268;10504;"MFW when they tell us we have to send home 5 of the 12 contestants tonight ...BUT it’s time for ALL STAR DUETS! I’m traveling to Bangkok during the show so won’t be able to live tweet with you West Coast, but make sure to tune in at 8p to see ALL THE TALENT # americanidolpic.twitter.com/Q26kiFPuTM"
katyperry;2018-04-10 02:04;1297;7702;"I can't wait for you to witness my baby bird @ cynthialovely when she opens for me in Mexico!Tickets at http://www.katyperry.com/tour pic.twitter.com/94BhAYA6ag"
katyperry;2018-04-09 10:57;1523;13022;"Who's ready for # americanidol Live on Instagram from Singapore in 5 minutes! This Top 24 is so fresh n so clean, y'all! pic.twitter.com/DMlAERIQSB"
katyperry;2018-04-07 12:06;908;6211;"Zomg this is me everyday after I read the whole internet. Lucky, there’s so much to learn in nature... https://twitter.com/am2dm/status/981651582944034816 …"
katyperry;2018-04-07 11:54;925;9112;"V Cute!https://twitter.com/americanidol/status/982412212823212033 …"
katyperry;2018-04-07 03:04;912;7049;"Oh this is just puurrfect # KatyKatGloss was named Best Lip Lustre in @ InStyle's Best Beauty Buys of 2018! Thank you so much Get your Friday night brights on and try one of the 12 shades I made just for yew! http://www.instyle.com/best-beauty-buys …pic.twitter.com/PA5tdnmJs7"
katyperry;2018-04-05 08:15;1773;10442;"On this day 50 years ago, they tried to silence his voice, but the # DreamStillLives https://twitter.com/steviewonder/status/981684090264064000 …"
katyperry;2018-04-04 18:42;2120;19229;"was feeling homesick today, being on this leg of tour for over 4 weeks now and then I put on @ KaceyMusgraves’s new record, Golden Hour during yoga and she made me feel not so alone. Music is so powerful and I am so grateful."
katyperry;2018-04-03 12:52;517;4480;"@ maddiezahm # americanidol"
katyperry;2018-04-03 12:51;454;3750;"You’re not going to miss this dance @ effiepassero. # americanidol"
katyperry;2018-04-03 12:40;464;3622;"\m/ @ CadeFoehner \m/ Keep that feather, keep catching those dreams. # americanidol"
katyperry;2018-04-03 12:29;663;6233;"HONEY! # americanidol"
katyperry;2018-04-03 12:27;432;3408;"@ calebleemusic WE ARE LISTENING AND WE LIKE WHAT WE HEAR! # americanidol"
katyperry;2018-04-03 12:20;427;3326;"@ MaraJustine1 There’s not just glitter on your nails It’s in every pore, and it comes out every time you sing # americanidol"
katyperry;2018-04-03 12:14;438;3426;". @ JonnyBrenns If your family being here meant that much to ME, I can only imagine how it felt to you. Nearly cried my lashes off! And your brother singing along! # americanidol"
katyperry;2018-04-03 12:06;551;4107;"You DO belong here! And anywhere you want! @ AdaVox # thatruntho # americanidolpic.twitter.com/GX8B2CspFg"
katyperry;2018-04-03 12:02;456;3341;"Out of the ashes, rises the phoenix @ AdaVox # americanidol"
katyperry;2018-04-03 12:01;376;2818;"Your attitude will take you everywhere, @ vmcqueenmusic I can’t wait to see what you do. # americanidol"
katyperry;2018-04-03 12:01;444;3669;"My wig is waiting to be blown off even harder and farther next year, @ noahdavis50 # americanidol"
katyperry;2018-04-03 11:56;605;4452;"WHAT IS WITH THESE COMMERCIAL BREAKS @ ABCNetwork YOU KEEP ME HANGING LIKE ALL MY EXES # americanidol"
katyperry;2018-04-03 11:43;73;344;"@ jurnee Ashley 4EVA # americanidol"
katyperry;2018-04-03 11:41;393;2855;"Good luck @ WillCasanovaDC. You’ll always have a leg up on the competition # americanidol"
katyperry;2018-04-03 11:39;671;5527;"Are you over me @ lukebryanonline? This gif looks like you are # americanidolpic.twitter.com/FCvkLI99Pg"
katyperry;2018-04-03 11:35;456;3494;"THAT IS NOT RIGHT @ ABCNetwork I CAN’T BELIEVE YOU CUT TO COMMERCIAL AND KEPT PEOPLE HANGING # americanidol"
katyperry;2018-04-03 11:33;447;3306;"It’s true, I can get a little bit feisty when I’m fighting for something I believe in. Sorry not sorry @ lukebryanonline # americanidol"
katyperry;2018-04-03 11:33;553;3990;"I swear to tell the truth, the whole truth, and nothing but the truth so help me God # americanidol"
katyperry;2018-04-03 11:33;379;2985;"Your dad is my hero @ hashtagcatie # americanidol"
katyperry;2018-04-03 11:31;757;4297;"Tears are salt. Salt is healing. Crying is good for your health. @ hashtagcatie # americanidolpic.twitter.com/mJAiGR46dK"
katyperry;2018-04-03 11:30;402;3192;"DON’T TOUCH MY SAUCE! @ alyssaraghu # americanidol"
katyperry;2018-04-03 11:28;389;2808;"101% IS RIGHT @ michellesussett # americanidol"
katyperry;2018-04-03 11:24;524;4147;"You are enough, and I still believe in you, put one foot in front of the other # ThaddeusJohnson # americanidol"
katyperry;2018-04-03 11:20;371;2955;"PS your dad is a beautiful man and your family deserves all the happiness in the world @ gabbybarrett_ # americanidol"
katyperry;2018-04-03 11:20;358;2936;"I AM READY TO BE CONVINCED! @ gabbybarrett_ # americanidol"
katyperry;2018-04-03 11:13;640;5128;"Rest In Peace and see you in my dreams @ tholmesmusic # americanidol"
katyperry;2018-04-03 11:13;381;3172;"Hi Sierra @ tholmesmusic # americanidol"
katyperry;2018-04-03 11:12;430;3750;"@ LukeBryanOnline @ MichaelJWoodardpic.twitter.com/ZtxXHyx4x1"
katyperry;2018-04-03 11:11;433;3288;". @ MichaelJWoodard @ LukeBryanOnline # americanidolpic.twitter.com/XIbgd9Y7us"
katyperry;2018-04-03 11:09;4357;25518;"Whenever I feel any anxiety, I just breathe through my nose and out through my mouth ‍"
katyperry;2018-04-03 11:05;423;3239;"Spring has SPRUNG! @ LaylaSpring # americanidol"
katyperry;2018-04-03 11:01;675;5374;"Can we re-name this American IdolS? Because this is getting tough to boil it down to one person # americanidol"
katyperry;2018-04-03 05:47;962;8560;"WEST COAST! I'm live-Tweeting # americanidol with you tonight before I catch a plane to Taipei. It's the FINAL JUDGMENT!"
katyperry;2018-04-02 05:14;2173;15313;"Catch all the feels with me LIVE tonight on Instagram at 8p PT when @ AmericanIdol is back for Hollywood Week solos I'll take YOUR questions at the commercial breaks! # americanidolpic.twitter.com/seAw5BMmYc"
katyperry;2018-04-01 14:30;1599;12311;"my brokenness + God’s Divinity = my wholeness @Hong Kong https://www.instagram.com/p/BhBJCOMlD64/"
katyperry;2018-03-31 16:48;12087;51732;"Every day is a new opportunity to show up"
katyperry;2018-03-31 02:25;956;8280;"There's something in the : new arrivals at http://katyperrycollections.com (and buy one get one 50% off with code BUNNYHOP just for Easter weekend)pic.twitter.com/KPoWGf9Fi5"
katyperry;2018-03-29 08:21;1328;10743;"Sometimes your wig flies when you least expect it on @ AmericanIdol. Today's # WigWednesday goes to @ MichaelJWoodard. What a beautiful soul. # americanidolpic.twitter.com/a5w0voxyuz"
katyperry;2018-03-28 14:08;2950;16187;"Looking forward to performing “Act My Age” @ ntv_sukkiri for Japan! It’s going to be my first time performing this bonus # Witness song on ! AISHITEMASU! https://twitter.com/ntv_sukkiri/status/978804072324022272 …"
katyperry;2018-03-27 12:53;1091;8245;"I know it's uncouth to dip out in the middle of the show, but I must prep for my Tokyo show now. Good luck to everyone in the group rounds, and I'll recap with you all later. you all, you all, Godspeed # americanidol"
katyperry;2018-03-27 12:49;711;5788;"TBH I still sleep everywhere - planes, trains, automobiles, corners of rooms, it doesn’t stop once you pop # americanidol"
katyperry;2018-03-27 12:49;502;3808;"FIND YOUR TRIBE # americanidol"
katyperry;2018-03-27 12:36;423;3350;"You've already won @ _davidfrancisco # americanidol"
katyperry;2018-03-27 12:32;542;3823;"When the whole world falls in love with you, this love triangle is going to turn into a rhombicosidodecahedron. Get ready @ tholmesmusic # americanidol"
katyperry;2018-03-27 12:27;367;2776;"Omg @ DennisLorenzo who knew you were a gymnast # americanidol"
katyperry;2018-03-27 12:21;477;3781;"Shoutout to # jurnee's wife. Thank you for your service # americanidol"
katyperry;2018-03-27 12:17;397;2842;"We all believe in you and it's written in the stars so trust the universe @ jonnybrenns # americanidol"
katyperry;2018-03-27 12:10;667;5378;"Shout out @ samsmithworld. Love you buddy # americanidol"
katyperry;2018-03-27 12:05;409;2847;"From now on, I'm not gonna say "break a leg" for every performance that you do @ CadeFoehner, but I am kinda glad that you broke that first leg # americanidol"
katyperry;2018-03-27 11:57;412;3125;"You are a dream @ MaddiePoppe # americanidol"
katyperry;2018-03-27 11:56;424;3265;"I you, and I you @ zachdonofrio. Every time I wear my socks, I'll think of you # americanidol"
katyperry;2018-03-27 11:53;463;2979;"Find someone who looks at you like @ hashtagcatie looks @ zachdonofrio # americanidol"
katyperry;2018-03-27 11:43;451;3633;"Every time @ LionelRichie cries, a dove dies # americanidol"
katyperry;2018-03-27 11:40;385;3272;"SHAKE AND BAKE AND IIIIII HELPED # MiloSposato # americanidol"
katyperry;2018-03-27 11:39;439;3402;". @ noahdavis50 # americanidolpic.twitter.com/oE5wIvaW6A"
katyperry;2018-03-27 11:19;406;3218;"Take us to church @ TrevorMcBane # americanidol"
katyperry;2018-03-27 11:16;415;2996;"You're MY hero @ AlyssaRaghu # americanidol"
katyperry;2018-03-27 11:15;415;2838;"You can be like a and you can bend and sway and you will not break @ laylaspring # americanidol"
katyperry;2018-03-27 11:08;406;2937;"HOLY CRAP I'M NERVOUS. We are separating the singers from the superstars now, aren't we @ LukeBryanOnline @ LionelRichie @ RyanSeacrest # americanidol"
katyperry;2018-03-27 11:04;391;2904;"You did not just kiss your bicep @ tholmesmusic # americanidol"
katyperry;2018-03-27 11:03;536;3615;"Luck is when opportunity meets preparation, truer words were never spoken @ RyanSeacrest # americanidol"
katyperry;2018-03-27 11:03;618;5568;"Welcome back! # americanidol"
katyperry;2018-03-27 08:07;800;5324;"Is it a ? Is it a ? No, it’s @ LukeBryanOnline, @ lionelrichie, @ ryanseacrest and my enormous heads in an attempt to do promo for # AmericanIdol’s HOLLYWOOD WEEK! Who knew it was this BIG of a deal? ‍pic.twitter.com/Y5NJAWsTaN"
katyperry;2018-03-26 13:12;855;6140;"YOU DID NOT COME HERE TO PLAY YOU CAME HERE TO SLAY @ adavox # americanidol"
katyperry;2018-03-26 13:12;1036;5909;"Social media is a blessing and a curse. Don't let bullies behind a keyboard tell you what you're worth. Thank you for staying and singing @ adavox # americanidol"
katyperry;2018-03-26 12:57;460;3179;"We work hard AND we play hard, right @ LukeBryanOnline @ LionelRichie @ RyanSeacrest? (Well, not you, @ RyanSeacrest. You just work…) # americanidol"
katyperry;2018-03-26 12:54;447;2910;"It looks like you have arrived on the right path now, and we are with you on this journey @ jurnee # americanidol"
katyperry;2018-03-26 12:52;445;3217;". @ lukebryanonline is the of bad dad jokes # americanidol"
katyperry;2018-03-26 12:49;414;2874;"Glad you could watch the big win Now FOCUS on helping us find a big star on # americanidol, @ LukeBryanOnline"
katyperry;2018-03-26 12:45;520;3085;"People listen with their eyes more than they listen with their ears. Truer words were never spoken. @ DamianoScarfi # americanidol"
katyperry;2018-03-26 12:41;458;3228;"I still think you got that sparkle # Orion # americanidol"
katyperry;2018-03-26 12:37;428;3057;"Welcome to the city # SamuelSwanson. Serving up a slice of velvet pie! # americanidol"
katyperry;2018-03-26 12:37;431;2927;"Be encouraged, Lovely Rose This is only the beginning of a beautiful journey for you # AyanaRoseLawson # americanidol"
katyperry;2018-03-26 12:17;448;3030;"There is a in you, and it’s lovely to see it rise. Let’s all dream the dream together with you and momma @ carlymoffa # americanidol"
katyperry;2018-03-26 12:14;407;2687;"A beautiful mess @ carlymoffa # americanidol"
katyperry;2018-03-26 12:07;422;3312;"Your father has fought this far for you and now we will join him on the front lines. Love you # BrielleRathbun, you strong woman # americanidol"
katyperry;2018-03-26 12:04;385;2627;"THAT’S the signature thrust, @ lukebryan?? # americanidol"
katyperry;2018-03-26 12:00;563;3420;"Beauty can be a combination of glowing soul and skin deep and if you’ve got both, then # americanidol"
katyperry;2018-03-26 11:54;407;2728;"I’m absolutely IN LOVE with everything that is @ michaeljwoodard # americanidol"
katyperry;2018-03-26 11:47;426;3222;"From one weirdo to another I U # Jarom # americanidol"
katyperry;2018-03-26 11:39;387;2578;"Well, ya “zoomed” through to Hollywood @ leeleevasi but be sure to keep your hands on the wheel so you don’t crash and burn # americanidol"
katyperry;2018-03-26 11:35;644;4196;"The difference between nerves and excitement is preparedness. # americanidol"
katyperry;2018-03-26 11:31;393;2797;"I’ll stand by you @ LoniSaysRawr # americanidol"
katyperry;2018-03-26 11:26;389;2594;"This montage is sponsored by @ SPANX (jk) ilysm ‍ # americanidol"
katyperry;2018-03-26 11:25;458;3046;"SNAAAAAAAAAACKTTTTHHHS (inspo) https://youtu.be/L52dVwMJTEc # americanidol"
katyperry;2018-03-26 11:23;399;2556;"Hey HOLLYWOOD aka @ DrakeMilligan, no scoopin’ steel parts for you! Just scoopin’ notes from now on! # americanidol"
katyperry;2018-03-26 11:21;830;4826;"# throwback The Queen is in the building! You sound better than a hound dog chasing a gut truck # americanidolpic.twitter.com/ebyhZQ1pWW"
katyperry;2018-03-26 11:14;469;3096;"Sometimes you play with when you sing your hero’s songs in front of them...good thing you cooked up something real nice! @ caitlinlucia # americanidol"
katyperry;2018-03-26 11:11;382;2503;"Shout out @ taylorguitars # americanidol"
katyperry;2018-03-26 11:11;391;2509;"Shout out @ hotelcafe # americanidol"
katyperry;2018-03-26 11:09;1057;6054;"Be your own hero. # americanidol"
katyperry;2018-03-26 11:09;504;3526;"I’m such a punk ‍ # americanidol"
katyperry;2018-03-26 11:08;432;2798;"When all else fails, take ‘em to church! @ gabbybarrett_ # americanidol"
katyperry;2018-03-26 11:06;423;2797;"I can’t believe @ gabbybarrett_ made @ ryanseacrest emotional! I for sure thought you had your feelings removed since you’ve been in Hollywood, Ryan! # americanidol"
katyperry;2018-03-26 11:05;631;3501;"If anybody woke me up like that @ gabbybarrett_ , I would have their head # americanidolpic.twitter.com/F3ClqRlpsR"
katyperry;2018-03-26 11:03;444;2801;"What a great way to start the last episode of auditions Right, @ lionelrichie @ lukebryan @ ryanseacrest # americanidol"
katyperry;2018-03-26 11:01;489;3262;"Looks like the kids are about to take @ lionelrichie to church via choir # americanidol"
katyperry;2018-03-26 05:29;1967;12140;"Get your snacks ready! It's the last night of auditions before Hollywood Week! # americanidolpic.twitter.com/wJC4BL20U4"
katyperry;2018-03-25 08:44;4296;25355;"What an inspiring turnout for # MarchForOurLives. I am so encouraged by our youth, our future, leading us to change! I am with you in spirit and in solidarity. Sending my love from Tokyo pic.twitter.com/GXBDfeB07M"
katyperry;2018-03-24 01:52;1015;6358;"THIS JUST IN Now your little one can make their match yours! I’m so excited to announce @ kpcollections now has KICKS FOR KIDS! Go to http://katyperrycollections.com to get yours today! pic.twitter.com/ZYM8OJVh7o"
katyperry;2018-03-23 02:49;752;2837;"pic.twitter.com/fRLMOzEVFX"
katyperry;2018-03-22 23:36;3170;12171;"Water should be a right, not a privilegeToday, 2.1 billion people do not have access to safe water. I saw some of this firsthand in Madagascar in 2013 and in Vietnam in 2016. This has to change To learn more https://www.unicef.org/wash/waterandclimate/#WorldWaterDay … # ForEveryChild pic.twitter.com/or59JylSyf"
katyperry;2018-03-22 21:09;1112;5863;"Your v own California GUUUURRRLLL coming for you, San Diego! Can't wait to see you @ @ KAABOODELMAR in September! Passes on sale at 9:00a https://goo.gl/8MH9H9 pic.twitter.com/3yIueudq4o"
katyperry;2018-03-22 12:17;2471;12773;"I CAME. I SAW. I WITNESSED BRASIL I love you so very much KC’s @Museum of Contemporary Art… https://www.instagram.com/p/BgnJ46olhIc/"
katyperry;2018-03-21 13:26;179;1717;"Actually they said this was your favorite one:pic.twitter.com/q5IoFZgM3H"
katyperry;2018-03-21 13:12;3697;18759;"lysm kc’s. thank you for always having my back. i gotchu 2."
katyperry;2018-03-21 07:31;1439;9221;"OF THE Katy Kat Palette now available online at http://katyperryxcovergirl.com . Are you a Hot Kat or a Cool Kat ? : @ manthony783 : @ chrisappleton1pic.twitter.com/a6TFsANmZV"
katyperry;2018-03-21 01:27;741;4877;"DETENTION @ cynthialovely should be on the honor roll! Lyric video for Alright is out NOW! https://twitter.com/vmagazine/status/976128416155095040 …"
katyperry;2018-03-20 13:20;627;4877;"Keep breaking the cycle @ MarcioDonaldson"
