katyperry;2016-10-14 08:25;2047;8573;"There's a lot of women making HERstory this election cycle! Find them up AND down the ballot Nov… https://www.instagram.com/p/BLhevmWgELj/"
katyperry;2016-10-12 01:05;8816;20621;"Investing in girls helps them build better lives and creates a more peaceful and prosperous world for ALL. RT if you agree # dayofthegirlpic.twitter.com/4hndfWsEoQ"
katyperry;2016-10-11 13:52;2249;8523;"Just wrapped another great @ COVERGIRL shoot. Honored to have the pleasure to announce the very… https://www.instagram.com/p/BLaV3V3Ay99/"
katyperry;2016-10-10 12:29;5125;16564;"There's a few brains I would like to see science dissect after full utilization and @ Sia's should be one of them. ILYSM"
katyperry;2016-10-10 10:52;2538;10601;"Finally, last debate is OCT 19. FIGURE OUT A WAY TO COVER MORE ISSUES. # debate"
katyperry;2016-10-10 10:43;1465;6599;"Twitter world: it's spelled Hillary with 2 L's (but I kinda have no room to talk re typos)"
katyperry;2016-10-10 10:39;948;4082;"YES THIS https://twitter.com/shannonwoodward/status/785308542093754368 …"
katyperry;2016-10-10 10:39;1145;5047;"I'm so glad for # earlyvoting # debates"
katyperry;2016-10-10 10:38;607;2493;"I'm coming over with a bottle"
katyperry;2016-10-10 10:38;1244;4643;"Make # karlbecker #1 TT if you have a"
katyperry;2016-10-10 10:36;1242;4604;"# KarlBecker"
katyperry;2016-10-10 10:34;2061;6182;"MY HEART GOES ON"
katyperry;2016-10-10 10:30;1322;5144;"# DROPTHEMICHRC"
katyperry;2016-10-10 10:28;1005;4284;". @ RonanFarrow measly numbers"
katyperry;2016-10-10 10:17;1220;4570;"COME ON WE DONT HAVE TIME TO MISS THIShttps://twitter.com/sallykohn/status/785302848875749377 …"
katyperry;2016-10-10 10:16;409;1311;"GIF u kno"
katyperry;2016-10-10 10:14;478;1456;"this is what the meme was created for"
katyperry;2016-10-10 10:02;1703;6501;"I notice these are not built in mics tonight...PLEASE DROP THE MIC TONIGHT HILL! @ HillaryClinton # DROPTHEMICHRC # debates"
katyperry;2016-10-10 09:55;986;4054;"YAShttps://twitter.com/sallykohn/status/785297182236798976 …"
katyperry;2016-10-10 09:50;1131;4227;"*teeth, you get it."
katyperry;2016-10-10 09:49;934;3590;"WHAT IT MEANS TO SMILE WITH YOUR MOUTH # YOUGOTTHIS http://www.bodylanguagesignals.com/mouth.html"
katyperry;2016-10-10 09:45;9164;14386;"RT IF YOU ARE YELLING AT THE TV RIGHT NOW. # debates"
katyperry;2016-10-10 09:42;1526;5867;"KEEP THEM NOTES @ HillaryClinton"
katyperry;2016-10-10 09:32;1080;4544;"Lol https://twitter.com/chelseahandler/status/785291253457883136 …"
katyperry;2016-10-10 09:31;1203;4591;"# GETTOTHEPOLICIEShttps://twitter.com/shannonwoodward/status/785290669111676928 …"
katyperry;2016-10-10 09:27;976;3883;"I KNOW # GETTOTHEPOLICIEShttps://twitter.com/joshgroban/status/785289908302807040 …"
katyperry;2016-10-10 09:22;2593;7348;"PUSSY, say it!https://twitter.com/ronanfarrow/status/785287790657474560 …"
katyperry;2016-10-10 09:18;7611;13375;"BEST joke of the yearhttps://twitter.com/realmattlucas/status/785286960889880576 …"
katyperry;2016-10-10 09:14;445;1278;"beta blockers"
katyperry;2016-10-10 09:04;1520;5923;"SLOW AND STEADY WINS THE RACE. # YOUGOTTHISHRChttps://twitter.com/hillaryclinton/status/785282982261190656 …"
katyperry;2016-10-10 08:55;2222;8986;"DON'T SHAKE HIS HAND # debates"
katyperry;2016-10-10 07:49;1940;7251;"...police reform, gun control, mental health awareness, women's rights & affordable education @ HillaryClinton # Debates"
katyperry;2016-10-10 07:49;2313;9735;"Difficult subjects I'd like to hear thoughts on tonight are: national security, climate change, excess incarceration (aka modern slavery)..."
katyperry;2016-10-10 07:29;1899;8165;"...lays out her policies about difficult subjects to an audience that is already preparing a seat at the table for her"
katyperry;2016-10-10 07:29;1870;7099;"My wish for tonight's # Debates is that @ HillaryClinton ignores the troll's time-wasting distractions and..."
katyperry;2016-10-09 05:01;2490;8508;"I dare you to stay home from the club tonight and get woke, I am:http://youtu.be/V66F3WU2CKk"
katyperry;2016-10-08 18:16;2002;6771;"Gone fishin https://twitter.com/getglucky/status/784676024642523136 …"
katyperry;2016-10-08 16:25;763;2108;"Nope. I would stay and peacefully protest."
katyperry;2016-10-08 16:04;620;1836;"it was one of those classic "celebs should keep their opinion to themselves lols""
katyperry;2016-10-08 15:57;1711;7985;"Wait...he is a celeb...so what ur saying is...don't use your voice...BUT run for president! Oh! Got it, thanks https://twitter.com/tbisez/status/784661380666368000 …"
katyperry;2016-10-08 15:46;1626;5667;"Lk! I found the new trump campaign clip, watch here: https://m.youtube.com/watch?v=FMUuuWUC-JU … # happyhalloween? # NSFW"
katyperry;2016-10-08 15:11;1310;5147;"Finally, some light at the end of the tunnel!https://twitter.com/getglucky/status/784641665453559808 …"
katyperry;2016-10-08 13:27;1747;6244;"Gay 4 DOLLY! https://www.instagram.com/p/BLSkmeRgdGr/"
katyperry;2016-10-08 12:07;517;1597;"@ RealMattLucas never forget skittles."
katyperry;2016-10-08 12:04;6122;16870;"If you have any more excuses about him after watching this, God have mercy on your soul.https://twitter.com/hillaryclinton/status/784542470847631360 …"
katyperry;2016-10-07 09:51;3338;9814;"Yes! Everyone is getting into formationhttps://twitter.com/benandjerrys/status/784062366577225728 …"
katyperry;2016-10-07 09:39;5003;8050;"I am ready papi"
katyperry;2016-10-07 06:56;3992;11045;"A visual explanation to what ppl in Florida and surrounding areas are experiencing... send them prayers up!https://twitter.com/bautistany/status/784141088705671174 …"
katyperry;2016-10-07 06:44;1881;7241;"My new president and my new preacher together at last!!! https://twitter.com/hillaryclinton/status/784137846865137664 …"
katyperry;2016-10-06 16:46;1857;6696;"HOLY SHIT this song by @ skottpeace is vibes for days:https://open.spotify.com/track/6vkGrjJyFJOSAD9oH3ICRZ …"
katyperry;2016-10-06 07:36;4167;13869;"You hear it as "excellent" I hear it as "egg salad with lint""
katyperry;2016-10-05 18:25;3586;9406;""
katyperry;2016-10-05 14:51;1460;6846;". @ ferras & I are cadence kweens cc @ jessesaintjohn"
katyperry;2016-10-05 08:19;3171;12091;"You know it's a good meeting when you have fomo while just going to the toilet."
katyperry;2016-10-04 04:31;1864;6995;"WOAH. Was floored by my bestie @ shannonwoodward last night in @ WestworldHBO I'm foaming at the mouth for more, questioning everything today"
katyperry;2016-10-04 04:26;546;1712;""
katyperry;2016-10-02 16:04;3314;15247;"In a world driven by fear @ DollyParton makes me feel safe, pure and simple."
katyperry;2016-10-01 19:10;7854;24681;"ready for October likepic.twitter.com/thGnDNXJSA"
katyperry;2016-10-01 03:41;1717;6889;"DOPE HABIBI https://twitter.com/ferras/status/781916398737948672 …"
katyperry;2016-09-30 15:37;4426;14218;"meaningful lyrical connection + bit of math + makes your head bob = pop song recipe"
katyperry;2016-09-30 06:23;2086;8520;"When you think summer is over but it's still about 90 degrees out here and you need to match the… https://www.instagram.com/p/BK9NqzXAcis/"
katyperry;2016-09-30 03:06;2508;8419;"HOW MANY MORE FUNNY THINGS DO WE HAVE TO DO TO GET YA TO THE POLLS NOV 8TH?! LOL. But seriously: https://www.youtube.com/watch?v=jzae4DKexko … # VoteHoney"
katyperry;2016-09-29 14:40;2046;7416;"A MUST READ FOR OUR FUTURE: orlandobloom's photo https://instagram.com/p/BK1_KKrjkt0/"
katyperry;2016-09-29 09:58;1741;6882;"Is something quite atrocious.https://twitter.com/getglucky/status/781278747479728128 …"
katyperry;2016-09-27 20:03;13208;31724;"Today, on # VoterRegistrationDay, I, @ funnyordie and @ rockthevote invite you to... # IRegisteredpic.twitter.com/6kscHoRa0k"
katyperry;2016-09-27 11:09;4506;13141;"From the beginning https://twitter.com/hillaryclinton/status/780599274384027648 …"
katyperry;2016-09-27 10:43;3907;12491;"when*https://twitter.com/vicenews/status/780598588887928832 …"
katyperry;2016-09-27 10:41;2151;8879;"Sleeping for a week now # debates"
katyperry;2016-09-27 10:37;3513;14149;". @ HillaryClinton pic.twitter.com/AOJkDuZwtp"
katyperry;2016-09-27 10:35;1342;5318;"OMG THE BIBLE https://twitter.com/merriamwebster/status/780595632658677760 …"
katyperry;2016-09-27 10:29;539;1822;"@ iamrashidajones this is what this gif was made for BRAVO"
katyperry;2016-09-27 10:27;1639;5853;"Is this a comedic episode of Black Mirror or...https://twitter.com/sallykohn/status/780594022603776000 …"
katyperry;2016-09-27 10:23;2575;9533;"This is like watching a frog sitting in water that is boiling slowly... # debates"
katyperry;2016-09-27 10:20;1912;6385;"5 minute time out for surehttps://twitter.com/bdgrabinski/status/780590812929204224 …"
katyperry;2016-09-27 10:18;1107;4495;"May I request one with a pitched down plshttps://twitter.com/getglucky/status/780591929251753984 …"
katyperry;2016-09-27 10:16;928;4245;". @ sallykohn sorry, meditation. I can't even spell anymore # debates"
katyperry;2016-09-27 10:15;952;4315;". @ sallykohn I'm going straight into a mediation after this."
katyperry;2016-09-27 10:13;1784;6888;"Must be the prep lolhttps://twitter.com/zachweiner/status/780590027457728512 …"
katyperry;2016-09-27 10:13;552;1683;"there you are, welcome to the party bb"
katyperry;2016-09-27 10:08;1500;6097;"*sets up catheter to not miss a beat* # debates"
katyperry;2016-09-27 10:04;1295;5190;"It's a # Debates drinking game for sure https://twitter.com/lenadunham/status/780588329519710209 …"
katyperry;2016-09-27 10:03;2907;9036;"https://twitter.com/hillaryclinton/status/780588262402424832 …"
katyperry;2016-09-27 10:02;1645;6261;"I literally just did a dance around the room in my pj'shttps://twitter.com/sallykohn/status/780587971418460161 …"
katyperry;2016-09-27 09:58;974;4042;". @ getglucky and Santa is real lol"
katyperry;2016-09-27 09:58;1505;5446;"Buy me something off my amazon prime listhttps://twitter.com/shannonwoodward/status/780586866101714944 …"
katyperry;2016-09-27 09:52;1368;5247;"Yes! https://twitter.com/sallykohn/status/780584532995108864 …"
katyperry;2016-09-27 09:32;469;1649;"genius"
katyperry;2016-09-27 09:31;3400;11272;"She's smiling with ease cause # shesgotthis # ImWithHer # debatenight"
katyperry;2016-09-27 09:24;3894;10395;"YOU LIVE IN YOUR OWN REALITY # debatenight"
katyperry;2016-09-27 05:03;5958;17217;"TOMORROW, I USE MY BODY AS CLICK BAIT TO HELP CHANGE THE WORLD pic.twitter.com/1a2GMm6PMi"
katyperry;2016-09-26 22:15;2732;10025;"Ready for # mudslingmonday # YOUGOTTHISHRCpic.twitter.com/0lbXPnUKDD"
katyperry;2016-09-25 15:05;683;2174;"I'm Gaten Matarazzo from ST. TBH."
katyperry;2016-09-25 15:03;594;1978;"yas kween"
katyperry;2016-09-25 14:56;619;2125;"thank you for this foto"
katyperry;2016-09-25 14:52;583;2029;"oh look who's back"
katyperry;2016-09-25 14:49;585;1945;"more shame. I guess I'll just stop interacting."
katyperry;2016-09-25 14:44;1274;6013;". @ akaruikaty cause you can't have fun if you don't feel safe bb"
katyperry;2016-09-25 14:42;974;4780;". @ maddisonxperry !WOMEN'S! calm down, I scored an 99. (room to grow )"
katyperry;2016-09-25 14:38;581;1859;"oh yeah add better education initiatives & affordable schooling, obvi I would have benefited from that as per my typo's"
katyperry;2016-09-25 14:35;1122;5271;". @ maddisonxperry oh I forgot mental health awareness"
katyperry;2016-09-25 14:30;1272;5769;". @ maddisonxperry national security, gun control, police reform, excess incarceration and woman's rights"
katyperry;2016-09-25 12:31;2820;12170;"I agree w/all besides part about the intentions of both candidates. Well spoken KKW, we must feel safe to ask's !https://twitter.com/kimkardashian/status/779869447288913920 …"
katyperry;2016-09-24 07:42;2292;8481;"AYE, ERRYONE! LISTEN TO THIS CHUNE! (gonna sprain a hip at some point this weekend)https://twitter.com/ferras/status/779405565911003136 …"
katyperry;2016-09-23 21:35;2756;9631;"when you find your prince @Shanghai Disneyland Park https://www.instagram.com/p/BKs0d6kgnUq/"
katyperry;2016-09-22 06:27;2457;8830;"Zuck & Chan for prez 2024!"
katyperry;2016-09-22 06:16;1337;3494;"been watching it from fetus"
katyperry;2016-09-22 06:14;2035;6815;"Dose me bbhttps://twitter.com/ferras/status/778702367466229760 …"
katyperry;2016-09-21 13:10;3683;10005;""
katyperry;2016-09-21 04:24;3664;10288;"tbh shakespeare https://twitter.com/vanityfair/status/778220938122792961 …"
katyperry;2016-09-20 15:26;3133;10223;"so. ready.https://twitter.com/karlihenriquez/status/778107939861237760 …"
katyperry;2016-09-20 06:10;2950;10248;"my body is a temple https://www.instagram.com/p/BKjcPd8gj9T/"
katyperry;2016-09-18 16:02;836;3104;"it's called calling bs"
katyperry;2016-09-18 15:57;781;2802;"needs a chiroprac -gma perry"
katyperry;2016-09-18 15:56;786;2788;"soon I'm on 9%"
katyperry;2016-09-18 15:54;4455;7388;"see you at my show 2K17"
katyperry;2016-09-18 15:53;842;2739;"Choose life. Don't let those words come out your mouth."
katyperry;2016-09-18 15:52;618;2281;"no there's always room"
katyperry;2016-09-18 15:48;668;2421;"calm down"
katyperry;2016-09-18 15:45;835;2665;"will be sending a prayer up for you tonight. You're strong. We have your back."
katyperry;2016-09-18 15:40;621;2251;"ageist"
katyperry;2016-09-18 15:39;880;2656;"iconic"
katyperry;2016-09-18 15:38;577;2092;"also I hv had one of those lime a ritas and they are cray"
katyperry;2016-09-18 15:37;565;2078;"I've only had 2 can't I just b nice"
katyperry;2016-09-18 15:33;577;2120;"thank you for this"
katyperry;2016-09-18 15:30;546;1948;"drink pedialyte."
katyperry;2016-09-18 15:29;584;2082;"drink 1 glass of water"
katyperry;2016-09-18 15:26;608;2050;"a finely chopped anything. Love endive tho and I go wild for hearts of palm tbh."
katyperry;2016-09-18 15:21;568;2031;"jk ily"
katyperry;2016-09-18 15:21;661;2194;"don't come for me, I birthed u"
katyperry;2016-09-18 15:19;1033;2464;"at least we're on the same time zones, think of Brazil"
katyperry;2016-09-18 15:18;714;2271;"I hv 140 characters, whut do u want?"
katyperry;2016-09-18 15:16;546;1936;"yeah mines in the mail"
katyperry;2016-09-18 15:02;823;2386;"because I am saving some mystery. Jk I don't have room on my phone. Waiting for my new iPhone with more storage."
katyperry;2016-09-18 15:00;570;1924;"everything's a lie, watch zeitgeist."
katyperry;2016-09-18 14:59;676;2145;"stay shook papa"
katyperry;2016-09-18 14:59;616;2018;"meaning I need more space on my phone to do stories cause I'm a secret hoarder."
katyperry;2016-09-18 14:57;576;1946;"this is true. I meant to add there was condiments on the first 1 and the 2nd one I didn't have time."
katyperry;2016-09-18 14:56;720;2074;"cuz I'm hungry, u?"
katyperry;2016-09-18 14:54;622;1972;"to b clear the 1st time means my 1st hot dog. There were 2. # moreshame # idcimwriting # helovesmeforme"
katyperry;2016-09-18 14:53;700;2147;"cuz I tried to do it the 1st time & I didn't have any space so I deleted an app & had to do it again & then my fv song came on"
katyperry;2016-09-18 13:19;4096;16412;"I no longer subscribe to organized religion but I believe in @ chancetherapper"
katyperry;2016-09-18 03:28;2700;9708;"me and you when we fight https://www.instagram.com/p/BKCUfAzj9iL/"
katyperry;2016-09-17 18:20;675;2252;"it was a belly laugh tbh"
katyperry;2016-09-17 18:18;623;2147;"bless"
katyperry;2016-09-17 18:05;2652;10164;"idc about followers but I hope this one gets me to 56 milly on ig cause my ocd is flaring https://www.instagram.com/p/BKc_rN3A2S0/"
katyperry;2016-09-17 14:28;6032;21291;"When you write such a fire lyric that you give yourself hives"
katyperry;2016-09-17 14:00;596;2071;"ilysm"
katyperry;2016-09-17 05:24;3872;13259;"secret hipster but generally a voice of the gp"
katyperry;2016-09-16 17:28;3652;10810;""
katyperry;2016-09-16 15:05;2084;6616;"@ GraceVanderWaal Congrats! You have it. Protect it and keep ing and ing...it will always serve you"
katyperry;2016-09-16 14:12;3753;12659;"Ayyye...It's all about the long plaaaaay..."
katyperry;2016-09-16 03:01;2656;9041;"proud mummy https://www.instagram.com/p/BKYzeBsg4vq/"
katyperry;2016-09-15 16:59;1916;7090;"my locations tho idkhttps://twitter.com/getglucky/status/776326770215772160 …"
katyperry;2016-09-15 16:09;674;2188;"watch zeitgeist"
katyperry;2016-09-15 09:18;4818;19040;"When ur so creatively busy that you look down and realize you can make a hair do from your pit hair that's grown since igaf. Tight"
katyperry;2016-09-15 03:32;2324;8771;"What if I just made a record full of scatting covers cc @ getglucky cc @ JackGarratt"
katyperry;2016-09-15 02:46;7266;22398;"Suggestion for next iPhone update: Person gets notification when they've been screen shotted and sent to group chat (tbh me)"
katyperry;2016-09-15 01:05;1835;4730;"unplug to connect."
katyperry;2016-09-13 17:15;803;2737;""
katyperry;2016-09-13 11:07;7496;33861;"Helped deliver my sister's baby at 2pm & am in the studio by 8pm. GET A GIRL THAT CAN DO BOTH"
katyperry;2016-09-13 06:00;3303;12097;"HAPPY TO HEAR YOU ARE HUMAN!Stay Strong @ HillaryClinton"
katyperry;2016-09-12 06:02;2244;7896;"fkinsnapss's video https://instagram.com/p/BKOivzFAmnS/ this might be too much but idc"
katyperry;2016-09-12 05:53;2609;9830;"It was rigged from the gethttps://twitter.com/conormcgregor5/status/775059961919508480 …"
katyperry;2016-09-12 05:24;740;2663;"you know me well"
katyperry;2016-09-12 05:20;4216;18394;"Just went to a child's party and am now dissecting the lyrics to Rosie Posie, Rock A Bye Baby & This Little Piggy TBH some f*ed up stuff."
katyperry;2016-09-11 16:32;5828;19983;"I love you pre internet."
katyperry;2016-09-11 11:55;2532;9207;"My new calling: Mini Food Shrimp tempura and fried shrimp ミニチュア料理 エビフライとエビ天 미니어처 요리https://youtu.be/xqI0YFLAO0g"
katyperry;2016-09-11 11:44;3948;15576;"Ayyye anyone at @ drake show have an extra baby wipe for my white @ AdidasBoosts my leg makeup is dripping"
katyperry;2016-09-11 05:58;5087;18996;"Cheesecakes here. Ily"
katyperry;2016-09-11 05:58;896;3912;"thanks for the reminder"
katyperry;2016-09-11 05:57;925;3807;"OG prism truck"
katyperry;2016-09-11 05:57;1853;5210;"I don't think, I listen."
katyperry;2016-09-11 05:53;5211;10053;"talent"
katyperry;2016-09-11 05:52;1731;4627;"all"
katyperry;2016-09-11 05:52;1124;3860;"what do you want a picture of today's newspaper by my head?"
katyperry;2016-09-11 05:51;1114;3843;"never finished it :-/"
katyperry;2016-09-11 05:50;1316;4055;"no"
katyperry;2016-09-11 05:49;1002;3645;"thanks but painful"
katyperry;2016-09-11 05:48;5474;10065;"I hated those days"
katyperry;2016-09-11 05:46;1273;4333;"*listens to I love Kanye once*"
katyperry;2016-09-11 05:44;747;3132;"wait is that like an early 2000's ref? Ily"
katyperry;2016-09-11 05:41;3698;8372;"SO MUCH"
katyperry;2016-09-11 05:41;1620;4550;"yes and yes"
katyperry;2016-09-11 05:41;2602;5461;"me too, I'm not perfect bb"
katyperry;2016-09-11 05:39;777;2798;"@ legendarymalek crap I meant *don't. I hate typos."
katyperry;2016-09-11 05:38;1015;3456;"I have always been this way. Check the timeline."
katyperry;2016-09-11 05:37;4809;9010;"hunny id unstan myself"
katyperry;2016-09-11 05:35;604;2527;"lucky"
katyperry;2016-09-11 05:35;726;2779;"so what you're saying is it's Opposite Day"
katyperry;2016-09-11 05:33;981;3165;"bb I've always been an open book bearer of light done come for me, love you."
katyperry;2016-09-11 05:31;924;3184;"be still my heart"
katyperry;2016-09-11 05:28;800;2943;"too much for me but I love"
katyperry;2016-09-11 05:26;729;2786;"you have no facts or context bb o"
katyperry;2016-09-11 05:25;895;3097;"ur right I've had too much truth tea this morn"
katyperry;2016-09-11 05:23;23438;32314;"if she says sorry, sure!"
katyperry;2016-09-11 05:23;2950;5696;"get a new approach bb"
katyperry;2016-09-11 05:22;1092;3269;"girl trust the process"
katyperry;2016-09-11 05:20;699;2564;"love this, we can't say hate ok"
katyperry;2016-09-11 05:19;650;2493;"sorry I went too far. Love ya"
katyperry;2016-09-11 05:19;809;2855;"pink drink, look it up basics"
katyperry;2016-09-11 05:18;752;2809;"whut like trump?"
katyperry;2016-09-11 05:17;3431;7190;"hola bb"
katyperry;2016-09-11 05:16;540;2109;"yes this"
katyperry;2016-09-11 05:14;827;3396;"JK ily"
katyperry;2016-09-11 05:13;716;2431;"don't make me come back to SB and sit ya down"
katyperry;2016-09-11 05:12;650;2391;"this is art bb"
katyperry;2016-09-11 05:11;17939;20349;"# BuyPerfectIllusionOniTunes"
katyperry;2016-09-11 05:10;842;3493;"like he deserves a full scholarship somewhere"
katyperry;2016-09-11 05:09;573;2128;"not you but I love this feature cc @ instagram"
katyperry;2016-09-11 05:09;1140;2882;"1 Corinthians 13: 4-8 bb"
katyperry;2016-09-11 05:08;1622;5268;"well that's fine cause there isn't one rn so"
katyperry;2016-09-11 05:07;593;2122;"it's dna"
katyperry;2016-09-11 05:06;593;2120;"too many drinks"
katyperry;2016-09-11 05:06;571;2099;"Saturday"
katyperry;2016-09-11 05:04;559;2050;"that subtle soft touch of the lip is everything"
katyperry;2016-09-11 05:04;567;2131;"ur a fav"
katyperry;2016-09-11 05:03;573;2184;"pink drank"
katyperry;2016-09-11 05:02;553;1981;"ish, when I'm not doing life"
katyperry;2016-09-11 05:01;612;2011;"I have 100 like pee wee, u know this"
katyperry;2016-09-11 05:00;882;3525;"yeah sorry"
katyperry;2016-09-11 05:00;582;2054;"legend"
katyperry;2016-09-11 04:59;757;3136;"it took me 3 to choose. Ur welcome."
katyperry;2016-09-11 04:58;548;1980;"undiagnosed add to be exact. Gonna web MD it."
katyperry;2016-09-11 04:55;583;2089;"artichoke"
katyperry;2016-09-11 04:55;1209;4412;"I'm in my polka dot robe chillin waiting for a Cheesecake Factory delivery"
katyperry;2016-09-11 04:54;642;2091;"you don't know your own strength bb"
katyperry;2016-09-11 04:52;721;2333;"looks like you don't know my calendar"
katyperry;2016-09-11 04:50;579;1996;"@halseysfirework @ rainbowspatrick @ katysfood icons fer sure"
katyperry;2016-09-11 04:42;826;2827;"I know you are but what am I"
katyperry;2016-09-11 04:39;932;2946;"girl bye"
katyperry;2016-09-11 04:32;721;2294;"@ drunkby6 go to East Beach tacos too and get the shrimp tacos"
katyperry;2016-09-11 01:20;2210;8938;". @ emelisande I am ready to lose it and then recover!!! Bring the truth!"
katyperry;2016-09-10 15:34;4156;14152;"flare"
katyperry;2016-09-10 11:47;7520;22433;"FrIdAy StUdIo ViBeZ pic.twitter.com/PYLgMFzUKg"
katyperry;2016-09-09 16:00;4785;16226;"Turkish delights are DISGUSTING, it's a FARCE cc: Chronicles of Narnia"
katyperry;2016-09-09 04:56;3418;9721;"If you are moved watching the video pls continue to support the other Pulse survivors by donating here:https://www.gofundme.com/PulseVictimsFund …"
katyperry;2016-09-09 04:52;5200;15732;"I was so inspired by @ OnePulseTony story & strength that I had to meet him, here's a preview http://www.ellentv.com/videos/0-r5v0dwyb/ …pic.twitter.com/lC9EpqRkep"
katyperry;2016-09-09 04:01;6339;19401;"Don't miss these happy tears today! https://twitter.com/theellenshow/status/773939905542000641 …"
katyperry;2016-09-08 14:46;4630;11944;"Drama*tique"
katyperry;2016-09-07 13:03;5043;15040;"That's glam"
katyperry;2016-09-07 12:16;5134;12747;"idiot for idioms"
katyperry;2016-09-07 12:14;1052;3057;"fraudulent wishes"
katyperry;2016-09-06 16:47;5248;17699;"Caught one"
katyperry;2016-09-06 08:12;2822;10594;"Every1 wants to b a butterfly butcha gotsa learn how to crawl b4 u ball okurrr @Santa… https://www.instagram.com/p/BJ_nGg1AcFP/"
katyperry;2016-09-06 05:23;4973;17544;"H70thBD to my inspo Freddie MercuryGive some to The Mercury Phoenix Trust - Fighting AIDS # FFADAYO @ The_MPT pic.twitter.com/qy28Ms6BB8"
katyperry;2016-09-04 01:23;3285;11738;"luminary fairy @Burning Man https://www.instagram.com/p/BJ5usssAGFC/"
katyperry;2016-08-29 04:45;3207;11031;"bout to get savage af https://www.instagram.com/p/BJqpEEXgkSM/"
katyperry;2016-08-27 07:47;2833;9079;"I’m co-hosting the @IHRCountdown w/my friend @ OnAirRomeo this weekend! Listen right here: http://bit.ly/1pqkaDF @ iHeartRadio"
katyperry;2016-08-27 01:09;3608;10636;"For your freakin weekend: # RISE REMIXES BY @ PURITY_RING, @MonsieurAdi & @ TALAOFFICIAL http://smarturl.it/RiseRemixes pic.twitter.com/Q8PUkNoqwc"
katyperry;2016-08-26 06:27;2885;9760;"# TBT my 1st burn Round ready, right @ mkives https://www.instagram.com/p/BJjGYSEgwpG/"
katyperry;2016-08-26 01:08;3866;13216;"Thought you had all of the shades? Introducing TAME TIGER: http://bit.ly/TameTiger . Fun surprise for you when you Tweet # KATYxCOVERGIRL!"
katyperry;2016-08-25 04:07;11217;30044;"Do not give your eyeballs to this racist, hate-filled, misogynoir crime. I # StandWithLeslie"
katyperry;2016-08-23 03:06;6645;24671;"The Olympics may be over but dad hats will never die : http://katyperry.shop.musictoday.com/store/ pic.twitter.com/oeMC7CMdba"
katyperry;2016-08-21 05:34;3386;13673;"Check out this brilliantly made video that is already giving me anxiety: Washed Up Together by Knox Hamilton http://vevo.ly/Y35MfY"
katyperry;2016-08-20 23:55;3368;13707;"happy saturday https://instagram.com/p/BHSEqD0gAXO/"
katyperry;2016-08-17 07:03;4017;11880;"GUYS - Remember that SWEAT I was talking about? Here it is: http://smarturl.it/MakingRise . # MakingofRise"
katyperry;2016-08-17 06:23;5358;21713;"Some behind-the-scenes at my MAGIC launch yesterday for my new kicks http://fun--mag.com/2016/08/16/katy-perry-shoe-launch/ …pic.twitter.com/tw0lbYJM6Z"
katyperry;2016-08-16 03:17;4415;14339;"Get ready for my & coming to stores Spring 2017https://twitter.com/wwd/status/765249337534345216 …"
katyperry;2016-08-14 09:51;3102;11831;"Collector of miniatures https://www.instagram.com/p/BJEkKVzAYL-/"
katyperry;2016-08-12 12:02;3656;11168;"Me rn:https://m.youtube.com/watch?v=sH9iudba8l4 …"
katyperry;2016-08-12 11:55;3170;12714;"Can someone please translate what this adorable toddler is advertising about the circus coming… https://www.instagram.com/p/BI_oxL3AxWS/"
