LizAnnSonders;2018-01-17 03:05;0;29;"Hmmm ... sorry if I jinxed ithttps://twitter.com/lizannsonders/status/953299953622896646 …"
LizAnnSonders;2018-01-17 03:03;6;27;"Both Dukes are dead ... just sayinghttps://twitter.com/ivanthek/status/953339723799461889 …"
LizAnnSonders;2018-01-17 02:33;0;0;"As noted, seen in the WSJ’s Daily Shot and also sourced to Onlmaps"
LizAnnSonders;2018-01-17 00:16;3;45;"This could be an interesting reversal day (not a forecast, just thinking aloud)"
LizAnnSonders;2018-01-17 00:03;14;9;"Drawdowns of major # cryptocurrencies... # Bitcoin down >35% from previous peak, marking biggest drawdown since early 2015... # Ethereum “only” off 10%... # Ripple appears to be biggest loser, down >50% @ biancoresearch @ Bloombergpic.twitter.com/2wvrMF2qJA"
LizAnnSonders;2018-01-16 23:17;1;25;"Bueller?https://twitter.com/ellesep/status/952020679221760000 …"
LizAnnSonders;2018-01-16 22:23;1;8;"Wonderful creatureshttps://twitter.com/dswt/status/953271119288528896 …"
LizAnnSonders;2018-01-16 21:41;9;27;"We have been writing about the “risk” of a melt-up for a while now- becoming clearer that’s what we’re experiencing- discipline, rebalancing, diversification all crucialhttps://twitter.com/memphiseagrove/status/953253829721710592 …"
LizAnnSonders;2018-01-16 21:39;2;15;"My high-level look at what # TaxReform means for the economy and stocks:https://www.schwab.com/resource-center/insights/content/taxman-bringing-some-cheer-new-year …"
LizAnnSonders;2018-01-16 19:45;6;13;"# EvercoreISI company surveys on what companies will do with tax savingspic.twitter.com/bJZxJd8dJy"
LizAnnSonders;2018-01-16 19:29;26;55;"% of population within each state that believes it’s the “worst possible state to live in” ... my home state of CT yet again ranks high (only IL is worse) @ onlmaps @ SoberLookpic.twitter.com/HuAIP7y1K1"
LizAnnSonders;2018-01-16 19:25;17;39;"This headline may not age well @ marketspic.twitter.com/jcJERXCW8c"
LizAnnSonders;2018-01-16 19:22;0;7;"This was Naples, FL ... not Naples, Italyhttps://twitter.com/lizannsonders/status/952927036510785536 …"
LizAnnSonders;2018-01-16 19:21;0;7;"Tax bill-related jump in buyback index @ Bloomberg @ SoberLookpic.twitter.com/mRVtaLSPfM"
LizAnnSonders;2018-01-15 23:34;1;31;"Ahhh Naplespic.twitter.com/657OvBsQ3q"
LizAnnSonders;2018-01-15 02:19;0;0;"Electric"
LizAnnSonders;2018-01-15 02:10;3;71;"Although it wasn’t required in my high school, I took it anyway and learned how to type more than 100 words per minute (still comes in very handy)https://twitter.com/joelcomm/status/952602720984354816 …"
LizAnnSonders;2018-01-13 09:04;0;0;"I’m so close!"
LizAnnSonders;2018-01-13 08:58;3;22;"That’s so mehttps://twitter.com/jensaidit/status/951981038149996544 …"
LizAnnSonders;2018-01-13 08:53;0;11;"I LOVE pencils! ... type A in me loves to sharpen them, too # Number2https://twitter.com/hmeisler/status/951914636177231875 …"
LizAnnSonders;2018-01-13 08:52;0;4;"Best. Musical. Ever.https://twitter.com/lin_manuel/status/951652821916704768 …"
LizAnnSonders;2018-01-13 08:51;29;173;"Having spent two weeks in Africa last year, this is heartwarming # elephants # giraffeshttps://twitter.com/yashar/status/951659703146373121 …"
LizAnnSonders;2018-01-13 08:48;11;32;"S&P hasn’t been more than 1.5% from a high in more than 90 days, the 2nd-longest streak in its history @ sentimentrader"
LizAnnSonders;2018-01-13 07:57;0;1;"I had a house on Okemo Mountain for many years"
LizAnnSonders;2018-01-13 03:21;0;2;"Yes, but he lives in Florida!https://twitter.com/carlquintanilla/status/951895482665766912 …"
LizAnnSonders;2018-01-13 03:16;2;4;"Perhaps courtesy of the crash in correlations, notice the inflection points for active vs. passive (index) domestic mutual fundspic.twitter.com/kXZZlYQ6BE"
LizAnnSonders;2018-01-13 03:07;0;44;"# WorstFirstDate @ jimmyfallon I was 16 years old...ordered steak tartare, thinking it was steak with tartar sauce (which I love)...had to stomach eating a plate full of raw hamburger meat (which I hate)"
LizAnnSonders;2018-01-13 02:57;1;19;"We’ve had outperform ratings on bothhttps://twitter.com/bespokeinvest/status/951874795834093570 …"
LizAnnSonders;2018-01-13 02:52;0;2;"Many thanks!"
LizAnnSonders;2018-01-12 23:06;3;12;"This is brilliantly funnyhttps://twitter.com/randyafrederick/status/951798506561273856 …"
LizAnnSonders;2018-01-12 20:46;15;13;"Where do the robots live? @ conradhackett @ SoberLookpic.twitter.com/Uy3r1wCtnQ"
LizAnnSonders;2018-01-12 20:44;4;8;"STEM majors earn more than non-STEM @ pewresearch @ SoberLookpic.twitter.com/IVUwfbcJT6"
LizAnnSonders;2018-01-12 20:34;26;34;"To which states did Americans move in 2017? Not to NY, NJ or IL (not to my state of CT either). Can someone explain VT at #1? @ taxfoundation @ SoberLookpic.twitter.com/u8GCXwCsHY"
LizAnnSonders;2018-01-12 10:56;0;0;"Sorry, I don't pick stocks...purely top-down"
LizAnnSonders;2018-01-12 05:37;0;1;"# HighwayTune"
LizAnnSonders;2018-01-12 05:30;1;1;"It should be @ GretaVanFleet"
LizAnnSonders;2018-01-11 22:47;15;21;"Global fund flows have been “risk-on” for 167 consecutive trading days— a new record @ BofAML @ biancoresearch @ Bloombergpic.twitter.com/HgV1xp5rMz"
LizAnnSonders;2018-01-11 22:44;4;9;"Correlation between inflation & VIX back into positive territory, suggesting some risk to stocks based on history @ biancoresearch @ Bloombergpic.twitter.com/HTf9wUI2Gw"
LizAnnSonders;2018-01-11 22:27;21;46;"# EvercoreISIpic.twitter.com/SVgRA3j4jC"
LizAnnSonders;2018-01-11 22:24;16;38;"An enlightening difference between South and North Korea at night! @ Amazing_Maps @ SoberLookpic.twitter.com/aGfybEo09p"
LizAnnSonders;2018-01-11 22:21;2;6;"As someone who tries to write in a manner most can comprehend, this is interesting: According to The Economist, “women’s economics papers become more readable as their careers progress. No such trend is seen for men.” @ ECONdailycharts @ SoberLookpic.twitter.com/YxFkwuMjKU"
LizAnnSonders;2018-01-11 22:17;2;7;"The inventories of single-family homes on the market keep dwindling @ calculatedrisk @ SoberLookpic.twitter.com/eKF7E1Fn7A"
LizAnnSonders;2018-01-11 22:14;3;16;"Volatility of # Bitcoin relative to other asset classes @ GoldmanSachs @ SoberLook @ Schuldensuehnerpic.twitter.com/UYLMdDe8Wl"
LizAnnSonders;2018-01-11 22:12;48;36;"Bankruptcy filings up sharply courtesy of traditional retail @ WhatILearnedTW @ SoberLookpic.twitter.com/pZE9LgEbya"
LizAnnSonders;2018-01-11 22:10;10;17;"According to @ tomkeene , RSI (relative strength) indicator, Dow Jones is the most overbought since 1904 @ Bloomberg @ SoberLookpic.twitter.com/F0Ep37wlxy"
LizAnnSonders;2018-01-11 22:03;0;0;"Love it"
LizAnnSonders;2018-01-11 21:59;1;15;"Walmart raising minimum wage to $11 & giving $1k bonuses to some employees due to coming tax savings"
LizAnnSonders;2018-01-11 21:18;0;5;"Sad, but very truehttps://twitter.com/roy_rblanchard/status/951434228805365761 …"
LizAnnSonders;2018-01-11 21:17;26;90;"The year of 3s perhaps? 3% GDP? 3% wage growth? 3% headline inflation? 3% 10y yield? 3-handle on unemployment rate? 3 rate hikes?"
LizAnnSonders;2018-01-11 06:52;0;1;"Not necessarily...all else equal, 3 more rate hikes (at 25bps points each) would bring the FFR to a range of 2-2.25%; still below 3%; but it would also depend on where 2y yield went."
LizAnnSonders;2018-01-11 04:05;0;1;"Yup, forgot to add that ... retweeted it with that included"
LizAnnSonders;2018-01-11 04:05;0;1;"That’s when a lot of census-based data goes back to (post-WWII)"
LizAnnSonders;2018-01-11 04:04;0;1;"Or to FL"
LizAnnSonders;2018-01-11 04:03;7;24;"I didn’t realize this was so one (right) sided @ onlmaps @ WSJpic.twitter.com/fknVdmNZNk"
LizAnnSonders;2018-01-11 03:57;0;0;"Oops ... meant to add that"
LizAnnSonders;2018-01-11 03:57;13;14;"The only state with a population decrease since 1950 is West Virginia (“...teardrop in my eye”) @ onlmaps @ uscensusbureau @ WSJpic.twitter.com/jqLWmTwoCx"
LizAnnSonders;2018-01-11 03:45;2;49;"Perhaps Radio Shack should have tried thispic.twitter.com/MvwLasNUFY"
LizAnnSonders;2018-01-10 04:32;4;16;"# Funnyhttps://twitter.com/jasonadamk/status/950322640732000256 …"
LizAnnSonders;2018-01-10 02:00;0;2;"You guys are SO good"
LizAnnSonders;2018-01-09 23:08;3;17;"Cell phones > landlines ... annoyingly though, I get way more robo calls on my cel phones than I do on my landline @ FactTank @ StatistaCharts @ SoberLook @ CDCgovpic.twitter.com/yVmMkZ4QkZ"
LizAnnSonders;2018-01-09 23:05;5;23;"We pay higher taxes in CT, NJ & CA, etc., but it obviously doesn’t go toward better roads # PotHoles @ DeutscheBank @ bySamRo @ SoberLook @ usnewspic.twitter.com/KDCkqioqsG"
LizAnnSonders;2018-01-09 22:57;34;52;"Is elimination of output gap signaling recession risk is rising? Or is this more like 1997, with some runway ahead? I lean toward the latter. # MarketEthos # RichardsonGMP @ SoberLookpic.twitter.com/1BTgIBTCEt"
LizAnnSonders;2018-01-09 20:14;12;19;"NFIB small business optimism index fell to still-high 104.9 in Dec from 107.5 in Nov, below consensus; but net % planning to raise compensation rose 6 to 23, highest since 2000"
LizAnnSonders;2018-01-09 09:26;1;2;"@ anthonynoto, you da man!https://twitter.com/loupas/status/950533862794305536 …"
LizAnnSonders;2018-01-09 05:02;8;30;"What’s going on in Idaho? @ onlmaps @ SoberLook @ NIHpic.twitter.com/tQIYwV6S2W"
LizAnnSonders;2018-01-09 04:59;9;22;"Small investors are mostly long # bitcoin, while larger investors are mostly short @ WSJ @ SoberLook # CFTCpic.twitter.com/J1mPYGsWvw"
LizAnnSonders;2018-01-09 04:54;7;9;"Weaker payrolls number on Friday nothing new ... payroll growth has been (naturally) slowing for a few years (but remains strong enough to keep downward pressure on unemployment rate) @ soberlook @ BLS_govpic.twitter.com/93l4makyoQ"
LizAnnSonders;2018-01-09 04:10;0;0;"Likely just a reflection of lower corporate tax rates"
LizAnnSonders;2018-01-09 04:09;11;42;"More of a contrarian indicatorhttps://twitter.com/lizannsonders/status/950459124655050755 …"
LizAnnSonders;2018-01-09 04:08;26;44;"Strongest uptrend in S&P 1500 earnings estimates in more than a decade @ bespokeinvestpic.twitter.com/7SMmBNLUwn"
LizAnnSonders;2018-01-09 03:38;0;0;"Rational exhuberance (for now)"
LizAnnSonders;2018-01-09 00:30;29;37;"Most corporate optimism on forward earnings since 2010 @ Bloomberg @ biancoresearchpic.twitter.com/1TEMVOTWYR"
LizAnnSonders;2018-01-08 02:36;6;19;"Thank you!https://twitter.com/nws/status/950057333572472832 …"
LizAnnSonders;2018-01-08 02:29;0;2;"You’re too kind"
LizAnnSonders;2018-01-08 01:19;0;6;"I think he said “golly” ... also, I wonder how many people knew I was 8 1/2 months pregnant on that show with my daughter (who was born 16 days later) ... seems like forever ago # WeMissLouisRukeyser"
LizAnnSonders;2018-01-07 09:27;0;2;"The Zweig Breadth Thrust Indicator is not on a buy presently"
LizAnnSonders;2018-01-07 09:08;2;9;"Now that's a putt!https://twitter.com/clemsonprez/status/949800598983069699 …"
LizAnnSonders;2018-01-06 22:47;0;4;"More upside"
LizAnnSonders;2018-01-06 04:03;8;24;"US leading global manufacturing strength @ StrategasRPpic.twitter.com/ylgED3dtLC"
LizAnnSonders;2018-01-06 03:27;63;71;"II Survey, which tracks opinions of ~130 market newsletter writers, posted 2nd-highest annual avg (almost 77%) of stock market bulls in its 54-year history...II’s figures have best contrarian forecasting strength out of most traditional sentiment indices @ LeutholdGrouppic.twitter.com/Bung4C2QTO"
LizAnnSonders;2018-01-05 23:18;1;11;"Non-manufacturing ISM index fell to 55.9 in Dec. from 57.4...well below 57.6 consensus...employment & supplier deliveries better, but orders & business activity weaker"
LizAnnSonders;2018-01-05 23:15;11;21;"# retailers announced ~8k store closings in 2017 @ UBS @ bySamRo @ SoberLookpic.twitter.com/3krfllpORb"
LizAnnSonders;2018-01-05 23:12;10;8;"Industries expected to shed the most jobs over the next decade @ FactTank @ SoberLook @ BLS_govpic.twitter.com/6sBVbUsONh"
LizAnnSonders;2018-01-05 23:07;8;9;"Increasing percentage of # LargeCapValue managers beating benchmarkspic.twitter.com/7zwAjMghN7"
LizAnnSonders;2018-01-05 22:44;10;26;"AAII’s “bull ratio” near 80%...only one other time since 2009 it’s been this high...historically, market’s struggled a bit when ratio >78%pic.twitter.com/joVoIWlBaC"
LizAnnSonders;2018-01-05 21:59;4;26;"Yes, payrolls were weaker than expected (culprit: retail) but shortfall not out of normal monthly volatility bounds and plenty sufficient to keep unemployment rate from ratcheting up"
LizAnnSonders;2018-01-05 00:38;37;98;"So goodhttps://twitter.com/buzzfeed/status/948952182325264384 …"
LizAnnSonders;2018-01-05 00:33;0;2;"Sacramento?https://twitter.com/charlesschwab/status/948939611581112321 …"
LizAnnSonders;2018-01-04 23:05;38;41;"Probability of 4 # Fed rates hikes in 2018 still only 12%, but climbing steadily @ Bloomberg @ SoberLookpic.twitter.com/nL5Jxnwl9h"
LizAnnSonders;2018-01-04 21:29;7;15;"ADP Dec. private sector payrolls +250k, well >190K consensus & causing whisper #for Friday’s BLS payrolls to move up"
LizAnnSonders;2018-01-04 05:38;0;2;"Great, as always, chatting with @ tracybyrneshttps://twitter.com/tracybyrnes/status/948667814767923200 …"
LizAnnSonders;2018-01-04 05:37;9;19;"Due to strong ISM mfg. and construction spending reports today, @ AtlantaFed GDPNow for Q4 real GDP was raised from 2.8% to 3.2%"
LizAnnSonders;2018-01-04 00:11;0;4;"All of the below (except get a new job & not making resolutions) @ StatistaCharts @ YouGovpic.twitter.com/WQPTswFiEp"
LizAnnSonders;2018-01-04 00:09;5;9;"Millennials less likely to move than other generations (& they’re starting to buy homes in greater numbers) @ pewresearch @ SoberLook @ WSJpic.twitter.com/o8DkQSenSZ"
LizAnnSonders;2018-01-04 00:07;1;10;"As a very frequent flier, it’s nice to see that 2017 was the safest year ever (no commercial flight accidents or fatalities)...let’s keep it up @ ECONdailycharts @ SoberLook @ AviationSafetypic.twitter.com/XGfEoSPHLC"
LizAnnSonders;2018-01-04 00:03;2;20;"Underemployment rate (U6) determines wages more consistently than unemployment rate (U3) # FTNFinancial @ SoberLook @ AtlantaFed @ BLS_govpic.twitter.com/wM2SpuyVAc"
LizAnnSonders;2018-01-03 23:27;25;45;"Manufacturing ISM up to 59.7 in Dec 9 (> 58.2 consensus) w/ orders rising to booming 69.4 & inventories falling to 42 from 45.5 (<50 signals inventories are too low)...all positive for growth"
LizAnnSonders;2018-01-03 22:57;4;10;"Countries most exposed to # Bitcoin @ Citi @ Schuldensuehner @ SoberLook @ LocalBitcoinspic.twitter.com/Y9ISbptZwn"
LizAnnSonders;2018-01-03 11:08;0;6;"Kudos @ chipgaines and @ joannagaines"
LizAnnSonders;2018-01-03 11:03;11;35;"V. goodhttps://twitter.com/awealthofcs/status/948347814635024387 …"
LizAnnSonders;2018-01-03 00:58;2;9;"Interesting graphic showing sentiment around various topics gauged from financial TV @ biancoresearch # TelevisionNewsArchivepic.twitter.com/FDlzibJDS5"
LizAnnSonders;2018-01-02 22:53;87;115;"Electricity usage for Visa (credit cards) vs. # Ethereum vs. # Bitcoin @ wef @ SoberLookpic.twitter.com/Vrl8ntJdEu"
LizAnnSonders;2018-01-02 07:35;30;82;"Looking into the new year, the U.S. economy may outperform financial assets; not vice versa like the past few years (another sign of # LateCycle)"
LizAnnSonders;2018-01-02 06:41;1;12;"Happy anniversary Jim and Bethhttps://twitter.com/clemsonprez/status/946893761740787713 …"
LizAnnSonders;2018-01-02 06:38;0;1;"We’ll be cheering for a Tigers’ win from sunny Naples, FL!"
LizAnnSonders;2017-12-29 02:46;6;30;"Loved seeing my friend David Williams tell such an inspiring @ MakeAWish story on @ SquawkCNBC ... I’m proud to be a board member for over a decade ... # WishKids are so very special and deservinghttps://urldefense.proofpoint.com/v2/url?u=https-3A__www.cnbc.com_video_2017_12_26_make-2Da-2Dwish-2Dfoundation-2Dceo-2Dwe-2Dare-2Dnow-2Dpart-2Dof-2Dthe-2Dhealing-2Dprocess.html-3Fplay-3D1&d=DwMGaQ&c=Ezx-H5PgBrUMEEvxgJuTQRYrd-4D8l8I18qkZZzJQbo&r=ZBsQ0HaEgMDDJMVVKE7HCRmG51IAY9RwAB8Aj_uM6QA&m=sBLA-jAhGBRrgZRT9a1W6STVN6RovCUJzaRNUtB2gyY&s=o6XH6H2Nn8sfbLhsxTphivLIQQWymjyFiaVKNz-reFQ&e= …"
LizAnnSonders;2017-12-28 00:30;11;27;"Consumer confidence expectations sink on tax reform skepticism # FBNpic.twitter.com/QTyzPePIJg"
LizAnnSonders;2017-12-27 00:34;11;25;"Atlanta Fed’s GDPNow Q4 forecast dropped to 2.8%, while NY Fed’s Nowcast is at 3.9% ... latter has more “soft” (survey-based) data incorporatedpic.twitter.com/VjQHZRxIV9"
LizAnnSonders;2017-12-23 00:07;9;28;"Well, this rollover is a bit depressing @ wsj h/t Paul Menestrierpic.twitter.com/gG4ZVCP0g4"
LizAnnSonders;2017-12-23 00:00;47;99;"“Dr. Copper” says US yield curve should be significantly steeper than it ispic.twitter.com/228sbQJnpg"
LizAnnSonders;2017-12-22 23:39;2;16;"Very coolhttps://twitter.com/businessinsider/status/944230323847446528 …"
LizAnnSonders;2017-12-22 23:14;12;25;"Nov. new home sales +733K annual rate, up 17.5% m/m (largest since 1992!) & +26.6% y/y ... well above 655K consensus & new cycle high"
LizAnnSonders;2017-12-22 07:57;4;202;"To all in the Twittersphere, I wish you a wonderful holiday season ... I will be a little less active than usual here over the next week or so in the interest of family time"
LizAnnSonders;2017-12-22 02:35;0;0;"Please say hello to my buddy Flody Suarez over there!"
LizAnnSonders;2017-12-22 02:33;6;14;"It’s not yet March, but there’s a bit of madness in the airhttps://twitter.com/businessinsider/status/943843924027826176 …"
LizAnnSonders;2017-12-22 00:16;2;6;"TX, CA & FL see biggest population jumps (aided by international migration) ... IL the biggest loser @ uscensusbureau @ biancoresearchpic.twitter.com/9KqVMan3mN"
LizAnnSonders;2017-12-22 00:10;4;10;"S&P’s correlation to inflation falling (correlation typically negative during tightening cycles) @ stlouisfed @ quandl @ biancoresearchpic.twitter.com/rJh3EH3qbD"
LizAnnSonders;2017-12-22 00:03;8;11;"According to CRFB, this tax cut is “only” 8th largest as % of GDP in past century @ BudgetHawks @ WSJ @ SoberLookpic.twitter.com/FtuGBMWQkC"
LizAnnSonders;2017-12-21 23:54;22;27;"Hmmm...surge in Google searches for “buy # bitcoin with credit card” @ GoogleTrends @ jessefelder @ SoberLookpic.twitter.com/u23gOhZJGL"
LizAnnSonders;2017-12-21 21:34;8;27;"# DogsAreTheBest https://twitter.com/rosslynaj/status/943438825065467904 …"
LizAnnSonders;2017-12-21 04:55;5;15;"One of best & rarest “no guy-check rallies” in U.S. stock market history @ LeutholdGrouppic.twitter.com/ZBT4DkvdVN"
LizAnnSonders;2017-12-21 04:29;2;15;"It’s such an honor to serve on the @ MakeAWishCT board of directorshttps://twitter.com/makeawishct/status/943568564623171585 …"
LizAnnSonders;2017-12-21 03:20;3;55;"Picked up this awesome artwork during @ MakeAWishCT’s Wish Night last month and got to meet Maddie, the wish kid/photographer who captured it during her wish to go to Iceland! Watch her video here: http://bit.ly/2Boctco pic.twitter.com/TwpyjhvdTX"
LizAnnSonders;2017-12-21 03:03;0;4;"Congratulations @ clemsonstudents!https://twitter.com/clemsonuniv/status/943550068639936513 …"
LizAnnSonders;2017-12-21 03:02;2;5;"Nov. existing home sales surged 5.6% to 5.81m annual rate... most since 12/10 (excl. distorted gain in 12/15 re: rollout of Know Before You Owe rule) & highest since 12/06 in middle of housing boom"
LizAnnSonders;2017-12-20 23:41;0;1;"Waking? :)"
LizAnnSonders;2017-12-20 23:41;37;150;"Looks like my happy days are on the upswingpic.twitter.com/dTkkee4Rw5"
LizAnnSonders;2017-12-20 23:32;7;19;"I like actual sunsets. Tax sunsets? Not so much. @ WSJ @ Jointcommittee_pic.twitter.com/4TOGXZwTLQ"
LizAnnSonders;2017-12-20 06:27;1;8;"Oops...6:30pm EThttps://twitter.com/lizannsonders/status/943159396229632000 …"
LizAnnSonders;2017-12-20 03:22;0;1;"Best earnings zone for stocks is -25% to -10% (typically when coming out of recession, like in 2009)pic.twitter.com/GeoUsiOp6I"
LizAnnSonders;2017-12-20 00:41;3;11;"Joining Nightly Business Report @ bizrpt @ CNBC this evening around 5:30pm ET to talk U.S. economy, market & tax reform"
LizAnnSonders;2017-12-19 23:16;13;22;"Tri-state area not happy @ Google @ TaxPolicyCenter @ biancoresearchpic.twitter.com/oFNa1uYNGb"
LizAnnSonders;2017-12-19 21:41;0;1;"Interest rate volatility up, REIT volatility up"
LizAnnSonders;2017-12-19 20:30;4;8;"How sector volatility has behaved relative to 20y norm ( # REITs way up; # tech way down) @ CreditSuisse @ SoberLook @ thomsonreuters @ FactSetpic.twitter.com/UG7NBTiBwd"
LizAnnSonders;2017-12-19 20:27;12;31;"S&P 500 earnings estimates holding up more than usual, while stronger earnings drove greater portion of 2017’s returns @ CreditSuisse @ SoberLook @ thomsonreuters @ FactSetpic.twitter.com/fjcMK7WOVA"
LizAnnSonders;2017-12-19 08:31;0;14;"# Pricelesshttps://twitter.com/foxnews/status/942911366087696384 …"
LizAnnSonders;2017-12-19 07:58;74;168;"S&P 500 hit another record high today w/ every single industry back above 200-DMAs...prior periods when this occurred, S&P's returns over following 3, 6 & 12 months were positive with remarkable consistency @ bespokeinvest"
LizAnnSonders;2017-12-19 05:44;0;1;"Reminded me of what @ brandongraham55 (thank you!) was so kind as to do last week when my sis @ LSonders (formerly worked for NFL) asked for a selfie video to console our brother’s 3 kids after their 1-year old beloved puppy died # ClassActhttps://twitter.com/buzzfeed/status/942870335933878272 …"
LizAnnSonders;2017-12-19 05:36;0;23;"No wayhttps://twitter.com/joelcomm/status/942870855582928896 …"
LizAnnSonders;2017-12-19 05:33;6;16;"Assuming a lift to # inflation, and in turn bond yields, in 2018, here’s how sectors have performed since 2010 @ LeutholdGrouppic.twitter.com/vglpDCHgU7"
LizAnnSonders;2017-12-19 05:26;0;0;"Not enough time to say a word"
LizAnnSonders;2017-12-19 04:02;0;12;"Fantastichttps://twitter.com/usatoday/status/942847186567561217 …"
LizAnnSonders;2017-12-19 03:55;4;38;"Got my haircut on Saturday and my hairdresser mentioned it... FWIWhttps://twitter.com/hmeisler/status/942842769088892928 …"
LizAnnSonders;2017-12-19 02:48;2;5;"Although clearly market’s doing well today, Corker’s news of a yes vote on # TaxReform perhaps unleashed a little “buy on rumor, sell on news” action Fridaypic.twitter.com/vUHaTBSDrZ"
LizAnnSonders;2017-12-19 02:47;0;2;"NAHB/Wells Fargo # Housing Market Index (HMI) up 5 in Dec to 74- highest level since 7/99 (& > consensus of 70); suggests pickup in housing starts into 2018 (all 3 components up, including surge in traffic of prospective buyers)"
LizAnnSonders;2017-12-19 02:20;8;29;"Map of infrastructure quality by state: Not quite sure where our tax dollars are going in CT, but this is depressing # MapsOnTheWeb @ redditpic.twitter.com/Bbi6mxgmjE"
LizAnnSonders;2017-12-19 02:06;6;15;"Operating rate per the ISM data points to acceleration in core # CPI # inflation next yearpic.twitter.com/4v6X8KHidD"
LizAnnSonders;2017-12-19 01:35;10;45;"My latest thoughts on tax reform, earnings, yield curve and stock market (with a nod to Led Zeppelin): https://www.schwab.com/resource-center/insights/content/whole-lotta-love-tax-reform …"
LizAnnSonders;2017-12-19 01:34;0;2;"@ jimcramer having an @ anthonynoto (who is a dear friend) lovefest today!"
LizAnnSonders;2017-12-19 00:14;31;62;"For those who requested a longer time frame to the VERY POPULAR 2y yield vs. S&P dividend yield chart I tweeted on Friday (we only have back to 1990):pic.twitter.com/MXgEppcONj"
LizAnnSonders;2017-12-19 00:12;20;53;"For those fretting the flattening of the 2/10 curve (now at 53bps), 0-50bps is actually the sweet spot for U.S. stocks, when they’ve historically (since 1988) had their BEST performance (>20% average & median for S&P 500) @ bcaresearch"
LizAnnSonders;2017-12-18 06:33;12;45;"Correlation between Q4 stock market performance & holiday retail sales = 85% ... market up 7% so far in Q4, which bodes well for holiday sales # EvercoreISIpic.twitter.com/3jD5WHt2EW"
LizAnnSonders;2017-12-18 02:56;0;2;"We downloaded the info from FactSet"
LizAnnSonders;2017-12-17 04:23;1;0;"Probably a ways to go before inversion or major trouble for equities (based on history) ... see belowpic.twitter.com/5U4vpDC1me"
LizAnnSonders;2017-12-17 04:20;0;9;"I didn’t make a conclusion"
LizAnnSonders;2017-12-17 01:34;12;43;"This made my day ... it’ll make yours, toohttps://twitter.com/dodo/status/942077120414588928 …"
LizAnnSonders;2017-12-17 01:27;0;17;"Kudos @ ClemsonUniv and @ ClemsonPrezhttps://twitter.com/clemsonuniv/status/942074359383912448 …"
LizAnnSonders;2017-12-17 01:24;3;27;"Stunninghttps://twitter.com/ianbremmer/status/942078590031720451 …"
LizAnnSonders;2017-12-16 22:27;0;2;"...and still-low rates globally, and ongoing liquidity injections from global central banks"
LizAnnSonders;2017-12-16 05:37;0;4;"I would argue they’re not hot now"
LizAnnSonders;2017-12-16 02:41;11;30;"Normally, financial conditions tighten during a rate hike cycle (shaded areas) ... not this time @ Bloomberg @ biancoresearchpic.twitter.com/HUTv8n1gOe"
LizAnnSonders;2017-12-16 02:27;548;772;"2y Treasury yield now above S&P dividend yield for first time in decadepic.twitter.com/vH0WsbjWPT"
LizAnnSonders;2017-12-15 21:37;0;0;"That’s not what “aided by” means"
LizAnnSonders;2017-12-15 21:08;8;21;"Tech & consumer discretionary have historically led market for next month when Citi Economic Surprise Index > 75th percentile # EvercoreISIpic.twitter.com/9KM9rt2PzE"
LizAnnSonders;2017-12-15 20:27;0;2;"Many thanks!"
LizAnnSonders;2017-12-15 07:44;2;2;"Listen to some “snow” ... wonderful song @ mattnathansonhttps://twitter.com/mattnathanson/status/941449826473885696 …"
