LizAnnSonders;2018-05-12 06:02;24;118;"Best selfie EVER @ CBSNewspic.twitter.com/sZfa0OIa6E"
LizAnnSonders;2018-05-12 05:49;0;15;"One puppy is never enoughhttps://twitter.com/mark_dow/status/995046551746633728 …"
LizAnnSonders;2018-05-12 05:41;0;3;"Always good stuff in herehttps://twitter.com/bespokeinvest/status/995055542447067136 …"
LizAnnSonders;2018-05-12 00:20;3;19;"This Old House is blue @ PlanMaestro @ simongerman600 @ SoberLook # AmericanFactFinderpic.twitter.com/jZNVaOf3qN"
LizAnnSonders;2018-05-11 23:50;11;7;"What consumers do is more important than what they say @ PantheonMacro @ SoberLookpic.twitter.com/Hnmtb2HNtn"
LizAnnSonders;2018-05-11 23:48;12;16;"Over the past couple of decades, wage changes have not been making their way into consumer inflation: @ OxfordEconomics @ SoberLook # HaverAnalyticspic.twitter.com/I8wopc99HK"
LizAnnSonders;2018-05-11 20:52;9;32;"Wowhttps://twitter.com/cbsnews/status/994688590792806401 …"
LizAnnSonders;2018-05-11 20:18;0;1;"pic.twitter.com/tf5poNxsk3"
LizAnnSonders;2018-05-11 06:10;1;6;"# Renew99 PLEASE"
LizAnnSonders;2018-05-11 04:17;0;0;"Didn’t realize I had"
LizAnnSonders;2018-05-11 01:57;3;17;"Joining @ CNBCClosingBell today around 4pm ET to talk earnings, etc"
LizAnnSonders;2018-05-10 22:11;0;7;"Pretty babyhttps://twitter.com/dswt/status/994569746208047104 …"
LizAnnSonders;2018-05-10 20:54;13;21;"# CPI ticks up 0.2% m/m, < 0.3% estimate (core +0.1%, also < estimate, w/ core y/y +2.1%, down from 2.2%) ... but smaller companies still anticipate higher inflation ahead @ JackAblin @ NFIB @ BLS_gov @ SoberLookpic.twitter.com/XGqg5zTR6T"
LizAnnSonders;2018-05-10 10:12;0;0;"Yes he is"
LizAnnSonders;2018-05-10 05:01;0;1;"Cowhide treats, not hotdogs (no people food for my guys)"
LizAnnSonders;2018-05-10 04:58;0;3;"I have seen every tour since original Joshua Tree tour 30 years ago"
LizAnnSonders;2018-05-10 04:58;0;0;"Can we join the party? We bring treats. # Oscar # Normanpic.twitter.com/Jv573GoeaV"
LizAnnSonders;2018-05-10 04:49;1;8;"He’s remarkablehttps://twitter.com/waltbettinger/status/994311761393172480 …"
LizAnnSonders;2018-05-10 04:48;0;1;"So does Bono, no?"
LizAnnSonders;2018-05-10 04:47;0;3;"My favorite “One” is with Mary J Blige"
LizAnnSonders;2018-05-10 04:19;0;1;"I have about 10, all tied for #1"
LizAnnSonders;2018-05-10 03:50;7;305;"Still remember this as my best day ever (ok, fine ... with the exception of my wedding day and births of my two children)pic.twitter.com/y8NI8s6qlN"
LizAnnSonders;2018-05-09 20:34;3;3;"Partly reflects some fence-sitters jumping offhttps://twitter.com/loganmohtashami/status/994193075265138689 …"
LizAnnSonders;2018-05-09 20:16;3;11;"Tight connection between monetary policy uncertainty and global financial stress @ Bloomberg @ biancoresearchpic.twitter.com/9odTFwDKJX"
LizAnnSonders;2018-05-09 20:09;13;34;"Economic data changes have rolled over, especially in Eurozone @ Bloomberg @ biancoresearchpic.twitter.com/mZew1XGeZX"
LizAnnSonders;2018-05-09 19:48;0;0;"@ Gavekal on # IranDealWithdrawal : “...time honored principle of ‘buy the rumor and sell the news’. Near-record speculative positions suggest that today’s US$75 a barrel oil price may already discount the sanctions against Iran.”"
LizAnnSonders;2018-05-09 19:43;1;8;"Congratulations @ BloombergRadio ... well donehttps://twitter.com/mikebloomberg/status/993997644505722880 …"
LizAnnSonders;2018-05-09 19:42;3;6;"Youthful exhuberance ... NOT ... for the stock market @ Gallup @ SoberLookpic.twitter.com/GnKwWOcSo6"
LizAnnSonders;2018-05-09 19:01;6;22;"Record number of women running for House @ FEC @ SoberLook @ Bloombergpic.twitter.com/kI3W5Zz7jI"
LizAnnSonders;2018-05-09 18:51;18;19;"Small cap companies increasingly more indebted than larger cap companies @ johnauthers @ FT @ SoberLook @ SocGen_USpic.twitter.com/FClM1Ycsya"
LizAnnSonders;2018-05-09 18:43;1;30;"Sad to be departing # AustinTX right now ... what a great city"
LizAnnSonders;2018-05-09 18:36;1;2;"The answer to whether corporate CIOs are planning to implement # blockchain based technology solutions is ... not really @ WSJ @ Gartner_incpic.twitter.com/jW5sEwoSra"
LizAnnSonders;2018-05-09 18:28;3;3;"Healthcare & state/local government = largest job openings @ stlouisfed @ SoberLookpic.twitter.com/vCVQ8hZ5Qd"
LizAnnSonders;2018-05-09 18:23;9;15;"# JOLTS shows record job openings & now 1-for-1 in jobs per unemployed (albeit with a skills gap that remains a sticking point) @ SoberLookpic.twitter.com/rBQHBYMill"
LizAnnSonders;2018-05-09 03:23;0;7;"It is always nice when we can all talk to Chuckhttps://twitter.com/joekillgorecs/status/993901510445617152 …"
LizAnnSonders;2018-05-08 19:18;17;43;"Post-WWII, worst median return for stocks came in months immediately prior to recession (notice positive average return DURING recessions)pic.twitter.com/sZQqEdne63"
LizAnnSonders;2018-05-08 19:15;29;52;"Since 1950, # MidtermElection years have seen an average -17% maximum drawdown (concentrated in first 3 quarters); with an average subsequent 1-year rally of +32% (from the drawdowns’ troughs)pic.twitter.com/N1aOfj0425"
LizAnnSonders;2018-05-08 17:28;4;6;"Female workers’ percentage of GDP globally # Statista @ wef @ petervanham @ SoberLook @ McKinseypic.twitter.com/fyNLbgMehT"
LizAnnSonders;2018-05-08 17:26;16;13;"Percentage of working poor by country @ soberlook @ OECD_Socialpic.twitter.com/Z1QUoiSXyZ"
LizAnnSonders;2018-05-08 08:05;0;1;"Wow, that would be a party to attendhttps://twitter.com/carlquintanilla/status/993548184893952000 …"
LizAnnSonders;2018-05-08 07:36;0;8;"Spell check ... ugh ... “riveter”"
LizAnnSonders;2018-05-08 04:18;155;201;"It’s uncommon to have simultaneous rallies in US dollar & oil prices...current period represents only 11th time since 1983 that crude oil rallied more than 10% during same 4w stretch that US dollar gained >3% @ bespokeinvestpic.twitter.com/Z4Ig8xY3Rg"
LizAnnSonders;2018-05-08 03:40;0;0;"The daily ThomsonReuters report has all that stuff, so yes"
LizAnnSonders;2018-05-08 01:18;0;0;"Stock Market Report short videos as well as written reports all on Insights tab on http://Schwab.com ... podcasts are being considered ... many thanks"
LizAnnSonders;2018-05-08 01:15;13;23;"Tighter financial conditions globally (thanks to # FOMC & # BoE) for first time post-GFC @ Bloomberg @ biancoresearchpic.twitter.com/vBvqk1gEAQ"
LizAnnSonders;2018-05-08 01:07;9;18;"My latest missive ... on earnings season so farhttps://www.schwab.com/resource-center/insights/content/beast-burden-high-earnings-bar …"
LizAnnSonders;2018-05-08 00:39;1;6;"# SouthAfrica has the highest income inequality ... # Iceland the lowest @ OECD_Social @ SoberLookpic.twitter.com/xDhiP3DFkL"
LizAnnSonders;2018-05-08 00:37;26;34;"# WV only state losing population over past 6+ decades ( # NV at the top) @ onlmaps @ SoberLook @ uscensusbureaupic.twitter.com/AyFWk8j0Mq"
LizAnnSonders;2018-05-08 00:34;5;7;"The # FAANG stocks didn’t take a bite out of the market for long & now represent record-high weight in @ Nasdaq @ Bloomberg @ SoberLookpic.twitter.com/ucXDqptmgT"
LizAnnSonders;2018-05-08 00:30;2;16;"Rosie the Riverter making a comeback @ RenMacLLC @ Bloomberg # Haver @ SoberLookpic.twitter.com/lORAZZc1Oo"
LizAnnSonders;2018-05-08 00:28;7;9;"# LFPR flat for several years now; but data looks less somber when adjusting for age @ GregDaco @ SoberLook @ OxfordEconomics # Haverpic.twitter.com/nKBYIFRTjp"
LizAnnSonders;2018-05-08 00:06;2;10;"One of the best characters ever on TV # Gilfoyle # SiliconValleyHBOhttps://twitter.com/techatbloomberg/status/993316991770546176 …"
LizAnnSonders;2018-05-07 23:29;0;3;"Tweeps ... I’ll be back on Twitter shortly ... publishing day"
LizAnnSonders;2018-05-06 07:44;2;105;"# LazyLabs pic.twitter.com/lE8tLstlWm"
LizAnnSonders;2018-05-06 02:02;8;9;"@ business @ biancoresearch http://Bloomberg.com article on surveys is spot on: “We believe the soft data, and subsequent forecasts, are suffering from a circular reference due to groupthink, herd mentality and political preferences.”pic.twitter.com/lRpSsa5zet"
LizAnnSonders;2018-05-05 07:21;1;14;"Not all heroes wear capes...https://twitter.com/time/status/992543161049337862 …"
LizAnnSonders;2018-05-05 07:11;13;37;"this is beyond adorablehttps://twitter.com/amazlngnature/status/992538480466104320 …"
LizAnnSonders;2018-05-05 04:57;1;4;"Stocks are discounting mechanism and anticipate inflection points"
LizAnnSonders;2018-05-05 01:32;49;85;"Testament to leading nature of stock market & lagging nature of unemployment rate, stocks have had lowest annualized return when UR has been in lowest zone @ FactSet @ USDOL @ NDR_Researchpic.twitter.com/f1r1RF4jdW"
LizAnnSonders;2018-05-05 00:54;46;59;"This surprised me @ DeutscheBankpic.twitter.com/AxD1fxw0Ep"
LizAnnSonders;2018-05-05 00:43;0;2;"They are special, they are wanted, they are heard and they are so important @ MakeAWishCThttps://twitter.com/makeawishct/status/992389830209400833 …"
LizAnnSonders;2018-05-04 03:37;72;99;"Forward P/E has come down significantly more than prices did during the correction courtesy of rising earnings expectationspic.twitter.com/h7vkPvutH8"
LizAnnSonders;2018-05-04 00:26;7;3;"April services ISM down to 56.8 from 58.8 in March, < consensus w/ new orders & prices paid higher, but employment, business activity & supplier deliveries all weaker... # tariffs weighing on sentiment"
LizAnnSonders;2018-05-04 00:20;2;8;"Q1 productivity +0.7% at annual rate (1.3% y/y), w/ unit labor costs +2.7% (1.1% y/y)...both < consensus (but Q4 productivity revised higher)"
LizAnnSonders;2018-05-03 00:14;20;29;"Dollar index (DXY) upside breakout above 200-DMA ... historically, this has led to additional DXY gains, but weaker SPX returns in short-to-intermediate term @ Bloomberg @ ICE_Markets @ biancoresearchpic.twitter.com/nQi1Q8B0rW"
LizAnnSonders;2018-05-02 21:12;28;37;"The U.S. has the lowest percentage of self-employed workers among OECD+ nations @ paul1kirby @ OECD @ soberlookpic.twitter.com/ocCnWHtE5I"
LizAnnSonders;2018-05-02 01:56;18;30;"US mfg orders showing weak capex, however companies reporting higher capex in Q1...reason for disconnect is that largest increases have been dominated by tech firms (so not always evident from equipment/machinery orders) @ CommerceGov @ stlouisfed @ CreditSuisse @ WSJpic.twitter.com/8NPvlxNcA9"
LizAnnSonders;2018-05-02 01:08;20;50;"I created this “Consumer Stress Index” many years ago to track a broad mix of factors impacting the consumer ... stress has been rising latelypic.twitter.com/kDeu6a9xFF"
LizAnnSonders;2018-05-02 01:02;10;8;"Consumer spending rebounding so far in Q2, hence the @ AtlantaFed # GDPNow estimate of 4.1% well > consensuspic.twitter.com/2eIdqzGwWr"
LizAnnSonders;2018-05-02 00:41;0;0;"Yup"
LizAnnSonders;2018-05-02 00:21;16;27;"Very weak construction spending report for March: -1.7% m/m, well below +0.5% consensus, mostly due to weak improvements component of residential spending ... but prior 2 months revised sharply higher: Feb to +1.0% from +0.1% & Jan to +1.7% from 0.0%"
LizAnnSonders;2018-05-01 23:40;12;23;"April mfg ISM dipped to below-consensus 57.3 from 59.3 in March, w/ orders dropping to still-robust 61.2 ... still healthy, but likely pressured down from tariffs uncertainty."
LizAnnSonders;2018-05-01 09:47;9;34;"A throw away hithttps://twitter.com/mikedee718/status/990439890289557505 …"
LizAnnSonders;2018-05-01 08:25;0;1;"Good luck # Tigershttps://twitter.com/clemsonuniv/status/991109948846190593 …"
LizAnnSonders;2018-05-01 07:45;55;82;"Sell in May and go away? Not so fast. Buy & hold produced significantly higher return historically vs. avoiding stocks in seasonally-weak May-to-October period. @ bespokeinvestpic.twitter.com/lWD9OtSBKL"
LizAnnSonders;2018-05-01 07:34;7;15;"An interesting look at % of Congress with # IvyLeague pedigrees all the way back to 1789 @ esoltas @ SoberLookpic.twitter.com/oQ7GbhuZkm"
LizAnnSonders;2018-05-01 07:30;6;13;"Health care & tech w/ best earnings relative to consensus so far for Q1 @ FactSet @ SoberLookpic.twitter.com/XaPxvUhvZx"
LizAnnSonders;2018-05-01 07:28;21;25;"Percentage of S&P companies beating earnings estimates at record high (but investors should always be aware of possible inflection points) @ marketspic.twitter.com/hSEkOyY9v5"
LizAnnSonders;2018-05-01 07:22;1;7;"Private-public compensation divergence @ SoberLook @ ThePainReport @ nberpubs @ BLS_govpic.twitter.com/O9acEyDdIl"
LizAnnSonders;2018-05-01 00:32;10;15;"Wages & salaries component of ECI climbing at fastest pace since 2003 @ stlouisfed @ SoberLookpic.twitter.com/CGIhjsaC8l"
LizAnnSonders;2018-05-01 00:31;4;5;"pic.twitter.com/yD6uR5NU9X"
LizAnnSonders;2018-05-01 00:26;20;23;"Expectations for a May rate hike up to 35% (if # Fed does hike, it would certainly send clear signal to market that non-presser meetings aren’t off limits) @ Bloomberg @ biancoresearchpic.twitter.com/2fo7aPW4mu"
LizAnnSonders;2018-05-01 00:16;17;33;"The # Fed is now pushing the most hawkish rhetoric (in their speeches) since pre-GFC @ biancoresearch @ federalreservepic.twitter.com/CqqaxgjVfX"
LizAnnSonders;2018-05-01 00:11;11;6;"Monetary policy uncertainty is rising, but from an extremely low level recently @ Bloomberg @ biancoresearchpic.twitter.com/Udl0t7coaj"
LizAnnSonders;2018-04-30 22:34;4;15;"March core PCE +0.2% m/m = consensus ... y/y change rose to +1.9% from 1.6% ... increase due to prior wireless services plunge dropping out of comparison"
LizAnnSonders;2018-04-30 11:13;2;40;"# LedZeppelinhttps://twitter.com/robinwigg/status/990754887066669056 …"
LizAnnSonders;2018-04-30 09:52;3;14;"Congratulations!https://twitter.com/slemmacs/status/990670873232261120 …"
LizAnnSonders;2018-04-27 21:00;7;9;"Employment cost index (ECI) +0.8% q/q in Q1, > 0.7% consensus w/ wages +0.9% q/q & private sector wages up even more at +1.0% q/q"
LizAnnSonders;2018-04-27 20:44;10;33;"Stronger business spending; weaker consumer spending = highlights of Q1 GDP report"
LizAnnSonders;2018-04-27 20:40;7;22;"2.3% Q1 real GDP beats estimates"
LizAnnSonders;2018-04-27 18:10;0;4;"Americans’ views on the political system @ pewresearch @ SoberLookpic.twitter.com/1jBEhxSoFe"
LizAnnSonders;2018-04-27 18:07;25;49;"Interesting global fiscal/monetary policy transition matrix # BMI @ SoberLookpic.twitter.com/FDZtgu6DLx"
LizAnnSonders;2018-04-26 23:21;4;42;"# LucyForeverhttps://twitter.com/carlquintanilla/status/989520944753532928 …"
LizAnnSonders;2018-04-26 21:58;7;5;"Businesses’ (and employees’) spending on healthcare rising significantly @ CMSGov @ WSJpic.twitter.com/zWYhY0fDjq"
LizAnnSonders;2018-04-26 21:55;2;7;"So much for the gratitude of # BabyBoomers’ kids @ axios @ SoberLookpic.twitter.com/3Za2HieOP0"
LizAnnSonders;2018-04-26 21:52;6;15;"Slowly rising % of active managers beating benchmarks @ MorningstarInc @ StateStreet @ SoberLookpic.twitter.com/YyKLnE1yDa"
LizAnnSonders;2018-04-26 21:50;16;27;"Consistent with what I wrote about on Monday: ( https://www.schwab.com/resource-center/insights/content/dont-fear-yield-curve-reaper … ), @ jdlahart shows the best market performance (since mid-1970s) has come when 10s-2s spread is between 50bps and zero @ WSJpic.twitter.com/zY821XM4d4"
LizAnnSonders;2018-04-26 21:42;8;27;"Strong economic releases today: jobless claims down to 209k (lowest since 1969); durable goods +2.6% (> consensus, but w/ less-strong details); mdse trade down to $68b (well < consensus)"
LizAnnSonders;2018-04-26 19:32;31;36;"Dollar’s recent surge contributing to ongoing tightening of # FinancialConditionspic.twitter.com/FTfs4gtNQ2"
LizAnnSonders;2018-04-26 19:30;3;6;"Perhaps jumping off fence in light of surging mortgage ratespic.twitter.com/oR0wXZUKXN"
LizAnnSonders;2018-04-26 19:26;7;12;"Mortgage applications to purchase a home hit new high so far in 2018 @ MBAMortgage @ SoberLookpic.twitter.com/jkTBYsJK5g"
LizAnnSonders;2018-04-26 02:31;0;6;"So cool- I’m a big fan of show @ GraceandFrankiehttps://twitter.com/neeshahathi/status/989206003022376960 …"
LizAnnSonders;2018-04-26 02:13;1;4;"Oops- on @ BloombergTV at 2:20 and with @ juliachatterley and @ scarletfu"
LizAnnSonders;2018-04-26 01:06;0;3;"Joining @ VonnieQuinn and @ markbartontv on @ BloombergTV today around 2:10pm ET ... followed by @ BloombergRadio with @ carolmassar around 2:30pm ET"
LizAnnSonders;2018-04-25 22:32;28;36;"For 1st time since ‘16 election majority of consumers expect stocks to be lower in 12 months according to latest sentiment reading from @ Conferenceboard @ biancoresearch @ Bloombergpic.twitter.com/ijaE29C4Yt"
LizAnnSonders;2018-04-25 22:22;9;18;"Widening spread between home prices and AHE @ stlouisfed @ SoberLookpic.twitter.com/nCOLYqoDs8"
LizAnnSonders;2018-04-25 22:21;11;16;"A little “flation” of the “stag” variety seen in regional mfg data @ RichmondFed @ NYFedResearch @ BV @ DiMartinoBooth @ jagalley @ SoberLookpic.twitter.com/pyO6qJczU1"
LizAnnSonders;2018-04-25 22:16;35;50;"Ongoing decline in spread between S&P dividend yield & 10y Treasury yieldpic.twitter.com/7V9ztMwcDf"
LizAnnSonders;2018-04-25 22:05;8;18;"Updated table through 3/31/18pic.twitter.com/qlPulGDAPw"
LizAnnSonders;2018-04-25 08:31;0;1;"It is indeed the best market book ever"
LizAnnSonders;2018-04-25 03:55;3;10;"# Proud https://twitter.com/charlesschwab/status/988810811794698241 …"
LizAnnSonders;2018-04-25 02:52;79;228;"I’ve tweeted this table many times ... here’s an update ... today yet again a reminder that the market is a discounting mechanism and a lot of the earnings good news may have already been priced into stockspic.twitter.com/kLuPewK92j"
LizAnnSonders;2018-04-24 21:30;13;10;"# YieldCurve leads # VIX by about 3 years @ MorganStanley @ bySamRo @ SoberLook @ Bloombergpic.twitter.com/FEhlGM19I5"
LizAnnSonders;2018-04-24 21:26;22;31;"Strong beat rates so far for both bottom and top line growth @ bespokeinvestpic.twitter.com/SxzAoszPpI"
LizAnnSonders;2018-04-24 21:20;23;29;"# Oil has become a crowded long trade @ JKempEnergy @ SoberLook @ CFTC @ ICE_Marketspic.twitter.com/NXHrQm7I4L"
LizAnnSonders;2018-04-24 21:12;16;13;"Job hopping becoming more common @ AtlantaFed @ SoberLook @ BLS_govpic.twitter.com/0sUln6rTtA"
LizAnnSonders;2018-04-24 09:54;0;16;"# Springhttps://twitter.com/ritholtz/status/988518202513686529 …"
LizAnnSonders;2018-04-24 07:59;6;70;"Kudos @ GerberLife - what a beautiful baby This is Lucas, the first Gerber Baby with Down syndromehttps://www.cnn.com/2018/02/07/health/first-gerber-baby-down-syndrome-trnd/index.html …"
LizAnnSonders;2018-04-24 07:18;0;6;"Now that is a great dress"
LizAnnSonders;2018-04-24 06:38;2;20;"Not all heroes wear capes ... or are human ... this is incredibly touchinghttps://twitter.com/mindykaling/status/988269490839343104 …"
LizAnnSonders;2018-04-24 06:00;0;0;"Happy Birthday fellas"
LizAnnSonders;2018-04-24 01:11;0;2;"That’s what I wrote about 2 weeks ago:https://www.schwab.com/resource-center/insights/content/gettin-tighter-financial-conditions-effect-on-stocks …"
LizAnnSonders;2018-04-24 00:24;13;29;"My thoughts on the oft-dire warnings of a flattening # YieldCurvehttps://www.schwab.com/resource-center/insights/content/dont-fear-yield-curve-reaper …"
LizAnnSonders;2018-04-23 20:05;12;14;"Public social spending as share of GDP for @ OECD countries @ conradhackett @ SoberLookpic.twitter.com/mP3O5PaRGB"
LizAnnSonders;2018-04-23 20:03;0;4;"@ federalreserve offers no surprises relative to other central banks @ economics @ SoberLookpic.twitter.com/EdhTotNcmG"
LizAnnSonders;2018-04-23 20:01;21;27;"U.S. & global valuations not stretched relative to 20y averages @ Callum_Thomas @ ForrestEquities @ jpmorgan @ Bloomberg @ FactSet @ MSCI_Incpic.twitter.com/S1Zu37jTFu"
LizAnnSonders;2018-04-23 19:56;22;22;"Probability of a May rate hike, next to nil ... probability of a June rate hike, near certaintypic.twitter.com/1mbs7f7wmK"
LizAnnSonders;2018-04-23 10:33;24;127;"As someone who is truly obsessed with this era of NYC, this film is remarkable ... I’m in awe ... I will watch this over and over and over againhttps://twitter.com/openculture/status/988100403895062528 …"
LizAnnSonders;2018-04-23 01:29;51;334;"This is a very lovely photopic.twitter.com/wM4uPvNzMV"
LizAnnSonders;2018-04-23 01:26;0;4;"LOVE your # Peleton classes @ DenisNoMenace"
LizAnnSonders;2018-04-21 03:28;3;23;"# FlashbackFridayhttps://twitter.com/carlquintanilla/status/987310905863163904 …"
LizAnnSonders;2018-04-21 01:49;1;38;"First Lady Barbara Bush’s Secret Service code name was “Tranquility” ... # perfect @ CNN # JonathanWackrow"
LizAnnSonders;2018-04-21 01:23;3;3;"Right now the correlation is indeed negative (falling spread, rising oil prices), but the correlation has varied widely over the decadespic.twitter.com/H6w9K7HHN4"
LizAnnSonders;2018-04-21 01:17;0;0;"# Kidding"
LizAnnSonders;2018-04-20 21:35;2;17;"Best and worst states for driving scores (CT ranks dead last, perhaps since my daughter got her license) @ EverQuoteInsurepic.twitter.com/hf3d3vto8C"
LizAnnSonders;2018-04-20 21:31;26;37;"Income taxes as a proportion of state revenues (white is my favorite color on this chart) @ uscensusbureau @ SoberLookpic.twitter.com/VOokvzoo7f"
LizAnnSonders;2018-04-20 21:28;9;10;"How recent US fiscal stimulus is impacting next year's budget deficit @ business @ BV @ BudgetHawks @ SoberLook @ USCBOpic.twitter.com/NPn9wYWL30"
LizAnnSonders;2018-04-20 21:26;5;6;"Estimate of total current government liabilities (NPV), including pensions and healthcare spending, across nations @ fwred @ SoberLookpic.twitter.com/xuDss1wCEa"
LizAnnSonders;2018-04-20 20:47;17;29;"IMF continues to upgrade its economic growth forecasts for most countries @ WSJpic.twitter.com/1epOqCzRnx"
LizAnnSonders;2018-04-20 10:23;0;0;"You wear it very well @ joannagaines"
LizAnnSonders;2018-04-20 05:35;0;0;"I’m back in CT ... quite nippy and rainy here, too"
LizAnnSonders;2018-04-20 05:31;2;6;"You guys continue to be the best music I’ve heard in years and years ... keep it up"
LizAnnSonders;2018-04-20 03:19;0;2;"# Funnyhttps://twitter.com/ivanthek/status/987038148474621953 …"
LizAnnSonders;2018-04-20 02:17;2;3;"Recent plunge alongside lower volatilitypic.twitter.com/LcopvSm07H"
LizAnnSonders;2018-04-20 02:16;1;0;"pic.twitter.com/RHO3bBtcOZ"
LizAnnSonders;2018-04-19 22:22;1;4;"It was a pleasure to sit down with @ DynastyFP CIO Scott Welch at # DynastyIF2018https://twitter.com/dynastyfp/status/986967637270974464 …"
LizAnnSonders;2018-04-19 21:22;45;71;"I’ve been getting a lot of questions about whether the YC’s breach of 50bps signals impending doom for either stocks or the economy ... not based on historypic.twitter.com/VzH3Nciavr"
LizAnnSonders;2018-04-19 20:51;0;1;"@ philadelphiafed mfg. survey up to 23.2 in April, > consensus, w/ decreases in new orders (big drop), shipments, inventories & capex plans and increases in prices paid/received (big increases), employment & delivery times"
LizAnnSonders;2018-04-19 20:33;14;13;"# Hurricane country @ howmuch_net @ SoberLookpic.twitter.com/Zv6UUAzwDX"
LizAnnSonders;2018-04-19 20:31;2;3;"Boot camps for the brain @ CourseReport @ SoberLookpic.twitter.com/JL5XQAUWU7"
LizAnnSonders;2018-04-19 20:25;10;25;"As # volatility has eased, so too have correlations @ SoberLookpic.twitter.com/pyV7f6wa2g"
LizAnnSonders;2018-04-19 20:18;73;98;"U.S. is the only advanced economy that expects an increase in its debt-to-GDP ratio over the next five years @ IMFNews @ SoberLookpic.twitter.com/EWpcz08h3h"
LizAnnSonders;2018-04-19 20:03;38;50;"Spiking probability of 4 # RateHikes this yearpic.twitter.com/5y4umIQRGJ"
LizAnnSonders;2018-04-19 20:01;6;10;"I’ve been musing that perhaps a key thing to focus on with regard to company guidance this earnings season is their thoughts on the current trade skirmish ... transcripts mentioning # Tariffs confirm that @ M_McDonough @ Bloombergpic.twitter.com/dRL77vFvD4"
LizAnnSonders;2018-04-19 11:15;0;0;"# NoWay"
LizAnnSonders;2018-04-18 21:50;2;3;"Longer-term chart of U.S. female working-age LFPRpic.twitter.com/ufnla8JJZa"
LizAnnSonders;2018-04-18 20:39;15;18;"Prime-age labor force participation by women around the world ... U.S. way below (& only decliner) vs. other developed countries @ WSJ @ OECDpic.twitter.com/CxUAkcHSQS"
LizAnnSonders;2018-04-18 20:37;7;8;"Tepid review so far of # TaxReform , even by # GOP @ WSJpic.twitter.com/MIdp2tBStm"
LizAnnSonders;2018-04-18 20:35;19;20;"Mortgage loan delinquencies may not be worse than GFC-era, but auto loan delinquencies are @ trevornoren @ FitchRatingspic.twitter.com/m09ELwzzpF"
LizAnnSonders;2018-04-18 20:31;11;18;"Widening divergence between market (SPY) performance overnight & intraday @ McClellanOsc @ SoberLookpic.twitter.com/Ypu1EsunL6"
LizAnnSonders;2018-04-18 07:53;0;0;"A true gem"
LizAnnSonders;2018-04-18 07:52;7;85;"RIP one of the most gracious First Ladies of all time Barbara Bush"
LizAnnSonders;2018-04-18 07:49;0;225;"Enjoying family on vacation last weekpic.twitter.com/ZfXBA0KjMP"
LizAnnSonders;2018-04-18 01:07;3;9;"Congratulations to everyone!https://twitter.com/jonathancraig/status/986289187895693312 …"
LizAnnSonders;2018-04-18 00:58;14;31;"And this doesn’t include a full year of # Fortnite @ WSJ @ Nielsenpic.twitter.com/vDMBiQAIdU"
LizAnnSonders;2018-04-18 00:55;3;8;"# Vietnam # Malaysia and # Brunei benefit most if U.S. joins # TPP @ WSJ @ PIIEpic.twitter.com/Emw7zFaPEK"
LizAnnSonders;2018-04-18 00:53;4;12;"Global growth less synchronized recently, with U.S. manufacturing diverging positively @ ConnectedWealth @ SoberLook # Haver @ IIFpic.twitter.com/mXOp7NAgzF"
LizAnnSonders;2018-04-18 00:35;14;29;"More Americans aged over 45 have been changing jobs recently as companies pay up for experience @ NYFed @ SoberLookpic.twitter.com/PtOEfOOTg4"
LizAnnSonders;2018-04-17 21:33;0;1;"I will tweet a link when/if I get one- thanks"
