LizAnnSonders;2017-08-01 02:35;6;19;"S&P earnings have been on tear ... if this pace persists, 2Q growth will be +12%"
LizAnnSonders;2017-08-01 02:28;0;10;"Glad we've been recommending over weights to tech and financials @ thomsonreuters @ biancoresearchpic.twitter.com/ogTGXPMU7s"
LizAnnSonders;2017-07-31 21:01;8;17;"Companies using cash flow for capex have been outperforming those using it for share repurchases, since election @ StrategasRP"
LizAnnSonders;2017-07-31 20:58;1;46;"On vacation for 2 weeks starting today...will be tweeting a bit less...bear with me!"
LizAnnSonders;2017-07-31 20:30;2;4;"Lower correlations have helped active mutual funds' 4w inflows hit 3y high"
LizAnnSonders;2017-07-31 19:38;16;43;"Dr. Copper rising with stocks ... good economic signpic.twitter.com/e5fjCvTkPn"
LizAnnSonders;2017-07-31 19:33;4;11;"I don't think my honorary doctorate counts in this, but good for the USA! @ StatistaCharts @ OECD @ WSJ @ SoberLookpic.twitter.com/ffBUK6z48v"
LizAnnSonders;2017-07-31 09:38;0;0;"Enjoying our time with @ anthonynoto and his FAB 5 on # ACKhttps://twitter.com/anthonynoto/status/891404919709761536 …"
LizAnnSonders;2017-07-29 03:14;0;0;"Never trying"
LizAnnSonders;2017-07-29 02:00;2;3;"Scratch one "with"https://twitter.com/lizannsonders/status/890888063962025984 …"
LizAnnSonders;2017-07-29 01:43;1;13;"Rest In Peace sweet Charlie Gard"
LizAnnSonders;2017-07-28 21:07;30;48;"Real GDP for 2Q up 2.5% w/ real consumption up 2.8% (up from 1.9% in Q1), while business investment was up a strong 5.2%"
LizAnnSonders;2017-07-28 20:51;0;25;"Happy birthday Chuck! @ CharlesSchwab"
LizAnnSonders;2017-07-28 18:54;4;12;"Touching base with with annoying office jargon @ StatistaCharts @ Glassdoor @ DataIsBeautiful @ josephncohen @ WSJ @ SoberLookpic.twitter.com/T1gTJ4CAE4"
LizAnnSonders;2017-07-28 18:43;4;7;"NY Yankees no longer the world's most valuable sports team @ StatistaCharts @ Forbes @ WSJ @ SoberLookpic.twitter.com/Xln4GEt4yO"
LizAnnSonders;2017-07-28 18:39;41;47;"The last two times the St. Louis Fed Financial Stress Index hit the current level, it bounced @ stlouisfed @ WSJ @ SoberLookpic.twitter.com/dv4X5zaZQ0"
LizAnnSonders;2017-07-28 18:29;20;29;"More on regulatory burdens dropping quickly @ business @ biancoresearchpic.twitter.com/7xOb38eneJ"
LizAnnSonders;2017-07-28 18:28;3;6;"Regulatory burdens dropping quickly @ WSJpic.twitter.com/EMRWEIoVXu"
LizAnnSonders;2017-07-28 04:55;5;17;"Durable goods and capex shipments stronger than expected ... bodes well for 2Q GDP"
LizAnnSonders;2017-07-27 19:07;18;31;"Healthcare = #1 concern of Americans @ ipsosus @ WSJ @ SoberLookpic.twitter.com/E5O07lCVdR"
LizAnnSonders;2017-07-27 18:57;7;9;"Financial conditions continue to ease, supporting asset prices (and giving the Fed runway to tighten further)pic.twitter.com/PaVdbd3gm0"
LizAnnSonders;2017-07-27 09:14;4;4;"Thoughts on the (uneventful) Fed meeting http://www.schwab.com/public/schwab/nn/articles/Fed-Keeps-it-on-the-QT …"
LizAnnSonders;2017-07-27 02:11;6;9;"Everyone's fixated on what # FOMC's "relatively soon" means ... likely a September start to balance sheet shrinkage (with no rate hike then)"
LizAnnSonders;2017-07-26 22:14;5;4;"As the VIX plumbs new lows, 740k puts & calls tied to it have changed hands daily in July, beating prior record of 644k set 2y agopic.twitter.com/Jwkgxk58hS"
LizAnnSonders;2017-07-26 21:07;2;12;"Slow going with presidential nominations @ ECONdailycharts @ WSJ @ SoberLookpic.twitter.com/AJDdojp92h"
LizAnnSonders;2017-07-26 21:04;3;9;"Dallas closing in on NYC! @ Moodys @ CushWake @ WSJ @ SoberLookpic.twitter.com/pz0Ld3mHBN"
LizAnnSonders;2017-07-26 21:01;8;15;"Global debt at all-time high although DMs ex-US debt has shrunk @ IIF @ BIS_org @ WSJ @ SoberLookpic.twitter.com/5nZvfYLY48"
LizAnnSonders;2017-07-26 20:20;2;7;"2/2 ...and therefore they—and their issuers—are subject to the full panoply of SEC regulation @ Gavekal"
LizAnnSonders;2017-07-26 20:19;5;24;"Yesterday, SEC released statement declaring that blockchain-based digital tokens such as bitcoin are securities 1/2"
LizAnnSonders;2017-07-26 19:09;9;23;"Yesterday was a "key reversal" day in the VIX, which has led to jumps in the index over the next week historically @ sentimentrader"
LizAnnSonders;2017-07-26 09:18;0;0;"20 years ago when I started ... ugh"
LizAnnSonders;2017-07-26 03:07;0;2;""Market Wizards is one of the most fascinating books ever written about Wall Street. A few of the 'Wizards' are my friends..." -Marty Zweig"
LizAnnSonders;2017-07-26 02:45;0;0;"I would hope so!https://twitter.com/murphmom/status/889916863295172610 …"
LizAnnSonders;2017-07-26 02:32;15;116;"Often asked for "best finance books" I've read ... 2 favs: Winning on Wall Street (Zweig) and Reminiscences of a Stock Operator (Lefevre)"
LizAnnSonders;2017-07-26 02:18;14;20;"Consumer confidence tracks closely with P/Es (bodes well for P/E expansion from here) # EvercoreISIpic.twitter.com/cVFCoP408K"
LizAnnSonders;2017-07-26 00:46;1;3;"Missing everyone in Hong Konghttps://twitter.com/waltbettinger/status/889887496393248769 …"
LizAnnSonders;2017-07-25 09:50;5;31;"Joining @ MariaBartiromo tomorrow morning on @ FoxBusiness about 7:30am ET...tune in!"
LizAnnSonders;2017-07-25 05:21;0;1;"Can't take credit"
LizAnnSonders;2017-07-25 05:21;0;0;"Incomes are higher and job growth is much stronger"
LizAnnSonders;2017-07-25 05:03;7;35;"# Rexit?https://twitter.com/john_hudson/status/889282886964314113 …"
LizAnnSonders;2017-07-25 02:15;6;19;"This is gonna help (large cap companies/high foreign sales companies to benefit from weaker dollar):pic.twitter.com/TanOOoBLXH"
LizAnnSonders;2017-07-25 00:11;5;20;"Of 20 Case-Schiller regions, 8 have home prices > 2006-07 highs: Seattle, Portland, Dallas, San Fran, Boston, Denver, Charlotte, Atlanta"
LizAnnSonders;2017-07-24 21:22;9;17;"Citi US Economic Surprise Index rebounding off depressed level (i.e., expectations bar finally got set low enough) @ businesspic.twitter.com/yl03kKQJPu"
LizAnnSonders;2017-07-24 21:11;52;85;"US leading indicators point to no imminent recession riskpic.twitter.com/aS0cbrPKAK"
LizAnnSonders;2017-07-24 20:57;8;31;"The conscious uncoupling of oil and stocks @ S&P @ FactSet @ jpmorgan @ WSJ @ SoberLookpic.twitter.com/KinX0eXxKN"
LizAnnSonders;2017-07-24 20:08;15;21;"Currency volatility rising while stock/bond volatility remains near record lows ... based on history, the latter is likely to catch up"
LizAnnSonders;2017-07-22 04:30;1;16;"At Bartlett Farm on # ACK, aka a different kind of bull marketpic.twitter.com/YSALJrkjV0"
LizAnnSonders;2017-07-22 03:13;0;0;"I have, many times (especially at SALT)"
LizAnnSonders;2017-07-21 22:39;13;12;"Only commodities have been the loser over the past 19 months @ business @ biancoresearchpic.twitter.com/BTDicwlFyo"
LizAnnSonders;2017-07-21 21:30;8;14;"Not proud to be #3 @ paul1kirby @ OECD @ WSJ @ SoberLookpic.twitter.com/g3VTXqUCFM"
LizAnnSonders;2017-07-21 21:29;3;4;"People getting news from social media/search engines often don’t remember source (at least Twitter is better) @ NiemanLab @ WSJ @ SoberLookpic.twitter.com/Mx8whep4D4"
LizAnnSonders;2017-07-21 21:26;23;30;"Note to students: say yes to chemical engineering and nursing and no to theology and criminal justice @ AEI @ WSJ @ SoberLookpic.twitter.com/teKdsy810F"
LizAnnSonders;2017-07-21 21:23;0;0;"More hawkish global central banks = lower dollar"
LizAnnSonders;2017-07-21 21:23;11;11;"Small companies' wage growth meaningfully higher than at large companies @ economics_ma @ WSJGraphics @ SoberLookpic.twitter.com/QgCGeFRaEk"
LizAnnSonders;2017-07-21 21:21;13;11;"Very positive read on future capex from Philly Fed @ WSJ @ philadelphiafed @ SoberLookpic.twitter.com/yARSamSYhA"
LizAnnSonders;2017-07-21 21:18;4;4;"Active picking up some fund flow steam relative to passive @ CreditSuisse @ WSJ @ SoberLookpic.twitter.com/kUpXasOMXa"
LizAnnSonders;2017-07-21 21:16;7;2;"Rise of the machines @ M_McDonough @ business @ WSJ @ SoberLookpic.twitter.com/Cp6MpOCtXN"
LizAnnSonders;2017-07-21 10:36;1;14;"As it should behttps://twitter.com/joshuabeamscs/status/888198305368363009 …"
LizAnnSonders;2017-07-21 02:11;39;73;"Leading Economic Index (LEI) up sharply, with 8 of 10 components strengthening ... bodes well for growth and indicative of no recession risk"
LizAnnSonders;2017-07-20 19:52;2;12;"We've got to do better than this @ OECD @ WSJ @ SoberLookpic.twitter.com/Xrnov0OI5t"
LizAnnSonders;2017-07-20 19:46;40;49;"Buybacks have been biggest driver of this bull market @ WSJ @ thomsonreuters @ CreditSuissepic.twitter.com/h8XJKYoUMe"
LizAnnSonders;2017-07-20 19:45;8;14;"FAANG's outperformance is back @ WSJ @ SoberLookpic.twitter.com/BRpL86ogWZ"
LizAnnSonders;2017-07-19 21:33;9;20;"Very strong housing starts today should boost 2H growth"
LizAnnSonders;2017-07-19 18:51;5;7;"I meant to write "starter"https://twitter.com/lizannsonders/status/887288239350063104 …"
LizAnnSonders;2017-07-19 18:50;12;19;"The Fed has an inflation expectations problem https://www.bloomberg.com/news/articles/2017-07-18/fed-s-long-run-miss-of-inflation-goal-undermines-rate-hike-case …pic.twitter.com/ClCUMxHxVw"
LizAnnSonders;2017-07-18 21:05;7;16;"As expected, soft data continues to catch down to hard data @ business @ biancoresearchpic.twitter.com/AaMmULgPoT"
LizAnnSonders;2017-07-18 20:58;35;45;"Weaker dollar = better for oil prices, S&P earnings and U.S. exportspic.twitter.com/oaivHkkLuY"
LizAnnSonders;2017-07-18 20:41;11;7;"Shame that the U.S. is nearly in the "stall out" space http://HBR.Org , Jonathan Sutter, @ TuftsUniversity @ WSJ @ SoberLookpic.twitter.com/yIdpPjQ0VV"
LizAnnSonders;2017-07-18 20:29;8;12;"This is why demand for started homes has been rising @ WSJ @ SoberLook @ uscensusbureaupic.twitter.com/H8HTVsFMJh"
LizAnnSonders;2017-07-18 20:25;29;23;"More economists now see downside risk for the US economy (highest since pre-election) @ WSJpic.twitter.com/IaCYHnYAJw"
LizAnnSonders;2017-07-18 09:32;0;0;"Matt, this is a really great song!"
LizAnnSonders;2017-07-18 09:30;0;9;"Happy birthday Kelly!https://twitter.com/billgriffeth/status/887003905032409088 …"
LizAnnSonders;2017-07-14 18:43;7;12;"NAFTA members' highly correlated economies @ WorldBank @ BrianHerman14 @ PIIE @ WSJ @ SoberLookpic.twitter.com/ficsnguhlQ"
LizAnnSonders;2017-07-14 00:32;16;35;"Wowhttps://twitter.com/galka_max/status/885491473340354562 …"
LizAnnSonders;2017-07-13 21:57;0;0;"From Evercore ISI todaypic.twitter.com/pPNTEIwktu"
LizAnnSonders;2017-07-13 21:55;29;31;"Where would repatriated cash go? Nearly 2x as many execs say pay down debt vs. capex. @ BankofAmerica @ MerrillLynch @ WSJ @ biancoresearchpic.twitter.com/nP8mQPkNWU"
LizAnnSonders;2017-07-13 21:38;14;9;"Fed getting a bit less hawkish in speeches @ federalreserve @ biancoresearchpic.twitter.com/swk7xFV3ml"
LizAnnSonders;2017-07-13 18:01;14;18;"Italy #1 in global health score # pasta # wine @ wef @ josephncohen @ WSJ @ SoberLook @ WHO @ WorldBank @ businesspic.twitter.com/rSbdWIcW9I"
LizAnnSonders;2017-07-13 17:52;15;43;"SPY ETF short interest continues to decline as short-sellers capitulate @ hedgopia @ jessefelder @ WSJ @ SoberLookpic.twitter.com/ghVZqqApy1"
LizAnnSonders;2017-07-13 17:49;6;20;"A news-flow chart showing that political jitters have overtaken economic uncertainty @ WSJpic.twitter.com/eXIqqQe37p"
LizAnnSonders;2017-07-13 17:41;9;20;"Will tight labor mkt force cos to be more efficient, leading to higher productivity? @ jsblokland @ enlundm @ WSJ @ SoberLook @ NordeaMarketspic.twitter.com/Umffr9NXg6"
LizAnnSonders;2017-07-12 20:14;20;16;"More evidence of Americans' confidence in job market @ jpmorganfunds @ WSJ @ SoberLookpic.twitter.com/3RvbxBJ5wJ"
LizAnnSonders;2017-07-12 01:47;0;0;"pic.twitter.com/EHl5mqOg4T"
LizAnnSonders;2017-07-11 23:46;0;0;"Medicare is for the elderly; Medicaid is for lower-income folks"
LizAnnSonders;2017-07-11 23:45;27;21;"One way to show online retailers' trouncing of the traditional competition @ business @ biancoresearchpic.twitter.com/NaAjAVFYun"
LizAnnSonders;2017-07-11 20:50;7;0;"Related to this, last year 7 of 8 size/style ETFs were beating S&P 500...this year only 1 of 8 is ahead (as of June 23) @ cornerstonemachttps://twitter.com/lizannsonders/status/884753661540347905 …"
LizAnnSonders;2017-07-11 20:42;32;37;"Interesting graphic of how Americans get their health insurance @ axios @ WSJ @ SoberLookpic.twitter.com/UY3svyrpdy"
LizAnnSonders;2017-07-11 20:38;5;8;"Rapid sector rotation = plunging correlations = active beneficiary @ WSJMoneyBeat @ chrisdieterich @ SoberLookpic.twitter.com/xYh8RiKmyV"
LizAnnSonders;2017-07-11 20:33;6;5;"REITs following retailers’ shares lower amid investors’ concerns about property firms losing retail rental clients @ WSJ @ SoberLookpic.twitter.com/S3r4fNOnkl"
LizAnnSonders;2017-07-11 20:31;7;13;"What goes up, must come down # ethereum has been cut nearly in half @ WSJ @ SoberLookpic.twitter.com/TeMXdK1bxV"
LizAnnSonders;2017-07-11 06:04;6;16;"M2 currently >70% of nominal GDP- relative to overall economic activity, 10pp higher compared to any other time in >60y @ LeutholdGrouppic.twitter.com/Rdus4EHZsh"
LizAnnSonders;2017-07-10 19:31;60;72;"In June, the number of Americans moving from “not in labor force” to “employed” was the highest on record. @ stlouisfed @ WSJ @ SoberLookpic.twitter.com/TuvEQD9b1w"
LizAnnSonders;2017-07-10 19:29;6;15;"ADP's miss factor remains quite high relative to BLS's jobs data @ WSJ @ SoberLookpic.twitter.com/6dFOu6ZbZ0"
LizAnnSonders;2017-07-08 23:46;1;26;"Nothing better than boarding the ferry for # ACKpic.twitter.com/GK0FrNQitT"
LizAnnSonders;2017-07-08 08:29;13;27;"Our latest collective missive:http://www.schwab.com/public/schwab/nn/articles/Market-Perspective …"
LizAnnSonders;2017-07-08 03:02;6;15;"All BUT top 1/10 of @ LeutholdGroup 3000 universe trades > 20 = mirror image of 12/99 valuation peak, when only top 1/10 traded at P/E > 20"
LizAnnSonders;2017-07-07 22:40;5;17;"Happy to be included...many thanks @ businessinsiderhttps://twitter.com/businessinsider/status/883262813061472256 …"
LizAnnSonders;2017-07-07 20:50;2;3;"Very proud of @ HakonC1M who was my personal guide during my March visit to/talk at Norwegian School of Economics (NHH) in Bergenhttps://twitter.com/hakonc1m/status/880431094767783937 …"
LizAnnSonders;2017-07-07 20:39;6;12;"Significant skills gap in addition to geographic mismatch https://twitter.com/sullycnbc/status/883304335408607233 …"
LizAnnSonders;2017-07-07 20:34;23;31;"Job market enticing folks off sidelines- size of labor force & number of unemployed up, indicating more people actively looking for work"
LizAnnSonders;2017-07-07 20:31;6;14;"222k jobs vs. 179k estimate"
LizAnnSonders;2017-07-07 20:25;4;10;"Correlations down sharply- benefits global diversification (and active management) @ jpmorgan @ WSJ @ SoberLookpic.twitter.com/elfwBS9yrP"
LizAnnSonders;2017-07-07 20:19;20;37;"Ratio of GSCI ( @ GoldmanSachs commodity index) to S&P 500 ... another extreme? @ jessefelder @ WSJ @ SoberLookpic.twitter.com/TVyoIdAG1x"
LizAnnSonders;2017-07-07 04:11;0;3;"Kudos"
LizAnnSonders;2017-07-07 03:30;0;0;"UC Irvine did a study sometime in the past couple of years"
LizAnnSonders;2017-07-06 23:12;19;35;"Stronger services ISM (covering ~80% of US economy) suggest healthy domestic demand/growth"
LizAnnSonders;2017-07-06 22:10;8;10;"Citi US Economic Surprise Index may be turning higher soon (even if only due to reversion to mean tendencies)pic.twitter.com/hfYvcTJKpN"
LizAnnSonders;2017-07-06 21:59;2;15;"Trade deficit narrowed from April's $47.6b to May's $46.5b driven by increased exports...points to strength in export growth looking ahead"
LizAnnSonders;2017-07-06 03:49;2;5;"# Fed minutes suggest balance sheet rolloff could begin before next rate hike"
LizAnnSonders;2017-07-06 00:31;0;0;"Thanks!"
LizAnnSonders;2017-07-05 22:10;6;7;"September # Fed rate hike odds still low at 22%, but December's are up to 55% @ business @ biancoresearchpic.twitter.com/jCYa633VBR"
LizAnnSonders;2017-07-05 20:12;9;15;"US economic surprises likely bottoming @ NordeaMarkets @ jbjakobsen @ josephncohen @ WSJ @ soberlookpic.twitter.com/zDCJr23aZa"
LizAnnSonders;2017-07-05 20:09;10;10;"Gap between 2 primary mfg gauges largest since 2011, which preceded slowdown in US factory activity...hmmm @ Danske_Research @ WSJ @ SoberLookpic.twitter.com/mRLCRiYGkz"
LizAnnSonders;2017-07-05 20:06;19;21;"Strong details within Monday's surprisingly positive # ISM manufacturing survey @ WSJ @ SoberLookpic.twitter.com/wfpr3yT1if"
LizAnnSonders;2017-07-04 03:40;0;1;"You have a great 4th as well!"
LizAnnSonders;2017-07-04 02:52;16;59;"My mid year outlook: http://www.schwab.com/public/schwab/nn/articles/2017-Mid-year-US-Equity-Outlook-Rattle-and-Hum …"
LizAnnSonders;2017-07-03 22:38;8;36;"Very strong ISM mfg points to stronger 2Q growth"
LizAnnSonders;2017-07-03 19:00;0;0;"Thanks John ... great to see you both"
LizAnnSonders;2017-06-30 18:48;19;22;"A troubling statistic; we have got to do better than this @ juliaoftoronto @ josephncohen @ WSJ @ SoberLookpic.twitter.com/1DEc6ZSlND"
LizAnnSonders;2017-06-30 18:44;11;29;"Having a 17-year old daughter, this has helped ... a lot (oh, it's also partly why inflation has dropped) @ USDOL @ WSJ @ SoberLookpic.twitter.com/HaCA4ZxuRD"
LizAnnSonders;2017-06-30 09:45;7;78;"So good # U2TheJoshuaTree2017pic.twitter.com/0op0DD8qDC"
LizAnnSonders;2017-06-30 08:39;0;4;"@ GaryKaminsky @ jameskam17 in the house at # U2TheJoshuaTree2017pic.twitter.com/R9vmTyJHy2"
LizAnnSonders;2017-06-30 06:22;0;3;"@ mattnathanson you rock"
LizAnnSonders;2017-06-30 05:37;4;98;"Stuck in GWB traffic now en route to MetLife but I am as happy now as I was in this photo to be seeing # U2TheJoshuaTreeTour2017 tonight!pic.twitter.com/ATBo8IZtll"
LizAnnSonders;2017-06-30 05:22;0;10;"No, Bill! Waze is good!https://twitter.com/billgriffeth/status/880532709969244160 …"
LizAnnSonders;2017-06-30 05:20;0;0;"Indeed- figured that out after analyzing retweet data- no sweat"
LizAnnSonders;2017-06-30 02:51;0;0;"I just replied ... curious as to how Bloomberg/EIA got it wrong if so"
LizAnnSonders;2017-06-30 02:50;0;0;"Got it from Bloomberg/EIA/Bianco ... why erroneous?"
LizAnnSonders;2017-06-29 23:49;0;1;"Indeed"
LizAnnSonders;2017-06-29 23:48;3;13;"Oil weak but not stocks ... reflects lower correlations over past year @ business @ biancoresearchpic.twitter.com/b5gZ3VQ3DF"
LizAnnSonders;2017-06-29 20:23;3;11;"Jobs was the manhttps://twitter.com/carlquintanilla/status/880398699653890048 …"
LizAnnSonders;2017-06-29 18:48;6;16;"Having just returned from a family wedding in Norway, I can attest to this @ DataIsBeautiful @ josephncohen @ WSJ @ SoberLookpic.twitter.com/cvTgRGZU3Z"
LizAnnSonders;2017-06-29 18:44;13;26;"For those who like technical analysis, what does this chart tell us about the next move for # Bitcoin? @ business @ WSJ @ SoberLookpic.twitter.com/Ntnhpg1WTo"
LizAnnSonders;2017-06-29 18:41;0;0;"We're spending more on experiences than stuff these days @ uscensusbureau @ GoldmanSachs @ joshdigga @ WSJ @ SoberLookpic.twitter.com/GTuDvzd6YE"
LizAnnSonders;2017-06-29 18:35;3;4;"Here's a different version of the data including hedge funds separated @ WSJ @ SoberLookpic.twitter.com/3RIUg9SPHq"
LizAnnSonders;2017-06-29 08:18;4;35;"Going tomorrow...CANNOT WAIT... # U2TheJoshuaTree2017https://twitter.com/u2/status/880157717935083521 …"
LizAnnSonders;2017-06-29 04:19;0;0;"Many thanks Tom"
LizAnnSonders;2017-06-29 00:28;0;10;"Joining @ CNBCClosingBell today around 4pm ET...tune in!"
LizAnnSonders;2017-06-28 23:01;9;14;"ETFs still small (albeit growing quickly) slice of equity ownership pie (households/mutual funds dominate) @ federalreserve @ biancoresearchpic.twitter.com/szdvy5nvEV"
LizAnnSonders;2017-06-28 22:35;0;6;"Merkle on top re: confidence ratings @ pewresearch @ WSJ @ SoberLookpic.twitter.com/5YwWWU9LV8"
LizAnnSonders;2017-06-28 22:12;11;17;"Households remain wary of debt (mortgage equity withdrawal), even w/ house prices fully recovered post-bubble @ WSJ @ SoberLook @ GoldmanSachspic.twitter.com/uuMRehF0Sq"
LizAnnSonders;2017-06-28 21:57;4;46;"Nothing better than dogshttps://twitter.com/megancarrier/status/879535360329605120 …"
LizAnnSonders;2017-06-28 03:39;0;0;"Someone did!"
LizAnnSonders;2017-06-28 03:25;3;11;"Spell check ... doh! ... # Ethereumhttps://twitter.com/lizannsonders/status/879629311489306626 …"
LizAnnSonders;2017-06-28 03:16;0;0;"Oops"
LizAnnSonders;2017-06-27 17:15;70;102;"Interesting comparison between Etherium & Dutch tulip bubble # cryptocurrency @ Investingcom @ WSJ @ SoberLookpic.twitter.com/cEZmN7ANpX"
LizAnnSonders;2017-06-26 16:21;3;5;"pic.twitter.com/vwKKpVQRA6"
LizAnnSonders;2017-06-26 16:20;7;15;"Bloomberg high tax basket of stocks underperforming S&P suggests further delay expected in tax reform @ business @ WSJ @ SoberLookpic.twitter.com/9QNtxmcqYu"
LizAnnSonders;2017-06-26 16:18;21;33;"# Bitcoin bubble Google searches @ jessefelder @ wsj @ SoberLookpic.twitter.com/5eBesndBil"
LizAnnSonders;2017-06-24 17:04;33;46;"Buybacks rolling over; dividends still rising @ standard_poors @ biancoresearchpic.twitter.com/YzoWiZ63rE"
LizAnnSonders;2017-06-24 16:58;4;14;"Market (as usual) is probably more right # DotPlot @ GregDaco @ OxfordEconomics @ josephncohen @ WSJ @ SoberLookpic.twitter.com/SVZrh3Ydux"
LizAnnSonders;2017-06-22 17:59;5;20;"The recent jump in small cap stocks is reversing @ WSJ @ soberlookpic.twitter.com/Q9wUDHGnAe"
LizAnnSonders;2017-06-22 17:59;2;9;"Landing in Oslo right nowhttps://twitter.com/ft/status/877642312850866177 …"
LizAnnSonders;2017-06-22 14:47;2;7;"The recent jump in small cap stocks is reversing @ WSJ @ soberlookpic.twitter.com/bvDeOrlGrb"
LizAnnSonders;2017-06-22 14:47;11;22;"Oil supply > 5y average > demand = lower prices Source: EIA @ WSJ @ soberlookpic.twitter.com/4IJ0OxFvo5"
LizAnnSonders;2017-06-22 05:22;2;10;"My contribution herein:https://twitter.com/businessinsider/status/877481563604340736 …"
LizAnnSonders;2017-06-22 05:21;1;1;"pic.twitter.com/hcAkXBnK4d"
LizAnnSonders;2017-06-22 05:20;1;1;"pic.twitter.com/arWe5ckAHb"
LizAnnSonders;2017-06-22 04:24;30;22;"Foreign capital flooding into US commercial real estate @ BostonFed @ WSJ @ SoberLookpic.twitter.com/8oTmLA4Mso"
LizAnnSonders;2017-06-21 06:43;0;1;"Not a perma bull- was very pessimistic in late '07- bulls for past 8 years have been correct"
LizAnnSonders;2017-06-21 06:41;4;7;"A podcast with @ zacharykarabell on what could go right:https://www.acast.com/whatcouldgoright/interviewwithlizannsonders …"
LizAnnSonders;2017-06-20 21:00;8;21;"Perhaps younger folks don't have patience for 18 holes? Encourage 9 hole matches! # ADD @ BMO @ WSJ @ SoberLookpic.twitter.com/fQYd6pl8pj"
LizAnnSonders;2017-06-20 20:57;5;7;"@ AtlantaFed GDPNow forecast for 2Q just dipped below 3% @ WSJ @ SoberLookpic.twitter.com/ye9iv2o4gv"
LizAnnSonders;2017-06-20 20:55;0;0;"@ ReutersJamiehttps://twitter.com/lizannsonders/status/877146313242025984 …"
LizAnnSonders;2017-06-20 20:52;0;2;"Citi's Economic Surprise Index can be found on Bloomberg, Reuters, FactSet, etc. (and probably on some public websites as well)"
LizAnnSonders;2017-06-20 20:49;21;38;"Something's gotta give? I believe it's more likely that the surprise index begins moving back up. @ Reuters @ WSJ @ SoberLookpic.twitter.com/PoqVUtda2D"
LizAnnSonders;2017-06-20 04:47;0;0;"''Tis a shame, isn't it?"
LizAnnSonders;2017-06-20 04:23;1;10;"Pessimism"
LizAnnSonders;2017-06-20 03:49;5;17;"With a nod to DMB here are my thoughts on tech: http://www.schwab.com/public/schwab/nn/articles/The-Space-Between-Tech-Today-Doesn-t-Resemble-Tech-Circa-2000 …"
LizAnnSonders;2017-06-20 02:25;0;0;"Good catch"
LizAnnSonders;2017-06-20 02:21;0;0;"Blue line is #of pages in Federal Register to year-end 2016 and red line is projected #of pages for 2017"
LizAnnSonders;2017-06-20 00:56;9;15;"# ArtificialIntelligence growth globally @ wef @ josephncohen @ WSJ @ SoberLook @ tracticapic.twitter.com/TXDG62nuYg"
LizAnnSonders;2017-06-20 00:17;3;11;"Cool visual on the likelihood of next # Fed chair (I have my fingers crossed for my friend Kevin Warsh) @ business @ biancoresearchpic.twitter.com/BVZpTVjlof"
LizAnnSonders;2017-06-20 00:13;26;33;"Regulations way down this year vs. last year @ business @ biancoresearchpic.twitter.com/3TjN2V1OGW"
LizAnnSonders;2017-06-19 06:35;7;31;"@ CharlesSchwab 5/4 of people admit they're bad with fractions. # DadJokes"
LizAnnSonders;2017-06-18 11:48;0;0;"Gramatik"
LizAnnSonders;2017-06-18 09:35;0;58;"Feeling old but young again hanging with the kids and @ Gramatik at @ RedRocksCOpic.twitter.com/IhqflbMs4i"
LizAnnSonders;2017-06-17 00:27;0;0;"Sorry- it was not filmed"
LizAnnSonders;2017-06-16 22:50;8;16;"That money you see sloshing around in the US stock market...it belongs to the robots: @ business @ biancoresearchpic.twitter.com/vVwU2BhzpH"
LizAnnSonders;2017-06-16 22:34;3;3;"Failure to launch Source: Skënderbeg Alternative Investments AG @ WSJ @ SoberLook @ cnsnews @ uscensusbureaupic.twitter.com/0eJ5zi1aFM"
LizAnnSonders;2017-06-16 22:30;7;16;"We trust our soldiers and scientists, but not our politicians (duh) @ pewresearch @ josephncohen @ WSJ @ SoberLookpic.twitter.com/3f5ODfzFpK"
LizAnnSonders;2017-06-16 22:27;17;44;"No major country in recession @ MoodysInvSvc @ WSJ @ SoberLookpic.twitter.com/kym7jVoEfv"
LizAnnSonders;2017-06-16 22:25;0;0;"# WallofWorry intact!"
LizAnnSonders;2017-06-16 22:23;3;8;"Market resilience may reflect that falling surprise index more about expectations bar having been set too high vs. weak absolute datapic.twitter.com/3pHBqw8txB"
LizAnnSonders;2017-06-16 22:18;5;6;"NFIB's "jobs hard to fill" survey suggests unemployment rate has plenty of runway to fall further @ NFIB @ WSJ @ SoberLookpic.twitter.com/cIuG2Gr7pK"
LizAnnSonders;2017-06-16 22:16;15;17;"In spite of 4 rate hikes since December 2015 financial conditions continue to loosen @ stlouisfed @ WSJ @ SoberLookpic.twitter.com/qbbvnwAF8z"
