LizAnnSonders;2016-11-11 03:15;6;18;"Falling appetite for free trade well pre-dated this election:pic.twitter.com/oAkmWhqDvk"
LizAnnSonders;2016-11-10 07:54;7;18;"Fun fact @ sentimentrader: reversal in S&P from overnight low to today's high = 1,000% annualized gain"
LizAnnSonders;2016-11-10 07:42;5;23;"Today's action defined by likely ACA changes, steeper yield curve, and infrastructure stimulus"
LizAnnSonders;2016-11-10 07:18;0;1;"Did not count that period"
LizAnnSonders;2016-11-10 01:42;18;27;"Updated fact...GOP sweeps historically: average Dow performance +18.7% (median +16.2%) with positive returns 10/13 times since 1901https://twitter.com/lizannsonders/status/796087516306804736 …"
LizAnnSonders;2016-11-09 23:27;2;3;"Amending my @ CNBC Power Lunch segment- now around 1:30pm ET"
LizAnnSonders;2016-11-09 21:47;2;6;"Our wee hours posting: http://www.schwab.com/insights/market-commentary/trump-wins-what-happens-now …"
LizAnnSonders;2016-11-09 21:25;3;37;"Joining @ CNBC Power Lunch as guest host today at 1pm...not sure what we'll discuss on this quiet day"
LizAnnSonders;2016-11-09 11:53;51;97;"All I can think at a moment like this is our tried-and-true "panic is not an investment strategy." Breathe."
LizAnnSonders;2016-11-09 04:30;28;61;"Simple fact, not editorial comment...best performance for Dow since 1901 has come when Ds had WH/Senate & Rs had House: +24% (no down years)"
LizAnnSonders;2016-11-08 04:29;4;7;"My latest, on jobs: http://www.schwab.com/public/schwab/nn/articles/Welcome-to-the-Working-Week-An-Update-on-Jobs-1 …"
LizAnnSonders;2016-11-07 22:58;5;7;"Perfect setup for today's rally: @ CNNMoneypic.twitter.com/a52g7MAv5p"
LizAnnSonders;2016-11-07 18:43;14;40;"This is funny, found by my friends at @ cornerstonemacpic.twitter.com/x3JwW2T1x0"
LizAnnSonders;2016-11-07 07:11;20;28;"Market action following 8-day or more losing streaks (this one is 9 so far) @ AlmanacTraderpic.twitter.com/ia8H8g9gtR"
LizAnnSonders;2016-11-04 22:50;4;18;"28 prior 8d losing streaks for S&P in history- last one '08- short-term historically mixed for returns out 1m, then better returns out 3-6m"
LizAnnSonders;2016-11-04 19:14;16;19;"This is gonna hurt @ NickatFP Daily Shotpic.twitter.com/2NbowrgA2I"
LizAnnSonders;2016-11-04 19:13;2;5;"I'm glad I don't drink coffeepic.twitter.com/P0vWpJXANl"
LizAnnSonders;2016-11-04 11:09;13;22;"Last two 8d losing streaks were both election years: 1996 and 2008https://twitter.com/hmeisler/status/794301882617319425 …"
LizAnnSonders;2016-11-03 19:42;0;3;"For sure!https://twitter.com/bill_j_donahue/status/794141994318725121 …"
LizAnnSonders;2016-11-03 19:22;0;21;"Travel too much? Got to HPN airport, started boarding flight to ORD ( # CubsWin!), then remembered I'm going to DC... # TravelWeary"
LizAnnSonders;2016-11-03 18:56;8;22;"Being a road warrior, this is no surprise (but a cool visual nonetheless)pic.twitter.com/U9OXF42koB"
LizAnnSonders;2016-11-03 18:51;1;5;"Inventory shocker behind oil's slide # DailyShotpic.twitter.com/Umpp09T0fP"
LizAnnSonders;2016-11-03 18:09;6;19;"Remember, there are two # jobs reports between now and December's # Fed meeting so it's not just tomorrow's that matters"
LizAnnSonders;2016-11-02 23:33;0;4;"Up, up and away (from waiting in line on Election Day) @ nytimes @ nytgraphics @ Tmp_Researchpic.twitter.com/DAO9jzDADG"
LizAnnSonders;2016-11-02 21:29;5;15;"If you're one of the many considering writing in a Presidential candidate, make sure you can:pic.twitter.com/ShZmPyiyqQ"
LizAnnSonders;2016-11-01 22:58;16;33;"Indeed @ Hedgeyepic.twitter.com/QB4gRh1uCm"
LizAnnSonders;2016-11-01 22:37;0;0;"Many thanks"
LizAnnSonders;2016-11-01 22:37;0;1;"Many thanks Heather"
LizAnnSonders;2016-11-01 22:37;0;0;"Many thanks"
LizAnnSonders;2016-11-01 22:36;2;6;"ISM mfg better plus positive revisions to construction data suggest upside to initial 2.9% Q3 real GDP"
LizAnnSonders;2016-11-01 20:09;5;31;"About to join @ MariaBartiromo on @ FoxBusinessAM around 8:20am this morning"
LizAnnSonders;2016-11-01 00:11;2;2;"Rising interest rates could move fence-sitters"
LizAnnSonders;2016-11-01 00:07;28;21;"Homeownership rate may FINALLY have bottomed @ WSJ @ biancoresearchpic.twitter.com/UmMJ2lnfoq"
LizAnnSonders;2016-10-31 19:18;12;17;"An interesting way to visualize 3Q GDP's contributions @ carlquintanilla, @ HPSInsight, @ MattMcDHPSpic.twitter.com/vkyIHGE5My"
LizAnnSonders;2016-10-29 21:58;5;10;"Millennials playing it "safer" than older generationspic.twitter.com/h8MBfDKG9J"
LizAnnSonders;2016-10-29 10:38;0;0;"Totally"
LizAnnSonders;2016-10-29 10:37;0;0;"Wall of worry indeed"
LizAnnSonders;2016-10-29 10:36;0;1;"Silent Generation: born 1923-1945"
LizAnnSonders;2016-10-27 22:22;8;16;"I won't, but I'm permitted to take a selfie with my ballot in CT Daily Shotpic.twitter.com/BVI8hRKVHD"
LizAnnSonders;2016-10-26 04:55;0;0;"@ David_M_Thome @ CharlesSchwab @ Schwab4RIAs Thank you Michael!"
LizAnnSonders;2016-10-26 04:54;0;0;"Mature in terms of MARKET cycle, not economic cycle"
LizAnnSonders;2016-10-26 04:53;0;0;"Thank you Mark!"
LizAnnSonders;2016-10-25 23:24;1;8;"Maturehttps://twitter.com/zarelli/status/790919134758445056 …"
LizAnnSonders;2016-10-25 21:45;19;43;"My version of the famous Sir John Templeton quote:pic.twitter.com/lNV2IKuATs"
LizAnnSonders;2016-10-25 21:35;5;11;"Very strong holiday hiring this yearpic.twitter.com/7VLQadp2Kg"
LizAnnSonders;2016-10-25 04:14;0;4;"Looking forward to seeing everyone in San Diego later today!https://twitter.com/Schwab4RIAs/status/790598780907352065 …"
LizAnnSonders;2016-10-25 03:09;2;6;"My latest, on rising healthcare inflation: http://www.schwab.com/public/schwab/nn/articles/Vertigo-Effect-of-Spiking-Healthcare-Costs-on-Consumers …"
LizAnnSonders;2016-10-25 02:23;2;11;"NIRP/QE and law of diminishing returnspic.twitter.com/kaTPvMBWxL"
LizAnnSonders;2016-10-25 02:22;5;9;"Manufacturing improving in most placespic.twitter.com/GwPuFA1FlI"
LizAnnSonders;2016-10-23 20:13;0;18;"Looking forward to seeing everyone at # SchwabIMPACT this week"
LizAnnSonders;2016-10-21 07:05;6;34;"Today is a sad day for beagles...MetLife fired # Snoopy"
LizAnnSonders;2016-10-21 05:26;8;14;"More on cash on "sidelines" @ biancoresearch @ business @ blackrockpic.twitter.com/HGFRbejoZe"
LizAnnSonders;2016-10-21 05:01;0;0;"When I hear from the horse's mouth (Bernanke) that they look at them all, I pay attention...just common sense"
LizAnnSonders;2016-10-21 03:13;0;0;"http://www.federalreserve.gov/faqs/economy_14419.htm …"
LizAnnSonders;2016-10-21 03:11;0;0;"I interviewed Bernanke last year- asked about this- his reply- Fed tracks EVERY measure of inflation"
LizAnnSonders;2016-10-20 23:00;0;0;"http://www.bloomberg.com/news/articles/2015-06-02/the-fed-s-favorite-inflation-gauge-is-helplessly-trailing-the-other-government-measure …"
LizAnnSonders;2016-10-20 21:33;0;8;"Joining @ SquawkStreet @ CNBC this morning around 10:15am ET"
LizAnnSonders;2016-10-20 10:47;0;15;"Funny but true- I was vote #1 in this pollhttps://twitter.com/usatoday/status/788933950269972482 …"
LizAnnSonders;2016-10-20 08:58;0;10;"And so it begins"
LizAnnSonders;2016-10-19 21:27;0;9;"Taping a convo with @ YahooFinance Alexis Christoforous this morning"
LizAnnSonders;2016-10-19 21:06;4;15;"Cash = most popular "investment" @ BofAML Daily Shotpic.twitter.com/OVwpt93POW"
LizAnnSonders;2016-10-19 21:02;3;16;"Ouchpic.twitter.com/Ui38Na0uEa"
LizAnnSonders;2016-10-19 03:57;1;14;"Well said @ Lin_Manuelhttps://twitter.com/lin_manuel/status/786209546356350976 …"
LizAnnSonders;2016-10-19 03:50;1;0;"I believe we have been in a secular bull market since the beginning (March 2009)"
LizAnnSonders;2016-10-18 23:14;0;3;"Appearing on @ cnbcAsiaPR tonight 7-7:15pm ET"
LizAnnSonders;2016-10-18 16:57;2;7;"The Uber effect Daily Shotpic.twitter.com/vIqG2fTnSg"
LizAnnSonders;2016-10-18 16:56;3;5;"You go young ladies! Daily Shotpic.twitter.com/VRVEIiokqB"
LizAnnSonders;2016-10-18 16:52;4;11;""Start spreading the news, I'm leaving today" Daily Shotpic.twitter.com/5BPLwlLuWY"
LizAnnSonders;2016-10-18 01:55;1;2;"@ UBS @ biancoresearch Capital goes where it's treated best"
LizAnnSonders;2016-10-15 06:22;1;17;"INCREDIBLY proud of my friend Dr. Evan Garfein of the Montefiore plastic surgery team, and prayers for the entire McDonald familyhttps://twitter.com/usatoday/status/786938390734397440 …"
LizAnnSonders;2016-10-15 01:38;2;9;"A thought turned into yet another brilliant cartoon by Charlos Gary @ CharlesSchwabpic.twitter.com/7alCfMRXD9"
LizAnnSonders;2016-10-14 17:55;3;6;"American Psych. Assn: >50%—on both sides of aisle—say election is major source of stress...usually top 3 are work, money, economy"
LizAnnSonders;2016-10-14 17:27;8;21;"Credit card borrowing jumped in 2Q but on the back of extremely low delinquency rates (smarter shopping?)pic.twitter.com/FL97K5crrD"
LizAnnSonders;2016-10-14 17:13;18;37;"Sure glad we decided NOT to go shark diving while in Cape Town this summer!https://twitter.com/abc/status/786823691199844352 …"
LizAnnSonders;2016-10-14 10:19;0;0;"Late cycle, but not end of cycle"
LizAnnSonders;2016-10-14 05:10;1;17;"About to speak at a client event in # Pittsburgh- amazing how vibrant a city it is with diverse and successful industries"
LizAnnSonders;2016-10-14 05:01;0;0;"Then it will not longer be getting better"
LizAnnSonders;2016-10-14 04:55;0;0;"Not saying it's to a healthy level- far from it- just saying it's finally getting better"
LizAnnSonders;2016-10-14 04:48;0;0;"BLS's household survey"
LizAnnSonders;2016-10-14 04:45;0;0;"In theory yes, but turn likely not significant enough yet for wage effect, esp given skills gap problem cited by many co's"
LizAnnSonders;2016-10-14 04:42;0;0;"Yes, but inflection points matter and it's turned back up which suggests fewer discouraged potential workers"
LizAnnSonders;2016-10-14 04:40;0;0;"If they are "actively looking" they are considered back in the participation rate"
LizAnnSonders;2016-10-14 04:31;19;29;"Unemployment claims- most leading of all jobs data- at fresh 43y low & unemployment rate up for "good" reason- rise in participation rate"
LizAnnSonders;2016-10-14 04:08;6;11;"Good one @ Hedgeyepic.twitter.com/e1lupbpDXx"
LizAnnSonders;2016-10-13 22:53;48;118;"I know for sure who is losing in this # election: 320 million Americans"
LizAnnSonders;2016-10-13 18:13;1;7;"Probably partly reflects millennials outnumbering boomerspic.twitter.com/zbc9NBoFR7"
LizAnnSonders;2016-10-13 18:11;8;12;"Interesting chart on job prospects by demographicspic.twitter.com/exA1EMD7pB"
LizAnnSonders;2016-10-13 05:47;18;50;"Counter factual offered by Fed: if not for ZIRP/QE, things would be worse. Perhaps consider whether things might actually be better???"
LizAnnSonders;2016-10-12 08:33;0;10;"You go girl"
LizAnnSonders;2016-10-12 01:50;0;3;". @ passthepuck @ carlquintanilla Not a poll- it's a chart of the betting markets"
LizAnnSonders;2016-10-12 00:13;18;19;"# Election odds diverge dramatically post-weekendpic.twitter.com/OcLzkiUTRx"
LizAnnSonders;2016-10-11 21:26;0;0;"Indeed!"
LizAnnSonders;2016-10-11 21:01;12;15;"Americans need to read more Daily Shotpic.twitter.com/QDl82dZseU"
LizAnnSonders;2016-10-11 02:51;6;14;"My latest on debt/deficits: http://www.schwab.com/public/schwab/nn/articles/Your-Time-is-Gonna-Come-Households-Leverage-Down-Government-Leverage-Up …"
LizAnnSonders;2016-10-10 09:28;14;68;"This is a sad night all around"
LizAnnSonders;2016-10-10 08:15;8;36;"Dinner convo tonite re Peggy Noonan op-ed last week re superficiality...my husband nailed it: "these days we are notified but not informed""
LizAnnSonders;2016-10-10 03:11;0;1;"@ JohnTarves Don't fret Jimmy, I'm from Philly and can't do a Philly accent!"
LizAnnSonders;2016-10-07 19:28;14;9;"# Fed rate hike odds now over 60% for this yearpic.twitter.com/DaCqL2E4Rw"
LizAnnSonders;2016-10-05 23:52;4;16;"ISM non-manufacturing report was largest one-month improvement in history of index (1997)"
LizAnnSonders;2016-10-05 19:12;6;10;"High global correlations = macro forces dominating performancepic.twitter.com/GflnoiVzf8"
LizAnnSonders;2016-10-04 17:42;5;13;"The worst report card ever @ JohnFMauldinpic.twitter.com/kXfhaT9qB3"
LizAnnSonders;2016-10-04 16:53;2;9;"All the single ladiespic.twitter.com/4WvmVC6Gwf"
LizAnnSonders;2016-10-04 16:52;5;7;"No wonder there's a perceived need for infrastructure spendingpic.twitter.com/D90ttnSf4e"
LizAnnSonders;2016-10-04 02:42;10;15;"US- the world's power player in # oil marketspic.twitter.com/1dFZlQkDSn"
LizAnnSonders;2016-10-04 02:41;2;2;"Good news for Bakken # oil in North Dakotapic.twitter.com/hkkREJraPx"
LizAnnSonders;2016-10-03 00:30;3;5;"Many thanks Ravihttps://twitter.com/ravipaige/status/782213648693469184 …"
LizAnnSonders;2016-09-28 23:47;10;21;"Cool chart on relative size of US cities @ business, @ Tmp_Research, Daily Shotpic.twitter.com/UrTGinfwQV"
LizAnnSonders;2016-09-28 01:03;6;24;"Trying to make light of the situationpic.twitter.com/ZjgnbIJguL"
LizAnnSonders;2016-09-27 17:19;2;34;"Compelling 3rd party candidate: the cocktail party"
LizAnnSonders;2016-09-27 16:53;15;12;"Betting markets' odds of Trump win sink into debatepic.twitter.com/Ax4xVLzzbR"
LizAnnSonders;2016-09-27 10:41;4;40;"Painful- good night"
LizAnnSonders;2016-09-27 10:31;0;5;".@JeffSiegel40 Good God no"
LizAnnSonders;2016-09-27 10:24;16;61;"At least it's almost over"
LizAnnSonders;2016-09-27 09:01;0;17;"Get ready to rumble"
LizAnnSonders;2016-09-27 02:41;8;14;"My latest on rising (but still lowish) recession risk: http://www.schwab.com/public/schwab/nn/articles/Every-Picture-Tells-a-Story-Recession-Risk-Up-but-Not-High …"
LizAnnSonders;2016-09-26 09:07;15;71;"Rest in peace Arnold Palmer- one of the greatest"
LizAnnSonders;2016-09-23 19:01;9;17;"Dumbing down of presidential speeches @ TheAtlantic, @ Tmp_Research Daily Shotpic.twitter.com/fyzGnjnQWA"
LizAnnSonders;2016-09-23 19:00;17;25;"Assets vs real economy Daily Shotpic.twitter.com/WB3LTYIAiv"
LizAnnSonders;2016-09-22 17:54;0;1;"I think the economy is weak partly because of Fed policy, not in spite of Fed policy"
LizAnnSonders;2016-09-22 16:55;0;7;"Joining @ FoxBusiness via phone this morning at 5:15am and 5:45am ET"
LizAnnSonders;2016-09-22 04:29;0;1;". @ roc0013 Fair point"
LizAnnSonders;2016-09-22 03:05;6;13;"With Yellen's "expect to see a rate hike this year" and 3 dissents, December's meeting is firmly on the table for a # Fed rate hike"
LizAnnSonders;2016-09-21 18:59;19;16;"Peterson Institute for Int'l Economics: impact of full trade war with Mexico and China on US job market @ wef, @ Tmp_Research, Daily Shotpic.twitter.com/mJUK0d22Bb"
LizAnnSonders;2016-09-20 01:42;9;10;"Another "duh" chartpic.twitter.com/bYK4Nu1wHe"
LizAnnSonders;2016-09-20 01:37;11;23;"A big reason why inflation is heading higher ... duhpic.twitter.com/MmjKpOyjwM"
LizAnnSonders;2016-09-16 23:03;4;18;"My take on what's being digested by markets lately...in a visualpic.twitter.com/pyEt92ojgv"
LizAnnSonders;2016-09-16 23:02;0;0;"Former...generally don't talk politics"
LizAnnSonders;2016-09-16 22:31;1;13;"Appearing today on @ CNBC @ PowerLunch at 1pm ET"
LizAnnSonders;2016-09-16 19:23;3;14;"Savers continue to get short-changed (FFs up, LIBOR up, but not CDs) @ boes_ Daily Shotpic.twitter.com/Lci1jQ1oyU"
LizAnnSonders;2016-09-15 17:50;2;10;"As a fan of charts myself, I am not surprised: @ priceonomics Daily Shotpic.twitter.com/xpcuKCdqNO"
LizAnnSonders;2016-09-14 19:00;12;12;"...and largest one-year drop in poverty rate since late-60spic.twitter.com/F0lkMbVvZp"
LizAnnSonders;2016-09-14 18:27;20;20;"Census: record improvement in income growth; lowest 2 deciles of incomes gaining most = improving income inequalitypic.twitter.com/a6jATvVD7x"
LizAnnSonders;2016-09-13 18:51;3;12;"Duhpic.twitter.com/SOgjcm5oG6"
LizAnnSonders;2016-09-13 18:47;6;9;"Is drop in LMCI like '86/'96 or indicative of recession? For now, best bet is former. @ DeutscheBank Daily Shotpic.twitter.com/LOIrTXTCAn"
LizAnnSonders;2016-09-13 08:24;3;17;"You lose some, you win some- my thoughts on the Friday/Monday flip flop: http://www.schwab.com/public/schwab/nn/articles/Is-That-All …"
LizAnnSonders;2016-09-13 06:49;1;5;"Appearing on @ CNBC Asia at the top of the 7pm hour (ET)"
LizAnnSonders;2016-09-10 21:09;9;28;"Our quick thoughts on yesterday http://www.schwab.com/insights/stocks/fed-uncertainty-brings-volatility-to-markets …"
LizAnnSonders;2016-09-09 20:44;0;0;"I'm a boomer- don't depress me"
LizAnnSonders;2016-09-09 20:20;0;1;"Economy sluggish this entire expansion...post-debt supercycle woes won't fade anytime soon, but no excess = no recession"
LizAnnSonders;2016-09-09 19:30;27;30;"Millennials are merry, boomers are bummingpic.twitter.com/kRy6apdEAG"
LizAnnSonders;2016-09-09 19:27;7;13;"Is @ GoldmanSachs right? Perhaps, if ECRI's inflation forecast proves correct. @ joshdigga @ jessefelder Daily Shotpic.twitter.com/xngtb00Pax"
LizAnnSonders;2016-09-09 00:49;0;1;"It's hires divided by openings in the first chart- being low means there are higher openings but fewer hires = skills gap"
LizAnnSonders;2016-09-08 21:38;0;5;"Ran into @ terrencehoward last night at O'Hare...chatted about world events and election...great guy..says this season of @ EmpireFOX rocks"
LizAnnSonders;2016-09-08 18:56;21;35;"Skills gap (falling hires/job openings) helps explain weaker job growth (not layoffs)pic.twitter.com/0VAjgSsq3h"
LizAnnSonders;2016-09-08 08:33;0;7;"Many thanks!https://twitter.com/morningstarinc/status/773680364988600321 …"
LizAnnSonders;2016-09-08 02:37;2;11;". @ MorningstarInc Stuck on tarmac at LGA for 2+ hours & counting w/ ground stop at ORD...wish me luck getting there"
LizAnnSonders;2016-09-07 02:27;1;5;"Appearing on @ FoxBusiness @ LizClaman Countdown to Closing Bell at 3:50pm ET today"
LizAnnSonders;2016-09-05 06:31;349;363;"Living in the next CT town, sad to see what's become of once-largest trading floor in world @ UBS @ biancoresearchpic.twitter.com/XKYkBO8Q6C"
LizAnnSonders;2016-09-03 23:20;0;0;"Post-debt super cycle sluggishness (everywhere in he world)"
LizAnnSonders;2016-09-03 04:17;0;2;"It's simply the case that recessions come because of excess- excess capex, excess monetary policy, excess inflation"
LizAnnSonders;2016-09-03 01:19;0;1;"sluggish economy = no excesses = low recession risk"
LizAnnSonders;2016-08-31 22:53;0;2;". @ Traderbarn @ biancoresearch @ BofAML 2008 massive outlier as market collapsed into election- would have rescaled whole chart"
LizAnnSonders;2016-08-31 22:44;0;1;". @ Traderbarn @ biancoresearch @ BofAML Good question- will try to find out (it's a @ BofAML chart)"
LizAnnSonders;2016-08-31 22:41;1;2;"Precisely- higher margin likely means less uncertainty heading toward election so better market"
LizAnnSonders;2016-08-31 22:25;7;20;"Margin of victory in elections has mattered in terms of market performance @ biancoresearch @ BofAMLpic.twitter.com/PiAVaLOGwU"
LizAnnSonders;2016-08-31 20:28;4;8;"Lowest vol = highest val @ SBarlow_ROB, UBS Daily Shotpic.twitter.com/UdLTK4Etli"
LizAnnSonders;2016-08-30 20:56;1;7;"Happy birthday Jeff!https://twitter.com/jeffreykleintop/status/770603958414999552 …"
LizAnnSonders;2016-08-30 18:48;4;6;"Atlanta Fed's GDPNow back up to 3.5% for 3Qpic.twitter.com/vO7OduNaZL"
LizAnnSonders;2016-08-30 18:43;2;6;"Joining @ MariaBartiromo @ FoxBusiness at 8:20am ET this morning"
LizAnnSonders;2016-08-30 05:06;8;17;"My latest missive on the lull in # volatility http://www.schwab.com/public/schwab/nn/articles/All-Summer-Long-Will-the-Extreme-Lull-in-Volatility-Persist …"
LizAnnSonders;2016-08-30 01:05;0;1;""I'm laughing at the clouds so dark above""
LizAnnSonders;2016-08-29 23:01;5;14;"Friday's jobs report may reinforce idea that the # Fed has moved from being data dependent to data point dependent"
LizAnnSonders;2016-08-27 01:01;0;1;"You may but I do very little on LinkedIn"
LizAnnSonders;2016-08-27 00:58;0;0;"Not at all!"
LizAnnSonders;2016-08-26 18:47;17;36;"You go girlspic.twitter.com/lv8YOFLLiv"
LizAnnSonders;2016-08-25 21:13;2;12;"Based on @ CNBC survey, # Fed is winging it to some degreepic.twitter.com/0kvDBy8Lmf"
LizAnnSonders;2016-08-25 03:51;9;11;"Interesting chart showing surge in macro's influence on equity returns @ biancoresearchpic.twitter.com/WWipP79CCc"
LizAnnSonders;2016-08-25 00:17;2;0;"Wages are growing, job growth strong (esp for 25-35 year olds), demand outstripping low supply, and mortgage rates are LOW"
LizAnnSonders;2016-08-24 18:34;0;1;"Business capex and productivity"
LizAnnSonders;2016-08-24 17:30;6;11;"Housing- a US economic bright spotpic.twitter.com/yrSAhMkOdc"
LizAnnSonders;2016-08-23 00:58;3;10;"Joining Charles Payne on Neil Cavuto @ FoxBusiness at 1:20pm today"
LizAnnSonders;2016-08-22 19:12;20;24;"Record % of stocks wth dividend yields > Treasury yields @ BofAML Daily Shotpic.twitter.com/cWG9d07KRp"
LizAnnSonders;2016-08-22 19:10;7;9;"The bulls are back in town @ yardenipic.twitter.com/r2XWrHngJ2"
LizAnnSonders;2016-08-20 09:49;0;0;"Many thanks Ray"
LizAnnSonders;2016-08-19 23:00;0;0;"Many thanks Michael"
LizAnnSonders;2016-08-18 22:31;5;22;"Just finished taping @ WallStreetWeek...tune in this weekend on @ FoxBusiness"
LizAnnSonders;2016-08-18 09:02;0;0;""
LizAnnSonders;2016-08-18 03:11;0;0;"I can see why"
LizAnnSonders;2016-08-18 03:11;0;0;"Epic"
LizAnnSonders;2016-08-18 03:09;36;70;"Marty Zweig coined the phrase "Don't fight the Fed" but the message now to the Fed is "Don't fight the market"...tables have turned"
LizAnnSonders;2016-08-16 22:51;2;1;"Commercial hedgers/position traders = SM, and small odd-lot/Rydex traders = DM"
LizAnnSonders;2016-08-16 22:50;0;1;"Looks at what the cohorts are actually doing- not an attitudinal measure"
LizAnnSonders;2016-08-16 20:28;0;0;"@ sentimentrader definitions from SentimenTrader"
LizAnnSonders;2016-08-16 20:28;1;5;"Examples of DM include eq-only p/c ratio, flow in/out of Rydex funds, & small speculators in equity index futures contracts"
LizAnnSonders;2016-08-16 20:26;1;2;"Examples of SM include OEX p/c & open int ratios, comm hedger positions in eq index futures, & current relationship between stocks & bonds"
LizAnnSonders;2016-08-16 19:44;34;49;"Contrarians, note the wide spread in favor of the "dumb" money @ sentimentraderpic.twitter.com/vDLxLxv6Rq"
LizAnnSonders;2016-08-16 18:25;21;43;"Yes, this person probably votes @ michaelshermer Daily Shotpic.twitter.com/vPAPEDlDtF"
LizAnnSonders;2016-08-16 02:35;5;19;"My latest missive on the economy, earnings and elephants http://www.schwab.com/public/schwab/nn/articles/With-a-Little-Help-From-My-Friends-On-Africa-Economy-and-Earnings …"
LizAnnSonders;2016-08-12 23:21;13;39;"Being en route home from a vacation in Africa I found this very interesting @ NickatFP Daily Shotpic.twitter.com/TL96AA4LmW"
LizAnnSonders;2016-08-12 13:39;0;0;"Which app Henry? Trying to watch from Africa."
LizAnnSonders;2016-08-11 17:38;6;7;"Skills gap persists @ NickatFP Daily Shotpic.twitter.com/dzKwuMnkbO"
LizAnnSonders;2016-08-10 20:43;2;41;"Back on the grid in Botswana- my new BFF just off our treehouse terracepic.twitter.com/Ugq25yrGRw"
LizAnnSonders;2016-08-05 18:47;0;7;". @ LizAnnSonders I meant "than""
LizAnnSonders;2016-08-05 17:25;3;52;"A more interesting road block then what we see on the Cross Bronx Expresswaypic.twitter.com/BYtAJrEBkg"
LizAnnSonders;2016-08-05 17:22;1;7;"...and hispic.twitter.com/fzOVEfjuC6"
LizAnnSonders;2016-08-05 17:22;0;3;"What's left of a water buffalo...pic.twitter.com/QTQA3Ct02n"
LizAnnSonders;2016-08-05 17:22;0;13;"...is in his bellypic.twitter.com/OYOc0zoBeF"
LizAnnSonders;2016-08-05 16:24;2;8;"Just when you think you're having a bad day...pic.twitter.com/z79vN3ETLS"
LizAnnSonders;2016-08-05 16:17;2;11;"A big # bull in Africapic.twitter.com/InB5rOLcMf"
LizAnnSonders;2016-08-04 16:07;2;20;"Mama, papa and babiespic.twitter.com/YxU5iYoqLX"
LizAnnSonders;2016-08-04 15:06;1;20;"Wildebeast herdpic.twitter.com/CmEBpTarJl"
LizAnnSonders;2016-08-04 14:56;0;1;"Of course!!!"
LizAnnSonders;2016-08-04 13:57;1;30;"White rhino first sighting this morningpic.twitter.com/VPAGmb2E9W"
LizAnnSonders;2016-08-04 03:07;0;3;"kelp"
LizAnnSonders;2016-08-04 02:49;1;51;"Me and my BFF penguin friendpic.twitter.com/0IfF33X0cp"
LizAnnSonders;2016-08-04 02:23;1;27;"Wowpic.twitter.com/Dz0mlnd8H7"
LizAnnSonders;2016-08-02 19:12;0;3;"Mala Mala tomorrow, then Vic Falls, then Okavanga Delta (Singita and Kwetsani) in Botswana"
LizAnnSonders;2016-08-02 19:09;6;95;"A shot of the tail of the southern right whale we saw right off our boat yesterday in Cape Townpic.twitter.com/9hI9XYFqnN"
LizAnnSonders;2016-08-02 19:08;0;3;"Yes, tasting their wine right now!"
LizAnnSonders;2016-08-02 19:01;3;32;"De Toren vineyard in beautiful South African wine countrypic.twitter.com/SpCNp9No7k"
LizAnnSonders;2016-08-02 03:39;31;50;"One of largest crocodiles ever photographedpic.twitter.com/GrL5Zq8po2"
LizAnnSonders;2016-08-01 21:51;2;45;"A southern right whale next to our Cape Flats trawler!pic.twitter.com/K6sqcFQ1dp"
LizAnnSonders;2016-08-01 19:00;3;42;"My new South African BFFpic.twitter.com/PX8qecBjAc"
LizAnnSonders;2016-08-01 13:20;2;42;"Pre-dawn hike up Table Mountain in Cape Townpic.twitter.com/hqiCN1CVbO"
LizAnnSonders;2016-07-31 21:28;0;40;"Stunning Cape Townpic.twitter.com/zctBRbNz9m"
LizAnnSonders;2016-07-31 04:46;1;9;"Go @ UDBlueHens!https://twitter.com/money/status/759486294724665344 …"
LizAnnSonders;2016-07-31 04:11;0;1;"@ ThisWeekABC Wow"
LizAnnSonders;2016-07-30 00:41;0;1;"Both and thank you!"
LizAnnSonders;2016-07-29 23:56;0;68;"Leaving at dawn tomorrow for 2w family vacation in Africa...will be tweeting much less frequently...have a great early August everyone"
LizAnnSonders;2016-07-29 19:24;3;16;"You go girls! @ WSJecon Daily Shotpic.twitter.com/Mx7cEgBy7J"
LizAnnSonders;2016-07-28 21:33;16;26;"Why we encouraged our son to major in math in college (he is) @ wefpic.twitter.com/K2lNtwpM3Z"
